,Search,Tweet,Entered on,pos_score,neu_score,neg_score,compound_score,angry_score,fear_score,happy_score,sad_score,surprise_score
464,Pence,big fan mike pence least take turn turn sign jan 6th ,2021-01-30,0.187,0.813,0.0,0.3182,0.0,0.33,0.0,0.0,0.67
465,Pence,find funny sudden people trying paint pence good side trump coin laughable ,2021-01-30,0.438,0.562,0.0,0.7184,0.0,0.0,0.25,0.0,0.75
466,Pence,may like pences ultra conservatism proud admire integrity standing firm fo ,2021-01-30,0.617,0.383,0.0,0.8834,0.0,0.8,0.2,0.0,0.0
467,Pence,delco judge rips gop ,2021-01-30,0.0,0.0,0.0,0.0,0.0,0.0,0.0,0.0,0.0
468,Pence,would said pence doubt ,2021-01-30,0.0,0.545,0.455,-0.3612,0.0,0.67,0.0,0.0,0.33
469,Pence,give 1 pence ,2021-01-30,0.0,0.0,0.0,0.0,0.0,1.0,0.0,0.0,0.0
470,Pence,received great review google thank dane pence ,2021-01-30,0.569,0.431,0.0,0.765,0.0,0.0,0.5,0.0,0.5
471,Pence,george soros face swapped mike pence socialist dare ,2021-01-30,0.0,0.0,0.0,0.0,0.0,1.0,0.0,0.0,0.0
472,Pence,trump would done thing act like terrorists ,2021-01-30,0.216,0.431,0.353,-0.3818,0.0,0.5,0.0,0.0,0.5
473,Pence,well look like mike pence ,2021-01-30,0.605,0.395,0.0,0.5574,0.0,0.0,0.0,0.0,0.0
474,Pence,well republicans r 4 happened capitol like even felt threatened little bit ,2021-01-30,0.315,0.479,0.205,0.1531,0.0,0.67,0.0,0.33,0.0
475,Pence,needs go look trash rankings alt tag html used describe images ,2021-01-30,0.0,0.0,0.0,0.0,1.0,0.0,0.0,0.0,0.0
476,Pence,chance judas mike pence hints 2024 runamp8230 ,2021-01-30,0.25,0.75,0.0,0.25,0.0,1.0,0.0,0.0,0.0
477,Pence,cant wait tell kids covid lockdown proud boys aka kk tried hang vp pence attac ,2021-01-30,0.301,0.699,0.0,0.6808,0.0,0.0,0.5,0.25,0.25
478,Pence,know v ps need permission speak dud pence get permission th ,2021-01-30,0.0,0.818,0.182,-0.25,0.0,1.0,0.0,0.0,0.0
479,Pence,assure amp support trump lies el ,2021-01-30,0.468,0.275,0.257,0.3182,0.0,0.5,0.0,0.0,0.5
480,Pence,bother mike pence hints 2024 run betraying president trump voters america ,2021-01-30,0.0,0.604,0.396,-0.7096,0.0,0.0,0.0,0.0,1.0
481,Pence,beli ,2021-01-30,0.0,0.0,0.0,0.0,0.0,0.0,0.0,0.0,0.0
482,Pence,pence love city familjen dreamhack ,2021-01-30,0.512,0.488,0.0,0.6369,0.0,0.0,1.0,0.0,0.0
483,Pence,quick question debate krusty krab flies stay somebody head ,2021-01-30,0.0,0.0,0.0,0.0,0.5,0.5,0.0,0.0,0.0
484,Pence,political career people see fake christian hypocrite hard ,2021-01-30,0.0,0.571,0.429,-0.5423,0.5,0.0,0.0,0.5,0.0
485,Pence,5 bring criminal terrorists like ,2021-01-30,0.227,0.091,0.682,-0.7184,0.0,0.33,0.0,0.67,0.0
486,Pence,think ,2021-01-30,0.0,0.0,0.0,0.0,0.0,0.0,0.0,0.0,1.0
487,Pence,three days hence shaving face pencilpence gillite best man get p harry split ar ,2021-01-30,0.259,0.741,0.0,0.6369,0.0,0.33,0.33,0.0,0.33
488,Pence,true pence evacuated trump watched tv ,2021-01-30,0.359,0.641,0.0,0.4215,0.0,0.0,0.0,0.0,1.0
489,Pence,line always bad though hes basically things cousins maligned ,2021-01-30,0.0,0.696,0.304,-0.5423,0.0,0.33,0.0,0.5,0.17
490,Pence,frm harry potter resists trump wanted supporters planned ,2021-01-30,0.293,0.707,0.0,0.4404,0.0,0.5,0.0,0.0,0.5
491,Pence,ask men get vasectomies ,2021-01-30,0.0,0.0,0.0,0.0,0.0,1.0,0.0,0.0,0.0
492,Pence,wrong scotus protests protests scotus break beat ,2021-01-30,0.0,0.367,0.633,-0.7096,0.0,0.0,0.0,0.0,1.0
493,Pence,jehovah witnesses watchtower ,2021-01-30,0.0,0.0,0.0,0.0,0.0,0.0,0.0,0.0,0.0
494,Pence,trump lashed pence stating courage reject certification biden victory ,2021-01-30,0.248,0.543,0.209,0.128,0.25,0.25,0.0,0.25,0.25
495,Pence,republicans honestly think mob would spared life got spare ,2021-01-30,0.273,0.727,0.0,0.4588,0.2,0.4,0.0,0.2,0.2
496,Pence,former vice president mike pence reportedly making plans form political committee signaling intention ,2021-01-30,0.0,0.0,0.0,0.0,0.0,0.0,0.0,1.0,0.0
497,Pence,mike pence received gold coin handshake biden victory confirmation worth 30 pieces silver ,2021-01-30,0.137,0.863,0.0,0.2263,0.0,0.5,0.0,0.0,0.5
498,Pence,household never vote president 2024 ever senate f ,2021-01-30,0.0,0.0,0.0,0.0,0.0,0.0,0.0,0.0,1.0
499,Pence,pence specifically ,2021-01-30,0.0,0.0,0.0,0.0,0.0,0.0,0.0,0.0,0.0
