,Search,Tweet,Entered on,pos_score,neu_score,neg_score,compound_score,angry_score,fear_score,happy_score,sad_score,surprise_score
418,Socialism,knew said grown ups charge really meant socialism kiddies infantilis ,2020-11-16,0.0,0.0,0.0,0.0,0.0,0.0,0.33,0.0,0.67
419,Socialism,wow would bad didnt make decide socialism ,2020-11-16,0.309,0.407,0.285,0.0772,0.0,0.4,0.0,0.4,0.2
420,Socialism,must watch new gop congresswoman elect grew ukraine lectures leftists socialism ,2020-11-16,0.0,0.0,0.0,0.0,0.0,0.0,0.0,0.0,1.0
421,Socialism,failed messaging counteract defund socialism battering mouths repugnikans ,2020-11-16,0.0,0.68,0.32,-0.5106,0.0,0.0,0.0,1.0,0.0
422,Socialism,look posted meme pointed latin american countries ,2020-11-16,0.0,0.0,0.0,0.0,0.0,0.0,0.0,0.0,1.0
423,Socialism,greatest country ever cant give socialism ,2020-11-16,0.457,0.543,0.0,0.6369,0.0,0.5,0.0,0.0,0.5
424,Socialism,could afford healthcare gets labeled socialis ,2020-11-16,0.0,0.0,0.0,0.0,0.0,1.0,0.0,0.0,0.0
425,Socialism,modern socialism ,2020-11-16,0.0,0.0,0.0,0.0,0.0,0.0,0.0,0.0,0.0
426,Socialism,government ownership means production state capitalism socialis ,2020-11-16,0.0,0.0,0.0,0.0,0.0,0.0,0.0,1.0,0.0
427,Socialism,going argue trickle economics gop convinced ,2020-11-16,0.297,0.44,0.264,0.0772,0.0,1.0,0.0,0.0,0.0
428,Socialism,yes socialism destroys countries people flee countries ,2020-11-16,0.239,0.442,0.319,-0.2263,0.0,0.67,0.0,0.33,0.0
429,Socialism,oh wait define socialism terms want sweet define socialism grocery ,2020-11-16,0.35,0.65,0.0,0.5106,0.0,0.0,0.0,0.0,1.0
430,Socialism,people arizona used say shit like virus blue wave comes ,2020-11-16,0.177,0.567,0.255,-0.2732,0.0,0.2,0.0,0.2,0.6
431,Socialism,man missing word nazi short form long ,2020-11-16,0.0,0.732,0.268,-0.296,0.5,0.25,0.0,0.25,0.0
432,Socialism,fascism grew socialism exactly zero socialists fascism ,2020-11-16,0.0,0.0,0.0,0.0,0.0,1.0,0.0,0.0,0.0
433,Socialism,socialism gtgtgtgtgtgtgt ,2020-11-16,0.0,0.0,0.0,0.0,0.0,0.0,0.0,0.0,0.0
434,Socialism,millions deaths going start dreams material ,2020-11-16,0.351,0.649,0.0,0.4019,0.0,1.0,0.0,0.0,0.0
435,Socialism,swedish socialism year 1902 defined small government deregulation l ,2020-11-16,0.0,0.0,0.0,0.0,0.0,0.0,0.0,0.0,0.0
436,Socialism,let see let see seen already remembered ,2020-11-16,0.0,0.0,0.0,0.0,0.0,0.0,0.0,1.0,0.0
437,Socialism,socialism control means production working class communism entail ,2020-11-16,0.0,0.0,0.0,0.0,0.0,0.67,0.0,0.0,0.33
438,Socialism,actually existing socialism ,2020-11-16,0.0,0.0,0.0,0.0,0.0,0.0,0.0,0.0,1.0
439,Socialism,government providing general welfare socialism republican members congress co ,2020-11-16,0.0,0.0,0.0,0.0,0.0,0.0,0.0,0.0,1.0
440,Socialism,us inferior least able approximate without falling socialism ,2020-11-16,0.142,0.591,0.266,-0.3085,0.0,0.0,0.0,0.0,0.0
441,Socialism,haahhahahaha trying say line ,2020-11-16,0.0,0.0,0.0,0.0,0.0,0.5,0.0,0.0,0.5
442,Socialism,debates socialism abolition policeschools make tired ,2020-11-16,0.0,0.633,0.367,-0.4404,0.0,0.0,0.0,1.0,0.0
443,Socialism,get scholarships study university good sports hs sports import ,2020-11-16,0.266,0.734,0.0,0.4404,0.0,0.0,1.0,0.0,0.0
444,Socialism,wanna know really grinds gears socialism ,2020-11-16,0.0,0.0,0.0,0.0,0.0,0.0,0.0,0.5,0.5
445,Socialism,folksthis socialism defund ljs ,2020-11-16,0.0,0.0,0.0,0.0,0.0,0.0,0.0,0.0,0.0
446,Socialism,go ahead fuquad define terms recklessly toss sort sloppy republi ,2020-11-16,0.0,0.0,0.0,0.0,0.0,0.0,0.0,1.0,0.0
447,Socialism,hmm meanwhile finland happiest country live mixe ,2020-11-16,0.412,0.588,0.0,0.6369,0.0,0.0,1.0,0.0,0.0
448,Socialism,realize socialism work capitalism fund right ,2020-11-16,0.0,0.0,0.0,0.0,0.0,1.0,0.0,0.0,0.0
449,Socialism,interested 70 million americans voted trump interviewed rural voters jasper ,2020-11-16,0.231,0.769,0.0,0.4019,0.0,0.0,0.5,0.0,0.5
450,Socialism,cant stand socialism ,2020-11-16,0.0,0.0,0.0,0.0,0.0,1.0,0.0,0.0,0.0
451,Socialism,socialism wikipedia socialism ,2020-11-16,0.0,0.0,0.0,0.0,0.0,0.0,0.0,0.0,0.0
452,Socialism,system derived base form socialism rejection libe ,2020-11-16,0.0,0.632,0.368,-0.5423,0.0,0.5,0.0,0.5,0.0
453,Socialism,stop strawman arguments strong hell existing social net socialism ,2020-11-16,0.185,0.281,0.534,-0.7351,0.0,0.75,0.25,0.0,0.0
454,Socialism,cancel cancel culture woke culture get damn job even pays minimum wage pay ,2020-11-16,0.0,0.526,0.474,-0.7269,0.0,1.0,0.0,0.0,0.0
455,Socialism,thats theyre scared communism experienced cuba end voting far right ,2020-11-16,0.0,0.756,0.244,-0.4404,0.0,0.67,0.0,0.33,0.0
456,Socialism,guys getting socialism know means right family planning options women fuc ,2020-11-16,0.0,0.0,0.0,0.0,0.0,0.5,0.0,0.0,0.5
457,Socialism,want world socialism want real greed power amp control ,2020-11-16,0.23,0.531,0.239,-0.2732,0.5,0.0,0.0,0.5,0.0
458,Socialism,universal healthcare socialism ,2020-11-16,0.0,0.0,0.0,0.0,0.0,0.0,0.0,0.0,0.0
459,Socialism,omg comments dems pushing lockdownsit pandemica glimpse socialism ,2020-11-16,0.0,0.0,0.0,0.0,0.0,0.5,0.0,0.0,0.5
460,Socialism,bro swear china needs actively suppress people literally capitalist socialis ,2020-11-16,0.2,0.696,0.104,0.2732,1.0,0.0,0.0,0.0,0.0
461,Socialism,bullshit thing ever heard fucking auth left ,2020-11-16,0.0,0.612,0.388,-0.5859,0.0,0.25,0.25,0.0,0.5
462,Socialism,believe socialist knew along especially young peop ,2020-11-16,0.0,0.0,0.0,0.0,0.0,0.0,0.0,0.0,0.0
463,Socialism,maybe many people open socialism ,2020-11-16,0.0,0.0,0.0,0.0,0.0,1.0,0.0,0.0,0.0
464,Socialism,cool bail big banks trillions free money forgiving student debt would socialism want handout ,2020-11-16,0.46,0.423,0.117,0.743,0.0,0.5,0.5,0.0,0.0
465,Socialism,corporate socialism country shitload socialist things working class ,2020-11-16,0.0,0.0,0.0,0.0,0.0,0.33,0.0,0.0,0.67
466,Socialism,thought demonstration socialism would like mean poverty inev ,2020-11-16,0.32,0.41,0.27,-0.1027,0.0,0.67,0.0,0.0,0.33
467,Socialism,let clear single communist socialist country could never exist long capitalism exists commu ,2020-11-16,0.178,0.822,0.0,0.3818,0.0,0.33,0.0,0.67,0.0
468,Socialism,yes socialism win texas via tube ,2020-11-16,0.619,0.381,0.0,0.7579,0.0,0.5,0.0,0.5,0.0
469,Socialism,corporate socialism cool tho stock buybacks jacking share price govt bailout much st ,2020-11-16,0.283,0.629,0.088,0.4767,0.0,0.33,0.33,0.33,0.0
470,Socialism,newly elected indiana gop rep grew soviet union gives stark warning socialism ,2020-11-16,0.0,0.821,0.179,-0.34,0.0,1.0,0.0,0.0,0.0
471,Socialism,fair seems like spends time fear mongering ,2020-11-16,0.375,0.234,0.391,-0.0516,0.0,0.0,0.0,1.0,0.0
472,Socialism,nice try bring ignorant player game educated people understand exactly sociali ,2020-11-16,0.201,0.647,0.151,0.1779,0.0,0.0,0.5,0.5,0.0
473,Socialism,like already lot left cal ,2020-11-16,0.385,0.615,0.0,0.3612,0.0,0.0,0.0,1.0,0.0
474,Socialism,saw show wanted tel im happy cong ,2020-11-16,0.381,0.619,0.0,0.5719,0.0,0.0,1.0,0.0,0.0
475,Socialism,need ever use word socialism ever rep abigail spanberger avid socialist finding ways ,2020-11-16,0.155,0.845,0.0,0.296,0.25,0.0,0.25,0.0,0.5
476,Socialism,right ok guess england canada israel nordic european countrie ,2020-11-16,0.216,0.784,0.0,0.296,0.0,0.5,0.0,0.0,0.5
477,Socialism,texas turned socialism apparently ,2020-11-16,0.0,0.0,0.0,0.0,0.0,0.0,0.0,0.0,1.0
478,Socialism,step towards socialism house rules thats dad taught family amp friends worth ,2020-11-16,0.333,0.667,0.0,0.6124,0.0,0.4,0.2,0.2,0.2
479,Socialism,looks like socialism finally arrived sad ,2020-11-16,0.26,0.417,0.323,-0.1531,0.0,0.5,0.0,0.5,0.0
480,Socialism,socialism based reddit unbased want socialism stay based ,2020-11-16,0.157,0.843,0.0,0.0772,0.33,0.0,0.0,0.67,0.0
481,Socialism,whats argument socialism breadlines ,2020-11-16,0.0,0.545,0.455,-0.3612,0.0,1.0,0.0,0.0,0.0
482,Socialism,aoc standing left ,2020-11-16,0.0,0.0,0.0,0.0,0.0,1.0,0.0,0.0,0.0
483,Socialism,damn texas turn socialism ,2020-11-16,0.0,0.526,0.474,-0.4019,0.0,0.0,0.0,0.0,1.0
484,Socialism,believe shilling progressivist agenda word socialism though ha ,2020-11-16,0.255,0.745,0.0,0.34,0.5,0.0,0.0,0.5,0.0
485,Socialism,free healthcare free college meets ,2020-11-16,0.688,0.312,0.0,0.765,0.0,0.33,0.67,0.0,0.0
486,Socialism,well actually socialism youre concerned ian melbourne victoria run socialist po ,2020-11-16,0.143,0.612,0.245,-0.3612,0.0,0.0,0.0,0.5,0.5
487,Socialism,know socialism umbrella term covers range po ,2020-11-16,0.0,0.625,0.375,-0.5574,0.0,1.0,0.0,0.0,0.0
488,Socialism,advocating taking working class pay millionares give predatory loans youn ,2020-11-16,0.0,0.865,0.135,-0.1027,0.0,0.5,0.0,0.0,0.5
489,Socialism,pray america must win electionotherwise socialism take usa ,2020-11-16,0.504,0.496,0.0,0.7269,0.0,1.0,0.0,0.0,0.0
490,Socialism,said breath jesus gave everything away property need like also socialism wrong bruh ,2020-11-16,0.151,0.663,0.187,-0.1531,0.2,0.2,0.0,0.2,0.4
491,Socialism,hate argument especially people go support capitalism socialism steal ,2020-11-16,0.171,0.288,0.541,-0.7533,0.0,0.33,0.0,0.33,0.33
492,Socialism,maybe need read history amp socialism theres massive difference b ,2020-11-16,0.0,0.0,0.0,0.0,0.0,1.0,0.0,0.0,0.0
493,Socialism,like socialism like taking one 1 rule housesenate president l ,2020-11-16,0.455,0.545,0.0,0.6124,0.0,0.5,0.0,0.0,0.5
494,Socialism,socialism killed millions ,2020-11-16,0.0,0.308,0.692,-0.6705,0.0,0.0,0.0,0.0,1.0
495,Socialism,stop using things europe scandinavian countries democratic ,2020-11-16,0.0,0.732,0.268,-0.296,0.0,0.0,0.0,0.0,1.0
496,Socialism,socialism cool btc cool talk double standards ,2020-11-16,0.479,0.521,0.0,0.5574,0.0,0.0,1.0,0.0,0.0
497,Socialism,darn socialism strikes ,2020-11-16,0.0,0.444,0.556,-0.3612,0.0,0.0,0.0,0.0,1.0
498,Socialism,gop rep elect grew ukraine warns socialism ,2020-11-16,0.0,0.811,0.189,-0.1027,0.0,1.0,0.0,0.0,0.0
499,Socialism,listen socialism works take away rights income religion replace government ,2020-11-16,0.0,0.0,0.0,0.0,0.25,0.75,0.0,0.0,0.0
