,Search,Tweet,Entered on,pos_score,neu_score,neg_score,compound_score,angry_score,fear_score,happy_score,sad_score,surprise_score
0,Socialism,yes call cuba full socialism also yeah cares long everyone ,2020-11-16,0.53,0.47,0.0,0.7845,0.0,0.33,0.0,0.67,0.0
1,Socialism,always whining socialism came us got bunch handouts ,2020-11-16,0.0,0.787,0.213,-0.2263,0.0,0.0,0.0,0.5,0.5
2,Socialism,hmm jesus said oppressive system stealin ,2020-11-16,0.0,0.649,0.351,-0.4019,0.0,0.5,0.0,0.0,0.5
3,Socialism,socialism attacks nothing attack poor middle class ,2020-11-16,0.425,0.333,0.242,0.2978,0.0,0.0,0.0,0.0,1.0
4,Socialism,flipping burgers 15 dollar hour job must love socialismcommunism want ,2020-11-16,0.407,0.593,0.0,0.6705,0.33,0.33,0.33,0.0,0.0
5,Socialism,please dont speak behalf us served reject socialism far left thoughts ,2020-11-16,0.164,0.643,0.193,-0.1027,0.0,0.75,0.0,0.25,0.0
6,Socialism,socialism awesome ,2020-11-16,0.804,0.196,0.0,0.6249,0.0,0.0,0.0,0.0,1.0
7,Socialism,national socialism german nationalism ,2020-11-16,0.0,0.0,0.0,0.0,0.0,0.5,0.5,0.0,0.0
8,Socialism,translation rumpets thing save scary election stealing even ,2020-11-16,0.212,0.331,0.457,-0.5719,0.0,0.33,0.0,0.0,0.67
9,Socialism,holy hit brilliant captures essence current right wing cognitive dissonance perfectly socialis ,2020-11-16,0.444,0.556,0.0,0.8402,0.17,0.5,0.33,0.0,0.0
10,Socialism,disability socialism ,2020-11-16,0.0,0.0,0.0,0.0,0.0,0.0,0.0,0.0,0.0
11,Socialism,rich get richer ga ca afford kelly loeffler blamed socialism coronavirus stock sell ,2020-11-16,0.348,0.498,0.154,0.5994,0.0,1.0,0.0,0.0,0.0
12,Socialism,fuck fuck socialism ,2020-11-16,0.0,0.125,0.875,-0.7906,0.0,0.0,1.0,0.0,0.0
13,Socialism,must democratic socialism keeps talking ,2020-11-16,0.0,0.0,0.0,0.0,0.0,0.0,0.0,0.0,0.0
14,Socialism,holy shit brilliant captures essence current right wing cognitive dissonance perfect ,2020-11-16,0.393,0.419,0.188,0.5994,0.0,0.43,0.29,0.14,0.14
15,Socialism,thought loathed welfare amp socialism ,2020-11-16,0.0,0.563,0.437,-0.4767,0.5,0.0,0.0,0.0,0.5
16,Socialism,heres socialism radical gun control laws lockdowns arent something support ,2020-11-16,0.0,0.632,0.368,-0.5659,0.0,0.0,0.0,0.0,1.0
17,Socialism,nope subscribe also clearly nothing ,2020-11-16,0.0,0.639,0.361,-0.3089,0.0,0.0,0.0,0.0,0.0
18,Socialism,communism spread america names socialism progressivism liberalism neo marxism ,2020-11-16,0.0,0.0,0.0,0.0,0.0,1.0,0.0,0.0,0.0
19,Socialism,liter buy sell homes cuba co ops dont mean socialism theres pizza co op ,2020-11-16,0.0,0.0,0.0,0.0,0.0,0.0,0.0,1.0,0.0
20,Socialism,shitshow brought pelosi probably funded bloomberg soros left wants control ,2020-11-16,0.0,0.0,0.0,0.0,0.0,0.67,0.0,0.33,0.0
21,Socialism,depends definition market socialism tbh ,2020-11-16,0.0,0.0,0.0,0.0,0.0,0.5,0.0,0.0,0.5
22,Socialism,tds max wonder baby thank potus trump team facilitatin ,2020-11-16,0.238,0.762,0.0,0.3612,0.0,0.0,0.0,0.0,1.0
23,Socialism,yep fucked took 70 years part americas society accept word soci ,2020-11-16,0.279,0.465,0.256,-0.1531,0.33,0.0,0.33,0.0,0.33
24,Socialism,im writing moment amurikka ready communism ready socialism social democracy ,2020-11-16,0.385,0.615,0.0,0.6124,0.0,0.5,0.5,0.0,0.0
25,Socialism,gop rep elect grew ukraine warns socialism 25 years ago hired man defected ,2020-11-16,0.0,0.728,0.272,-0.4767,0.0,1.0,0.0,0.0,0.0
26,Socialism,also excellent take socialism hayak bit optimistic vie ,2020-11-16,0.5,0.5,0.0,0.7184,0.0,0.0,1.0,0.0,0.0
27,Socialism,imagine understanding socialism thinking biden policies way socialism ,2020-11-16,0.0,0.0,0.0,0.0,0.0,0.33,0.0,0.0,0.67
28,Socialism,need new economy third world socialism third world socialism laserdisc ,2020-11-16,0.0,0.0,0.0,0.0,0.0,1.0,0.0,0.0,0.0
29,Socialism,republicans used defund police socialism talk get elected many voters aware ,2020-11-16,0.0,0.0,0.0,0.0,0.0,0.0,0.0,1.0,0.0
30,Socialism,isnt whole platform socialism ,2020-11-16,0.0,0.0,0.0,0.0,0.0,1.0,0.0,0.0,0.0
31,Socialism,darling live canada saying overly taxed extrem cost ,2020-11-16,0.352,0.648,0.0,0.5859,0.0,0.0,0.0,0.0,1.0
32,Socialism,stupid ridiculous socialism ,2020-11-16,0.0,0.145,0.855,-0.7096,0.0,0.0,0.0,0.0,0.0
33,Socialism,bernie sanders forced labor secretary socialism ,2020-11-16,0.0,0.625,0.375,-0.4588,0.0,1.0,0.0,0.0,0.0
34,Socialism,ndps liberals idea canadians cdnpoli venezuela socialism ,2020-11-16,0.0,0.0,0.0,0.0,0.0,0.0,0.0,0.0,0.0
35,Socialism,eliminating private healthcare single payer m4a definition socialism ,2020-11-16,0.0,0.0,0.0,0.0,0.0,0.0,0.0,0.0,1.0
36,Socialism,due totalitarian regimes left right ,2020-11-16,0.0,0.563,0.437,-0.4767,0.0,1.0,0.0,0.0,0.0
37,Socialism,definitely socialism created daylight savings time basically took sunlight give ,2020-11-16,0.37,0.63,0.0,0.5719,0.0,0.75,0.0,0.0,0.25
38,Socialism,yes agree cuba fully socialist businesses worker co ops soc ,2020-11-16,0.394,0.606,0.0,0.6369,0.0,0.5,0.0,0.5,0.0
39,Socialism,gop congresswoman elect fled soviet union pretty socialism runs money ,2020-11-16,0.262,0.738,0.0,0.4939,0.0,0.5,0.5,0.0,0.0
40,Socialism,market socialism implies socialism capitalism mutually exclusive guess ,2020-11-16,0.176,0.824,0.0,0.128,0.0,0.5,0.0,0.0,0.5
41,Socialism,ironic socialism odds starving death drastically increase ,2020-11-16,0.17,0.222,0.607,-0.7096,0.0,1.0,0.0,0.0,0.0
42,Socialism,first socialism fully achieved countries ussr got capitalistic china ,2020-11-16,0.0,0.0,0.0,0.0,0.0,0.0,0.0,0.0,1.0
43,Socialism,yo actually really appreciate taking time ,2020-11-16,0.374,0.626,0.0,0.4576,0.0,0.0,0.25,0.0,0.75
44,Socialism,market comes people buying selling things one ,2020-11-16,0.0,0.0,0.0,0.0,0.0,0.33,0.0,0.0,0.67
45,Socialism,trump inauguration head gop billionaire hired lobbyists get covid bail pp loans call th ,2020-11-16,0.0,0.0,0.0,0.0,0.0,0.5,0.0,0.0,0.5
46,Socialism,think part socialistanarchiston left holding contradictions leftist ,2020-11-16,0.0,0.723,0.277,-0.3182,0.0,0.0,0.0,0.0,1.0
47,Socialism,none socialism none progressive taxation government spending government services socialism ,2020-11-16,0.0,0.0,0.0,0.0,0.0,0.0,0.0,0.0,0.0
48,Socialism,really appreciate exposing socialism communism many people balls knowled ,2020-11-16,0.242,0.566,0.192,0.1567,0.0,0.0,0.5,0.0,0.5
49,Socialism,think wo work continues commodity producti ,2020-11-16,0.0,0.0,0.0,0.0,0.0,0.5,0.0,0.0,0.5
50,Socialism,found daughter trumper friends collecting help wic bitch socialism bu ,2020-11-16,0.349,0.422,0.229,0.25,0.0,0.0,0.5,0.0,0.5
51,Socialism,young people wanting socialism go venezuela bit see like idea ,2020-11-16,0.217,0.783,0.0,0.3612,0.0,0.0,0.0,0.0,0.0
52,Socialism,mean socialism ,2020-11-16,0.0,0.0,0.0,0.0,0.0,0.0,0.0,0.0,0.0
53,Socialism,believe affordable education healthcare making sure workin ,2020-11-16,0.277,0.723,0.0,0.3182,0.0,0.67,0.0,0.33,0.0
54,Socialism,dear leader said would get free socialism bad ,2020-11-16,0.41,0.347,0.243,0.34,0.0,0.2,0.2,0.2,0.4
55,Socialism,got news intertwined history catholicism socialism ,2020-11-16,0.0,0.0,0.0,0.0,0.0,1.0,0.0,0.0,0.0
56,Socialism,dont think know history utter failure ,2020-11-16,0.0,0.602,0.398,-0.5106,0.0,0.33,0.0,0.33,0.33
57,Socialism,might well start new party considering democrats going ,2020-11-16,0.444,0.556,0.0,0.5859,0.33,0.33,0.0,0.33,0.0
58,Socialism,everything politician politicians corrupt authoritarian country capital ,2020-11-16,0.0,0.0,0.0,0.0,0.0,0.67,0.0,0.33,0.0
59,Socialism,really disgusting silly dumbacrats get feelings hurt easy worry trump ,2020-11-16,0.222,0.259,0.519,-0.7727,0.0,0.17,0.0,0.5,0.33
60,Socialism,conservative states enjoy socialist tax dollars hate ,2020-11-16,0.269,0.42,0.311,-0.128,0.0,0.0,0.33,0.67,0.0
61,Socialism,work government gives everything think call somethingsocialism ,2020-11-16,0.0,0.0,0.0,0.0,0.0,0.5,0.0,0.25,0.25
62,Socialism,60 minutes grew long gone far left unreal used high ,2020-11-16,0.0,0.0,0.0,0.0,0.0,1.0,0.0,0.0,0.0
63,Socialism,hello read rev dr barber medicare amp 15hr federal minimum wage ,2020-11-16,0.0,0.0,0.0,0.0,0.0,1.0,0.0,0.0,0.0
64,Socialism,socialism commodity production exchange market ,2020-11-16,0.0,0.0,0.0,0.0,0.0,1.0,0.0,0.0,0.0
65,Socialism,nothing says socialism like taking taxpayer dollars paying blue haired millennials useless ge ,2020-11-16,0.0,0.691,0.309,-0.6007,0.0,0.0,0.0,0.33,0.67
66,Socialism,chairmen joe forgot congratulate potus trump team facilitating enabling ,2020-11-16,0.286,0.714,0.0,0.4939,0.33,0.0,0.33,0.0,0.33
67,Socialism,think ffp 3 awesome policy innovation would prefer material support ,2020-11-16,0.61,0.39,0.0,0.8555,0.0,0.4,0.2,0.0,0.4
68,Socialism,absolutely communist think certain services th ,2020-11-16,0.321,0.679,0.0,0.3321,0.0,0.67,0.0,0.0,0.33
69,Socialism,im suburb st louis go ught hard jill schupp hard break racis ,2020-11-16,0.0,0.781,0.219,-0.2023,0.67,0.0,0.0,0.0,0.33
70,Socialism,socialism except goes donors president pay campaign debt smh ,2020-11-16,0.0,0.492,0.508,-0.6369,0.0,1.0,0.0,0.0,0.0
71,Socialism,socialism healthcare education ,2020-11-16,0.0,0.0,0.0,0.0,0.0,0.0,0.0,0.0,0.0
72,Socialism,person convinced 2 things 1 doesnt actually understand socialism 2 likely ,2020-11-16,0.278,0.722,0.0,0.4019,0.0,0.33,0.0,0.0,0.67
73,Socialism,yes socialism workers control ,2020-11-16,0.474,0.526,0.0,0.4019,0.0,0.0,0.0,1.0,0.0
74,Socialism,today faux socialists ca answer ,2020-11-16,0.0,0.0,0.0,0.0,0.0,0.0,0.0,0.0,0.0
75,Socialism,also ,2020-11-16,0.0,0.0,0.0,0.0,0.0,0.0,0.0,0.0,0.0
76,Socialism,member congress jim jordan receives top medical care courtesy american tax pay ,2020-11-16,0.444,0.473,0.083,0.7269,0.0,0.0,0.0,0.0,1.0
77,Socialism,controversial opinion dont subscribe idea socialismcommunism cannot work hu ,2020-11-16,0.0,0.816,0.184,-0.2023,0.0,1.0,0.0,0.0,0.0
78,Socialism,look fascism one defining fea ,2020-11-16,0.0,0.0,0.0,0.0,0.0,1.0,0.0,0.0,0.0
79,Socialism,gnd forgiving college debt arent wildly unpopular ,2020-11-16,0.279,0.481,0.24,0.1027,0.0,0.5,0.0,0.5,0.0
80,Socialism,country worse worse communism worse socialism thief murder ,2020-11-16,0.0,0.147,0.853,-0.9545,0.0,0.0,0.0,1.0,0.0
81,Socialism,true really flummoxing fairly aggressive boost minimum wage passes year ,2020-11-16,0.383,0.487,0.13,0.5627,0.0,0.33,0.0,0.0,0.67
82,Socialism,arguing parents politics hit b ut th ci ali sm completely shut ,2020-11-16,0.0,0.769,0.231,-0.4588,0.5,0.5,0.0,0.0,0.0
83,Socialism,europe fine democratic socialism ,2020-11-16,0.375,0.625,0.0,0.2023,0.0,0.0,1.0,0.0,0.0
84,Socialism,thats socialism ,2020-11-16,0.0,0.0,0.0,0.0,0.0,0.0,0.0,0.0,0.0
85,Socialism,disgusted fact ppl actually lines waiting ,2020-11-16,0.0,0.595,0.405,-0.5267,0.0,0.25,0.0,0.25,0.5
86,Socialism,equate thing broadly understood bad known fascist thing think bad socialism ,2020-11-16,0.0,0.43,0.57,-0.891,0.0,0.17,0.0,0.33,0.5
87,Socialism,youre right democratic socialism need ,2020-11-16,0.0,0.0,0.0,0.0,0.0,1.0,0.0,0.0,0.0
88,Socialism,come gave people housing food covid ,2020-11-16,0.0,0.0,0.0,0.0,0.0,1.0,0.0,0.0,0.0
89,Socialism,socialism obviously ,2020-11-16,0.0,0.0,0.0,0.0,0.0,0.0,0.0,0.0,0.0
90,Socialism,unreasonable conservatives think socialism ,2020-11-16,0.0,0.0,0.0,0.0,0.0,0.0,0.0,0.0,1.0
91,Socialism,greatest lie american public ever swallowed capitalism good socialism c ,2020-11-16,0.504,0.496,0.0,0.7964,0.0,0.33,0.33,0.0,0.33
92,Socialism,simple fix everybody wants free schools find professors work free make millions ,2020-11-16,0.398,0.602,0.0,0.765,0.0,0.4,0.4,0.2,0.0
93,Socialism,democrat raphael warnock defender socialism ,2020-11-16,0.259,0.741,0.0,0.1027,0.0,0.0,0.0,0.0,0.0
94,Socialism,socialism looks like cant belive yall still want live system produces ,2020-11-16,0.297,0.703,0.0,0.4215,0.0,1.0,0.0,0.0,0.0
95,Socialism,define socialism without using google ,2020-11-16,0.0,0.0,0.0,0.0,0.0,0.0,0.0,0.0,0.0
96,Socialism,communist states dont exist term communist state oxymoron ,2020-11-16,0.0,0.824,0.176,-0.128,0.0,0.0,0.0,1.0,0.0
97,Socialism,black lives matter privilegeget used black crime going skyrocket prosecution going ,2020-11-16,0.07,0.506,0.424,-0.765,0.0,0.75,0.0,0.25,0.0
98,Socialism,insane trump pushed social ,2020-11-16,0.0,0.526,0.474,-0.4019,0.0,0.5,0.0,0.0,0.5
99,Socialism,socialism great unpopular nowadays ,2020-11-16,0.577,0.423,0.0,0.6249,0.0,0.0,0.5,0.5,0.0
100,Socialism,dad teach bankruptcy form socialism putting trillions stocks ,2020-11-16,0.0,0.0,0.0,0.0,0.0,0.33,0.0,0.67,0.0
101,Socialism,difference social assistance socialism lol ,2020-11-16,0.412,0.588,0.0,0.4215,0.0,1.0,0.0,0.0,0.0
102,Socialism,man said refuses wear mask doesnt believe im socialism ,2020-11-16,0.0,0.0,0.0,0.0,0.0,0.0,0.0,0.67,0.33
103,Socialism,lost south florida bernie idiots would stop talking goddamn socialism ,2020-11-16,0.0,0.479,0.521,-0.765,0.0,0.5,0.0,0.5,0.0
104,Socialism,cats little socialism ,2020-11-16,0.0,0.0,0.0,0.0,0.0,0.0,0.0,0.0,0.0
105,Socialism,makes sense people imagine socialism something strings attached im ,2020-11-16,0.0,0.0,0.0,0.0,0.0,0.0,0.33,0.33,0.33
106,Socialism,socialism lost scare factor theyve starting using marxism ,2020-11-16,0.0,0.522,0.478,-0.6705,0.0,0.0,0.0,0.5,0.5
107,Socialism,,2020-11-16,0.0,0.0,0.0,0.0,0.0,0.0,0.0,0.0,0.0
108,Socialism,belt point countries willing return back profit healthcare system ,2020-11-16,0.266,0.734,0.0,0.4404,0.0,0.67,0.0,0.0,0.33
109,Socialism,shows dems think democratic socialism reos think communism great national cohesion ,2020-11-16,0.291,0.709,0.0,0.6249,0.0,0.0,0.5,0.0,0.5
110,Socialism,left biden marketing effort begins make socialism look mainstream news ,2020-11-16,0.0,0.0,0.0,0.0,0.0,0.5,0.0,0.5,0.0
111,Socialism,donald trump conservatives radical socialism ,2020-11-16,0.0,0.0,0.0,0.0,0.0,0.0,0.0,0.0,1.0
112,Socialism,socialism texashypocrisy ,2020-11-16,0.0,0.0,0.0,0.0,0.0,0.0,0.0,0.0,0.0
113,Socialism,democratic socialism socialism communism like roadsschool pu ,2020-11-16,0.26,0.521,0.219,0.1027,0.0,0.0,0.0,0.0,0.0
114,Socialism,communism socialism give money ,2020-11-16,0.0,0.0,0.0,0.0,0.0,1.0,0.0,0.0,0.0
115,Socialism,actually number call minnesota people tell report others violating thanksgiving rul ,2020-11-16,0.094,0.652,0.254,-0.4939,0.0,0.33,0.0,0.33,0.33
116,Socialism,think capitalism could described part magnification follies human nature impe ,2020-11-16,0.182,0.818,0.0,0.25,0.0,0.33,0.0,0.33,0.33
117,Socialism,dominion conspiring china venezuela done business past cuba want help ,2020-11-16,0.333,0.667,0.0,0.4588,0.0,0.33,0.0,0.33,0.33
118,Socialism,ha know complain parent basement ca find job ,2020-11-16,0.22,0.55,0.229,-0.0258,0.0,0.75,0.0,0.25,0.0
119,Socialism,reporters need also socialism ,2020-11-16,0.0,0.0,0.0,0.0,0.0,0.0,0.0,0.0,0.0
120,Socialism,laughing loud socialism works ,2020-11-16,0.516,0.484,0.0,0.4939,0.0,1.0,0.0,0.0,0.0
121,Socialism,define socialism please pretty sure bankruptcy falls ,2020-11-16,0.661,0.339,0.0,0.7783,0.0,0.33,0.33,0.33,0.0
122,Socialism,disgusting honest cowardism another street thug degree better words lake educati ,2020-11-16,0.352,0.455,0.193,0.4215,0.25,0.0,0.0,0.5,0.25
123,Socialism,cool critique liberalism think approach socialism would lead national capitalism ,2020-11-16,0.204,0.796,0.0,0.3182,0.0,0.2,0.4,0.0,0.4
124,Socialism,people believe socialism school brainwashed thin ,2020-11-16,0.0,0.0,0.0,0.0,0.0,0.0,0.0,0.0,0.0
125,Socialism,food stamps welfare socialism security checks voted trump let feed ,2020-11-16,0.211,0.789,0.0,0.34,0.25,0.25,0.0,0.25,0.25
126,Socialism,better yet reality show contestants love socialism communism get 1st ,2020-11-16,0.47,0.53,0.0,0.7964,0.0,0.0,0.5,0.0,0.5
127,Socialism,also put place iq test running office prevent people like getting ,2020-11-16,0.286,0.714,0.0,0.3818,0.0,0.5,0.0,0.5,0.0
128,Socialism,congratulations win saw amp liked said countering socialism amp crazy aoc ,2020-11-16,0.528,0.352,0.121,0.8442,0.0,0.33,0.0,0.33,0.33
129,Socialism,china bat virus old news dems try exploit another exaggerated crisis ,2020-11-16,0.0,0.537,0.463,-0.7096,0.0,0.5,0.0,0.0,0.5
130,Socialism,socialism like fema florida 21 red states taker states kentucky one ,2020-11-16,0.2,0.8,0.0,0.3612,0.33,0.0,0.0,0.67,0.0
131,Socialism,fake tweet like demon rats msm fakers come clean investigate 100 allegation f ,2020-11-16,0.301,0.52,0.179,0.2732,0.0,0.5,0.0,0.5,0.0
132,Socialism,fair ask reporter socialism theyll define something resembling scandinavian countri ,2020-11-16,0.204,0.796,0.0,0.3182,0.0,1.0,0.0,0.0,0.0
133,Socialism,socialism based ,2020-11-16,0.0,0.0,0.0,0.0,0.0,0.0,0.0,1.0,0.0
134,Socialism,united soon fight high taxes wait see ,2020-11-16,0.269,0.481,0.25,0.0516,0.0,0.33,0.0,0.33,0.33
135,Socialism,meaning beauty absence childhood socialism ,2020-11-16,0.487,0.513,0.0,0.5859,0.0,0.0,1.0,0.0,0.0
136,Socialism,property ownership one democratically elected government second socialism generally ,2020-11-16,0.0,0.0,0.0,0.0,0.0,0.0,0.0,0.0,0.0
137,Socialism,logic reason science human nature compute communists mental illness social ,2020-11-16,0.0,0.769,0.231,-0.4019,0.0,0.67,0.0,0.33,0.0
138,Socialism,obviously want say every ,2020-11-16,0.302,0.698,0.0,0.0772,0.0,0.0,0.0,0.0,1.0
139,Socialism,squad long yall rant anti american socialist dogma denigrate 12 people coun ,2020-11-16,0.0,0.68,0.32,-0.5719,0.5,0.5,0.0,0.0,0.0
140,Socialism,think actions lenin stalin would necessary ,2020-11-16,0.0,0.0,0.0,0.0,0.0,0.67,0.0,0.0,0.33
141,Socialism,anyone surprised taken flagged anyone mention ,2020-11-16,0.275,0.725,0.0,0.2263,0.0,0.0,0.0,0.0,1.0
142,Socialism,point socialism isnt answer might bunch ,2020-11-16,0.0,0.0,0.0,0.0,0.5,0.0,0.0,0.0,0.5
143,Socialism,dr carr says seeing right logical outcome fantasy race amp simply unsustainabl ,2020-11-16,0.0,0.0,0.0,0.0,0.0,0.67,0.0,0.0,0.33
144,Socialism,world would taxpayers want pay student debt made conscious decision execut ,2020-11-16,0.098,0.606,0.295,-0.3818,0.0,0.67,0.0,0.33,0.0
145,Socialism,divide good old usa take care go ,2020-11-16,0.55,0.45,0.0,0.7269,0.0,0.0,1.0,0.0,0.0
146,Socialism,hate socialism much abolish public education social security clown ,2020-11-16,0.183,0.534,0.282,-0.3182,0.0,0.67,0.0,0.33,0.0
147,Socialism,aoc good haters bad ,2020-11-16,0.274,0.094,0.632,-0.5859,0.0,0.0,0.5,0.5,0.0
148,Socialism,combined socialism term encompassed many wildly different ideas abou ,2020-11-16,0.0,0.0,0.0,0.0,0.0,0.0,0.0,0.0,0.0
149,Socialism,please explain social security pitch ,2020-11-16,0.61,0.39,0.0,0.5719,0.0,0.5,0.0,0.5,0.0
150,Socialism,dumbasses gop states c amon need box food would socialism ,2020-11-16,0.0,0.0,0.0,0.0,0.0,0.5,0.0,0.5,0.0
151,Socialism,middle even though deny socialists tell friends tell ,2020-11-16,0.27,0.522,0.209,0.1779,0.0,0.0,0.25,0.75,0.0
152,Socialism,cringe queers died socialism nazism capitalism ,2020-11-16,0.0,0.581,0.419,-0.5574,0.0,1.0,0.0,0.0,0.0
153,Socialism,angela please get facts right going comment china wealthiest cou ,2020-11-16,0.407,0.593,0.0,0.6705,0.0,0.67,0.0,0.33,0.0
154,Socialism,kind thinking got stop taking basic public health measures nothing socialism wearin ,2020-11-16,0.218,0.641,0.141,0.296,0.0,0.0,0.33,0.0,0.67
155,Socialism,indefinite lock downs free stimulus checks creating full dependency government poof ,2020-11-16,0.379,0.621,0.0,0.6705,0.0,0.0,0.5,0.5,0.0
156,Socialism,dems entire system messed georgias entire election ,2020-11-16,0.0,0.714,0.286,-0.34,0.25,0.75,0.0,0.0,0.0
157,Socialism,would better hurry socialism communism already began mandated mask due deliberate rele ,2020-11-16,0.209,0.791,0.0,0.4404,0.0,0.33,0.0,0.33,0.33
158,Socialism,parties media managed make socialism filthy word many cor ,2020-11-16,0.252,0.748,0.0,0.4019,0.25,0.25,0.0,0.25,0.25
159,Socialism,thats kind socialism works ,2020-11-16,0.531,0.469,0.0,0.5267,0.0,0.5,0.5,0.0,0.0
160,Socialism,aoc spirit animal ,2020-11-16,0.459,0.541,0.0,0.1779,0.0,0.0,0.0,1.0,0.0
161,Socialism,exactly want bitch socialism dont hear complaining ,2020-11-16,0.27,0.374,0.355,-0.4419,0.0,0.0,0.0,1.0,0.0
162,Socialism,would actually love every reporter type work asked people define socialism ,2020-11-16,0.296,0.704,0.0,0.6369,0.0,0.67,0.17,0.0,0.17
163,Socialism,cumulative battle future americaand rest worldis coming head ,2020-11-16,0.0,0.729,0.271,-0.3818,0.0,0.5,0.0,0.0,0.5
164,Socialism,bernie lost claimed democratic socia ,2020-11-16,0.0,0.635,0.365,-0.3182,0.0,0.0,0.0,0.5,0.5
165,Socialism,sounds like socialism ,2020-11-16,0.556,0.444,0.0,0.3612,0.0,0.0,0.0,0.0,0.0
166,Socialism,something something life socialism ,2020-11-16,0.0,0.0,0.0,0.0,0.0,1.0,0.0,0.0,0.0
167,Socialism,life hard pay stuff good argument government entitlements ,2020-11-16,0.238,0.328,0.434,-0.1027,0.4,0.4,0.2,0.0,0.0
168,Socialism,isis raheem state paid undergrad degree politics liberal arts major gets fas ,2020-11-16,0.0,0.0,0.0,0.0,0.0,0.5,0.0,0.5,0.0
169,Socialism,got parents died still communism czech rep escaped 1968 ,2020-11-16,0.0,0.69,0.31,-0.5574,0.0,1.0,0.0,0.0,0.0
170,Socialism,yup socialism rich harsh punishment everyone else god forbid dont bail b ,2020-11-16,0.284,0.299,0.418,-0.4019,0.0,0.33,0.0,0.33,0.33
171,Socialism,getting ridiculed media saying wwii fought socialism hardly anyone stat ,2020-11-16,0.0,0.625,0.375,-0.5859,0.0,0.0,0.0,0.5,0.5
172,Socialism,almost certainly dont understanding socialism br ,2020-11-16,0.296,0.704,0.0,0.2748,0.0,0.0,0.0,0.0,0.0
173,Socialism,says tin jeremy corbyn true socialism ,2020-11-16,0.359,0.641,0.0,0.4215,0.0,0.0,0.0,0.0,1.0
174,Socialism,like socialism shes gonna take way share without contributing potluck ,2020-11-16,0.37,0.63,0.0,0.5719,0.0,0.0,0.0,0.0,0.0
175,Socialism,life software engineer code offs real thing get two gr ,2020-11-16,0.0,0.0,0.0,0.0,0.0,0.5,0.0,0.25,0.25
176,Socialism,communism spread america names socialism progressivism liberalism neo marxism ,2020-11-16,0.0,0.0,0.0,0.0,0.0,1.0,0.0,0.0,0.0
177,Socialism,well asked define socialism came whatever ,2020-11-16,0.296,0.704,0.0,0.2732,0.0,0.5,0.0,0.0,0.5
178,Socialism,socialism even happening china korea scandinavia countries ,2020-11-16,0.0,0.0,0.0,0.0,0.0,0.0,0.0,0.0,0.0
179,Socialism,socialism economic system democracy political system ,2020-11-16,0.0,0.0,0.0,0.0,0.0,1.0,0.0,0.0,0.0
180,Socialism,spoken like die hard democrat would take socialism party rather smart constitutio ,2020-11-16,0.391,0.347,0.262,0.3818,0.25,0.75,0.0,0.0,0.0
181,Socialism,many frame us cold war imperialist exploits ideological opposition socialism really intervent ,2020-11-16,0.0,0.613,0.387,-0.743,0.0,0.0,0.0,0.33,0.67
182,Socialism,thats socialism actually means putting small large private businesse ,2020-11-16,0.0,0.0,0.0,0.0,0.0,0.0,0.0,0.5,0.5
183,Socialism,meant say misinterpreting rather following scientific socialism non dogmatic manner ,2020-11-16,0.0,0.0,0.0,0.0,0.0,0.5,0.0,0.0,0.5
184,Socialism,ok need explain communism isnt sa ,2020-11-16,0.306,0.694,0.0,0.296,0.0,0.0,0.0,0.0,0.0
185,Socialism,socialism 13 courage brothers remember cause stand cried nicolas navarro beaten ,2020-11-16,0.193,0.482,0.325,-0.296,0.0,0.5,0.0,0.0,0.5
186,Socialism,laughing loud whos confused friend biden sociali ,2020-11-16,0.504,0.315,0.181,0.6249,0.0,0.5,0.5,0.0,0.0
187,Socialism,gotta agree sound nice cons never balk military border spending tel ,2020-11-16,0.371,0.629,0.0,0.6486,0.5,0.0,0.5,0.0,0.0
188,Socialism,rs keep telling us socialism problem act like dictators aint falling okie doke ,2020-11-16,0.237,0.601,0.162,0.0629,0.0,0.5,0.0,0.5,0.0
189,Socialism,yup working people dont right socialismcommunism ,2020-11-16,0.0,0.0,0.0,0.0,0.0,1.0,0.0,0.0,0.0
190,Socialism,cancel student debt another euphemism socialism ,2020-11-16,0.0,0.471,0.529,-0.5423,0.0,0.0,0.0,0.0,0.0
191,Socialism,geeze hard socialism works works make 10 governmen ,2020-11-16,0.0,0.833,0.167,-0.1027,0.25,0.5,0.0,0.25,0.0
192,Socialism,agree capitalism must modified socialism ,2020-11-16,0.385,0.615,0.0,0.3612,0.0,0.0,0.0,0.0,0.0
193,Socialism,thats socialism baby ,2020-11-16,0.0,0.0,0.0,0.0,0.0,0.0,0.0,0.0,0.0
194,Socialism,guess lotta folks red states gonna suing relatives homeowner insurance compa ,2020-11-16,0.0,0.826,0.174,-0.2732,0.25,0.25,0.0,0.25,0.25
195,Socialism,correction cilantro intermediate state caraway parsley guess socialism bad ,2020-11-16,0.0,0.696,0.304,-0.5423,0.0,0.25,0.0,0.5,0.25
196,Socialism,amazing people wired love big government socialism view government ,2020-11-16,0.533,0.467,0.0,0.8402,0.0,0.0,0.5,0.0,0.5
197,Socialism,socialism vs socialism ,2020-11-16,0.0,0.0,0.0,0.0,0.0,0.0,0.0,0.0,0.0
198,Socialism,make new word brainwashing youve subjecte ,2020-11-16,0.0,0.667,0.333,-0.3612,0.5,0.0,0.0,0.5,0.0
199,Socialism,yup socialism ,2020-11-16,0.0,0.0,0.0,0.0,0.0,0.0,0.0,0.0,0.0
200,Socialism,ditto neil evidence better rock solid undeniable court show pretty damn quic ,2020-11-16,0.418,0.435,0.147,0.6124,0.0,0.5,0.25,0.0,0.25
201,Socialism,forgiving student loans isnt descending socialism germany free c ,2020-11-16,0.508,0.492,0.0,0.7351,0.0,0.0,0.5,0.5,0.0
202,Socialism,could please explain socialism also need learn wha ,2020-11-16,0.247,0.753,0.0,0.3182,0.0,0.0,0.0,1.0,0.0
203,Socialism,social security medicare count socialism actually curious trying figure defining ,2020-11-16,0.37,0.63,0.0,0.5719,0.0,0.6,0.0,0.0,0.4
204,Socialism,currently live corporate socialism wouldnt socialism people least effective ,2020-11-16,0.0,0.758,0.242,-0.3724,0.0,0.0,0.0,0.0,0.0
205,Socialism,socialism communism ,2020-11-16,0.0,0.0,0.0,0.0,0.0,0.0,0.0,0.0,0.0
206,Socialism,know definition loan definiton loan investor follow socialism idea ,2020-11-16,0.0,0.0,0.0,0.0,0.0,0.5,0.0,0.0,0.5
207,Socialism,capitalism rewards personal responsibility training education hard work experience integrity ,2020-11-16,0.404,0.496,0.099,0.6486,0.33,0.67,0.0,0.0,0.0
