,Search,Tweet,Entered on,pos_score,neu_score,neg_score,compound_score,angry_score,fear_score,happy_score,sad_score,surprise_score
208,Socialism,aoc get job see rest us get wake socialism doesnt work neither leftish ideas ,2020-11-16,0.0,0.0,0.0,0.0,0.0,0.67,0.0,0.33,0.0
209,Socialism,want live socialism government country sociali ,2020-11-16,0.206,0.794,0.0,0.0772,0.0,0.0,0.0,0.0,0.0
210,Socialism,market socialism capitalism ,2020-11-16,0.0,0.0,0.0,0.0,0.0,1.0,0.0,0.0,0.0
211,Socialism,think naunce family negatively affected socialism ie chines ,2020-11-16,0.0,0.814,0.186,-0.1531,0.0,0.0,0.0,0.33,0.67
212,Socialism,oh god go socialism careful wish could always focus ,2020-11-16,0.516,0.484,0.0,0.6597,0.0,0.0,0.0,0.67,0.33
213,Socialism,one thing bothers social programs bad thing need make people safe ,2020-11-16,0.179,0.494,0.327,-0.34,0.0,0.2,0.0,0.4,0.4
214,Socialism,candace owens damn also need every american take marxism socialism communism ,2020-11-16,0.0,0.787,0.213,-0.4019,0.0,0.0,0.0,0.0,0.0
215,Socialism,willing support effort repeal drunk driving laws infringing ,2020-11-16,0.243,0.541,0.216,0.0772,0.0,0.5,0.0,0.0,0.5
216,Socialism,even tell socialism nice slogan ,2020-11-16,0.412,0.588,0.0,0.4215,0.0,0.0,0.5,0.5,0.0
217,Socialism,think still 19 20 years early americans support ubi wait social ,2020-11-16,0.213,0.787,0.0,0.4019,0.0,0.33,0.0,0.0,0.67
218,Socialism,capitalism rewards personal responsibility training education hard work experience integri ,2020-11-16,0.248,0.64,0.112,0.4019,0.33,0.67,0.0,0.0,0.0
219,Socialism,advocates socialism people whove never subject gop rep elect grew ukraine w ,2020-11-16,0.0,0.0,0.0,0.0,0.0,0.0,0.0,0.0,0.0
220,Socialism,reddit abolished socialism would want socialist country ,2020-11-16,0.178,0.822,0.0,0.0772,0.0,1.0,0.0,0.0,0.0
221,Socialism,keep socialism side pond thank much ,2020-11-16,0.333,0.667,0.0,0.3612,0.0,0.0,0.0,0.0,0.0
222,Socialism,frightened socialism dictatorship one threatens democracy ,2020-11-16,0.0,0.421,0.579,-0.6705,0.0,1.0,0.0,0.0,0.0
223,Socialism,terrible slogan defund police immediately repudiated correct inte ,2020-11-16,0.0,0.693,0.307,-0.4767,0.0,1.0,0.0,0.0,0.0
224,Socialism,socialism problem venezuela problem venezuela fact one resource dependent country ,2020-11-16,0.0,0.597,0.403,-0.6597,0.0,1.0,0.0,0.0,0.0
225,Socialism,spending put money pockets donors corporate socialism isnt oxymoron ,2020-11-16,0.146,0.854,0.0,0.0951,0.0,0.0,0.0,1.0,0.0
226,Socialism,push agenda needs majority commission narrowly h ,2020-11-16,0.0,0.0,0.0,0.0,0.0,1.0,0.0,0.0,0.0
227,Socialism,get ready socialism full control nwo dont complain ,2020-11-16,0.434,0.566,0.0,0.5588,0.0,0.0,0.5,0.5,0.0
228,Socialism,word socialism replaced word witchcraft ,2020-11-16,0.0,0.0,0.0,0.0,0.67,0.33,0.0,0.0,0.0
229,Socialism,wonder healthier first step socialism capitalism would ,2020-11-16,0.0,0.0,0.0,0.0,0.0,0.33,0.0,0.0,0.67
230,Socialism,michael grownup world realize responsible decis ,2020-11-16,0.315,0.685,0.0,0.3182,0.0,1.0,0.0,0.0,0.0
231,Socialism,kleptocracy swallowed much end times nonsense sacking ,2020-11-16,0.0,0.69,0.31,-0.4019,0.0,1.0,0.0,0.0,0.0
232,Socialism,mussolini pioneered nationalistic socialism yeah see like socialists rejected ,2020-11-16,0.336,0.429,0.236,0.1027,0.0,0.0,0.0,0.0,0.0
233,Socialism,democrats look sharpen message senate setback hill talking abou ,2020-11-16,0.0,0.0,0.0,0.0,0.0,0.0,0.0,0.0,0.0
234,Socialism,22 socialism valentine day february 14 1945 never recovered perished june 16 1945 ,2020-11-16,0.0,0.0,0.0,0.0,0.0,0.0,0.5,0.0,0.5
235,Socialism,said backs socialism mean wants continue social security medicare right ,2020-11-16,0.207,0.69,0.103,0.296,0.0,0.75,0.0,0.0,0.25
236,Socialism,uhhm putting 1 wealth tax families worth 20 million basically socialism may ,2020-11-16,0.362,0.638,0.0,0.6249,0.0,0.6,0.0,0.2,0.2
237,Socialism,socialism bad matter ,2020-11-16,0.196,0.179,0.625,-0.5267,0.0,0.5,0.0,0.5,0.0
238,Socialism,funny hows people want socialism ,2020-11-16,0.583,0.417,0.0,0.4939,0.0,0.0,0.0,0.0,1.0
239,Socialism,clearly benefits socialism included core literacy program like cuba ,2020-11-16,0.565,0.435,0.0,0.7783,0.0,1.0,0.0,0.0,0.0
240,Socialism,attacking capitalism encourages socialism competition definitely eliminated e ,2020-11-16,0.444,0.317,0.238,0.3818,0.0,1.0,0.0,0.0,0.0
241,Socialism,dare availalable pushbutton soundtrack stupidity seriously tho p ,2020-11-16,0.0,0.521,0.479,-0.5574,0.0,1.0,0.0,0.0,0.0
242,Socialism,long tax deductible course socialism evil know ,2020-11-16,0.0,0.577,0.423,-0.6597,0.0,1.0,0.0,0.0,0.0
243,Socialism,technology hybridization socialism totalitarianism ,2020-11-16,0.0,0.448,0.552,-0.5719,0.0,0.0,0.0,0.0,0.0
244,Socialism,twin paths socialism equity climate change alarmism ,2020-11-16,0.0,0.822,0.178,-0.0772,0.0,1.0,0.0,0.0,0.0
245,Socialism,great representation socialism swan fish ,2020-11-16,0.506,0.494,0.0,0.6249,0.0,0.5,0.5,0.0,0.0
246,Socialism,mad socialism ,2020-11-16,0.0,0.238,0.762,-0.4939,1.0,0.0,0.0,0.0,0.0
247,Socialism,thats awesome im crazy jealous dad trump supporter thinks socialism blank ,2020-11-16,0.333,0.376,0.29,0.2023,0.0,0.25,0.0,0.0,0.75
248,Socialism,socialism 12 hospitalized tuberculosis polish sister maria rolanda abraham attacked soviet soc ,2020-11-16,0.0,0.786,0.214,-0.4588,0.0,0.0,0.0,0.0,0.0
249,Socialism,probably biden take counsel every person sanders often correct ,2020-11-16,0.0,0.0,0.0,0.0,0.0,1.0,0.0,0.0,0.0
250,Socialism,truth truth globalists conspiracy capitalists masonic sect control world ,2020-11-16,0.329,0.429,0.243,0.0516,0.0,0.0,0.0,0.0,0.0
251,Socialism,would point socialism abolish ,2020-11-16,0.0,0.0,0.0,0.0,0.0,0.5,0.0,0.0,0.5
252,Socialism,socialism rich rugged capitalism poor rich ,2020-11-16,0.541,0.226,0.233,0.6249,0.33,0.67,0.0,0.0,0.0
253,Socialism,socialism virus hits sick elderlythe people would destroy socialize ,2020-11-16,0.0,0.507,0.493,-0.7783,0.25,0.5,0.0,0.25,0.0
254,Socialism,think fact year focus much less immigration wall th ,2020-11-16,0.0,0.0,0.0,0.0,0.33,0.33,0.0,0.0,0.33
255,Socialism,truth truth globalists conspiracy capitalists masonic sect control world ,2020-11-16,0.329,0.429,0.243,0.0516,0.0,0.0,0.0,0.0,0.0
256,Socialism,national socialism ,2020-11-16,0.0,0.0,0.0,0.0,0.0,0.0,1.0,0.0,0.0
257,Socialism,republicans think socialism would force breadlines irony ,2020-11-16,0.0,0.833,0.167,-0.0516,0.0,0.5,0.0,0.25,0.25
258,Socialism,tired hypocrisy everything socialism kill country stuff us ,2020-11-16,0.0,0.441,0.559,-0.8225,0.33,0.0,0.0,0.33,0.33
259,Socialism,different country socialism corruption ,2020-11-16,0.0,0.0,0.0,0.0,0.0,0.0,0.0,0.0,1.0
260,Socialism,,2020-11-16,0.0,0.0,0.0,0.0,0.0,0.0,0.0,0.0,0.0
261,Socialism,even paris climate agreement targets met wed still headed towards environmental collapse bidens path ,2020-11-16,0.174,0.652,0.174,0.0,0.0,0.67,0.0,0.33,0.0
262,Socialism,socialism economic realization christian gospel william temple ,2020-11-16,0.0,0.0,0.0,0.0,0.0,0.0,0.0,0.0,0.0
263,Socialism,watch disney love letter socialism bug life ,2020-11-16,0.412,0.588,0.0,0.6369,0.0,0.5,0.25,0.0,0.25
264,Socialism,totally intrue senator loeffler working georgians radical socialism ,2020-11-16,0.0,0.0,0.0,0.0,0.0,1.0,0.0,0.0,0.0
265,Socialism,hate everything college gay agendas liberal thinking socialism eggheads talking global warming ,2020-11-16,0.105,0.654,0.242,-0.4767,0.0,0.33,0.17,0.33,0.17
266,Socialism,socialism badunless pertains ,2020-11-16,0.0,0.0,0.0,0.0,0.0,0.0,0.0,0.0,0.0
267,Socialism,quick question socialism ,2020-11-16,0.0,0.0,0.0,0.0,0.5,0.5,0.0,0.0,0.0
268,Socialism,thoughts socialism rep ect victoria suarez ,2020-11-16,0.0,0.0,0.0,0.0,0.0,1.0,0.0,0.0,0.0
269,Socialism,,2020-11-16,0.0,0.0,0.0,0.0,0.0,0.0,0.0,0.0,0.0
270,Socialism,guy claimed stood unity see exactly another obama biden administration w side soc ,2020-11-16,0.0,0.0,0.0,0.0,0.0,0.67,0.0,0.0,0.33
271,Socialism,heres socialism fascists bite big one ,2020-11-16,0.0,0.735,0.265,-0.2023,0.0,0.0,0.0,0.0,0.0
272,Socialism,oh sure yeah meani wish context video draw assumptions ,2020-11-16,0.545,0.455,0.0,0.7351,0.0,1.0,0.0,0.0,0.0
273,Socialism,bs definition socialism socialism enti ,2020-11-16,0.0,0.0,0.0,0.0,0.0,0.0,0.0,0.0,1.0
274,Socialism,want know went wrong read want know f ,2020-11-16,0.268,0.412,0.32,-0.3612,0.0,1.0,0.0,0.0,0.0
275,Socialism,gop rep elect grew ukraine warns socialism via epochtimes ,2020-11-16,0.0,0.851,0.149,-0.1027,0.0,1.0,0.0,0.0,0.0
276,Socialism,short sighted nature election twitter always electing stro ,2020-11-16,0.0,0.0,0.0,0.0,0.25,0.25,0.0,0.5,0.0
277,Socialism,necessary thing give republicans ammunition win ga jan 5th bal ,2020-11-16,0.297,0.703,0.0,0.5859,0.0,0.5,0.0,0.0,0.5
278,Socialism,know gop made ,2020-11-16,0.0,0.0,0.0,0.0,0.0,0.0,0.0,1.0,0.0
279,Socialism,hit nail head showing talking reset intelligent canadian ,2020-11-16,0.3,0.7,0.0,0.4588,0.5,0.5,0.0,0.0,0.0
280,Socialism,wondering california liking government control socialism test run ,2020-11-16,0.278,0.722,0.0,0.4019,0.0,0.0,0.0,0.0,1.0
281,Socialism,want know went wrong read want know fixe ,2020-11-16,0.243,0.467,0.29,-0.3612,0.0,1.0,0.0,0.0,0.0
282,Socialism,must work state pay back tuition socialism way ,2020-11-16,0.0,0.833,0.167,-0.1027,0.0,0.5,0.0,0.5,0.0
283,Socialism,fear socialism squad ,2020-11-16,0.0,0.385,0.615,-0.4939,0.0,0.0,0.0,1.0,0.0
284,Socialism,therefore uneducated right left think healthcare socialism ,2020-11-16,0.0,0.0,0.0,0.0,0.0,0.5,0.0,0.0,0.5
285,Socialism,gop rep elect grew ukraine warns socialism via epochtimes ,2020-11-16,0.0,0.851,0.149,-0.1027,0.0,1.0,0.0,0.0,0.0
286,Socialism,know socialism lazy ,2020-11-16,0.0,0.444,0.556,-0.3612,0.0,0.0,0.0,1.0,0.0
287,Socialism,although cubans might white gonna weigh place ,2020-11-16,0.0,0.0,0.0,0.0,0.33,0.67,0.0,0.0,0.0
288,Socialism,ten years democrats nothing lt true happy lt ,2020-11-16,0.0,0.53,0.47,-0.652,0.0,0.0,1.0,0.0,0.0
289,Socialism,would reddit exist socialism ,2020-11-16,0.0,0.0,0.0,0.0,0.0,1.0,0.0,0.0,0.0
290,Socialism,top sounds like propagandizing socialism coming worked considering ,2020-11-16,0.417,0.583,0.0,0.5106,0.0,0.25,0.0,0.25,0.5
291,Socialism,ftr second highly paragraph negates first propaganda favor aoc rewriting black women p ,2020-11-16,0.184,0.68,0.136,0.1779,0.0,0.0,0.5,0.0,0.5
292,Socialism,yaass free money us spend stimulate economy basic economics far socialism h ,2020-11-16,0.366,0.634,0.0,0.6369,0.0,0.67,0.33,0.0,0.0
293,Socialism,republicans believe socialism timing thing capitalism raking c ,2020-11-16,0.0,0.0,0.0,0.0,0.0,0.0,0.0,0.0,1.0
294,Socialism,democracy survived democracy freedom restrictions r ,2020-11-16,0.714,0.286,0.0,0.8176,0.0,0.0,0.0,0.0,0.0
295,Socialism,survival socialism restore society nature ,2020-11-16,0.355,0.645,0.0,0.296,0.0,1.0,0.0,0.0,0.0
296,Socialism,must watch new gop congresswoman elect grew ukraine blisters socialism ,2020-11-16,0.0,0.0,0.0,0.0,0.0,0.0,0.0,0.0,1.0
297,Socialism,using nazbols argument socialism good look ,2020-11-16,0.309,0.426,0.266,0.1027,0.0,0.5,0.5,0.0,0.0
298,Socialism,lot idiocy unpack definition socialism even close read book ,2020-11-16,0.0,0.0,0.0,0.0,0.0,0.0,0.33,0.33,0.33
299,Socialism,socialism going constitution socialism mostly economic construc ,2020-11-16,0.0,0.0,0.0,0.0,0.0,1.0,0.0,0.0,0.0
300,Socialism,know picking thinking loud shame ,2020-11-16,0.0,0.563,0.437,-0.4767,0.0,0.0,0.0,0.0,1.0
301,Socialism,defining feature capitalism economy centered around capital accumulatio ,2020-11-16,0.0,0.0,0.0,0.0,0.0,1.0,0.0,0.0,0.0
302,Socialism,laughing loud man socialism federal government involved ,2020-11-16,0.348,0.652,0.0,0.4939,0.0,1.0,0.0,0.0,0.0
303,Socialism,plan goes far beyond european democratic socialism stated model china ,2020-11-16,0.0,0.0,0.0,0.0,0.0,0.8,0.0,0.2,0.0
304,Socialism,yes think possible question trump hold know worse ,2020-11-16,0.229,0.508,0.263,-0.1027,0.0,0.2,0.0,0.4,0.4
305,Socialism,misunderstood jesus parable talents affirms capital ,2020-11-16,0.319,0.426,0.255,0.1531,0.0,1.0,0.0,0.0,0.0
306,Socialism,wild wanting tax dollars fund programs actually help us somehow called socialism ,2020-11-16,0.197,0.803,0.0,0.4019,0.0,0.33,0.0,0.0,0.67
307,Socialism,icymi democrat congresswoman yells say socialism ever defund police almost cost job ,2020-11-16,0.0,0.0,0.0,0.0,0.0,0.2,0.0,0.0,0.8
308,Socialism,socialism also really easy call capitalism market socialism ,2020-11-16,0.313,0.687,0.0,0.4927,0.0,0.5,0.0,0.0,0.5
309,Socialism,taught history nazis product socialism rudimentary f ,2020-11-16,0.0,0.0,0.0,0.0,0.0,0.5,0.0,0.5,0.0
310,Socialism,remember communists advocate war peace peace shown useless fight socialism amp liberatio ,2020-11-16,0.3,0.3,0.399,-0.3182,0.0,0.0,0.0,1.0,0.0
311,Socialism,free public schools abject failure see produces ignorance social j ,2020-11-16,0.219,0.397,0.384,-0.3612,0.0,0.25,0.25,0.5,0.0
312,Socialism,whole country built partially socialism everything fighting british ,2020-11-16,0.0,0.737,0.263,-0.3612,0.0,0.5,0.0,0.5,0.0
313,Socialism,teaching personal responsibility pure socialism paying every cent send kids college ,2020-11-16,0.0,0.0,0.0,0.0,0.0,0.6,0.2,0.2,0.0
314,Socialism,right true everyone mostly generational largest group gre ,2020-11-16,0.286,0.714,0.0,0.4215,0.0,0.5,0.0,0.0,0.5
315,Socialism,thats also socialism youd never hear rand paul advocate bailouts frie ,2020-11-16,0.0,0.0,0.0,0.0,0.0,0.0,0.0,0.0,0.0
316,Socialism,still state enforce socialism talking obligations members ,2020-11-16,0.0,0.0,0.0,0.0,0.0,0.0,0.0,1.0,0.0
317,Socialism,b b b socialism ,2020-11-16,0.0,0.0,0.0,0.0,0.0,0.0,0.0,0.0,0.0
318,Socialism,like know anyone take anyone serious thinks able go capitalism exist ,2020-11-16,0.195,0.703,0.102,0.296,0.0,0.0,0.0,0.0,1.0
319,Socialism,thats socialism reason likey socialism cause corporations free market freedom get owned lib ,2020-11-16,0.405,0.595,0.0,0.8176,0.0,0.33,0.33,0.33,0.0
320,Socialism,maybe real issue longer control people like sheep little minions socia ,2020-11-16,0.2,0.8,0.0,0.3612,0.0,0.0,0.0,1.0,0.0
321,Socialism,right need end socialism spurs innovation receive reward ,2020-11-16,0.512,0.488,0.0,0.743,0.0,0.5,0.0,0.0,0.5
322,Socialism,welcome china quarantine hotel w expense 14 days ,2020-11-16,0.333,0.667,0.0,0.4588,0.0,0.33,0.67,0.0,0.0
323,Socialism,socialism finest give illegals 1200 sick oh bail fiscally inept ny amp california ,2020-11-16,0.0,0.784,0.216,-0.5106,0.0,0.5,0.0,0.5,0.0
324,Socialism,bad trump comes misconstruing information socialism defi ,2020-11-16,0.0,0.632,0.368,-0.5423,0.0,0.0,0.0,0.33,0.67
325,Socialism,nothing socialism stop watching tv go educate yourse ,2020-11-16,0.212,0.788,0.0,0.2235,0.0,0.0,0.0,0.0,1.0
326,Socialism,think could kill mantras around work free stuff common objection socialism fr ,2020-11-16,0.183,0.556,0.261,-0.34,0.14,0.43,0.14,0.0,0.29
327,Socialism,yes good governance way another socialism good thing sad see ,2020-11-16,0.483,0.341,0.176,0.6597,0.0,0.0,0.4,0.4,0.2
328,Socialism,looks like alot socialism ,2020-11-16,0.455,0.545,0.0,0.3612,0.0,0.0,0.0,0.0,0.0
329,Socialism,promoting fascism triggered word socialism pro ,2020-11-16,0.333,0.667,0.0,0.3612,0.5,0.5,0.0,0.0,0.0
330,Socialism,swear guys turning cuba soviet sugar plantation nessisary socialism ,2020-11-16,0.0,0.87,0.13,-0.0516,0.5,0.0,0.0,0.0,0.5
331,Socialism,average humans college degree make money humans without one canceling student debt trans ,2020-11-16,0.0,0.828,0.172,-0.3612,0.0,0.67,0.0,0.33,0.0
332,Socialism,,2020-11-16,0.0,0.0,0.0,0.0,0.0,0.0,0.0,0.0,0.0
333,Socialism,exactly move eu canada people realize lucky ch ,2020-11-16,0.286,0.714,0.0,0.4215,0.0,0.0,1.0,0.0,0.0
334,Socialism,recent cuban emigres basically cancelled liberalizing second gens ,2020-11-16,0.0,0.778,0.222,-0.25,0.0,1.0,0.0,0.0,0.0
335,Socialism,socialism super rich corporate sector actual capitalist econom ,2020-11-16,0.556,0.444,0.0,0.8176,0.0,1.0,0.0,0.0,0.0
336,Socialism,love republicans resort calling democrats socialists co ,2020-11-16,0.412,0.588,0.0,0.6369,0.0,0.0,1.0,0.0,0.0
337,Socialism,socialism ideology difficult thrive without infringing peoples basic rights property ,2020-11-16,0.0,0.783,0.217,-0.3612,0.0,1.0,0.0,0.0,0.0
338,Socialism,,2020-11-16,0.0,0.0,0.0,0.0,0.0,0.0,0.0,0.0,0.0
339,Socialism,ca believe keep saying socialism gives us fire department roads polic ,2020-11-16,0.0,0.806,0.194,-0.34,0.0,0.67,0.0,0.0,0.33
340,Socialism,mother teaches biden lover children socialism hilarious ,2020-11-16,0.565,0.435,0.0,0.7579,0.0,0.0,0.5,0.5,0.0
341,Socialism,little taste socialism ,2020-11-16,0.0,0.0,0.0,0.0,0.0,0.0,1.0,0.0,0.0
342,Socialism,debate whether market socialism really socialism still capitalism mostly important regardles ,2020-11-16,0.153,0.847,0.0,0.2023,0.0,0.5,0.25,0.0,0.25
343,Socialism,big scary word comprehensive exploration long debated misunderstood ideology socialism inc ,2020-11-16,0.236,0.424,0.339,-0.4019,0.33,0.67,0.0,0.0,0.0
344,Socialism,gop rep elect grew ukraine warns socialism via epochtimes ,2020-11-16,0.0,0.851,0.149,-0.1027,0.0,1.0,0.0,0.0,0.0
345,Socialism,love people automatically jump hispanic vote terrified socialism yet hispanic vote ,2020-11-16,0.244,0.523,0.233,0.0516,0.0,0.0,0.5,0.0,0.5
346,Socialism,poo stinky squirrel keep running wheel socialism sucks wars needed ,2020-11-16,0.0,0.449,0.551,-0.8225,0.0,0.0,0.0,0.0,0.0
347,Socialism,answered imma go aoc socialism ,2020-11-16,0.0,0.0,0.0,0.0,0.0,0.0,0.0,0.0,0.0
348,Socialism,must watch new gop congresswoman elect grew ukraine blisters socialism ,2020-11-16,0.0,0.0,0.0,0.0,0.0,0.0,0.0,0.0,1.0
349,Socialism,public schools socialist whenever getting petitions signed medicare ,2020-11-16,0.0,0.0,0.0,0.0,0.0,1.0,0.0,0.0,0.0
350,Socialism,socialism bigger threat ,2020-11-16,0.0,0.37,0.63,-0.5267,0.0,1.0,0.0,0.0,0.0
351,Socialism,whats point richest nation world citizens ca ,2020-11-16,0.362,0.638,0.0,0.5267,0.0,0.0,0.0,0.0,1.0
352,Socialism,please define socialism afterwards democratic socialism marxism ,2020-11-16,0.277,0.723,0.0,0.3182,0.0,0.0,0.0,1.0,0.0
353,Socialism,anything involves government elements socialism tha ,2020-11-16,0.0,0.0,0.0,0.0,0.0,0.5,0.0,0.0,0.5
354,Socialism,student loans kind socialism got days ,2020-11-16,0.405,0.595,0.0,0.5267,0.0,0.0,1.0,0.0,0.0
355,Socialism,rage tweets tv vision trump post presidency begins emerge via yahoo ,2020-11-16,0.137,0.616,0.247,-0.3818,0.0,0.5,0.0,0.0,0.5
356,Socialism,hes raised born hoosier building socialism confusing first ,2020-11-16,0.0,0.787,0.213,-0.2263,0.0,0.5,0.0,0.25,0.25
357,Socialism,raphael sorry calling reverend would sacrilege call ,2020-11-16,0.0,0.822,0.178,-0.0772,0.0,0.67,0.0,0.33,0.0
358,Socialism,sorry comrade capitalism rewards personal responsibility training education hard work ,2020-11-16,0.242,0.547,0.211,0.34,0.25,0.5,0.0,0.25,0.0
359,Socialism,hate socialism yet stick hand social handout gop hypocrisy never ends ,2020-11-16,0.201,0.566,0.233,-0.128,0.0,0.75,0.0,0.25,0.0
360,Socialism,,2020-11-16,0.0,0.0,0.0,0.0,0.0,0.0,0.0,0.0,0.0
361,Socialism,hate socialism ,2020-11-16,0.0,0.213,0.787,-0.5719,0.0,0.0,0.0,1.0,0.0
362,Socialism,sadly capitalists effective years convincing americans socialism ,2020-11-16,0.46,0.317,0.222,0.4588,0.0,0.0,0.0,0.0,0.0
363,Socialism,lets cancel student loan debt important bail corporations bad decisions propos ,2020-11-16,0.107,0.417,0.476,-0.7351,0.0,0.25,0.25,0.5,0.0
364,Socialism,phony race baiting democrats use disguise socialism agenda ,2020-11-16,0.0,0.778,0.222,-0.25,0.0,1.0,0.0,0.0,0.0
365,Socialism,read thread paul miller2 mistakes corrects typify beliefs many eg government publi ,2020-11-16,0.0,0.815,0.185,-0.3612,0.0,0.0,0.0,0.0,0.0
366,Socialism,,2020-11-16,0.0,0.0,0.0,0.0,0.0,0.0,0.0,0.0,0.0
367,Socialism,one define socialism scare people great georgia b ,2020-11-16,0.333,0.407,0.26,0.2263,0.0,0.0,1.0,0.0,0.0
368,Socialism,like arguing someone believe scie ,2020-11-16,0.294,0.353,0.353,-0.128,0.0,0.0,0.0,0.0,0.0
369,Socialism,gov spending bankscorporate bailouts ok gov spending poor people socialism ,2020-11-16,0.165,0.602,0.233,-0.2263,0.0,0.0,0.0,0.0,0.0
370,Socialism,magas often conflate socialism fascism ,2020-11-16,0.0,0.0,0.0,0.0,0.0,1.0,0.0,0.0,0.0
371,Socialism,paying people money isnt socialism ,2020-11-16,0.0,0.0,0.0,0.0,0.0,0.0,0.0,0.0,0.0
372,Socialism,socialism factory bums parasites ,2020-11-16,0.0,0.0,0.0,0.0,0.0,0.0,0.0,1.0,0.0
373,Socialism,socialism existed potluck ca everyone afford bring dish ,2020-11-16,0.0,0.0,0.0,0.0,0.0,0.33,0.0,0.67,0.0
374,Socialism,gop worried big boogeyman national debt cause want ensure suckle tax payer ,2020-11-16,0.235,0.482,0.283,-0.2023,0.0,0.0,0.5,0.5,0.0
375,Socialism,socialism factory bums parasites ,2020-11-16,0.0,0.0,0.0,0.0,0.0,0.0,0.0,1.0,0.0
376,Socialism,vote socialism youll shoot way ,2020-11-16,0.0,0.625,0.375,-0.34,0.0,0.0,0.0,0.0,0.0
377,Socialism,socialism bad capitalism based ,2020-11-16,0.0,0.462,0.538,-0.5423,0.0,0.0,0.0,1.0,0.0
378,Socialism,socialism ,2020-11-16,0.0,0.0,0.0,0.0,0.0,0.0,0.0,0.0,0.0
379,Socialism,money redistributed poor people welfare payments republicans call socialism whe ,2020-11-16,0.0,0.744,0.256,-0.4767,0.0,0.0,0.0,0.0,0.0
380,Socialism,hey lost 3 lawyers got new one good look attorney gofundme pleas ,2020-11-16,0.204,0.634,0.162,0.1531,0.0,0.0,0.33,0.33,0.33
381,Socialism,socialism save individual property rights water rights right live pro ,2020-11-16,0.262,0.738,0.0,0.4939,0.0,0.75,0.0,0.25,0.0
382,Socialism,assuming person wrote also misuses words like socialism communist liberal word ,2020-11-16,0.2,0.8,0.0,0.3612,1.0,0.0,0.0,0.0,0.0
383,Socialism,small step towards socialism ,2020-11-16,0.0,0.0,0.0,0.0,0.0,0.0,0.0,0.0,0.0
384,Socialism,brand socialism wo change thing fits bill ,2020-11-16,0.0,0.0,0.0,0.0,0.0,0.0,0.33,0.33,0.33
385,Socialism,introducing great reset world leaders radical plan transform economy globalists amp socialists ,2020-11-16,0.272,0.728,0.0,0.6249,0.0,0.5,0.5,0.0,0.0
386,Socialism,defund police socialism lousy messaging ,2020-11-16,0.0,0.533,0.467,-0.5423,1.0,0.0,0.0,0.0,0.0
387,Socialism,democratic socialism 1 tax wealthy 2 tax cuts poor 3 ubi 4 m4a 5 raise minimum wage ,2020-11-16,0.149,0.536,0.315,-0.4215,0.0,0.5,0.5,0.0,0.0
388,Socialism,anything assuage belief around half americans friggin clue socialism ,2020-11-16,0.0,0.0,0.0,0.0,0.0,0.0,0.0,0.0,1.0
389,Socialism,true form indiana gop makes liability protections employers top priority steadfastly refusing ,2020-11-16,0.269,0.468,0.263,0.0258,0.0,0.0,0.0,0.67,0.33
390,Socialism,fascism therefore opposed socialism following clause unity wit ,2020-11-16,0.0,0.0,0.0,0.0,0.0,0.75,0.0,0.0,0.25
391,Socialism,socialism ,2020-11-16,0.0,0.0,0.0,0.0,0.0,0.0,0.0,0.0,0.0
392,Socialism,fascism grew socialism whole point try keep ,2020-11-16,0.0,0.0,0.0,0.0,0.0,0.67,0.0,0.0,0.33
393,Socialism,love every time someone says socialism bad say bank ,2020-11-16,0.286,0.476,0.238,0.1779,0.0,0.2,0.2,0.2,0.4
394,Socialism,truth truth globalists conspiracy capitalists masonic sect control world ,2020-11-16,0.329,0.429,0.243,0.0516,0.0,0.0,0.0,0.0,0.0
395,Socialism,gonna flake socialism asp ,2020-11-16,0.0,0.0,0.0,0.0,0.0,0.0,0.0,0.0,0.0
396,Socialism,laugh course hispanic cuban thats ,2020-11-16,0.474,0.526,0.0,0.5574,0.0,0.0,0.0,0.0,0.0
397,Socialism,truth truth globalists conspiracy capitalists masonic sect control world etc ,2020-11-16,0.307,0.467,0.227,0.0516,0.0,0.0,0.0,0.0,0.0
398,Socialism,people also think socialism smart idea ,2020-11-16,0.351,0.649,0.0,0.4019,0.0,0.0,0.0,0.0,1.0
399,Socialism,truth truth globalists conspiracy capitalists masonic sect control world etc ,2020-11-16,0.307,0.467,0.227,0.0516,0.0,0.0,0.0,0.0,0.0
400,Socialism,liberal democracy factor emergence systems socialism expec ,2020-11-16,0.0,0.0,0.0,0.0,0.0,0.67,0.0,0.0,0.33
401,Socialism,define socialism laugh ,2020-11-16,0.643,0.357,0.0,0.5574,0.0,0.0,0.0,0.0,0.0
402,Socialism,read whole thing quite short read 21 short pages long never says ,2020-11-16,0.0,0.0,0.0,0.0,0.33,0.33,0.0,0.0,0.33
403,Socialism,dont understand italian dont says socialist ,2020-11-16,0.0,0.0,0.0,0.0,0.0,0.0,0.0,0.0,1.0
404,Socialism,socialism socialism means production belongs th ,2020-11-16,0.0,0.0,0.0,0.0,0.0,0.0,1.0,0.0,0.0
405,Socialism,bernie fake socialist believe gi bill amp social security socialism working class bla ,2020-11-16,0.145,0.667,0.188,-0.1779,0.0,0.6,0.0,0.2,0.2
406,Socialism,calhoun really pushing agenda us fully cus three period worksheet deals p ,2020-11-16,0.0,0.0,0.0,0.0,0.0,0.5,0.0,0.0,0.5
407,Socialism,know difficult task people try think little harder yo ,2020-11-16,0.0,0.762,0.238,-0.3612,0.0,0.0,0.0,0.0,1.0
408,Socialism,saw even know socialism neither communism think vo ,2020-11-16,0.0,0.0,0.0,0.0,0.0,0.0,0.0,0.5,0.5
409,Socialism,dont stores loot people assault riots throw cities burn ,2020-11-16,0.0,0.496,0.504,-0.7964,0.0,0.5,0.0,0.5,0.0
410,Socialism,yep either suckers paid debts honorable sh ,2020-11-16,0.438,0.308,0.254,0.34,0.0,0.0,0.0,0.0,0.0
411,Socialism,think market socialism workers control means production kee ,2020-11-16,0.0,0.0,0.0,0.0,0.0,0.5,0.0,0.0,0.5
412,Socialism,would give polio vaccine people already died polio jimmy lost legs polio yo ,2020-11-16,0.0,0.651,0.349,-0.7096,0.0,0.75,0.0,0.25,0.0
413,Socialism,find de ,2020-11-16,0.0,0.0,0.0,0.0,0.0,0.0,0.0,0.0,0.0
414,Socialism,socialism total landscaping ,2020-11-16,0.0,0.0,0.0,0.0,0.0,0.0,0.0,0.0,0.0
415,Socialism,like maybe socialism communism recognition almost curr ,2020-11-16,0.294,0.706,0.0,0.3612,0.0,0.0,0.0,0.0,0.0
416,Socialism,bout fucking time see one article main stream media globalist agenda socialism c ,2020-11-16,0.0,0.0,0.0,0.0,0.0,0.33,0.33,0.33,0.0
417,Socialism,good view socialism respect acting calmtheir world sch ,2020-11-16,0.5,0.5,0.0,0.7184,0.0,0.0,1.0,0.0,0.0
