,Search,Tweet,Entered on,pos_score,neu_score,neg_score,compound_score,angry_score,fear_score,happy_score,sad_score,surprise_score
0,coronavirus,reminder counting votes election remember shred since year election ca ,2020-11-01,0.0,0.0,0.0,0.0,0.0,1.0,0.0,0.0,0.0
1,coronavirus,rolling stone trump official planned give santa claus performers early access covid 19 vaccine ,2020-11-01,0.0,0.0,0.0,0.0,0.0,0.33,0.0,0.0,0.67
2,coronavirus,way handled coronavirus really dry run aliens come know selling ,2020-11-01,0.0,0.0,0.0,0.0,0.0,0.5,0.0,0.0,0.5
3,coronavirus,coronavirus latest us disease control agency pledges help revive cruise ship sector ,2020-11-01,0.338,0.662,0.0,0.6249,0.0,0.5,0.0,0.0,0.5
4,coronavirus,pandemic caused overspend online strategies may help ,2020-11-01,0.31,0.69,0.0,0.4019,0.0,0.67,0.0,0.0,0.33
5,coronavirus,many us traveling holidays likely first time theyve airport taken ,2020-11-01,0.224,0.776,0.0,0.3818,0.0,0.5,0.0,0.0,0.5
6,coronavirus,worst thing ever happen london needs resign ,2020-11-01,0.0,0.435,0.565,-0.7579,0.0,0.0,0.0,0.33,0.67
7,coronavirus,fauci us deal whole lot hurt surging coronavirus cases ,2020-11-01,0.0,0.702,0.298,-0.5267,0.0,0.25,0.0,0.75,0.0
8,coronavirus,new coronavirus curbs europe spark exasperation anger ,2020-11-01,0.179,0.472,0.349,-0.4215,0.0,0.0,0.0,1.0,0.0
9,coronavirus,scientist advising uk government suggested coronavirus vaccine could cleared safe use soon ,2020-11-01,0.301,0.699,0.0,0.5106,0.0,0.5,0.0,0.5,0.0
10,coronavirus,wrote back beginning may ,2020-11-01,0.0,0.0,0.0,0.0,0.0,1.0,0.0,0.0,0.0
11,coronavirus,one week ago still hope deal election day republican democratic leadership remained ,2020-11-01,0.209,0.791,0.0,0.4404,0.0,0.5,0.5,0.0,0.0
12,coronavirus,britain starts accelerated review astra zeneca potential covid 19 vaccine article amp reuters ,2020-11-01,0.0,0.0,0.0,0.0,0.0,0.0,0.0,0.0,0.0
13,coronavirus,posted link study yesterday chilling stanford economists estimate trumps campaign ralli ,2020-11-01,0.0,0.901,0.099,-0.0258,0.0,0.0,0.0,0.5,0.5
14,coronavirus,woman died coronavirus plane fellow passengers never notified ,2020-11-01,0.0,0.66,0.34,-0.5574,0.0,1.0,0.0,0.0,0.0
15,coronavirus,serious republicans voting biden weak candidate compared gu ,2020-11-01,0.0,0.588,0.412,-0.4939,0.0,0.0,0.0,1.0,0.0
16,coronavirus,numbers floored hunger pennsylvania hits highest level since pandemic start ,2020-11-01,0.0,0.818,0.182,-0.25,0.33,0.33,0.0,0.0,0.33
17,coronavirus,fauci rips white house coronavirus approach finally ,2020-11-01,0.0,0.0,0.0,0.0,0.0,1.0,0.0,0.0,0.0
18,coronavirus,hahaha look tiny ive seen taller coronavirus germs ,2020-11-01,0.34,0.66,0.0,0.5574,0.0,0.0,0.0,0.0,0.0
19,coronavirus,think 1st responders arent able get anyone respirato ,2020-11-01,0.0,0.0,0.0,0.0,0.0,0.0,0.0,0.0,1.0
20,coronavirus,event201 done 2 months called coronavirus outbreak acting trying prot ,2020-11-01,0.0,0.0,0.0,0.0,0.0,0.0,0.0,0.0,0.0
21,coronavirus,iraqi kurdistan reports 1054 new coronavirus cases 28 deaths ministry ,2020-11-01,0.0,0.0,0.0,0.0,0.0,1.0,0.0,0.0,0.0
22,coronavirus,like trump even though dont like trump hes tacky debates debacle doesnt know sh ,2020-11-01,0.294,0.706,0.0,0.6124,0.0,0.0,0.0,0.33,0.67
23,coronavirus,vote trump appreciate law order god first maga kag maga2020 democrats covid19 coronavirus ,2020-11-01,0.304,0.696,0.0,0.5859,0.0,0.0,0.2,0.0,0.8
24,coronavirus,covid19 coronavirus ananish chaudhuri vaccine hurdles yet clear get one australia ,2020-11-01,0.206,0.794,0.0,0.3818,0.0,0.0,0.0,1.0,0.0
25,coronavirus,stimulus checks mitch mc connell says relief come 2021 smart news ,2020-11-01,0.392,0.608,0.0,0.7003,0.0,0.5,0.0,0.0,0.5
26,coronavirus,hoax man ask ricky rose ,2020-11-01,0.0,0.656,0.344,-0.2732,0.0,1.0,0.0,0.0,0.0
27,coronavirus,us coronavirus cases keep rising grim march election day ,2020-11-01,0.0,0.684,0.316,-0.5719,0.0,0.0,1.0,0.0,0.0
28,coronavirus,connor reed wiki connor reed biography connor reed tested positive covid 19 december last year go ,2020-11-01,0.194,0.806,0.0,0.5574,0.0,0.0,0.0,0.0,0.0
29,coronavirus,ppl like one taking coronavirus seriously proceed ur face talker outside din ,2020-11-01,0.176,0.704,0.12,0.2023,0.0,0.0,0.0,0.0,1.0
30,coronavirus,fauci rips white house coronavirus approach thank dr fauci backing ,2020-11-01,0.31,0.69,0.0,0.3818,0.0,1.0,0.0,0.0,0.0
31,coronavirus,one explanation apparent contradiction employees might working traditional commuti ,2020-11-01,0.0,0.8,0.2,-0.25,0.5,0.5,0.0,0.0,0.0
32,coronavirus,18 states set single day coronavirus case records last week ,2020-11-01,0.0,0.0,0.0,0.0,0.0,0.33,0.33,0.33,0.0
33,coronavirus,well declared victory coronavirus would par course ,2020-11-01,0.259,0.741,0.0,0.2732,0.0,1.0,0.0,0.0,0.0
34,coronavirus,1020 bbc1 explain latest coronavirus restrictions government says hopes lockdown en ,2020-11-01,0.219,0.781,0.0,0.4215,0.0,0.0,0.0,0.0,1.0
35,coronavirus,kind journalism ignores demographicpoliticaleconomic differences unreliable ca compare lon ,2020-11-01,0.272,0.56,0.168,0.3182,0.0,0.0,1.0,0.0,0.0
36,coronavirus,could see thinking could get away small secret underground party gotta pretty audacious ,2020-11-01,0.438,0.562,0.0,0.7783,0.2,0.2,0.2,0.0,0.4
37,coronavirus,ugh read ,2020-11-01,0.0,0.263,0.737,-0.4215,0.0,0.0,0.0,1.0,0.0
38,coronavirus,allowed say coronavirus voldermort ,2020-11-01,0.0,0.0,0.0,0.0,0.0,0.0,0.0,0.0,1.0
39,coronavirus,youre upset got caught gracefully step back advising anyone ,2020-11-01,0.262,0.538,0.2,0.2023,0.0,1.0,0.0,0.0,0.0
40,coronavirus,coronavirus tests thought devil ,2020-11-01,0.0,0.405,0.595,-0.6597,0.0,0.0,0.0,0.0,1.0
41,coronavirus,pandemic affected every component world includes online sales ecommerce yo ,2020-11-01,0.0,0.849,0.151,-0.1531,0.0,0.5,0.0,0.5,0.0
42,coronavirus,states say lack federal funds distribute coronavirus vaccine cdc tells ready nov 15 wa ,2020-11-01,0.149,0.714,0.137,0.0516,0.0,0.2,0.2,0.4,0.2
43,coronavirus,case point federal cares act coronavirus relief dollars used must spent tied con ,2020-11-01,0.357,0.643,0.0,0.7269,0.0,0.33,0.0,0.33,0.33
44,coronavirus,get new job fired trump de santis needs put top resumé ,2020-11-01,0.125,0.625,0.25,-0.4215,0.0,0.25,0.0,0.25,0.5
45,coronavirus,100 virus turned outgoing nation hermit australias borders clos ,2020-11-01,0.216,0.784,0.0,0.296,0.0,0.0,0.0,0.0,1.0
46,coronavirus,emerging country india despite challenges population density living conditions amp poverty begi ,2020-11-01,0.0,0.689,0.311,-0.5457,0.5,0.5,0.0,0.0,0.0
47,coronavirus,thankfully china gave uscoronavirus dna jan 11 feb 28th trump calling covid ,2020-11-01,0.203,0.797,0.0,0.4215,0.0,0.5,0.0,0.0,0.5
48,coronavirus,apesgorillas contracted coronavirus ,2020-11-01,0.0,0.0,0.0,0.0,0.0,1.0,0.0,0.0,0.0
49,coronavirus,well doesnt know anything coronavirus either right atlas quack vote blue end nightmare ,2020-11-01,0.149,0.851,0.0,0.2732,0.0,0.67,0.0,0.33,0.0
50,coronavirus,yes indeed ,2020-11-01,0.73,0.27,0.0,0.4019,0.0,0.0,0.0,1.0,0.0
51,coronavirus,headed get tested coronavirus could use prayers wish luck ,2020-11-01,0.449,0.551,0.0,0.6908,0.0,0.5,0.5,0.0,0.0
52,coronavirus,part trump bernie bro kinda like hateful angry rhetoric demigod tend ,2020-11-01,0.137,0.495,0.369,-0.5791,0.67,0.0,0.0,0.0,0.33
53,coronavirus,todays coronavirus news ontario reports 977 new cases nine deaths italy eyes restrictions fauci warns ,2020-11-01,0.0,0.909,0.091,-0.1027,0.0,1.0,0.0,0.0,0.0
54,coronavirus,ca wait coronavirus get leave january 1st ,2020-11-01,0.0,0.833,0.167,-0.0516,0.0,0.0,0.0,0.0,1.0
55,coronavirus,entertain suggestions red state move help flip ,2020-11-01,0.5,0.5,0.0,0.6124,0.5,0.0,0.0,0.25,0.25
56,coronavirus,get feeling scummo marketing guv amint panic getting vaccine vacci ,2020-11-01,0.117,0.625,0.258,-0.4215,0.0,1.0,0.0,0.0,0.0
57,coronavirus,like chinese whispers things get twisted ,2020-11-01,0.333,0.667,0.0,0.3612,0.0,0.0,0.0,0.0,1.0
58,coronavirus,theres consistent attempt misinformation murdoch press ,2020-11-01,0.0,0.685,0.315,-0.3182,0.0,1.0,0.0,0.0,0.0
59,coronavirus,white house coronavirus adviser dr birx boycotting covid task force misinformation via yahoo ,2020-11-01,0.0,0.688,0.312,-0.6124,0.0,1.0,0.0,0.0,0.0
60,coronavirus,name spread like da coronavirus sosa da air ,2020-11-01,0.263,0.737,0.0,0.3612,0.0,1.0,0.0,0.0,0.0
61,coronavirus,uk pandemic update 26 31 october 2020 covid19 covid19 uk uk uk lockdown2 klockdown coronavirus covid_19 ,2020-11-01,0.0,0.0,0.0,0.0,0.0,0.0,0.0,0.0,0.0
62,coronavirus,1883867 must keep customers names michigan gov biden campaign show kind coronavirus related power dems ,2020-11-01,0.195,0.805,0.0,0.5267,0.5,0.0,0.5,0.0,0.0
63,coronavirus,eye dic competent lead coronavirus task force big toe ,2020-11-01,0.223,0.777,0.0,0.3182,0.0,1.0,0.0,0.0,0.0
64,coronavirus,13 former hometown always hostile children really taking next level ,2020-11-01,0.0,0.776,0.224,-0.3818,0.25,0.0,0.0,0.25,0.5
65,coronavirus,2 warehouse halloween parties attended nearly 100 shut ,2020-11-01,0.31,0.69,0.0,0.4019,1.0,0.0,0.0,0.0,0.0
66,coronavirus,word novel novel coronavirus means literally nobody knows ab ,2020-11-01,0.397,0.603,0.0,0.5574,0.33,0.67,0.0,0.0,0.0
67,coronavirus,open smart news read researchers show extent covid 19 spread grocery store ,2020-11-01,0.197,0.803,0.0,0.4019,0.0,1.0,0.0,0.0,0.0
68,coronavirus,awfully british fears getting billy bookcase lockdown ,2020-11-01,0.0,0.661,0.339,-0.4728,0.0,0.0,0.0,1.0,0.0
69,coronavirus,put tree stick two fingers covid fuck covid fuck lockdown happy fucking christmas covid uk ,2020-11-01,0.163,0.529,0.308,-0.5106,0.0,0.17,0.67,0.17,0.0
70,coronavirus,europe covid 19 cases double five weeks total infections surpass 10 million smart news ,2020-11-01,0.172,0.828,0.0,0.4019,0.0,0.0,0.0,0.0,0.0
71,coronavirus,stand exasperation bewilderment trump totally control shown bbc two uk need ,2020-11-01,0.0,0.0,0.0,0.0,0.0,0.25,0.0,0.25,0.5
72,coronavirus,trump could stopped coronavirus wasnt able doesnt leadership skills ,2020-11-01,0.0,0.808,0.192,-0.2263,0.0,0.0,0.0,0.0,1.0
73,coronavirus,isnt grand conspiracy strategy test samples fewer ,2020-11-01,0.271,0.488,0.242,0.0762,0.0,0.5,0.0,0.0,0.5
74,coronavirus,choice leader voted ya shifted left uk jeremy corbyn wouldnt ,2020-11-01,0.0,0.0,0.0,0.0,1.0,0.0,0.0,0.0,0.0
75,coronavirus,glad embraced western culture even though continue talk shit everyday ,2020-11-01,0.205,0.548,0.247,-0.1531,0.0,0.0,0.25,0.5,0.25
76,coronavirus,congratulations state evidence considered afternoon coronavirus cases goes states american ,2020-11-01,0.302,0.698,0.0,0.5994,0.0,0.4,0.0,0.6,0.0
77,coronavirus,article published initially june 2020 continues provide good overview covid 19 rememb ,2020-11-01,0.209,0.791,0.0,0.4404,0.0,0.0,1.0,0.0,0.0
78,coronavirus,trump want hear families affected loved ones hospitalized coronavirus ,2020-11-01,0.406,0.469,0.125,0.5574,0.0,0.2,0.2,0.2,0.4
79,coronavirus,care comment 9 million coronavirus cases 23000 deaths trumps ,2020-11-01,0.314,0.686,0.0,0.4939,0.0,0.5,0.0,0.0,0.5
80,coronavirus,texas landowners facing coronavirus pandemic land seizures border wall cnn politics ,2020-11-01,0.0,0.0,0.0,0.0,0.4,0.6,0.0,0.0,0.0
81,coronavirus,coronavirus outbreak hits prison staff inmates via bbc news ,2020-11-01,0.0,0.708,0.292,-0.5106,1.0,0.0,0.0,0.0,0.0
82,coronavirus,basic coronavirus measure weve months venues even qr codes l ,2020-11-01,0.0,0.0,0.0,0.0,0.0,0.0,0.0,0.0,0.0
83,coronavirus,covid 19 hospitalizations rise staffing shortages lack beds ventilators biggest concern ,2020-11-01,0.0,0.698,0.302,-0.4404,0.0,0.0,0.0,1.0,0.0
84,coronavirus,covid 19 hospitalizations rise staffing shortages lack beds ventilators biggest concern ,2020-11-01,0.0,0.698,0.302,-0.4404,0.0,0.0,0.0,1.0,0.0
85,coronavirus,18 states set single day coronavirus case records last week ,2020-11-01,0.0,0.0,0.0,0.0,0.0,0.33,0.33,0.33,0.0
86,coronavirus,anthony playing cricket opposing player started shouting coronavirus exp ,2020-11-01,0.184,0.816,0.0,0.2023,0.0,0.5,0.0,0.0,0.5
87,coronavirus,video modular construction company keeping workers safe via ,2020-11-01,0.293,0.707,0.0,0.4404,0.0,1.0,0.0,0.0,0.0
88,coronavirus,study trump rallies linked 700 covid 19 coronavirus deaths caveats ,2020-11-01,0.0,0.0,0.0,0.0,0.0,0.67,0.0,0.0,0.33
89,coronavirus,syracuse bike share program suspended financial constraints coronavirus ,2020-11-01,0.195,0.531,0.274,-0.2263,0.0,1.0,0.0,0.0,0.0
90,coronavirus,study trump rallies linked 700 covid 19 coronavirus deaths caveats ,2020-11-01,0.0,0.0,0.0,0.0,0.0,0.67,0.0,0.0,0.33
91,coronavirus,covid 19 hospitalizations rise staffing shortages lack beds ventilators biggest concern ,2020-11-01,0.0,0.698,0.302,-0.4404,0.0,0.0,0.0,1.0,0.0
92,coronavirus,sweden hits grim coronavirus record country warned infections get worse ,2020-11-01,0.0,0.44,0.56,-0.836,0.33,0.33,0.0,0.33,0.0
93,coronavirus,developed duke researchers living lung model mimics tiny air sacs lungs allows scientists ,2020-11-01,0.0,0.0,0.0,0.0,0.0,1.0,0.0,0.0,0.0
94,coronavirus,happened ,2020-11-01,0.0,0.0,0.0,0.0,0.0,0.0,0.0,0.0,0.0
95,coronavirus,look ,2020-11-01,0.0,0.0,0.0,0.0,0.0,0.0,0.0,0.0,0.0
96,coronavirus,half slovakia population tested coronavirus one day ,2020-11-01,0.0,0.0,0.0,0.0,0.0,0.0,1.0,0.0,0.0
97,coronavirus,coronavirus still go holiday says well cant travel second homes thursday ,2020-11-01,0.348,0.652,0.0,0.5859,0.0,0.0,0.0,0.5,0.5
98,coronavirus,massachusetts total coronavirus death toll surpasses 1000 cases rise 1139 ,2020-11-01,0.0,0.698,0.302,-0.5994,0.0,1.0,0.0,0.0,0.0
99,coronavirus,group stanford university economists created statistical model estimate least 30 ,2020-11-01,0.182,0.818,0.0,0.25,0.0,0.5,0.0,0.0,0.5
100,coronavirus,uk crossed grim milestone 1 million covid19 cases prepares second complete lockdown ,2020-11-01,0.0,0.73,0.27,-0.5719,1.0,0.0,0.0,0.0,0.0
101,coronavirus,every time tweet anything h ,2020-11-01,0.0,0.0,0.0,0.0,0.0,0.0,0.0,0.0,0.0
102,coronavirus,1 new case saint vincent grenadines 2130 gmt coronavirus corona virus update covid19 coronavirus pandemic ,2020-11-01,0.0,0.0,0.0,0.0,0.0,0.0,0.0,0.0,0.0
103,coronavirus,ohio gop governor says follows fauci birx given good guidance covid 19 ,2020-11-01,0.209,0.791,0.0,0.4404,0.0,0.33,0.33,0.0,0.33
104,coronavirus,france announced second coronavirus lockdown amid second wave cases graphic truth ,2020-11-01,0.187,0.813,0.0,0.3182,0.0,1.0,0.0,0.0,0.0
105,coronavirus,group stanford university economists created statistical model estimate least 30 ,2020-11-01,0.182,0.818,0.0,0.25,0.0,0.5,0.0,0.0,0.5
106,coronavirus,coronavirus get white house far spread new york times worked genetic ,2020-11-01,0.0,0.0,0.0,0.0,0.0,1.0,0.0,0.0,0.0
107,coronavirus,palestinian government records six new deaths coronavirus ,2020-11-01,0.0,0.0,0.0,0.0,0.0,1.0,0.0,0.0,0.0
108,coronavirus,atlanta magazine behind georgias covid 19 dashboard disaster coronavirus georgia datadashboards ,2020-11-01,0.0,0.709,0.291,-0.6249,0.0,0.0,0.0,1.0,0.0
109,coronavirus,rules new national covid lockdown england ,2020-11-01,0.0,0.0,0.0,0.0,0.0,0.5,0.5,0.0,0.0
110,coronavirus,fact according 60 strength fine ,2020-11-01,0.625,0.375,0.0,0.6124,0.0,0.0,1.0,0.0,0.0
111,coronavirus,coronavirus uk ca spanish city huelva ,2020-11-01,0.0,0.0,0.0,0.0,0.0,0.0,0.0,0.0,0.0
112,coronavirus,news new 71931 new covid 19 cases across us according data compiled johns hopkins new death tol ,2020-11-01,0.0,0.804,0.196,-0.5994,0.0,1.0,0.0,0.0,0.0
113,coronavirus,dr anthony fauci comments regarding surging number coronavirus cases expected soon ,2020-11-01,0.115,0.885,0.0,0.0772,0.0,0.25,0.5,0.25,0.0
114,coronavirus,busy intense barely describe experienced front lines ,2020-11-01,0.178,0.822,0.0,0.0772,0.0,1.0,0.0,0.0,0.0
115,coronavirus,11 new local covid cases one local death reported el dorado ,2020-11-01,0.0,0.719,0.281,-0.5994,0.0,1.0,0.0,0.0,0.0
116,coronavirus,global internet things io cloud platform market top manufacturers amazon web services google ibm microso ,2020-11-01,0.212,0.788,0.0,0.3612,0.0,0.4,0.0,0.2,0.4
117,coronavirus,learnt lot last time shielding programme things worked things ,2020-11-01,0.0,0.0,0.0,0.0,0.0,0.4,0.0,0.2,0.4
118,coronavirus,new walk testing unit operating ballymena symptoms covid 19 new conti ,2020-11-01,0.0,0.0,0.0,0.0,0.0,1.0,0.0,0.0,0.0
119,coronavirus,coronavirus running control ,2020-11-01,0.0,0.0,0.0,0.0,0.0,0.0,0.0,0.0,0.0
120,coronavirus,one week ago still hope deal election day republican democratic leadership remained ,2020-11-01,0.209,0.791,0.0,0.4404,0.0,0.5,0.5,0.0,0.0
121,coronavirus,new restrictions travel visits pubs socialising come effect district enters tier 3 ,2020-11-01,0.0,0.0,0.0,0.0,0.0,0.0,0.0,0.0,1.0
122,coronavirus,new york requiring travelers non neighboring states get coronavirus test potentially ,2020-11-01,0.0,0.0,0.0,0.0,0.0,0.0,0.0,1.0,0.0
123,coronavirus,new restrictions travel visits pubs socialising come effect wakefield enters tier 3 tomor ,2020-11-01,0.0,0.0,0.0,0.0,0.0,0.0,0.0,0.0,1.0
124,coronavirus,state agencies collaborate create online dashboard track covid 19 cases school districts ,2020-11-01,0.16,0.84,0.0,0.2732,0.0,0.0,0.0,1.0,0.0
125,coronavirus,coronavirus impact economic usa 6 months know impact coronavirus sh ,2020-11-01,0.0,0.0,0.0,0.0,1.0,0.0,0.0,0.0,0.0
126,coronavirus,virus ko lightly mat lena mask lagaao keep sanitising social distancing maintain karo urged bh ,2020-11-01,0.0,0.0,0.0,0.0,0.0,0.33,0.33,0.33,0.0
127,coronavirus,coronavirus teaching us telehealth ,2020-11-01,0.0,0.0,0.0,0.0,0.0,0.0,0.0,1.0,0.0
128,coronavirus,europes country country travel restrictions explained politico europe ,2020-11-01,0.0,0.0,0.0,0.0,0.0,0.0,0.0,0.0,0.0
129,coronavirus,every time tweet anything helping americans struggling physical fina ,2020-11-01,0.183,0.583,0.233,-0.1531,0.0,0.0,0.0,0.0,1.0
130,coronavirus,everyone watch totally control amazon prime see full extent negligence ,2020-11-01,0.18,0.82,0.0,0.2449,0.0,0.67,0.0,0.0,0.33
131,coronavirus,jared kushner said trump took back us doctors trump virus death toll235 k ,2020-11-01,0.0,0.738,0.262,-0.5994,0.0,0.2,0.0,0.0,0.8
132,coronavirus,moron plucked another russian propaganda outfit fox news advise ,2020-11-01,0.0,0.574,0.426,-0.6369,0.0,0.5,0.0,0.5,0.0
133,coronavirus,way around would terrorist attack biological weapon coronavirus ,2020-11-01,0.0,0.333,0.667,-0.875,0.0,1.0,0.0,0.0,0.0
134,coronavirus,got update coronavirus didnt even know real doctor apologize ,2020-11-01,0.149,0.851,0.0,0.1027,0.0,0.0,0.0,1.0,0.0
135,coronavirus,,2020-11-01,0.0,0.0,0.0,0.0,0.0,0.0,0.0,0.0,0.0
136,coronavirus,white house attacks fauci pointing world worst coronavirus infection rates world worst ,2020-11-01,0.0,0.448,0.552,-0.9022,0.0,0.25,0.0,0.5,0.25
137,coronavirus,coronavirus lockdown 1 revealed conspiracy theorists amongst us lockdown 2 cementing idiocy ,2020-11-01,0.0,0.726,0.274,-0.5267,0.0,0.0,0.0,0.0,1.0
138,coronavirus,last night took 5 year old neighbor porch see hordes kids trick treating neighbo ,2020-11-01,0.0,0.909,0.091,-0.0516,0.0,0.0,0.25,0.0,0.75
139,coronavirus,understanding covid 19 necessarily worry individuals worry society ,2020-11-01,0.0,0.508,0.492,-0.7003,0.0,0.0,0.0,1.0,0.0
140,coronavirus,traitor trump nobody lies traitor trump coronavirus doctors science ,2020-11-01,0.0,0.741,0.259,-0.4215,0.0,0.0,0.0,0.0,1.0
141,coronavirus,great divergence us covid 19 economy delivered luxury houses evictions others ,2020-11-01,0.291,0.709,0.0,0.6249,0.0,0.67,0.33,0.0,0.0
142,coronavirus,surprise anyone biden refuses blame china coronavirus beijing biden nafta ,2020-11-01,0.168,0.64,0.192,-0.0772,0.0,0.0,0.0,0.5,0.5
143,coronavirus,funeral home workers spain staged 24 hour strike demand staff help h ,2020-11-01,0.178,0.461,0.362,-0.2023,0.0,0.25,0.0,0.25,0.5
144,coronavirus,government society understands one way get mess meanwhile american polit ,2020-11-01,0.0,0.783,0.217,-0.3612,1.0,0.0,0.0,0.0,0.0
145,coronavirus,btc defi mdm eth chx credit coronavirus decimated small medium businesses across globe p ,2020-11-01,0.178,0.822,0.0,0.3818,0.0,1.0,0.0,0.0,0.0
146,coronavirus,hospitals overwhelmed exhausted staffs surging covid 19 cases push nation limits via usatoday ,2020-11-01,0.082,0.748,0.17,-0.3182,0.0,0.33,0.0,0.33,0.33
147,coronavirus,among eu uk highest deaths 2nd quickest rise deaths 2nd highest ,2020-11-01,0.0,0.0,0.0,0.0,0.0,1.0,0.0,0.0,0.0
148,coronavirus,analysis trumps dont seem understand supporters dying coronavirus ,2020-11-01,0.0,0.744,0.256,-0.3412,0.0,0.5,0.0,0.25,0.25
149,coronavirus,every time tweet anything helping americans struggling physical fina ,2020-11-01,0.183,0.583,0.233,-0.1531,0.0,0.0,0.0,0.0,1.0
150,coronavirus,smile smile coronavirus rd coronavirus covid_19 santodomingo republicadominicana ,2020-11-01,0.455,0.545,0.0,0.6124,0.0,0.0,1.0,0.0,0.0
151,coronavirus,readers rushed aid iconic bookseller owner called savethestrand good news ,2020-11-01,0.244,0.756,0.0,0.4404,0.0,0.0,1.0,0.0,0.0
152,coronavirus,word trump possessed satan pandemic trumps bullshit deadly ,2020-11-01,0.0,0.648,0.352,-0.5859,0.25,0.25,0.0,0.0,0.5
153,coronavirus,pure insanity atlas wh amp giving interview russian tv white house coronavirus adviser atlas ap ,2020-11-01,0.126,0.681,0.194,-0.3182,0.0,1.0,0.0,0.0,0.0
154,coronavirus,kirstie alley slams cnn comment wouldownplaying coronavirus cnn responded kirstie welcome ,2020-11-01,0.231,0.769,0.0,0.4588,0.0,0.0,1.0,0.0,0.0
155,coronavirus,saying common sense common definitely applies case winner h ,2020-11-01,0.52,0.48,0.0,0.7579,0.0,0.75,0.0,0.0,0.25
156,coronavirus,sweden threat deterred people like america value freedom ,2020-11-01,0.552,0.242,0.206,0.6908,0.0,1.0,0.0,0.0,0.0
157,coronavirus,positivity rates 16 zip codes 3 percent citys self imposed threshold closing schools ,2020-11-01,0.226,0.685,0.089,0.4588,0.0,0.67,0.33,0.0,0.0
158,coronavirus,positivity rates 16 zip codes 3 percent citys self imposed threshold closing schools ,2020-11-01,0.226,0.685,0.089,0.4588,0.0,0.67,0.33,0.0,0.0
159,coronavirus,positivity rates 16 zip codes 3 percent citys self imposed threshold closing schools ,2020-11-01,0.226,0.685,0.089,0.4588,0.0,0.67,0.33,0.0,0.0
160,coronavirus,every time tweet anything helping americans struggling ,2020-11-01,0.22,0.5,0.28,-0.1531,0.0,0.0,0.0,0.0,1.0
161,coronavirus,see new data shows nyc zip codes high coronavirus rates ,2020-11-01,0.0,0.0,0.0,0.0,0.0,1.0,0.0,0.0,0.0
162,coronavirus,positivity rates 16 zip codes 3 percent citys self imposed threshold closing schools ,2020-11-01,0.226,0.685,0.089,0.4588,0.0,0.67,0.33,0.0,0.0
163,coronavirus,try explaining vietnam genius island nothing borders closed ,2020-11-01,0.0,0.0,0.0,0.0,0.0,0.0,0.5,0.0,0.5
164,coronavirus,perhaps preserving environment amp water bad idea cli ,2020-11-01,0.0,0.667,0.333,-0.5423,0.0,0.33,0.0,0.67,0.0
165,coronavirus,patch found two empty storefronts per block six neighborhoods experts warn vacancies could spread commer ,2020-11-01,0.0,0.663,0.337,-0.6249,0.0,1.0,0.0,0.0,0.0
166,coronavirus,patch found two empty storefronts per block six neighborhoods experts warn vacancies could spread commer ,2020-11-01,0.0,0.663,0.337,-0.6249,0.0,1.0,0.0,0.0,0.0
167,coronavirus,study address many shoppers wearing masks painting picture suggest masks ,2020-11-01,0.0,0.0,0.0,0.0,0.0,0.0,0.0,1.0,0.0
168,coronavirus,wonder boris rest tory scum tory scumbags try blame ifwhen plan work n ,2020-11-01,0.0,0.821,0.179,-0.34,0.0,0.5,0.0,0.0,0.5
169,coronavirus,apparently working vaccine cambridge universal coronavirus vaccine ,2020-11-01,0.0,0.0,0.0,0.0,0.0,1.0,0.0,0.0,0.0
170,coronavirus,every time tweet anything helping americans struggling ,2020-11-01,0.22,0.5,0.28,-0.1531,0.0,0.0,0.0,0.0,1.0
171,coronavirus,wouldose coronavirus person gets may determine sick get masks could help ,2020-11-01,0.18,0.6,0.22,-0.1531,0.0,0.25,0.0,0.5,0.25
172,coronavirus,alert watch antifa protester taunts police flees fear cops approach global pandemic news ,2020-11-01,0.129,0.585,0.287,-0.4019,0.0,0.33,0.0,0.33,0.33
173,coronavirus,hes done nothing help rich friends kill middle class minorities coronavirus ,2020-11-01,0.0,0.36,0.64,-0.9088,0.0,0.2,0.2,0.0,0.6
174,coronavirus,685 new coronavirus cases 17 deaths today mr covid19 super spreader william ruto till running r ,2020-11-01,0.218,0.782,0.0,0.5994,0.0,1.0,0.0,0.0,0.0
175,coronavirus,bo jo finally right thing think thats bad thing remind ,2020-11-01,0.0,0.72,0.28,-0.5423,0.0,0.33,0.0,0.17,0.5
176,coronavirus,belfast school principal issues warning continued closures coronavirus circuitbreak ,2020-11-01,0.0,0.769,0.231,-0.34,0.0,1.0,0.0,0.0,0.0
177,coronavirus,read article words read ,2020-11-01,0.0,0.0,0.0,0.0,1.0,0.0,0.0,0.0,0.0
178,coronavirus,alphabets quarterly profit jumps 59 percent advertisers return big tech profits climb ad sales pick ,2020-11-01,0.309,0.691,0.0,0.7003,0.0,0.75,0.0,0.0,0.25
179,coronavirus,quite simple find interested guess facts suit bigote ,2020-11-01,0.297,0.703,0.0,0.4522,0.0,0.33,0.33,0.0,0.33
180,coronavirus,reminder cares hardship assistance online application period starts nov 2 navajo times ,2020-11-01,0.21,0.629,0.161,0.1779,0.0,0.0,0.0,1.0,0.0
181,coronavirus,work coalface reason vulnerable teachers parents ,2020-11-01,0.0,0.725,0.275,-0.2263,0.0,0.5,0.0,0.5,0.0
182,coronavirus,coronavirus covid 19 roadmap reopening coronavirus victoria ,2020-11-01,0.0,0.0,0.0,0.0,0.0,0.0,0.0,0.0,0.0
183,coronavirus,kickstarter creators coping coronavirus kickstarter crypto crypto news ,2020-11-01,0.0,0.0,0.0,0.0,0.0,0.0,0.0,0.0,1.0
184,coronavirus,see light end tunnel say israeli prime minister benjamin netanyahu israel bega ,2020-11-01,0.0,0.0,0.0,0.0,0.0,0.5,0.0,0.0,0.5
185,coronavirus,trump administration downplaying impact covid 19 pandemic waning days campaig ,2020-11-01,0.0,0.0,0.0,0.0,0.25,0.0,0.25,0.25,0.25
186,coronavirus,stimulus checks mitch mc connell says relief come 2021 ,2020-11-01,0.279,0.721,0.0,0.4767,0.0,0.5,0.0,0.0,0.5
