,Search,Tweet,Entered on,pos_score,neu_score,neg_score,compound_score,angry_score,fear_score,happy_score,sad_score,surprise_score
1340,mask,least keep mask public amp dont hang large groups dw sexy safe home ,2020-11-03,0.364,0.636,0.0,0.743,0.0,0.0,0.0,0.67,0.33
1341,mask,normal mask ,2020-11-03,0.0,0.0,0.0,0.0,0.0,0.0,0.0,1.0,0.0
1342,mask,american moots please stay safe wear mask ,2020-11-03,0.51,0.49,0.0,0.6369,0.33,0.0,0.0,0.67,0.0
1343,mask,key election alert new wear mask people listen people ignore w ,2020-11-03,0.173,0.63,0.197,-0.0772,0.0,0.0,0.0,1.0,0.0
1344,mask,walk mask free ,2020-11-03,0.623,0.377,0.0,0.5106,0.0,0.0,0.5,0.5,0.0
1345,mask,jennifer lopez created hair mask deal damaged hair ,2020-11-03,0.183,0.55,0.266,-0.2263,0.0,0.0,0.0,0.33,0.67
1346,mask,take mask goof ball ,2020-11-03,0.0,0.0,0.0,0.0,0.0,0.0,0.0,1.0,0.0
1347,mask,experienced made magical though en ,2020-11-03,0.0,0.0,0.0,0.0,0.0,0.0,0.0,1.0,0.0
1348,mask,see smile right mask ,2020-11-03,0.455,0.545,0.0,0.3612,0.0,0.33,0.33,0.33,0.0
1349,mask,enforcing strongly san diego ca even go thru fucking drive th ,2020-11-03,0.174,0.826,0.0,0.2732,0.0,0.5,0.5,0.0,0.0
1350,mask,everyone looks hotter w mask ,2020-11-03,0.0,0.0,0.0,0.0,0.0,0.0,0.0,1.0,0.0
1351,mask,dont want dont belong staring hands know belong ,2020-11-03,0.0,0.851,0.149,-0.0572,0.0,0.0,1.0,0.0,0.0
1352,mask,drivers also required wear mask board transit vehicles allowed remov ,2020-11-03,0.0,0.0,0.0,0.0,0.0,0.0,0.0,1.0,0.0
1353,mask,nobody ive seen wears mask ,2020-11-03,0.0,0.0,0.0,0.0,0.0,0.0,0.0,1.0,0.0
1354,mask,reporter wearing mask alone front camera single p ,2020-11-03,0.0,0.75,0.25,-0.25,0.0,0.0,0.0,1.0,0.0
1355,mask,illegal mask mandate place open state fully instead back tr ,2020-11-03,0.0,0.714,0.286,-0.5574,0.0,0.6,0.0,0.4,0.0
1356,mask,isnt wearing mask isnt daniel andrews wearing mask sick ,2020-11-03,0.0,0.708,0.292,-0.5106,0.0,0.0,0.0,1.0,0.0
1357,mask,lock wear maskkeep distance enough chinazi coronavirus cummunist party must pay th ,2020-11-03,0.191,0.709,0.099,0.3182,0.0,0.0,0.0,0.0,0.0
1358,mask,proud mask wearer ,2020-11-03,0.608,0.392,0.0,0.4767,0.0,0.0,0.5,0.5,0.0
1359,mask,believe fake melania wears melania skin mask ,2020-11-03,0.0,0.659,0.341,-0.4767,0.0,0.0,0.0,1.0,0.0
1360,mask,really take time gym working mask hard ,2020-11-03,0.0,0.811,0.189,-0.1027,0.25,0.25,0.0,0.25,0.25
1361,mask,need everyone put face mask put meditation chill ,2020-11-03,0.0,0.0,0.0,0.0,0.0,0.0,0.0,1.0,0.0
1362,mask,mask ,2020-11-03,0.0,0.0,0.0,0.0,0.0,0.0,0.0,1.0,0.0
1363,mask,ocarina time majora mask usually focused zelda games start comes story ,2020-11-03,0.206,0.794,0.0,0.3818,0.0,0.0,0.0,0.5,0.5
1364,mask,laugh idiot liberals btw keep mask ,2020-11-03,0.33,0.367,0.303,0.0772,0.0,0.0,0.0,1.0,0.0
1365,mask,use tactic alsoshe hold mask run around hous ,2020-11-03,0.0,0.0,0.0,0.0,0.0,0.0,0.0,1.0,0.0
1366,mask,trump nitwits wearing mask people wanted kids wear bullet proof backpacks ,2020-11-03,0.0,0.0,0.0,0.0,0.0,0.25,0.25,0.25,0.25
1367,mask,thinking knife real ol boy hockey mask real fake ,2020-11-03,0.0,0.721,0.279,-0.4767,0.0,0.0,0.0,0.8,0.2
1368,mask,mask smh ,2020-11-03,0.0,0.303,0.697,-0.3182,0.0,0.0,0.0,1.0,0.0
1369,mask,people know aylmer ontario support protest trying stop anti masker p ,2020-11-03,0.178,0.395,0.428,-0.4215,0.0,0.0,0.0,0.0,0.0
1370,mask,mask freeman dah abis soany suggestions lain mok suruh try ka ,2020-11-03,0.213,0.787,0.0,0.4019,0.0,0.0,0.0,1.0,0.0
1371,mask,line got polling place lady across table sounded like darth vader h ,2020-11-03,0.2,0.8,0.0,0.3612,0.0,1.0,0.0,0.0,0.0
1372,mask,100 leadership health disease prevention trump peoples freedom ergo fre ,2020-11-03,0.318,0.682,0.0,0.6369,0.0,0.0,0.0,0.0,1.0
1373,mask,dallas county judge refused wear mask university park united methodist polling place would rem ,2020-11-03,0.165,0.706,0.129,0.1531,0.0,0.6,0.0,0.4,0.0
1374,mask,truthfully dont think politicial running today wants make world better ,2020-11-03,0.42,0.58,0.0,0.7003,0.0,0.0,0.0,0.33,0.67
1375,mask,im sick mask past part ,2020-11-03,0.0,0.548,0.452,-0.5106,0.0,0.0,0.0,1.0,0.0
1376,mask,im mask way ,2020-11-03,0.0,0.0,0.0,0.0,0.0,0.0,0.0,1.0,0.0
1377,mask,nice old lady inside trader hoes make america great mask behind closed ,2020-11-03,0.408,0.592,0.0,0.7845,0.0,0.0,0.5,0.5,0.0
1378,mask,mask mandates possibly precautions may lifted area please help ,2020-11-03,0.417,0.583,0.0,0.6124,0.0,0.25,0.0,0.5,0.25
1379,mask,look happened spain lockdown strict spain masks mandatory indoors ,2020-11-03,0.14,0.86,0.0,0.0772,0.0,0.0,0.0,1.0,0.0
1380,mask,want tiny dicks mask bday ,2020-11-03,0.245,0.755,0.0,0.0772,0.0,0.0,0.0,1.0,0.0
1381,mask,poor radio hosts keep fucking mask ,2020-11-03,0.0,0.617,0.383,-0.4767,0.0,0.33,0.33,0.33,0.0
1382,mask,also heres mask ,2020-11-03,0.0,0.0,0.0,0.0,0.0,0.0,0.0,1.0,0.0
1383,mask,r e l l sick seeing faceshe needs bigger mask ,2020-11-03,0.0,0.602,0.398,-0.5106,0.0,0.0,0.0,1.0,0.0
1384,mask,thought including yes even walkingjoggingbiking sidewalks public walkw ,2020-11-03,0.278,0.722,0.0,0.4019,0.0,0.0,0.0,0.5,0.5
1385,mask,haha thank much worried going bamboo refuse wear mas ,2020-11-03,0.369,0.336,0.295,0.2732,0.0,0.33,0.0,0.67,0.0
1386,mask,remember vote wear mask wash hands take relaxing shower home ,2020-11-03,0.262,0.738,0.0,0.4939,0.0,0.5,0.0,0.5,0.0
1387,mask,stamping foot ,2020-11-03,0.0,0.0,0.0,0.0,1.0,0.0,0.0,0.0,0.0
1388,mask,reporters deliver reports without mask whilst empty room outside dont bother ,2020-11-03,0.287,0.713,0.0,0.3875,0.0,0.5,0.0,0.5,0.0
1389,mask,mask joke ,2020-11-03,0.688,0.312,0.0,0.296,0.0,0.0,0.5,0.5,0.0
1390,mask,team talk grayson kristina went party mask social distancing ,2020-11-03,0.252,0.748,0.0,0.4019,0.0,0.67,0.0,0.33,0.0
1391,mask,mask drawings one books keepers ,2020-11-03,0.0,0.0,0.0,0.0,0.0,0.5,0.0,0.5,0.0
1392,mask,today always go public los angeles without mask ,2020-11-03,0.0,0.0,0.0,0.0,0.0,0.0,0.0,1.0,0.0
1393,mask,havent checked election today headphones amp self care tonight give alcohol body scrub ,2020-11-03,0.211,0.789,0.0,0.4939,0.0,1.0,0.0,0.0,0.0
1394,mask,genuinely cannot believe measure cuts gave people mask never taking ty ,2020-11-03,0.144,0.688,0.167,-0.0762,0.0,0.25,0.0,0.5,0.25
1395,mask,therapy president control ,2020-11-03,0.0,0.0,0.0,0.0,0.0,0.0,0.0,0.0,0.0
1396,mask,donate trump virus many spread herman oh yeah ca tell us anymore ,2020-11-03,0.167,0.833,0.0,0.296,0.0,0.33,0.0,0.33,0.33
1397,mask,biden wears mask campaigning trump party place also hate masks ,2020-11-03,0.188,0.556,0.257,-0.25,0.0,0.2,0.0,0.6,0.2
1398,mask,mask makes 100 hotter ,2020-11-03,0.0,0.0,0.0,0.0,0.0,0.0,0.0,1.0,0.0
1399,mask,close edge damn election anyone breathes without mask done election day vote2020 ,2020-11-03,0.0,0.803,0.197,-0.4019,0.0,0.2,0.4,0.4,0.0
1400,mask,yes took long time us get p fit tested told get tested tr ,2020-11-03,0.342,0.658,0.0,0.6369,0.0,0.2,0.2,0.4,0.2
1401,mask,43 forest stolen girls june hur keep thinking forest search missing father thirtee ,2020-11-03,0.0,0.671,0.329,-0.6597,0.0,0.0,0.0,0.25,0.75
1402,mask,already see ppl cough sneeze public mask laughing loud ,2020-11-03,0.286,0.714,0.0,0.4939,0.0,0.0,0.0,1.0,0.0
1403,mask,became alone trying find someone else became pieces trying become whole aqua timez quotez mask ,2020-11-03,0.0,0.875,0.125,-0.25,0.0,0.33,0.0,0.67,0.0
1404,mask,france wear mask make full lockdowns fatality rate moment much h ,2020-11-03,0.0,0.667,0.333,-0.6705,0.0,0.5,0.0,0.5,0.0
1405,mask,mask ended disaster sewing wise sch mask b ,2020-11-03,0.254,0.41,0.336,-0.25,0.0,0.25,0.0,0.75,0.0
1406,mask,wore fishnet mask ,2020-11-03,0.0,0.0,0.0,0.0,0.0,0.0,0.0,1.0,0.0
1407,mask,alright getting yak ski mask amp taking ass city ,2020-11-03,0.16,0.56,0.28,-0.3612,0.0,0.0,0.0,0.5,0.5
1408,mask,adjustable washable reusable cotton kids face mask ribbon elastic filter pocket nose wire inspira ,2020-11-03,0.0,0.0,0.0,0.0,0.0,0.0,0.33,0.67,0.0
1409,mask,know retribution wearing bane mask batman ever ,2020-11-03,0.0,0.0,0.0,0.0,0.0,0.33,0.0,0.33,0.33
1410,mask,thank fav bout yeswear mask ,2020-11-03,0.647,0.353,0.0,0.6705,0.0,0.0,0.0,1.0,0.0
1411,mask,cheers whatever happens next couple days matter kind one another wear fucking mas ,2020-11-03,0.432,0.568,0.0,0.765,0.0,0.2,0.8,0.0,0.0
1412,mask,,2020-11-03,0.0,0.0,0.0,0.0,0.0,0.0,0.0,0.0,0.0
1413,mask,cares unless n95 mask work ,2020-11-03,0.429,0.571,0.0,0.4588,0.0,0.5,0.0,0.5,0.0
1414,mask,need wear mask sounds like entitled like husband let suckers masks ,2020-11-03,0.408,0.402,0.19,0.4215,0.0,0.25,0.0,0.75,0.0
1415,mask,poll watcher update someone said kag made retching noises behind mask ,2020-11-03,0.0,0.0,0.0,0.0,0.0,0.0,0.0,0.75,0.25
1416,mask,10 makcik nasi lemak 8 puji cantiknya mata year thanks face mask ,2020-11-03,0.225,0.775,0.0,0.4404,0.0,0.0,0.0,1.0,0.0
1417,mask,pls rmbr gonna go vote follow rules ur state set place wear mask n ,2020-11-03,0.098,0.902,0.0,0.0772,0.0,0.6,0.0,0.4,0.0
1418,mask,kinda went mask talking dad ,2020-11-03,0.0,0.0,0.0,0.0,0.0,0.5,0.0,0.5,0.0
1419,mask,mask slipped ,2020-11-03,0.0,0.0,0.0,0.0,0.0,0.5,0.0,0.5,0.0
1420,mask,stressing work watching news dealing mfs dont wanna keep mask ,2020-11-03,0.0,0.783,0.217,-0.3612,0.0,0.25,0.0,0.5,0.25
1421,mask,mask chins really sells ,2020-11-03,0.0,0.0,0.0,0.0,0.0,0.0,0.0,0.5,0.5
1422,mask,gee wonder perhaps molecule 11000th width human hair easily passes f ,2020-11-03,0.211,0.789,0.0,0.34,0.0,0.25,0.0,0.0,0.75
1423,mask,im sad didnt amber fabric softener jungkook uses got lavender vanilla one instead th ,2020-11-03,0.0,0.807,0.193,-0.4767,0.0,0.67,0.0,0.33,0.0
1424,mask,3 ws wear mask watch distance wash hands ,2020-11-03,0.0,0.0,0.0,0.0,0.0,0.33,0.0,0.33,0.33
1425,mask,around globe mask mandates number cases rise need look beyond cbc buddy ,2020-11-03,0.106,0.894,0.0,0.0772,0.0,0.67,0.0,0.33,0.0
1426,mask,imagine never oppressed feeling oppressed wear piece fucking fabric face ,2020-11-03,0.379,0.519,0.102,0.5773,0.0,0.2,0.2,0.4,0.2
1427,mask,82 new covid cases elko county 3 days 20 49 age group ferchrissakes wear mask ,2020-11-03,0.0,0.0,0.0,0.0,0.25,0.0,0.25,0.25,0.25
1428,mask,get art printed awesome products support redbubble r band findyourthing ,2020-11-03,0.493,0.507,0.0,0.7783,0.0,0.5,0.0,0.0,0.5
1429,mask,excited share latest addition etsy shop beaded mask necklace glass beads ,2020-11-03,0.338,0.662,0.0,0.5574,0.0,0.0,0.0,1.0,0.0
1430,mask,actually sargon realized would ,2020-11-03,0.0,0.0,0.0,0.0,0.0,0.5,0.0,0.0,0.5
1431,mask,may odds ever favor ,2020-11-03,0.474,0.526,0.0,0.4019,0.0,0.33,0.33,0.0,0.33
1432,mask,actually curious cause remember growing ppl would always say disrespectful put poppy anywhere ot ,2020-11-03,0.25,0.75,0.0,0.4588,0.0,0.17,0.0,0.33,0.5
1433,mask,1 mask sight wow ,2020-11-03,0.655,0.345,0.0,0.5859,0.0,0.0,0.0,0.5,0.5
1434,mask,apparently one guy talking said asked turn american flag mask insi ,2020-11-03,0.0,0.0,0.0,0.0,0.0,0.25,0.0,0.25,0.5
1435,mask,swing state jim carrey wears yellow suit mask dances cameron diaz club ,2020-11-03,0.0,0.0,0.0,0.0,0.0,0.6,0.0,0.4,0.0
1436,mask,someone outside polling place told youre wearing mask must voting biden im mean yes ,2020-11-03,0.172,0.828,0.0,0.4019,0.0,0.25,0.0,0.75,0.0
1437,mask,2 told go far booth walked wondered loud made go f ,2020-11-03,0.0,0.0,0.0,0.0,0.0,0.25,0.0,0.5,0.25
1438,mask,arrogant selfish rude disrespectful thats top mask vote blue ballot ,2020-11-03,0.105,0.351,0.544,-0.8176,0.0,0.0,0.2,0.4,0.4
1439,mask,soo found kendall supports trump brynns mom anti mask brynn posted ,2020-11-03,0.181,0.652,0.167,0.0516,0.0,0.0,0.0,0.5,0.5
1440,mask,wore reds mask 2nd knee replacement doctor big cubs fan great job anyway ,2020-11-03,0.368,0.632,0.0,0.7506,0.25,0.25,0.25,0.25,0.0
1441,mask,customer refused wear mask repeatedly told theyre required store kept arguing ,2020-11-03,0.0,0.634,0.366,-0.6369,0.0,0.0,0.0,1.0,0.0
1442,mask,since biden doesnt openly says supports white supremacy favor actu ,2020-11-03,0.3,0.538,0.162,0.1999,0.0,0.33,0.33,0.0,0.33
1443,mask,got paper mask keep nothing even gloves ,2020-11-03,0.0,0.0,0.0,0.0,0.0,0.0,0.0,1.0,0.0
1444,mask,yall getting real pitiful 1200 dollars countries got support mfn family bro ,2020-11-03,0.17,0.629,0.201,-0.128,0.0,0.0,0.0,0.5,0.5
1445,mask,fucking preach ones using fucking excuse legit someone rant said ca ,2020-11-03,0.123,0.693,0.185,-0.204,0.17,0.17,0.33,0.17,0.17
1446,mask,25km limit watch onslaught victorians seeking fresh mask free air nsw truly hope nsw welcome ,2020-11-03,0.59,0.41,0.0,0.9246,0.0,0.29,0.29,0.14,0.29
1447,mask,everytime put car park anywhere thats home 2 year old goes mask mask mask like thanks gf ive months ,2020-11-03,0.252,0.748,0.0,0.6597,0.0,0.29,0.0,0.71,0.0
1448,mask,breonna mask making emotional ,2020-11-03,0.348,0.652,0.0,0.1531,0.0,0.0,0.0,1.0,0.0
1449,mask,ridiculous mask garage ,2020-11-03,0.0,0.444,0.556,-0.3612,0.0,0.0,0.0,1.0,0.0
1450,mask,wears mask thinks cool ,2020-11-03,0.434,0.566,0.0,0.3182,0.0,0.0,0.33,0.33,0.33
1451,mask,ppl pull mask speak hm ,2020-11-03,0.0,0.0,0.0,0.0,0.0,0.5,0.0,0.5,0.0
1452,mask,poor language use saying residents saskatoon regina pa wear masks liv ,2020-11-03,0.0,0.763,0.237,-0.4767,0.0,0.0,0.0,0.33,0.67
1453,mask,wow love queen wears mask pandemics ,2020-11-03,0.667,0.333,0.0,0.8402,0.0,0.0,0.33,0.33,0.33
1454,mask,anybody wear mask public business treated like pestilent rat ,2020-11-03,0.238,0.762,0.0,0.3612,0.0,0.33,0.0,0.33,0.33
1455,mask,every poll worker presented beginning day face mask shield ,2020-11-03,0.0,0.0,0.0,0.0,0.0,0.33,0.33,0.33,0.0
1456,mask,said newsy would recommend wearing mask indoors everywhere goodness get pol ,2020-11-03,0.379,0.621,0.0,0.6705,0.0,0.33,0.0,0.33,0.33
1457,mask,hey mask help shut fuck helps even ,2020-11-03,0.414,0.312,0.273,0.2023,0.17,0.0,0.17,0.17,0.5
1458,mask,hey buddy um wheres mask bro ,2020-11-03,0.0,0.0,0.0,0.0,0.0,0.0,0.0,0.5,0.5
1459,mask,aint lying thats want wear depopulation quicker ,2020-11-03,0.309,0.556,0.136,0.3724,0.0,0.0,0.0,0.0,0.0
1460,mask,use sheet mask whenever feel like ,2020-11-03,0.333,0.667,0.0,0.3612,0.0,0.0,0.0,1.0,0.0
1461,mask,global problem hoping one genius scientist find cure want walk ban ,2020-11-03,0.236,0.402,0.362,-0.4939,0.0,0.33,0.0,0.33,0.33
1462,mask,trump literally called virus hoax refused wear mask got rid task l ,2020-11-03,0.0,0.677,0.323,-0.5106,0.0,0.0,0.0,0.67,0.33
1463,mask,mask coming ,2020-11-03,0.0,0.0,0.0,0.0,0.0,0.0,0.0,0.5,0.5
1464,mask,biden openly says intervene amazon sake uniting world simple way mask american imperialism ,2020-11-03,0.124,0.876,0.0,0.1779,0.0,0.33,0.0,0.33,0.33
1465,mask,also point republican platform cutting sanctuary mask states money w ,2020-11-03,0.0,0.842,0.158,-0.128,0.0,0.0,0.0,0.67,0.33
1466,mask,minouette shop pj mask inspired mask greg gekko kerrific ,2020-11-03,0.286,0.714,0.0,0.4939,0.0,0.0,0.33,0.67,0.0
1467,mask,tampa blue rally one wreaking mask ,2020-11-03,0.0,0.0,0.0,0.0,0.0,0.33,0.0,0.67,0.0
1468,mask,oof people know mask goes damn nose ,2020-11-03,0.0,0.69,0.31,-0.4019,0.0,0.5,0.0,0.5,0.0
1469,mask,yes wear mask outside next question ,2020-11-03,0.351,0.649,0.0,0.4019,0.0,0.33,0.0,0.67,0.0
1470,mask,indonesian airline garuda indonesia launched fly design ga competition invited creative people desi ,2020-11-03,0.286,0.714,0.0,0.5267,0.0,0.5,0.0,0.0,0.5
1471,mask,theres still time wear mask pray vote pray ,2020-11-03,0.434,0.566,0.0,0.5574,0.0,0.67,0.0,0.33,0.0
1472,mask,martin county florida told sir need wear mask say call cops ,2020-11-03,0.0,0.0,0.0,0.0,0.0,0.0,0.0,0.67,0.33
1473,mask,lets learn letter sounds ok kids letter says inaudible sound mask facial cues ,2020-11-03,0.155,0.845,0.0,0.296,0.0,0.0,0.25,0.5,0.25
1474,mask,wear mask improperly cant complain get covid ,2020-11-03,0.26,0.74,0.0,0.2755,0.0,0.0,0.0,1.0,0.0
1475,mask,every galarian pokemon english pos literally desert anaconda shotgun face ,2020-11-03,0.0,0.0,0.0,0.0,0.0,0.0,0.0,0.0,0.0
1476,mask,spanish lockdown particularly strict spain mas ,2020-11-03,0.0,0.0,0.0,0.0,0.0,0.0,0.0,0.0,0.0
1477,mask,even w mask ,2020-11-03,0.0,0.0,0.0,0.0,0.0,0.0,0.0,1.0,0.0
1478,mask,mask hand ,2020-11-03,0.762,0.238,0.0,0.4939,0.0,0.0,0.0,1.0,0.0
1479,mask,would love know logic behind putting mask nose thats logic ,2020-11-03,0.318,0.682,0.0,0.6369,0.0,0.2,0.2,0.6,0.0
1480,mask,excited share latest addition etsy shop beaded mask necklace glass beads ,2020-11-03,0.338,0.662,0.0,0.5574,0.0,0.0,0.0,1.0,0.0
1481,mask,bottom left mask absolutely terrifying ,2020-11-03,0.0,0.5,0.5,-0.6115,0.0,0.5,0.0,0.5,0.0
1482,mask,love mask get ,2020-11-03,0.677,0.323,0.0,0.6369,0.0,0.0,0.5,0.5,0.0
1483,mask,lockdown spain strict spain masks must worn indoors outdoors despite span ,2020-11-03,0.0,0.82,0.18,-0.296,0.5,0.0,0.0,0.5,0.0
1484,mask,southwest empties flight nashville airport passenger refuses wear mask ,2020-11-03,0.0,0.825,0.175,-0.1779,0.0,0.33,0.0,0.67,0.0
1485,mask,love mask ,2020-11-03,0.808,0.192,0.0,0.6369,0.0,0.0,0.5,0.5,0.0
1486,mask,yer pictureavatar wearing mask must think influencer dont realize pictures ,2020-11-03,0.0,0.0,0.0,0.0,0.0,0.0,0.0,0.5,0.5
1487,mask,wear damn mask ,2020-11-03,0.0,0.426,0.574,-0.4019,0.0,0.0,0.0,1.0,0.0
1488,mask,referring people arrested discussing mask protests posting ,2020-11-03,0.0,0.5,0.5,-0.6124,0.0,0.0,0.0,1.0,0.0
1489,mask,1 went vote tonight walked wo mask nobody gave trouble woman sitting ,2020-11-03,0.0,0.787,0.213,-0.4019,0.0,0.5,0.0,0.5,0.0
1490,mask,gtgo polls trump mask hat hoodie gtget fight pollsters gtget police called electioneer ,2020-11-03,0.0,0.822,0.178,-0.3818,0.0,0.0,0.0,0.67,0.33
1491,mask,cat prediction forthcoming offense later day often bury tree often feel ,2020-11-03,0.0,0.833,0.167,-0.25,0.0,0.0,0.33,0.67,0.0
1492,mask,might eat dumplings sick mask nausea watching election returns ,2020-11-03,0.0,0.603,0.397,-0.5574,0.33,0.17,0.0,0.33,0.17
1493,mask,love mask ,2020-11-03,0.808,0.192,0.0,0.6369,0.0,0.0,0.5,0.5,0.0
1494,mask,say erection yes said election take mask ears ,2020-11-03,0.278,0.722,0.0,0.4019,0.0,0.0,0.0,0.5,0.5
1495,mask,driving required wear mask sorry replying earlier ,2020-11-03,0.0,0.822,0.178,-0.0772,0.0,0.33,0.0,0.67,0.0
1496,mask,remember shes one warned sex without maskshe needs triple bagger ,2020-11-03,0.0,0.811,0.189,-0.2732,0.0,1.0,0.0,0.0,0.0
1497,mask,youve collectively spent millions dollars masks little guidance us certainl ,2020-11-03,0.0,0.0,0.0,0.0,0.0,0.0,0.0,1.0,0.0
1498,mask,im really glad wore mask like looks super cool keep ,2020-11-03,0.667,0.333,0.0,0.8999,0.0,0.0,0.5,0.25,0.25
1499,mask,strollin copper mask ,2020-11-03,0.0,0.0,0.0,0.0,0.0,0.0,0.0,1.0,0.0
1500,mask,dude nasty matter happens hero wear mask protect doctors nurses ,2020-11-03,0.432,0.355,0.213,0.4019,0.0,0.33,0.33,0.33,0.0
1501,mask,dr theresa tam three layer masks filters ready whatever needed stop th ,2020-11-03,0.17,0.68,0.15,0.0772,0.0,0.0,0.5,0.5,0.0
1502,mask,bit roasting antivaxxers could funny one house idk barging ,2020-11-03,0.257,0.619,0.124,0.3612,0.0,0.0,0.0,0.0,1.0
1503,mask,wearing mask feel like virus become live free cou ,2020-11-03,0.453,0.547,0.0,0.7003,0.0,0.0,0.5,0.5,0.0
1504,mask,look like stormtropper ᛋᛋ thugs ready inflict harm torture defenseless innocent peop ,2020-11-03,0.319,0.259,0.422,-0.5267,0.0,0.33,0.33,0.33,0.0
1505,mask,cool bro make sure got mask keep 6 feet ,2020-11-03,0.434,0.566,0.0,0.5574,0.0,0.25,0.25,0.5,0.0
1506,mask,may look happy old pictures believe mask cover ongoing mess head ive c ,2020-11-03,0.228,0.617,0.154,0.296,0.17,0.5,0.17,0.17,0.0
1507,mask,mask deaths greece learned aristi 14 year old student died suddenly wearing mask ,2020-11-03,0.0,0.769,0.231,-0.5574,0.0,0.5,0.0,0.5,0.0
1508,mask,mask shit retarded ,2020-11-03,0.0,0.12,0.88,-0.8074,0.0,0.0,0.0,0.5,0.5
1509,mask,non existent cafe serving conspiracy nut cookies flat earth totally ex ,2020-11-03,0.0,0.746,0.254,-0.5267,0.0,0.0,0.0,0.5,0.5
1510,mask,reopen sign say reopen school assume w ,2020-11-03,0.0,0.0,0.0,0.0,0.0,0.5,0.0,0.0,0.5
1511,mask,cute mask ,2020-11-03,0.75,0.25,0.0,0.4588,0.0,0.0,0.5,0.5,0.0
1512,mask,people home ca contract covid19 unless caught exposed somewhere ,2020-11-03,0.0,0.86,0.14,-0.0772,0.0,0.67,0.0,0.33,0.0
1513,mask,think shes telling mask incorrectly ,2020-11-03,0.0,0.0,0.0,0.0,0.0,0.0,0.0,0.67,0.33
1514,mask,sir namaste mv tao suchitra observed people roaming without masks amp maintaining soci ,2020-11-03,0.0,0.0,0.0,0.0,0.0,0.0,0.0,1.0,0.0
1515,mask,thank ,2020-11-03,1.0,0.0,0.0,0.3612,0.0,0.0,0.0,0.0,0.0
1516,mask,,2020-11-03,0.0,0.0,0.0,0.0,0.0,0.0,0.0,0.0,0.0
1517,mask,put mask cuz fun starting keep long ai fooling foxy king bot ,2020-11-03,0.206,0.625,0.169,0.1531,0.0,0.2,0.2,0.6,0.0
1518,mask,know voted im proud continue wear mask practice safety covid im proud ,2020-11-03,0.5,0.5,0.0,0.8402,0.0,0.25,0.5,0.25,0.0
1519,mask,might im actually retard thought pi ,2020-11-03,0.0,0.595,0.405,-0.5267,0.33,0.0,0.0,0.0,0.67
1520,mask,meanwhile sweden lockdowns social distancing full stadiums people mask mandates ,2020-11-03,0.0,0.0,0.0,0.0,0.0,0.5,0.0,0.5,0.0
1521,mask,saw guy take mask sneeze like bro wrong whole fkn time ,2020-11-03,0.171,0.616,0.212,-0.1531,0.0,0.5,0.0,0.5,0.0
1522,mask,agree reckon williamstown beach around 50 ,2020-11-03,0.333,0.667,0.0,0.3612,0.0,0.0,0.0,0.0,0.0
1523,mask,aunt may take mask want see nephew peter knew aunt may known peter ,2020-11-03,0.098,0.902,0.0,0.0772,0.0,0.4,0.0,0.2,0.4
1524,mask,posted story karen confronting wearing mask profile page ,2020-11-03,0.0,0.814,0.186,-0.1531,0.0,0.0,0.0,1.0,0.0
1525,mask,im told part problem 14 booths 7 booths masked ,2020-11-03,0.0,0.722,0.278,-0.4019,0.0,0.33,0.0,0.67,0.0
1526,mask,best ignore results drinking wine face mask ,2020-11-03,0.359,0.427,0.214,0.4019,0.0,0.0,0.0,0.5,0.5
1527,mask,mask 2 face memphis jookin ,2020-11-03,0.0,0.0,0.0,0.0,0.0,0.0,0.0,1.0,0.0
1528,mask,beautiful melania mask must put ,2020-11-03,0.494,0.506,0.0,0.5994,0.0,0.0,0.33,0.67,0.0
1529,mask,gonna ask need mask say id appreciate wore tell youre going get ,2020-11-03,0.197,0.803,0.0,0.4019,0.0,0.33,0.17,0.33,0.17
1530,mask,im going fight people grocery pick area dont put mask talk person processing order ,2020-11-03,0.0,0.833,0.167,-0.3818,0.0,0.25,0.0,0.75,0.0
1531,mask,take phony face mask back round trump people wear rather die first ,2020-11-03,0.0,0.738,0.262,-0.5994,0.0,0.25,0.0,0.25,0.5
1532,mask,wearing mask one recognise yougtgtgt ,2020-11-03,0.0,0.0,0.0,0.0,0.0,0.0,0.0,1.0,0.0
1533,mask,im queensland pretty rare see anyone mask ,2020-11-03,0.348,0.652,0.0,0.4939,0.0,0.0,0.5,0.5,0.0
1534,mask,afford mask ,2020-11-03,0.0,0.0,0.0,0.0,0.0,0.5,0.0,0.5,0.0
1535,mask,people saying harry isnt wearing mask right talking florence guys realize acts ,2020-11-03,0.0,0.0,0.0,0.0,0.0,0.5,0.0,0.25,0.25
1536,mask,harry pull mask ur nose dont shy ,2020-11-03,0.225,0.775,0.0,0.1877,0.0,0.5,0.0,0.5,0.0
1537,mask,love wears mask keep way ,2020-11-03,0.512,0.488,0.0,0.6369,0.0,0.0,0.5,0.5,0.0
1538,mask,hope everyone america good turnout polls voted early morning 7am ,2020-11-03,0.42,0.58,0.0,0.7003,0.0,0.5,0.5,0.0,0.0
1539,mask,wearing mask hot harry styles ,2020-11-03,0.0,0.0,0.0,0.0,0.0,0.33,0.0,0.67,0.0
1540,mask,sheet mask new candle cause little things ,2020-11-03,0.0,0.0,0.0,0.0,0.0,0.0,0.0,0.5,0.5
1541,mask,ran ralphs got fried chicken controlled didnt hug every biden mask hat ,2020-11-03,0.0,0.812,0.188,-0.3724,0.0,0.5,0.0,0.5,0.0
1542,mask,line ups store afternoon six customers one clerk masked except clerk asked ,2020-11-03,0.0,0.0,0.0,0.0,0.0,0.67,0.0,0.33,0.0
1543,mask,take mask ,2020-11-03,0.0,0.0,0.0,0.0,0.0,0.0,0.0,1.0,0.0
1544,mask,comes djt florida playing like expected early lead joe mail heavy trump po ,2020-11-03,0.24,0.559,0.201,-0.0772,0.0,0.2,0.2,0.2,0.4
1545,mask,sir love please wear mask properly ,2020-11-03,0.619,0.381,0.0,0.7579,0.0,0.0,0.5,0.5,0.0
1546,mask,sweetie wearing mask keeping washing hands impossible yall ,2020-11-03,0.314,0.686,0.0,0.4939,0.0,0.5,0.0,0.5,0.0
1547,mask,really gotta wear damn mask get food grow nigga ,2020-11-03,0.0,0.73,0.27,-0.4522,0.0,0.0,0.0,0.5,0.5
1548,mask,women playing back behind mental torture games husbands ex property share want fac ,2020-11-03,0.291,0.495,0.214,-0.1531,0.0,0.5,0.0,0.5,0.0
1549,mask,bro even mask tell yo face longer amount time virgin ,2020-11-03,0.0,0.0,0.0,0.0,0.0,0.0,0.0,1.0,0.0
1550,mask,apparently morning gov said need state mask mandate bc counties one ,2020-11-03,0.0,0.0,0.0,0.0,0.0,0.0,0.0,0.67,0.33
1551,mask,joke ever sort violence anti mask freedom march ar ,2020-11-03,0.36,0.281,0.36,0.0,0.0,0.0,0.33,0.33,0.33
1552,mask,erie live corry coach kelly goodsel standing center mask speaks beavers timeout third ,2020-11-03,0.0,0.0,0.0,0.0,0.0,0.75,0.0,0.25,0.0
1553,mask,hope everyone america good turnout polls voted early morning 7am ,2020-11-03,0.42,0.58,0.0,0.7003,0.0,0.5,0.5,0.0,0.0
1554,mask,btw mask gives ,2020-11-03,0.0,0.0,0.0,0.0,0.0,0.5,0.0,0.5,0.0
1555,mask,witnessed man take mask cough hand jesus bro laugh ,2020-11-03,0.493,0.507,0.0,0.7783,0.0,0.0,0.0,1.0,0.0
1556,mask,ok share biden tee wore earlier made unscathed trumplandia im smiling unde ,2020-11-03,0.451,0.549,0.0,0.7506,0.0,0.0,0.5,0.5,0.0
1557,mask,got mask queen ig yall check ,2020-11-03,0.0,0.0,0.0,0.0,0.0,0.0,0.0,1.0,0.0
1558,mask,also shoutouts barely anyone polling place wearing mask including majority poll workers morons ,2020-11-03,0.0,0.839,0.161,-0.3182,0.0,0.5,0.0,0.5,0.0
1559,mask,voted today hope also hope wearing mask need ,2020-11-03,0.492,0.508,0.0,0.7003,0.0,0.67,0.0,0.33,0.0
1560,mask,blank mask 183 ,2020-11-03,0.0,0.0,0.0,0.0,0.0,0.0,0.0,1.0,0.0
1561,mask,ppls attn pls consider donating hk ny mask circuit provides masks indi ,2020-11-03,0.106,0.894,0.0,0.0772,0.0,0.0,0.0,1.0,0.0
1562,mask,take mask ,2020-11-03,0.0,0.0,0.0,0.0,0.0,0.0,0.0,1.0,0.0
