,Search,Tweet,Entered on,pos_score,neu_score,neg_score,compound_score,angry_score,fear_score,happy_score,sad_score,surprise_score
665,mask,compare asked wear mask nazi germany youre fucking idiot ,2020-11-03,0.0,0.69,0.31,-0.5563,0.0,0.33,0.33,0.33,0.0
666,mask,dont forget mask ,2020-11-03,0.454,0.546,0.0,0.1695,0.5,0.0,0.0,0.5,0.0
667,mask,catching old yt got reminded crochetedmesh masks forced wearin ,2020-11-03,0.0,0.727,0.273,-0.4588,0.0,0.5,0.0,0.5,0.0
668,mask,sa ,2020-11-03,0.0,0.0,0.0,0.0,0.0,0.0,0.0,0.0,0.0
669,mask,voted person morning socially distanced mask 10 minute wait speck ink ,2020-11-03,0.0,0.0,0.0,0.0,0.0,0.0,0.33,0.33,0.33
670,mask,trying make political point stupid mask ,2020-11-03,0.0,0.595,0.405,-0.5267,0.0,0.0,0.0,0.67,0.33
671,mask,yes wearing mask pandemic oppression ,2020-11-03,0.403,0.597,0.0,0.4019,0.0,0.0,0.0,1.0,0.0
672,mask,thank read important yet perspective illog ,2020-11-03,0.518,0.482,0.0,0.5106,0.0,0.0,1.0,0.0,0.0
673,mask,always wear mask look much better women swoon laughing loud ,2020-11-03,0.433,0.567,0.0,0.7269,0.0,0.0,0.0,0.67,0.33
674,mask,put double mask vote trying way suppress vote ,2020-11-03,0.0,0.0,0.0,0.0,0.0,0.0,0.0,1.0,0.0
675,mask,cuz havent washed germ covered hands dont want touch face take mask ,2020-11-03,0.0,0.9,0.1,-0.0572,0.0,0.5,0.0,0.5,0.0
676,mask,shop mask never issue ,2020-11-03,0.0,0.0,0.0,0.0,0.0,0.0,0.0,1.0,0.0
677,mask,im back voting mask staying fuck ,2020-11-03,0.0,0.588,0.412,-0.5423,0.33,0.0,0.33,0.33,0.0
678,mask,anyone explain logic anyone cause pretty sure lockdown mask wearing happened tr ,2020-11-03,0.355,0.645,0.0,0.6705,0.0,0.33,0.33,0.33,0.0
679,mask,able work office friday would 100 wear ua mask friday utes polo ,2020-11-03,0.0,0.0,0.0,0.0,0.0,0.67,0.0,0.33,0.0
680,mask,maybe biden voters arent gathering elections parties still pandemic wear mask vote ,2020-11-03,0.0,0.83,0.17,-0.3089,0.0,0.0,0.0,1.0,0.0
681,mask,buy wesley 175 mask pin 10 euro please contact wesleyppugmailcom details ,2020-11-03,0.187,0.813,0.0,0.3182,0.0,0.0,0.0,1.0,0.0
682,mask,would like know thinks mask saving could drop slice ,2020-11-03,0.216,0.603,0.181,0.1027,0.0,0.33,0.0,0.33,0.33
683,mask,visiting hawaii learn face mask rules vary county county ,2020-11-03,0.0,0.0,0.0,0.0,0.0,0.5,0.0,0.5,0.0
684,mask,could walk 2m apart mask ,2020-11-03,0.0,0.0,0.0,0.0,0.0,0.0,0.0,1.0,0.0
685,mask,thats face mask hat love ,2020-11-03,0.512,0.488,0.0,0.6369,0.0,0.0,0.5,0.5,0.0
686,mask,everywhere asia also mask use tokyo actually lower cities like paris madrid londo ,2020-11-03,0.159,0.701,0.14,0.0772,0.0,0.0,0.0,0.5,0.5
687,mask,nothing creating resistance ooh like idk filter thats mask dummy guess ,2020-11-03,0.181,0.58,0.238,0.0547,0.0,0.0,0.0,0.33,0.67
688,mask,totally voted real donald trump need end mask requirement return normal life 2021 ,2020-11-03,0.0,0.0,0.0,0.0,0.0,0.25,0.0,0.5,0.25
689,mask,nfl expands bench area tightens game day mask requirements via app ,2020-11-03,0.123,0.877,0.0,0.1027,0.0,0.33,0.33,0.33,0.0
690,mask,mask ,2020-11-03,0.0,0.0,0.0,0.0,0.0,0.0,0.0,1.0,0.0
691,mask,afraid take thst mask ,2020-11-03,0.0,0.0,0.0,0.0,0.0,0.5,0.0,0.5,0.0
692,mask,going polls foreign fashion without mask ,2020-11-03,0.0,0.0,0.0,0.0,0.0,0.5,0.0,0.5,0.0
693,mask,gotten half way door realized forgot mask car ,2020-11-03,0.0,0.0,0.0,0.0,0.5,0.0,0.0,0.5,0.0
694,mask,bitch wearing mask ,2020-11-03,0.0,0.345,0.655,-0.5859,0.0,0.0,0.0,1.0,0.0
695,mask,lockdown spain extremely strict spain masks must worn inside outdoors even ,2020-11-03,0.0,0.82,0.18,-0.296,0.0,0.0,0.0,1.0,0.0
696,mask,perhaps mouse come mouth wait mask way ,2020-11-03,0.0,0.0,0.0,0.0,0.0,0.0,0.0,0.67,0.33
697,mask,social distance wear mask v e today ,2020-11-03,0.0,0.0,0.0,0.0,0.0,0.5,0.0,0.5,0.0
698,mask,yeah one without mask laughing loud ,2020-11-03,0.249,0.453,0.298,-0.1098,0.0,0.0,0.0,1.0,0.0
699,mask,told group teens put masks entering building fuckheads audacity ,2020-11-03,0.0,0.0,0.0,0.0,0.14,0.29,0.0,0.43,0.14
700,mask,annoying dog owner person doesnt wear mask bldg wait rn ,2020-11-03,0.0,0.769,0.231,-0.4019,0.0,0.0,0.0,0.67,0.33
701,mask,opinion accounting gimmicks cant mask states sick economy ,2020-11-03,0.278,0.722,0.0,0.4023,0.0,0.4,0.0,0.6,0.0
702,mask,breached mandatory mask order well done ,2020-11-03,0.459,0.541,0.0,0.34,0.0,0.0,0.0,1.0,0.0
703,mask,party coming mask course laughing loud ,2020-11-03,0.596,0.404,0.0,0.7096,0.0,0.0,0.0,0.5,0.5
704,mask,act gon mask ,2020-11-03,0.0,0.0,0.0,0.0,0.0,0.0,0.0,1.0,0.0
705,mask,youre line polls today please safe wear mask bring water social distance much possible ,2020-11-03,0.302,0.698,0.0,0.6369,0.0,0.33,0.0,0.67,0.0
706,mask,mask matters ,2020-11-03,0.524,0.476,0.0,0.0258,0.0,0.5,0.0,0.5,0.0
707,mask,think style mask chemical part touching skin ,2020-11-03,0.0,0.0,0.0,0.0,0.0,0.0,0.0,0.67,0.33
708,mask,easily spot trumpie voting line wearing mask obeying 6ft away ,2020-11-03,0.211,0.789,0.0,0.34,0.2,0.6,0.0,0.2,0.0
709,mask,open rp reader woke infinity school ground strange man white mask tapped shoulder ,2020-11-03,0.0,0.87,0.13,-0.2023,0.25,0.5,0.0,0.25,0.0
710,mask,mask thoo ,2020-11-03,0.0,0.0,0.0,0.0,0.0,0.0,0.0,1.0,0.0
711,mask,question seemed hopeful inexit polls dems many americans think maskwea ,2020-11-03,0.268,0.732,0.0,0.5106,0.0,0.25,0.0,0.25,0.5
712,mask,meant mask pressed mask hehe ,2020-11-03,0.0,0.0,0.0,0.0,0.0,0.33,0.0,0.67,0.0
713,mask,doug ford fault went winter winter spring summer fall business guy ,2020-11-03,0.0,0.787,0.213,-0.4019,0.0,0.5,0.25,0.0,0.25
714,mask,republican precinct captain complimented evening shift outfit im definitely blushing mask rn ,2020-11-03,0.355,0.645,0.0,0.6705,0.0,0.5,0.0,0.5,0.0
715,mask,thought id join fun first time voting ready line 2 hrs amp break ,2020-11-03,0.471,0.529,0.0,0.7906,0.0,0.17,0.33,0.0,0.5
716,mask,running back forgot mask ,2020-11-03,0.0,0.0,0.0,0.0,0.5,0.0,0.0,0.5,0.0
717,mask,pregnancy new mom mask shall fun maybe ill throw cute onesie ,2020-11-03,0.368,0.468,0.164,0.5423,0.0,0.0,0.67,0.33,0.0
718,mask,karma working hard election day gop candidate indiana ag tests positive covid 19 election day ,2020-11-03,0.2,0.722,0.078,0.4939,0.25,0.25,0.5,0.0,0.0
719,mask,told friends irc chat wearing mask good even enemies authoritarian got mad ,2020-11-03,0.294,0.392,0.314,-0.1027,0.2,0.0,0.4,0.4,0.0
720,mask,um left ones looting burning destroying getting way w ,2020-11-03,0.0,0.66,0.34,-0.5574,0.0,0.67,0.0,0.33,0.0
721,mask,getting covid tested feels gross wear mask wash hands distance socially ,2020-11-03,0.0,0.763,0.237,-0.4767,0.0,0.25,0.25,0.5,0.0
722,mask,,2020-11-03,0.0,0.0,0.0,0.0,0.0,0.0,0.0,0.0,0.0
723,mask,look mask ,2020-11-03,0.0,0.0,0.0,0.0,0.0,0.0,0.0,1.0,0.0
724,mask,woke late today please stay safe voting today wear mask let turned away t_t good luck ,2020-11-03,0.481,0.519,0.0,0.8779,0.22,0.0,0.22,0.44,0.11
725,mask,happy im getting face routine back face wanna act rn weather change hate dumb ass mask ,2020-11-03,0.141,0.458,0.401,-0.7783,0.0,0.0,0.4,0.6,0.0
726,mask,tell lot person respond ask wear mask properly ,2020-11-03,0.0,0.0,0.0,0.0,0.0,0.2,0.2,0.6,0.0
727,mask,couldnt spit wit mask ,2020-11-03,0.0,0.0,0.0,0.0,0.33,0.0,0.0,0.33,0.33
728,mask,biden hide basement double mask ,2020-11-03,0.0,0.702,0.298,-0.1779,0.33,0.33,0.0,0.33,0.0
729,mask,everyone needs vote pshh everyone needed keep asses inside face mask hardly anyone sip tea ,2020-11-03,0.0,0.0,0.0,0.0,0.0,0.0,0.0,1.0,0.0
730,mask,joe declaring mandate even loses mask mandate ,2020-11-03,0.0,0.723,0.277,-0.3182,0.0,0.0,0.0,1.0,0.0
731,mask,dont wear mask either im riddled disease ,2020-11-03,0.0,0.0,0.0,0.0,0.0,0.5,0.0,0.5,0.0
732,mask,please touch outside mask wash hands use hand sanitizer immediately h ,2020-11-03,0.407,0.593,0.0,0.6705,0.0,0.25,0.0,0.75,0.0
733,mask,brandons dad invited us thanksgiving dinner b told wed go anyone wanting hold presley would ,2020-11-03,0.0,0.0,0.0,0.0,0.0,0.67,0.0,0.33,0.0
734,mask,rule like known rule says cant wear mask trump biden besides saying encouraged ,2020-11-03,0.312,0.688,0.0,0.6124,0.0,0.33,0.0,0.17,0.5
735,mask,voted see would deny rights still worn mask one says word stop complying ,2020-11-03,0.0,0.595,0.405,-0.7003,0.2,0.4,0.0,0.2,0.2
736,mask,standard wear mask others even chance spreading ,2020-11-03,0.25,0.75,0.0,0.25,0.0,0.67,0.0,0.33,0.0
737,mask,gonna start screaming nice mask asshole isnt one theyre poor ,2020-11-03,0.358,0.468,0.174,0.4125,0.0,0.0,0.5,0.5,0.0
738,mask,absolutely love hear room passive mask policies putting employees ris ,2020-11-03,0.44,0.56,0.0,0.7425,0.0,0.43,0.14,0.43,0.0
739,mask,really majority wearing mask line outside totally guessing biden voters ,2020-11-03,0.0,0.0,0.0,0.0,0.0,0.25,0.0,0.25,0.5
740,mask,keep mask ,2020-11-03,0.0,0.0,0.0,0.0,0.0,0.0,0.0,1.0,0.0
741,mask,wears mask know double duh ,2020-11-03,0.0,0.0,0.0,0.0,0.0,0.0,0.0,1.0,0.0
742,mask,plz get well soon amp love mask ,2020-11-03,0.655,0.345,0.0,0.765,0.0,0.0,0.5,0.5,0.0
743,mask,bruh whiny bitch wah wah ca breathe moom hot smfh duct tape mouth shut put mask ,2020-11-03,0.0,0.798,0.202,-0.5859,0.14,0.14,0.0,0.71,0.0
744,mask,one wear mask biden wins stay indoors else vote f ,2020-11-03,0.316,0.684,0.0,0.5719,0.5,0.0,0.0,0.5,0.0
745,mask,cannot stress importance voting enough future hands lets show vote wear ,2020-11-03,0.173,0.67,0.157,0.0572,0.0,0.0,0.0,1.0,0.0
746,mask,like mask ,2020-11-03,0.714,0.286,0.0,0.3612,0.0,0.0,0.0,1.0,0.0
747,mask,yeah vote god sake total fraud remember making fun ,2020-11-03,0.463,0.305,0.232,0.4215,0.0,0.0,0.33,0.33,0.33
748,mask,hey shouldnt ask driver wear mask covers nose mouth ,2020-11-03,0.0,0.0,0.0,0.0,0.0,0.4,0.0,0.4,0.2
749,mask,pretty mask ,2020-11-03,0.762,0.238,0.0,0.4939,0.0,0.0,0.5,0.5,0.0
750,mask,,2020-11-03,0.0,0.0,0.0,0.0,0.0,0.0,0.0,0.0,0.0
751,mask,mf said keep mask ,2020-11-03,0.0,0.0,0.0,0.0,0.0,0.0,0.0,0.5,0.5
752,mask,accidentally walked retail clothing store walked around 10 minutes realized ,2020-11-03,0.0,0.789,0.211,-0.34,0.0,0.0,0.0,0.0,0.0
753,mask,told us vote mail forced toda ,2020-11-03,0.0,0.625,0.375,-0.4588,0.0,0.5,0.0,0.5,0.0
754,mask,concerning indeed theres us armed mask han ,2020-11-03,0.0,0.0,0.0,0.0,0.0,0.0,0.0,1.0,0.0
755,mask,come alaska seen mask weeks ,2020-11-03,0.0,0.0,0.0,0.0,0.0,0.0,0.0,1.0,0.0
756,mask,refuse wear mask conspiracy side least courage say ,2020-11-03,0.0,0.378,0.622,-0.8035,0.0,0.25,0.0,0.5,0.25
757,mask,need vote today already grab mask hand sanitizer head also love carr ,2020-11-03,0.425,0.575,0.0,0.8126,0.0,0.33,0.33,0.33,0.0
758,mask,precinct today plenty sanitizing mask wearing distancing outdoor voting options plus ,2020-11-03,0.0,0.0,0.0,0.0,0.0,0.0,0.0,1.0,0.0
759,mask,denby fawcett shaming people wo fix hawaii mask problem ,2020-11-03,0.0,0.748,0.252,-0.4019,0.0,0.5,0.0,0.5,0.0
760,mask,got mask lids mall black ones ,2020-11-03,0.0,0.0,0.0,0.0,0.0,0.67,0.0,0.33,0.0
761,mask,also find nearly every country happy wear mask really big deal ,2020-11-03,0.27,0.73,0.0,0.5719,0.0,0.0,0.33,0.33,0.33
762,mask,according cnn exit poll 68 people say wearing mask public health responsibility 30 say personal choice ,2020-11-03,0.0,0.0,0.0,0.0,0.2,0.2,0.0,0.2,0.4
763,mask,could pro life arent wearing mask supposed protectin ,2020-11-03,0.0,0.0,0.0,0.0,0.0,0.67,0.0,0.33,0.0
764,mask,felt bad see bitch ass party mask dumb motherfucker ,2020-11-03,0.111,0.123,0.766,-0.9517,0.0,0.0,0.0,1.0,0.0
765,mask,2 mask ,2020-11-03,0.0,0.0,0.0,0.0,0.0,0.0,0.0,1.0,0.0
766,mask,concerned harry doesnt realise put mask around ears instead holding ,2020-11-03,0.0,0.0,0.0,0.0,0.0,0.4,0.0,0.6,0.0
767,mask,old lady walking around albertsons mask hanging one ear covering mouth hanging ,2020-11-03,0.0,0.0,0.0,0.0,0.0,0.33,0.0,0.67,0.0
768,mask,soo guess pretty sure get good vote count dump people line wearing ,2020-11-03,0.442,0.421,0.137,0.7003,0.0,0.5,0.33,0.0,0.17
769,mask,mask ,2020-11-03,0.0,0.0,0.0,0.0,0.0,0.0,0.0,1.0,0.0
770,mask,matching mask hair ,2020-11-03,0.0,0.0,0.0,0.0,0.0,0.0,0.0,0.5,0.5
771,mask,wearing mask see breaking ,2020-11-03,0.0,0.0,0.0,0.0,0.0,0.0,0.0,0.5,0.5
772,mask,wonder many people ca stand refusal implement nationa ,2020-11-03,0.0,0.0,0.0,0.0,0.0,0.5,0.0,0.0,0.5
773,mask,didnt see single person without mask ,2020-11-03,0.0,0.0,0.0,0.0,0.0,0.0,0.0,1.0,0.0
774,mask,welljust produced loud burp wearing mask yeah pleasant ,2020-11-03,0.478,0.522,0.0,0.6705,0.0,0.0,0.5,0.5,0.0
775,mask,mask says ,2020-11-03,0.0,0.0,0.0,0.0,0.0,0.0,0.0,0.5,0.5
776,mask,guys might able wear lipgloss anymore wearing mask keeps face warm london winter ,2020-11-03,0.137,0.863,0.0,0.2263,0.33,0.33,0.0,0.33,0.0
777,mask,waited line care long took proudly filled oval next biden harris ,2020-11-03,0.43,0.57,0.0,0.7783,0.0,0.5,0.17,0.0,0.33
778,mask,funny trump derangement syndrome tds trump greatest president ever bacterial pne ,2020-11-03,0.441,0.559,0.0,0.7964,0.0,0.2,0.0,0.0,0.8
779,mask,yo yuh im gen z gonna fuck landed gentry dont fuck two parties cause im radical enby ye ,2020-11-03,0.0,0.602,0.398,-0.8503,0.0,0.33,0.67,0.0,0.0
780,mask,got home first general election vote 20 btw made sure living proof ,2020-11-03,0.173,0.827,0.0,0.3182,0.0,0.4,0.0,0.4,0.2
781,mask,nice mask ,2020-11-03,0.737,0.263,0.0,0.4215,0.0,0.0,0.5,0.5,0.0
782,mask,ive put face mask cat wont stop staring horror ,2020-11-03,0.411,0.589,0.0,0.5975,0.0,0.0,0.0,0.67,0.33
783,mask,best protect others causing skin breakout tips help cl ,2020-11-03,0.613,0.387,0.0,0.8591,0.0,0.0,0.25,0.25,0.5
784,mask,first nakey melania lady doesnt wear mask ,2020-11-03,0.0,0.0,0.0,0.0,0.0,0.0,0.0,0.5,0.5
785,mask,listen science people massachusetts imposing 300 fines mask outd ,2020-11-03,0.0,0.851,0.149,-0.1027,0.0,0.0,0.0,1.0,0.0
786,mask,went vish second life saw moon fall house majora mask style ,2020-11-03,0.0,0.0,0.0,0.0,0.0,0.67,0.0,0.33,0.0
787,mask,im playing designing face mask many photos choose ,2020-11-03,0.205,0.795,0.0,0.2023,0.0,0.33,0.0,0.33,0.33
788,mask,guy working polls complimented tixxo mask good work please vote havent yet ,2020-11-03,0.471,0.529,0.0,0.7906,0.0,0.4,0.2,0.4,0.0
789,mask,ca make stuff spending 3 years bashing science trump based safety covid test ,2020-11-03,0.203,0.797,0.0,0.4215,0.17,0.33,0.0,0.33,0.17
790,mask,prepare voting person live voting suppressed area bring chair mask hand sanitizer wate ,2020-11-03,0.211,0.789,0.0,0.4939,0.0,0.0,0.0,1.0,0.0
791,mask,everyone sees wear mask wash hands ,2020-11-03,0.0,0.0,0.0,0.0,0.0,0.5,0.0,0.5,0.0
792,mask,please wear mask public people ,2020-11-03,0.365,0.635,0.0,0.3182,0.0,0.0,0.0,1.0,0.0
793,mask,shocked 48 americans think covid 19 response going well 22000 people died fr ,2020-11-03,0.117,0.556,0.328,-0.5859,0.0,0.4,0.0,0.2,0.4
794,mask,cnn exit poll wearing face mask public public responsibility 68 personal choice 30 election day election2020 ,2020-11-03,0.0,0.0,0.0,0.0,0.25,0.25,0.25,0.25,0.0
795,mask,think going play majora mask mini ace today ,2020-11-03,0.255,0.745,0.0,0.34,0.0,0.5,0.0,0.25,0.25
796,mask,needs used avenger costume cape domino mask would probably goo ,2020-11-03,0.0,0.0,0.0,0.0,0.0,0.67,0.0,0.33,0.0
797,mask,200k dead trump chance save 100k lives chose push anti mask anti science agenda vote ,2020-11-03,0.216,0.415,0.369,-0.5719,0.0,0.5,0.0,0.25,0.25
798,mask,say god claire anti mask ,2020-11-03,0.284,0.405,0.311,-0.0516,0.0,0.0,0.0,0.33,0.67
799,mask,dont love masks wear protect others middle pan ,2020-11-03,0.217,0.501,0.281,-0.1945,0.0,0.0,0.5,0.5,0.0
800,mask,mask wearing made forget mustache hair top head grow fast ,2020-11-03,0.154,0.684,0.162,-0.0258,0.17,0.17,0.0,0.33,0.33
801,mask,tie make saber rise child mask poor disguise want park silencer right li ,2020-11-03,0.079,0.61,0.311,-0.5859,0.0,0.5,0.0,0.5,0.0
802,mask,mask water snacks tissues careful ,2020-11-03,0.286,0.714,0.0,0.1531,0.0,0.0,0.0,1.0,0.0
803,mask,resume back please wear mask ,2020-11-03,0.365,0.635,0.0,0.3182,0.0,0.0,0.0,1.0,0.0
804,mask,yall 8pm get polling places vote youre hayward csueb amp city hall hold voti ,2020-11-03,0.0,0.0,0.0,0.0,0.0,1.0,0.0,0.0,0.0
805,mask,yall drive mask windows ,2020-11-03,0.0,0.0,0.0,0.0,0.0,0.5,0.0,0.5,0.0
806,mask,embarrassment lying experts one minute says wear mask shut ,2020-11-03,0.0,0.526,0.474,-0.743,0.25,0.0,0.0,0.5,0.25
807,mask,halloween parties yall still couldnt wear mask ,2020-11-03,0.31,0.69,0.0,0.4019,0.0,0.0,0.0,1.0,0.0
808,mask,gotten half way door times remembered always wear mask inside alway ,2020-11-03,0.0,0.0,0.0,0.0,0.0,0.0,0.0,1.0,0.0
809,mask,strange things mornings said yesterday see wild random things bondi today started ,2020-11-03,0.0,0.859,0.141,-0.2023,0.0,0.0,0.0,0.0,1.0
810,mask,matter opinion personally prefer majora mask uniqueness compared ,2020-11-03,0.136,0.864,0.0,0.0258,0.0,0.33,0.33,0.33,0.0
811,mask,hey north carolina voters getting dark outside polls still open extensions bring ,2020-11-03,0.0,0.0,0.0,0.0,0.0,0.2,0.0,0.4,0.4
812,mask,saw invitation virtual conference germany today attendees given access registration ,2020-11-03,0.0,0.0,0.0,0.0,0.0,1.0,0.0,0.0,0.0
813,mask,meet quite people supermarket even chat mask long ,2020-11-03,0.0,0.0,0.0,0.0,0.0,0.5,0.0,0.5,0.0
814,mask,vividness room even physical objects iron mask existed many unwarrantable assumptions ,2020-11-03,0.0,0.0,0.0,0.0,0.0,0.67,0.0,0.33,0.0
815,mask,love face mask get ,2020-11-03,0.583,0.417,0.0,0.6369,0.0,0.0,0.5,0.5,0.0
816,mask,online school really crazy seeing ppl apt building husl stuff know ,2020-11-03,0.0,0.788,0.212,-0.4005,0.2,0.6,0.0,0.0,0.2
817,mask,must mag wearing mask ,2020-11-03,0.0,0.0,0.0,0.0,0.0,0.0,0.0,1.0,0.0
818,mask,5 recent sales ,2020-11-03,0.0,0.0,0.0,0.0,0.0,0.0,0.0,0.0,0.0
819,mask,yes theyre close still better close wear mask instead wearing mask ,2020-11-03,0.384,0.616,0.0,0.6808,0.0,0.14,0.29,0.43,0.14
820,mask,wearing mask appropriately dont cover nose mask purpose ,2020-11-03,0.0,0.0,0.0,0.0,0.0,0.25,0.25,0.5,0.0
821,mask,mask ,2020-11-03,0.0,0.0,0.0,0.0,0.0,0.0,0.0,1.0,0.0
822,mask,also didnt see even one mask ,2020-11-03,0.0,0.0,0.0,0.0,0.0,0.0,0.0,1.0,0.0
823,mask,mask kamala harris endorsed communism hours election day informing america daily news ,2020-11-03,0.154,0.846,0.0,0.25,0.0,0.0,0.5,0.5,0.0
824,mask,easy work home want shut long someone else deli ,2020-11-03,0.375,0.625,0.0,0.4939,0.25,0.5,0.0,0.25,0.0
825,mask,mask boy ,2020-11-03,0.0,0.0,0.0,0.0,0.0,0.0,0.0,1.0,0.0
826,mask,infuriating mississippi state allow absentee early voting pandemic co ,2020-11-03,0.142,0.448,0.41,-0.5574,0.0,0.5,0.0,0.5,0.0
827,mask,love liberal mask symbolism ,2020-11-03,0.583,0.417,0.0,0.6369,0.0,0.0,0.5,0.5,0.0
828,mask,looks like theyre wearing mask unlike trump crowds one laughing loud ,2020-11-03,0.388,0.612,0.0,0.6908,0.0,0.0,0.0,0.5,0.5
829,mask,information fart smell molecule 05 nm 05 billionth meter across coronavirus 100x large ,2020-11-03,0.0,0.0,0.0,0.0,0.0,1.0,0.0,0.0,0.0
830,mask,good girl make sure keep safe wear mask also time send ,2020-11-03,0.503,0.497,0.0,0.7964,0.0,0.33,0.17,0.33,0.17
831,mask,yall ever pull mask hear someone talk ,2020-11-03,0.0,0.0,0.0,0.0,0.0,0.0,0.0,0.5,0.5
832,mask,abed new la life trying live new life mask true occasionally sees visions ,2020-11-03,0.287,0.713,0.0,0.5302,0.0,0.75,0.0,0.25,0.0
833,mask,mask map soul 7 lost first time voting ,2020-11-03,0.0,0.723,0.277,-0.3182,0.0,0.0,0.0,0.5,0.5
834,mask,56 nights stick talk mask ,2020-11-03,0.0,0.0,0.0,0.0,0.0,0.5,0.0,0.5,0.0
835,mask,got tsu face mask ,2020-11-03,0.0,0.0,0.0,0.0,0.0,0.0,0.0,1.0,0.0
836,mask,mask thought polling places required ,2020-11-03,0.0,0.0,0.0,0.0,0.0,0.33,0.0,0.33,0.33
837,mask,get ahold republican thugs wearing mask saves lives ,2020-11-03,0.0,0.0,0.0,0.0,0.0,0.0,0.0,1.0,0.0
838,mask,yes despite cnn commentary last 6 months americans stupid easy wash ,2020-11-03,0.35,0.438,0.212,0.296,0.25,0.25,0.0,0.5,0.0
839,mask,hope everyone america good turnout polls voted early morning 7am g ,2020-11-03,0.42,0.58,0.0,0.7003,0.0,0.5,0.5,0.0,0.0
840,mask,err side humanity wear mask everytime leave house everytime ,2020-11-03,0.0,0.87,0.13,-0.0516,0.0,0.0,0.0,1.0,0.0
841,mask,old white man without mask decided cough without even careful others fck put ,2020-11-03,0.0,0.893,0.107,-0.1139,0.0,0.4,0.0,0.6,0.0
842,mask,guarantee great uncle didnt feel better 20 years vote someone actually car ,2020-11-03,0.348,0.514,0.137,0.571,0.0,0.0,0.33,0.0,0.67
843,mask,tam gave away ppe masks february said work fact tam said risk fro covid ,2020-11-03,0.0,0.861,0.139,-0.2732,0.14,0.43,0.0,0.14,0.29
844,mask,wear mask vote ffs ,2020-11-03,0.0,0.441,0.559,-0.5859,0.0,0.0,0.0,1.0,0.0
845,mask,iahdksgekehekrh gonna say grandma next tile refuses wear mask ,2020-11-03,0.0,0.0,0.0,0.0,0.0,0.0,0.0,0.67,0.33
846,mask,case wondering pandemic going conservative mask averse areas means confirmed ca ,2020-11-03,0.0,0.0,0.0,0.0,0.0,0.4,0.0,0.4,0.2
847,mask,maybe ask dr wear mask surgical ,2020-11-03,0.0,0.0,0.0,0.0,0.0,0.5,0.0,0.5,0.0
848,mask,people recognizing mask people havent seen years ,2020-11-03,0.0,0.0,0.0,0.0,0.0,0.0,0.0,1.0,0.0
849,mask,new texans texas sports nation nfl expands team bench areas mask protocols ,2020-11-03,0.113,0.887,0.0,0.1027,0.0,0.0,0.0,1.0,0.0
850,mask,3 layer face mask 20 boxes 100 days supply 62499 save 17500 ,2020-11-03,0.242,0.758,0.0,0.4939,0.0,0.0,0.5,0.5,0.0
851,mask,already go vote grab mask pen water snack safe know rights ask hel ,2020-11-03,0.195,0.805,0.0,0.4404,0.0,0.5,0.0,0.5,0.0
852,mask,spanish lockdown strict spain masks must worn indoors outdoors des ,2020-11-03,0.0,0.804,0.196,-0.296,0.0,0.0,0.0,1.0,0.0
853,mask,hope everyone america good turnout polls voted early morning 7a ,2020-11-03,0.42,0.58,0.0,0.7003,0.0,0.5,0.5,0.0,0.0
854,mask,hope hair stylist knows talkeramp hope know sick either got weak ass lung ,2020-11-03,0.247,0.34,0.413,-0.5994,0.0,0.4,0.0,0.4,0.2
855,mask,change mask helm ,2020-11-03,0.0,0.0,0.0,0.0,0.0,0.0,0.0,1.0,0.0
856,mask,southwest airlines flight bna deplaned argumentative female passenger refused wear face mask ,2020-11-03,0.0,0.68,0.32,-0.5719,0.0,0.0,0.0,1.0,0.0
857,mask,available one type mask masked republic usually one ,2020-11-03,0.0,0.0,0.0,0.0,0.0,0.33,0.0,0.67,0.0
858,mask,southwest flight deplanes nashville airport passenger refuses wear face mask ,2020-11-03,0.0,0.0,0.0,0.0,0.0,0.33,0.0,0.67,0.0
859,mask,mask socially distancing ,2020-11-03,0.0,0.0,0.0,0.0,0.0,0.0,0.5,0.5,0.0
860,mask,get art printed awesome products support redbubble r band findyourthing redbubble ,2020-11-03,0.459,0.541,0.0,0.7783,0.0,0.5,0.0,0.0,0.5
861,mask,reminder offer stands 7pm wear mask well sanitize car passengers ,2020-11-03,0.189,0.811,0.0,0.2732,0.0,0.67,0.0,0.33,0.0
862,mask,someone please pull sleep mask world eyes tell us bad dream ,2020-11-03,0.272,0.506,0.222,-0.0516,0.0,0.0,0.0,1.0,0.0
863,mask,needs face mask big one ,2020-11-03,0.0,0.0,0.0,0.0,0.0,0.0,0.0,1.0,0.0
864,mask,yep voting station went told choice took mask ,2020-11-03,0.239,0.761,0.0,0.296,0.2,0.2,0.0,0.4,0.2
865,mask,fired ,2020-11-03,0.0,0.0,1.0,-0.5574,0.0,0.0,0.0,0.0,0.0
866,mask,see double standard trump votes florida wearing gucci dress mask ,2020-11-03,0.0,0.0,0.0,0.0,0.0,0.0,0.0,0.5,0.5
867,mask,looking wondering mask seems different realized ,2020-11-03,0.0,0.0,0.0,0.0,0.0,0.0,0.0,0.67,0.33
868,mask,done mask damn near 4 hours cant wait wash face ,2020-11-03,0.0,0.748,0.252,-0.4019,0.0,0.33,0.0,0.33,0.33
869,mask,mari really said aylin like tiffany amp proceeds say oh sorry ive never seen without mas ,2020-11-03,0.153,0.775,0.072,0.3535,0.0,0.0,0.0,0.25,0.75
870,mask,mask great example ,2020-11-03,0.672,0.328,0.0,0.6249,0.0,0.0,0.5,0.5,0.0
871,mask,hows everyones day mines going fine every time stop working remember world around tear ,2020-11-03,0.113,0.75,0.138,-0.1027,0.0,0.4,0.4,0.2,0.0
872,mask,work pharma company recently made mask requirement strict virus might airborne ,2020-11-03,0.0,0.0,0.0,0.0,0.25,0.25,0.0,0.5,0.0
873,mask,finally voted felt good well good luck guys couldnt pick photos best lol go ,2020-11-03,0.547,0.319,0.134,0.8531,0.0,0.17,0.5,0.17,0.17
874,mask,mask something hold away nose rendering useless ,2020-11-03,0.0,0.682,0.318,-0.4215,0.33,0.0,0.0,0.33,0.33
875,mask,true vital let mask slip real life ,2020-11-03,0.5,0.5,0.0,0.6124,0.0,0.4,0.0,0.6,0.0
876,mask,dont wear mask make statement ,2020-11-03,0.0,0.0,0.0,0.0,0.0,0.0,0.0,1.0,0.0
877,mask,know im cute behind mask amp glasses im tired ,2020-11-03,0.233,0.543,0.225,0.0258,0.0,0.0,0.33,0.67,0.0
878,mask,really hate comparison yall try draw maui pasifika girls everytime yall get feelings hurt ,2020-11-03,0.0,0.619,0.381,-0.8122,0.0,0.2,0.0,0.4,0.4
879,mask,greg hunt useless doesnt even know wear mask like someone wh ,2020-11-03,0.175,0.629,0.196,-0.0772,0.0,0.0,0.0,0.5,0.5
880,mask,biden would live communist china hellhole vaccination mandetory mask mandetory meanwh ,2020-11-03,0.0,0.0,0.0,0.0,0.0,0.5,0.0,0.5,0.0
881,mask,responsibleoutsidesocial distancingand mask hope rig ,2020-11-03,0.392,0.405,0.203,0.34,0.0,0.5,0.0,0.5,0.0
882,mask,election end mask orders ,2020-11-03,0.0,0.0,0.0,0.0,0.0,0.0,0.0,1.0,0.0
883,mask,trump hat refused wear mask escorted separate area vote said taking concentration camp ,2020-11-03,0.0,0.845,0.155,-0.296,0.0,0.17,0.0,0.33,0.5
884,mask,cannot express sheer power felt tell dude allowed vote polling ,2020-11-03,0.0,0.0,0.0,0.0,0.2,0.2,0.0,0.4,0.2
885,mask,long abundance hand sanitizer 6ft apart wearing mask rbbing damn face haha ,2020-11-03,0.346,0.503,0.151,0.5423,0.0,0.5,0.0,0.5,0.0
886,mask,wear mask stay safe election ,2020-11-03,0.42,0.58,0.0,0.4404,0.5,0.0,0.0,0.5,0.0
887,mask,think better wash mask lines whole thing took minutes maybe 10 tops sweet ,2020-11-03,0.479,0.521,0.0,0.8481,0.0,0.33,0.0,0.11,0.56
888,mask,mask gag ,2020-11-03,0.0,0.294,0.706,-0.34,0.0,0.0,0.0,1.0,0.0
