,Search,Tweet,Entered on,pos_score,neu_score,neg_score,compound_score,angry_score,fear_score,happy_score,sad_score,surprise_score
2228,mask,yoh put hand front mouth yawning day mask idk going day ,2020-11-03,0.235,0.662,0.103,0.4215,0.0,0.14,0.29,0.43,0.14
2229,mask,turn durag mask 1x rn activities ,2020-11-03,0.0,0.0,0.0,0.0,0.0,0.0,0.0,0.5,0.5
2230,mask,people regretted voting trump shut government people voted h ,2020-11-03,0.0,0.729,0.271,-0.3818,0.33,0.0,0.0,0.0,0.67
2231,mask,hide behind mask oxygen ,2020-11-03,0.0,0.638,0.362,-0.1779,0.33,0.0,0.0,0.67,0.0
2232,mask,mask quintessential ,2020-11-03,0.0,0.0,0.0,0.0,0.0,0.0,0.0,1.0,0.0
2233,mask,im ugly asf im glad gotta wear mask aint one wanna see face lmfaoo ,2020-11-03,0.164,0.656,0.18,-0.0772,0.0,0.0,0.25,0.75,0.0
2234,mask,introduced rs 100 penalty passengers fail wear masks back april later int ,2020-11-03,0.0,0.606,0.394,-0.7579,0.0,0.0,0.0,1.0,0.0
2235,mask,fact confined spaces likely help virus spread whic ,2020-11-03,0.278,0.722,0.0,0.4019,0.0,0.67,0.0,0.0,0.33
2236,mask,sure looks like headed 2021 nothing changed ca safely hug friends famil ,2020-11-03,0.533,0.339,0.127,0.8112,0.0,0.75,0.25,0.0,0.0
2237,mask,course shes wearing mask correctly either ,2020-11-03,0.0,0.0,0.0,0.0,0.0,0.0,0.0,1.0,0.0
2238,mask,mask let goo ,2020-11-03,0.0,0.0,0.0,0.0,0.0,0.0,0.0,1.0,0.0
2239,mask,laugh biden bangers election viewing parties sans mask hypocrite ,2020-11-03,0.474,0.526,0.0,0.743,0.0,0.0,0.0,1.0,0.0
2240,mask,got mask nose surprised bc trump supporters ,2020-11-03,0.49,0.51,0.0,0.5859,0.0,0.0,0.0,0.33,0.67
2241,mask,said wear mask mf nice lt3 ,2020-11-03,0.359,0.641,0.0,0.4215,0.0,0.0,0.33,0.33,0.33
2242,mask,hope everyone america good turnout polls voted early mornin ,2020-11-03,0.453,0.547,0.0,0.7003,0.0,0.5,0.5,0.0,0.0
2243,mask,literally ca breathe mask wearing mask ca breathe somebody ,2020-11-03,0.0,0.0,0.0,0.0,0.0,0.5,0.0,0.5,0.0
2244,mask,mendocino co election 2020 live blog first resulted released 8pm confusion provisional ba ,2020-11-03,0.0,0.845,0.155,-0.296,0.0,0.5,0.0,0.0,0.5
2245,mask,man imagine watching loved one die covid turning tv see president mocking virus p ,2020-11-03,0.19,0.488,0.322,-0.4019,0.0,0.0,0.25,0.0,0.75
2246,mask,part federal law missing point mr spammer wo take becau ,2020-11-03,0.0,0.597,0.403,-0.6597,0.0,0.0,0.0,0.33,0.67
2247,mask,admit mask ,2020-11-03,0.643,0.357,0.0,0.2023,0.0,0.0,0.0,1.0,0.0
2248,mask,wear mask ,2020-11-03,0.0,0.0,0.0,0.0,0.0,0.0,0.0,1.0,0.0
2249,mask,wear mask wonder effective arei touch face lots wearing maski touch ,2020-11-03,0.237,0.763,0.0,0.4767,0.0,0.0,0.0,0.8,0.2
2250,mask,everyone wears mask chose create ,2020-11-03,0.344,0.656,0.0,0.2732,0.0,0.0,0.0,1.0,0.0
2251,mask,ooh like names doctor bcs mask need suitcase doctor ay ,2020-11-03,0.217,0.783,0.0,0.3612,0.0,0.0,0.0,0.5,0.5
2252,mask,texas deep deep red ,2020-11-03,0.0,0.0,0.0,0.0,1.0,0.0,0.0,0.0,0.0
2253,mask,bad anymore mask mandates wont change thing people sti ,2020-11-03,0.0,0.696,0.304,-0.5423,0.0,0.0,0.0,0.67,0.33
2254,mask,things right play sims order worm string mask redbubble go outside find ra ,2020-11-03,0.167,0.833,0.0,0.34,0.0,0.5,0.0,0.25,0.25
2255,mask,hope everyone america good turnout polls v ,2020-11-03,0.592,0.408,0.0,0.7003,0.0,0.5,0.5,0.0,0.0
2256,mask,jobs cant go country shut beca ,2020-11-03,0.0,0.0,0.0,0.0,0.5,0.5,0.0,0.0,0.0
2257,mask,choose safety choose mtdc put mask face plans fun vacation mtdc ensur ,2020-11-03,0.379,0.621,0.0,0.7269,0.0,0.25,0.25,0.5,0.0
2258,mask,august drove pennsylvania saw sign convenience store one wearing mask ,2020-11-03,0.0,0.0,0.0,0.0,0.0,0.67,0.0,0.33,0.0
2259,mask,go let us know mask turn throwing darts miserable duo ,2020-11-03,0.0,0.738,0.262,-0.4939,0.0,0.0,0.0,0.67,0.33
2260,mask,meat night weekend friday men invited prep work starting 8 pm behind chapel ,2020-11-03,0.0,0.0,0.0,0.0,0.0,0.67,0.0,0.33,0.0
2261,mask,refiner pride policy forcing frontline workers confront customers perceived covid19 face mask infrac ,2020-11-03,0.159,0.728,0.113,0.1779,0.0,0.4,0.2,0.4,0.0
2262,mask,psychopath put trump get better soon rally mask near house scumbags let win angry ,2020-11-03,0.319,0.524,0.157,0.5267,0.14,0.14,0.0,0.43,0.29
2263,mask,dam mask small strings pulling big ass ears shits sore smh ,2020-11-03,0.0,0.38,0.62,-0.886,0.33,0.0,0.0,0.33,0.33
2264,mask,mask ,2020-11-03,0.0,0.0,0.0,0.0,0.0,0.0,0.0,1.0,0.0
2265,mask,day polls wearing shitty mask think mighty fine idea ,2020-11-03,0.145,0.565,0.29,-0.4215,0.0,0.0,0.5,0.25,0.25
2266,mask,idm wearing mask give acne headache get annoying ,2020-11-03,0.0,0.722,0.278,-0.4019,0.0,0.5,0.0,0.5,0.0
2267,mask,hard pass see preferably sans mask ,2020-11-03,0.0,0.781,0.219,-0.1027,0.5,0.0,0.0,0.5,0.0
2268,mask,face mask drink 4th cocktail hows everyone else ,2020-11-03,0.0,0.0,0.0,0.0,0.0,0.0,0.0,1.0,0.0
2269,mask,gop headquarters holds big gathering public place lot mask wears dfl headquarters online wa ,2020-11-03,0.0,0.0,0.0,0.0,0.0,0.33,0.0,0.67,0.0
2270,mask,put prevent happenin annd fog glasses doin time weari ,2020-11-03,0.121,0.879,0.0,0.0258,0.0,0.5,0.0,0.5,0.0
2271,mask,still wear mask tomorrow orr ,2020-11-03,0.0,0.0,0.0,0.0,0.0,0.0,0.0,1.0,0.0
2272,mask,mask nothing ,2020-11-03,0.0,0.0,0.0,0.0,0.0,0.0,0.0,1.0,0.0
2273,mask,nt mask well ,2020-11-03,0.512,0.488,0.0,0.2732,0.0,0.0,0.0,1.0,0.0
2274,mask,explanation long basically painting lawfully stealing hit sounds like ,2020-11-03,0.189,0.53,0.28,-0.296,0.25,0.5,0.0,0.0,0.25
2275,mask,alright cool likealmost nobody wearing mask sigh ,2020-11-03,0.574,0.426,0.0,0.5267,0.0,0.0,0.33,0.67,0.0
2276,mask,duncan anti mask pro trump probably biggest betrayal felt year anyways ,2020-11-03,0.0,0.596,0.404,-0.7269,0.0,0.25,0.0,0.5,0.25
2277,mask,red covid red mask ,2020-11-03,0.0,0.0,0.0,0.0,0.67,0.0,0.0,0.33,0.0
2278,mask,know ive extremely silent progress partial raptor mask suit lemme honest hav ,2020-11-03,0.389,0.611,0.0,0.749,0.0,0.0,0.5,0.5,0.0
2279,mask,parents forcing go school cant breathe doo ughh im literally gonna suffer mask ,2020-11-03,0.0,0.774,0.226,-0.5423,0.0,0.75,0.0,0.25,0.0
2280,mask,wendy please keep mask ,2020-11-03,0.434,0.566,0.0,0.3182,0.0,0.0,0.0,1.0,0.0
2281,mask,seriously mask racism completely falling left people always judge others basis ,2020-11-03,0.0,0.51,0.49,-0.7713,0.0,0.0,0.0,1.0,0.0
2282,mask,wear mask gloves keep masked get close listen heart ,2020-11-03,0.0,0.0,0.0,0.0,0.0,0.0,0.25,0.75,0.0
2283,mask,middle pandemic wearing mask public safety political ,2020-11-03,0.318,0.682,0.0,0.4215,0.0,0.5,0.0,0.5,0.0
2284,mask,better feeling exercising right vote exercising right wear mask trump2020 ,2020-11-03,0.355,0.645,0.0,0.5267,0.0,0.33,0.0,0.5,0.17
2285,mask,side note joe biden touched covid mask 11 times course 3min clip ,2020-11-03,0.0,0.0,0.0,0.0,0.0,0.0,0.0,1.0,0.0
2286,mask,one campaign party wearing mask seems incredibly irresponsible hope lose covidiot ,2020-11-03,0.309,0.368,0.323,-0.0717,0.0,0.33,0.0,0.67,0.0
2287,mask,couldnt less relevant love mask ,2020-11-03,0.0,0.559,0.441,-0.4874,0.0,0.0,0.5,0.5,0.0
2288,mask,dont want advocate stopping mask wearing dont think need ,2020-11-03,0.149,0.724,0.126,0.0572,0.0,0.0,0.0,0.5,0.5
2289,mask,arent people wearing mask ,2020-11-03,0.0,0.0,0.0,0.0,0.0,0.0,0.0,1.0,0.0
2290,mask,us lana please good example wear real mask lana ,2020-11-03,0.426,0.574,0.0,0.6369,0.0,0.0,0.25,0.75,0.0
2291,mask,get art printed awesome products redbubble r band findyourthing redbubble masks gnomes ,2020-11-03,0.291,0.709,0.0,0.6249,0.0,0.33,0.0,0.33,0.33
2292,mask,superman mask phantasm ,2020-11-03,0.0,0.0,0.0,0.0,0.0,0.0,0.0,1.0,0.0
2293,mask,freezing cold thank god mask warm nose ,2020-11-03,0.596,0.275,0.128,0.6249,0.0,0.25,0.0,0.25,0.5
2294,mask,throw mask ,2020-11-03,0.0,0.0,0.0,0.0,0.0,0.0,0.0,1.0,0.0
2295,mask,hope everyone america good turnout polls voted early morning ,2020-11-03,0.453,0.547,0.0,0.7003,0.0,0.5,0.5,0.0,0.0
2296,mask,depends moved 100 miles september trump counties lots signs fla ,2020-11-03,0.0,0.0,0.0,0.0,0.0,0.33,0.0,0.33,0.33
2297,mask,im eating bowl mac n cheese wearing face mask kind yall doin ,2020-11-03,0.254,0.746,0.0,0.5267,0.0,0.4,0.2,0.2,0.2
2298,mask,mask looks good ,2020-11-03,0.592,0.408,0.0,0.4404,0.0,0.0,0.5,0.5,0.0
2299,mask,going wins tell everybody wear mask 130 billionnai ,2020-11-03,0.346,0.654,0.0,0.5719,0.0,0.33,0.0,0.67,0.0
2300,mask,fixed mask ,2020-11-03,0.0,0.0,0.0,0.0,0.0,0.0,0.0,1.0,0.0
2301,mask,random one time customer came store told ,2020-11-03,0.0,0.0,0.0,0.0,0.0,0.0,0.0,0.5,0.5
2302,mask,take mask ,2020-11-03,0.0,0.0,0.0,0.0,0.0,0.0,0.0,1.0,0.0
2303,mask,said stupid things bother wear mask amp lnp appointee nominate vic w ,2020-11-03,0.0,0.608,0.392,-0.7003,0.0,0.0,0.0,0.33,0.67
2304,mask,cousin going party mask fever ,2020-11-03,0.403,0.597,0.0,0.4019,0.0,0.5,0.0,0.5,0.0
2305,mask,good dude happened mask wearing pulled yell put danger ,2020-11-03,0.218,0.526,0.256,-0.128,0.0,0.2,0.2,0.4,0.2
2306,mask,love mask ,2020-11-03,0.808,0.192,0.0,0.6369,0.0,0.0,0.5,0.5,0.0
2307,mask,wish wasnt hard wear glasses mask wear work ,2020-11-03,0.4,0.6,0.0,0.4581,0.33,0.33,0.0,0.33,0.0
2308,mask,masks arent answer must insist mask locking us glad lose ,2020-11-03,0.219,0.584,0.197,0.0772,0.0,0.0,0.25,0.75,0.0
2309,mask,absolutely distraught folks gay son died choking covid 19 mask thought p ,2020-11-03,0.0,0.433,0.567,-0.8883,0.0,0.4,0.2,0.2,0.2
2310,mask,finished working election judge first time get covid definitely guy wa ,2020-11-03,0.213,0.787,0.0,0.4019,0.0,0.67,0.0,0.0,0.33
2311,mask,harryy mask nose please know safe everyone might ,2020-11-03,0.464,0.536,0.0,0.6369,0.33,0.0,0.0,0.67,0.0
2312,mask,harry fixing mask hot ,2020-11-03,0.0,0.0,0.0,0.0,0.0,0.33,0.0,0.67,0.0
2313,mask,remember doug insecure nose zit day dance costume party could ,2020-11-03,0.2,0.593,0.207,-0.0258,0.0,0.67,0.33,0.0,0.0
2314,mask,cant manage virus possibleeven great president like trumpwear ,2020-11-03,0.524,0.476,0.0,0.765,0.0,0.5,0.5,0.0,0.0
2315,mask,keep screaming americans shut wear mask indefinitely see gets ,2020-11-03,0.0,0.755,0.245,-0.3818,0.5,0.0,0.0,0.5,0.0
2316,mask,people mask racism excuse gods way surely never see pearly gates like im ver ,2020-11-03,0.322,0.481,0.197,0.1531,0.0,0.0,0.0,0.67,0.33
2317,mask,ok walk store whole store wearing mask need wear one ive b ,2020-11-03,0.18,0.82,0.0,0.296,0.0,0.5,0.0,0.5,0.0
2318,mask,regardless wins wear mask unless want grandparents die dont kill people save greatest generation ,2020-11-03,0.471,0.291,0.238,0.7514,0.0,0.33,0.0,0.33,0.33
2319,mask,mask dont wear know wear able sense presence ,2020-11-03,0.0,0.0,0.0,0.0,0.0,0.0,0.0,1.0,0.0
2320,mask,first must obliged protocols frontliners authorities told us protocols ,2020-11-03,0.0,0.0,0.0,0.0,0.0,0.33,0.0,0.33,0.33
2321,mask,omg finally fixed mask ,2020-11-03,0.0,0.0,0.0,0.0,0.0,0.33,0.0,0.33,0.33
2322,mask,anyway im gonna go look mask tomorrow morning ,2020-11-03,0.0,0.0,0.0,0.0,0.0,0.0,0.0,1.0,0.0
2323,mask,yall noticed trump never mask ,2020-11-03,0.0,0.0,0.0,0.0,0.0,0.33,0.0,0.33,0.33
2324,mask,shouldnt close always going mask ripped 2016 monster ,2020-11-03,0.0,0.0,0.0,0.0,0.0,0.25,0.25,0.5,0.0
2325,mask,dont matter give raid gas mask im good bro ,2020-11-03,0.264,0.638,0.098,0.4265,0.0,0.4,0.2,0.2,0.2
2326,mask,embarrassing mask moment ,2020-11-03,0.0,0.435,0.565,-0.3818,0.0,0.67,0.0,0.33,0.0
2327,mask,voted sheriff busy chasing cause refused wear mask let vote ,2020-11-03,0.0,0.804,0.196,-0.296,0.0,0.25,0.0,0.75,0.0
2328,mask,gave ya dusty bitches mask amp dont none ,2020-11-03,0.0,0.642,0.358,-0.5994,0.0,0.5,0.0,0.5,0.0
2329,mask,fucking icu nurse cotton masks work ,2020-11-03,0.0,0.0,0.0,0.0,0.0,0.33,0.33,0.33,0.0
2330,mask,red error mask must buy ,2020-11-03,0.0,0.597,0.403,-0.4019,0.33,0.0,0.0,0.67,0.0
2331,mask,im stress eating lips touching face bought mask tonight ,2020-11-03,0.0,0.741,0.259,-0.4215,0.25,0.25,0.0,0.5,0.0
2332,mask,wanna face mask bad rn dont buy anymore dont ,2020-11-03,0.0,0.696,0.304,-0.5423,0.0,0.0,0.0,1.0,0.0
2333,mask,put mask nose jesus christ ,2020-11-03,0.0,0.0,0.0,0.0,0.0,0.0,0.0,1.0,0.0
2334,mask,invested enough hours incredibly anxiety help country full ,2020-11-03,0.271,0.547,0.182,0.2466,0.0,0.33,0.0,0.33,0.33
2335,mask,bitches like pro life continue wear mask like lying ,2020-11-03,0.289,0.289,0.422,-0.5106,0.0,0.5,0.0,0.5,0.0
2336,mask,mask line sun burn see bangs curled sunburn ,2020-11-03,0.0,0.0,0.0,0.0,0.0,0.25,0.0,0.5,0.25
2337,mask,1 statutory warning4 females guys r person like mask sanatani cons specially fema ,2020-11-03,0.2,0.8,0.0,0.3612,0.0,0.0,0.0,1.0,0.0
2338,mask,santa maria presente community action santa maria valley hits different pull mi gente bring mask ,2020-11-03,0.0,0.0,0.0,0.0,0.2,0.4,0.0,0.4,0.0
2339,mask,great mask ,2020-11-03,0.804,0.196,0.0,0.6249,0.0,0.0,0.5,0.5,0.0
2340,mask,suspiciously red mask ,2020-11-03,0.0,0.426,0.574,-0.4019,0.33,0.33,0.0,0.33,0.0
2341,mask,yes agree 100 shit sad really hurts heart cant even go supermarket black lives matter ,2020-11-03,0.248,0.354,0.397,-0.6997,0.0,0.14,0.0,0.57,0.29
2342,mask,boleh guna brightening body scrub untuk exfoliate remove sel kulit mati dan lembutkan kulit h ,2020-11-03,0.212,0.788,0.0,0.5423,0.0,0.0,0.0,0.0,0.0
2343,mask,think kinda psychotic wearing purge mask whats yalls real intentions ,2020-11-03,0.0,0.0,0.0,0.0,0.0,0.0,0.0,0.67,0.33
2344,mask,hat mask fishing joke mfs go 10 nigga bye ,2020-11-03,0.216,0.784,0.0,0.296,0.0,0.0,0.5,0.5,0.0
2345,mask,hasnt done mask mandate hasnt done bail bars res ,2020-11-03,0.0,0.0,0.0,0.0,0.0,0.0,0.0,1.0,0.0
2346,mask,mask still ,2020-11-03,0.0,0.0,0.0,0.0,0.0,0.0,0.0,1.0,0.0
2347,mask,free country free country abandon things free country contain virus free country fo ,2020-11-03,0.548,0.332,0.12,0.8834,0.14,0.14,0.57,0.0,0.14
2348,mask,ads talk see face mask ca see bra hot redhead ,2020-11-03,0.0,0.0,0.0,0.0,0.0,0.0,0.0,1.0,0.0
2349,mask,missouri chose vote red red wave coronavirus lot shaming face mask issue divides ,2020-11-03,0.0,0.0,0.0,0.0,0.4,0.2,0.0,0.4,0.0
2350,mask,like 2016 except im wearing mask 8 hours day work 20000 plus americans dead fk ,2020-11-03,0.133,0.638,0.229,-0.4215,0.0,0.33,0.33,0.33,0.0
2351,mask,matt gaetz jack ass wearing gas mask ,2020-11-03,0.0,0.632,0.368,-0.5423,0.0,0.0,0.0,1.0,0.0
2352,mask,always ensure wear mask public keep social distance stay safe bring back curfew ,2020-11-03,0.333,0.667,0.0,0.6705,0.2,0.2,0.0,0.6,0.0
2353,mask,mask physically distance stay social wash hands ,2020-11-03,0.0,0.0,0.0,0.0,0.25,0.5,0.0,0.25,0.0
2354,mask,thinking cool combo fancy suit weird gas mask gotta make costume prime minister ,2020-11-03,0.153,0.733,0.113,0.1531,0.0,0.17,0.17,0.33,0.33
2355,mask,sticks googly eyes maskvisor thing looks like eyes ,2020-11-03,0.263,0.737,0.0,0.3612,0.0,0.5,0.0,0.0,0.5
2356,mask,problem save millions lives also approve mask wearing stay safe americans lt3 ,2020-11-03,0.343,0.506,0.152,0.5267,0.25,0.25,0.25,0.25,0.0
2357,mask,yhu mask larrayswife ,2020-11-03,0.0,0.0,0.0,0.0,0.0,0.0,0.0,1.0,0.0
2358,mask,shit creeping mask ,2020-11-03,0.0,0.357,0.643,-0.5574,0.0,0.0,0.0,0.5,0.5
2359,mask,stood line mask observed people looking looked back minu ,2020-11-03,0.0,0.0,0.0,0.0,0.0,0.67,0.0,0.33,0.0
2360,mask,im living fear instead reading available mask studies juststayhome plan ,2020-11-03,0.0,0.738,0.262,-0.4939,0.0,0.33,0.0,0.67,0.0
2361,mask,pj mask pajama party yeah ,2020-11-03,0.62,0.38,0.0,0.5994,0.0,0.0,0.0,1.0,0.0
2362,mask,thank carolina duchess sorry mask rants people vi ,2020-11-03,0.225,0.45,0.324,-0.0258,0.33,0.0,0.0,0.67,0.0
2363,mask,wow mask holy fuck ,2020-11-03,0.409,0.215,0.376,0.0772,0.0,0.0,0.33,0.33,0.33
2364,mask,idk yall peopleseeing someone new without mask like pulled ,2020-11-03,0.0,0.666,0.334,-0.3632,0.0,0.0,0.0,1.0,0.0
2365,mask,wearing mask right would walked ,2020-11-03,0.0,0.0,0.0,0.0,0.0,0.67,0.0,0.33,0.0
2366,mask,cwtw blood slasheroc use harpoon wear meat victims mask laughing loud ,2020-11-03,0.221,0.621,0.159,0.2263,0.0,0.0,0.0,1.0,0.0
2367,mask,two sides coin agree trump mask racism ,2020-11-03,0.216,0.431,0.353,-0.3818,0.0,0.0,0.0,0.5,0.5
2368,mask,wait minute p5 masks represent persona therefore joker gets spirit turn ,2020-11-03,0.262,0.738,0.0,0.296,0.0,0.0,0.0,0.5,0.5
2369,mask,wear mask ,2020-11-03,0.0,0.0,0.0,0.0,0.0,0.0,0.0,1.0,0.0
2370,mask,whew mask racism amp vibes ,2020-11-03,0.0,0.494,0.506,-0.6249,0.0,0.0,0.0,0.5,0.5
2371,mask,mask j ,2020-11-03,0.0,0.0,0.0,0.0,0.0,0.0,0.0,1.0,0.0
2372,mask,niggas look good mask take nose spread cross face ,2020-11-03,0.236,0.569,0.195,0.128,0.25,0.25,0.25,0.25,0.0
2373,mask,bizarre post guy let start revolution wear mask covid insane ,2020-11-03,0.0,0.615,0.385,-0.6124,0.0,0.0,0.0,0.67,0.33
2374,mask,mask hood fuck ,2020-11-03,0.0,0.364,0.636,-0.5423,0.0,0.0,0.5,0.5,0.0
2375,mask,even wearing mask right disgusting many levels fact poc also go way ,2020-11-03,0.0,0.764,0.236,-0.5267,0.0,0.33,0.0,0.67,0.0
2376,mask,yes grandma keep mask ,2020-11-03,0.474,0.526,0.0,0.4019,0.0,0.0,0.0,1.0,0.0
2377,mask,heroes wear mask ,2020-11-03,0.623,0.377,0.0,0.5106,0.0,0.0,0.0,1.0,0.0
2378,mask,center right voter ended going trump looking forward covid vaccine development unaffe ,2020-11-03,0.0,0.0,0.0,0.0,0.0,0.75,0.0,0.0,0.25
2379,mask,worked target 2 weeks like 10 karen wear masks say comfortab ,2020-11-03,0.217,0.783,0.0,0.3612,0.0,0.5,0.0,0.25,0.25
2380,mask,late love seungmin sm looks pretty even mask ,2020-11-03,0.552,0.448,0.0,0.8126,0.0,0.0,0.5,0.5,0.0
2381,mask,cutie blue mask ,2020-11-03,0.556,0.444,0.0,0.3612,0.0,0.0,0.0,1.0,0.0
2382,mask,really dig mask vote 2020 ,2020-11-03,0.0,0.0,0.0,0.0,0.0,0.0,0.0,0.5,0.5
2383,mask,dont forget mask masks save lives ,2020-11-03,0.549,0.451,0.0,0.5948,0.33,0.0,0.0,0.67,0.0
2384,mask,looks like people nc want higher taxes regulations putting cooper voting cooper oh ,2020-11-03,0.257,0.743,0.0,0.4215,0.0,0.0,0.0,1.0,0.0
2385,mask,good dan forrest going away mask mandate ,2020-11-03,0.326,0.674,0.0,0.4404,0.25,0.25,0.25,0.25,0.0
2386,mask,consider virginia tyrant governor mask mandate michigan wellpeople sick ,2020-11-03,0.0,0.708,0.292,-0.5106,0.0,0.0,0.0,1.0,0.0
2387,mask,still cant believe people would actually vote guy cant even tell supporters wear ,2020-11-03,0.0,0.833,0.167,-0.3412,0.0,0.33,0.0,0.33,0.33
2388,mask,wholesale 10pieces 22 distributor 20pieces orders 18 kobagi amp lyou kyung 010 ,2020-11-03,0.0,0.0,0.0,0.0,0.0,0.0,0.0,0.0,1.0
2389,mask,widely shared photo biden without mask plane taken 2019 ,2020-11-03,0.231,0.769,0.0,0.34,0.0,0.0,0.0,0.5,0.5
2390,mask,funny thing looks like cat wearing mask ,2020-11-03,0.519,0.481,0.0,0.6597,0.0,0.0,0.0,0.33,0.67
2391,mask,well trump relentless campaigning final two weeks turned tidewhile biden nothing ,2020-11-03,0.268,0.732,0.0,0.3182,0.0,0.33,0.0,0.0,0.67
2392,mask,everyone wearing mask ironic many revolting masks political ,2020-11-03,0.0,0.824,0.176,-0.128,0.0,0.0,0.0,1.0,0.0
2393,mask,wheres flipping mask ,2020-11-03,0.0,0.0,0.0,0.0,0.5,0.0,0.0,0.5,0.0
2394,mask,freedom stops mine begins wear fing mask ,2020-11-03,0.389,0.463,0.148,0.5574,0.0,0.0,0.0,1.0,0.0
2395,mask,right damn hot hotter mask ,2020-11-03,0.0,0.597,0.403,-0.4019,0.0,0.33,0.0,0.67,0.0
2396,mask,thinking thing mask guess counted yet trump lose hell ,2020-11-03,0.0,0.49,0.51,-0.8074,0.0,0.14,0.0,0.29,0.57
2397,mask,situation nowadays critical due corona virus standar operating procedure obeyedsuch ,2020-11-03,0.0,0.796,0.204,-0.3182,0.0,1.0,0.0,0.0,0.0
2398,mask,trailer stinks much wear wrong mask ,2020-11-03,0.0,0.44,0.56,-0.6249,0.0,0.0,0.0,1.0,0.0
2399,mask,hope everyone america good turnout polls voted early morning ,2020-11-03,0.453,0.547,0.0,0.7003,0.0,0.5,0.5,0.0,0.0
2400,mask,wears ronald reagan mask ,2020-11-03,0.0,0.0,0.0,0.0,0.0,0.0,0.0,1.0,0.0
2401,mask,may say zelda false zelda gmaes add something unique story nintendo never b ,2020-11-03,0.0,0.0,0.0,0.0,0.0,0.33,0.0,0.33,0.33
2402,mask,madam exempt wearing mask ehnn didnt test positive covid im dreaming people v ,2020-11-03,0.098,0.698,0.204,-0.3662,0.0,0.0,0.5,0.5,0.0
2403,mask,king put ur mask ur nose ,2020-11-03,0.0,0.0,0.0,0.0,0.0,0.0,0.0,1.0,0.0
2404,mask,friends anti vax anti mask flat earther wife called election everyone go bed election night ,2020-11-03,0.157,0.609,0.234,-0.128,0.0,0.0,0.33,0.67,0.0
2405,mask,mending sweaters checking twitter raw honey face mask thing take bath know ,2020-11-03,0.0,0.0,0.0,0.0,0.0,0.0,0.0,0.75,0.25
2406,mask,okay realtalk never get hug grandmother yall stupid motherfuckers cant wear godda ,2020-11-03,0.113,0.534,0.353,-0.6192,0.0,0.0,0.0,0.0,0.0
2407,mask,craig kelly promotg fruitloops anti mask anti vaxxers member lnp corrupt govt turnd ,2020-11-03,0.0,0.705,0.295,-0.5574,0.0,0.5,0.0,0.5,0.0
2408,mask,hard understand peoples names mask polling place used ,2020-11-03,0.0,0.833,0.167,-0.1027,0.33,0.33,0.0,0.33,0.0
2409,mask,im gonna grab mask smack ,2020-11-03,0.0,0.0,0.0,0.0,0.0,0.0,0.0,1.0,0.0
2410,mask,make mask look good ,2020-11-03,0.492,0.508,0.0,0.4404,0.0,0.0,0.33,0.67,0.0
2411,mask,issued n95 mask plastic face shield required reuse several times gross l ,2020-11-03,0.0,0.763,0.237,-0.4767,0.0,0.33,0.0,0.67,0.0
2412,mask,face mask support mask pad ,2020-11-03,0.403,0.597,0.0,0.4019,0.0,0.0,0.0,1.0,0.0
2413,mask,also id trump helping major companies switch making ,2020-11-03,0.239,0.761,0.0,0.296,0.0,0.0,0.0,0.33,0.67
2414,mask,thoughts joe biden maybe shouldve worn red mask ,2020-11-03,0.0,0.761,0.239,-0.296,0.33,0.33,0.0,0.33,0.0
2415,mask,mask look cute go brr ,2020-11-03,0.429,0.571,0.0,0.4588,0.0,0.0,0.5,0.5,0.0
2416,mask,literally one wearing mask face ,2020-11-03,0.0,0.0,0.0,0.0,0.0,0.0,0.0,1.0,0.0
2417,mask,lemme put clown mask real quick ,2020-11-03,0.0,0.0,0.0,0.0,0.25,0.0,0.0,0.75,0.0
2418,mask,getting mask weapon choice finna go head starbucks birkin store get one lil b ,2020-11-03,0.0,0.845,0.155,-0.296,0.33,0.33,0.0,0.33,0.0
2419,mask,update went buy booze today wearing mask carded choosing believe still look young ,2020-11-03,0.0,0.0,0.0,0.0,0.0,0.5,0.0,0.5,0.0
2420,mask,protesters million mask march frequently wear versions guy fawkes mask homage graphic novel ,2020-11-03,0.151,0.724,0.125,0.1027,0.0,0.33,0.0,0.67,0.0
2421,mask,bitch really public space daughter without wearing fcking mask wonder people talk abo ,2020-11-03,0.0,0.759,0.241,-0.5859,0.0,0.0,0.0,0.33,0.67
2422,mask,shop complete holiday gifts checklist safely make sure wear protective essentials stepping ,2020-11-03,0.477,0.523,0.0,0.802,0.0,0.5,0.25,0.25,0.0
2423,mask,fish mask f ,2020-11-03,0.0,0.0,0.0,0.0,0.0,0.0,0.0,1.0,0.0
2424,mask,horror always country wears mask dont mean covid ,2020-11-03,0.0,0.654,0.346,-0.5719,0.0,0.0,0.0,0.67,0.33
2425,mask,say think trump closing th border temporarily goo ,2020-11-03,0.0,0.0,0.0,0.0,0.0,0.0,0.25,0.0,0.75
2426,mask,could statewide mask mandate noi hate state ,2020-11-03,0.0,0.619,0.381,-0.5719,0.0,0.0,0.0,1.0,0.0
2427,mask,trump wins face mask nazis start getting slapped ,2020-11-03,0.346,0.654,0.0,0.5719,0.0,0.0,0.0,0.5,0.5
2428,mask,ltwts gt medihea lx bts post card rm18 include postage rm 7 nego price buy ,2020-11-03,0.139,0.861,0.0,0.2732,0.0,0.0,0.0,0.0,0.0
2429,mask,thank temyracle scrub amp mask cute packaging item rm 50 ws int ,2020-11-03,0.355,0.645,0.0,0.6705,0.0,0.0,0.5,0.5,0.0
2430,mask,hope everyone america good turnout polls voted early thi ,2020-11-03,0.453,0.547,0.0,0.7003,0.0,0.5,0.5,0.0,0.0
2431,mask,yall think putting mask commercialanimated santa clauses nah ,2020-11-03,0.0,0.833,0.167,-0.1027,0.0,0.25,0.0,0.5,0.25
2432,mask,cdc recommends wearing fabric mask go public ,2020-11-03,0.241,0.759,0.0,0.2263,0.0,0.5,0.0,0.5,0.0
2433,mask,woulda known posting 1 picture trump mask would ton bullshit twitter accounts upset lmaoo ,2020-11-03,0.0,0.632,0.368,-0.7506,0.0,0.57,0.0,0.29,0.14
2434,mask,im tired wearing mask feel rough ,2020-11-03,0.0,0.633,0.367,-0.4404,0.0,0.0,0.0,1.0,0.0
2435,mask,dems tried say didnt care science mask bullshit fuckin covid circulati ,2020-11-03,0.0,0.583,0.417,-0.7527,0.0,0.33,0.0,0.33,0.33
2436,mask,mask mandates minimize large gatherings mass increase rapid testing educa ,2020-11-03,0.204,0.796,0.0,0.3182,0.0,0.0,0.0,1.0,0.0
2437,mask,hi hoping get adorable pic mask wear holidays loo ,2020-11-03,0.589,0.411,0.0,0.8225,0.0,0.0,0.5,0.5,0.0
2438,mask,take mask talk ,2020-11-03,0.0,0.0,0.0,0.0,0.0,0.0,0.0,1.0,0.0
2439,mask,excuses people made wear mask probably public eye opening _ last ,2020-11-03,0.0,0.0,0.0,0.0,0.0,0.4,0.0,0.6,0.0
2440,mask,author eric j gates recently spent time big thrill discussing latest anthology collection death ,2020-11-03,0.144,0.632,0.224,-0.34,0.0,0.5,0.0,0.0,0.5
2441,mask,absolutely amazing song brought tears lyrics refrain ,2020-11-03,0.372,0.455,0.173,0.4927,0.0,0.25,0.0,0.5,0.25
2442,mask,dumbass thought masquerade mask ,2020-11-03,0.0,0.455,0.545,-0.5574,0.0,0.0,0.0,0.5,0.5
2443,mask,mask shit joke ,2020-11-03,0.324,0.147,0.529,-0.34,0.0,0.0,0.33,0.33,0.33
2444,mask,even stuffed animal notrunning floor scrubber wear mask menards seen automated ,2020-11-03,0.0,0.0,0.0,0.0,0.33,0.0,0.0,0.33,0.33
2445,mask,people want go back normalcy soo fucking bad dont want wear mask take ,2020-11-03,0.159,0.61,0.231,-0.4927,0.0,0.0,0.33,0.67,0.0
2446,mask,mask fake virus ,2020-11-03,0.0,0.392,0.608,-0.4767,0.0,0.0,0.0,1.0,0.0
2447,mask,fixing mask holding door hes talented ,2020-11-03,0.398,0.602,0.0,0.5106,0.0,0.0,0.0,1.0,0.0
2448,mask,harry teaching mask falls nose need adjust put ,2020-11-03,0.0,0.0,0.0,0.0,0.0,0.25,0.0,0.75,0.0
2449,mask,thank removing dilberts mask ,2020-11-03,0.455,0.545,0.0,0.3612,0.0,0.0,0.0,1.0,0.0
2450,mask,mask cute yes voted ,2020-11-03,0.74,0.26,0.0,0.6908,0.0,0.0,0.33,0.67,0.0
