,Search,Tweet,Entered on,pos_score,neu_score,neg_score,compound_score,angry_score,fear_score,happy_score,sad_score,surprise_score
426,Biden,biden ,2020-10-31,0.0,0.0,0.0,0.0,0.0,0.0,0.0,0.0,0.0
427,Biden,us election jr told trump supporters fun biden vehicles rammed armed group ,2020-10-31,0.383,0.617,0.0,0.7351,0.0,0.0,0.2,0.4,0.4
428,Biden,might make sense biden chosen tim kaine vp still woman ticket time ,2020-10-31,0.0,0.0,0.0,0.0,0.5,0.0,0.0,0.5,0.0
429,Biden,things equal 2016 thats biden win ,2020-10-31,0.432,0.568,0.0,0.5859,0.0,0.0,0.0,0.0,1.0
430,Biden,total turnout 89 million votes 2016 trump texas 80000 v ,2020-10-31,0.0,0.0,0.0,0.0,0.0,0.0,0.0,0.0,1.0
431,Biden,fuck one cares hunter biden ,2020-10-31,0.316,0.316,0.368,-0.128,0.0,0.0,0.5,0.5,0.0
432,Biden,anyone confidently think biden win need optimism tonight ,2020-10-31,0.675,0.325,0.0,0.886,0.0,0.67,0.0,0.0,0.33
433,Biden,trump terrorists trump tweeted video caravan surrounding biden bus caption love texas ,2020-10-31,0.23,0.546,0.224,0.0258,0.0,0.25,0.25,0.0,0.5
434,Biden,vote biden wo kill ,2020-10-31,0.0,0.39,0.61,-0.6908,0.0,0.0,0.0,0.0,1.0
435,Biden,video saw showed biden supporter trying drive trump supporter road ,2020-10-31,0.344,0.656,0.0,0.4939,0.0,0.5,0.0,0.0,0.5
436,Biden,saw first biden flag today big ass sign door said wear mask joke ,2020-10-31,0.132,0.659,0.21,-0.3182,0.0,0.2,0.2,0.2,0.4
437,Biden,trump inspired encouraged white supremacists assorted fascists like ones wh ,2020-10-31,0.482,0.294,0.224,0.6597,0.0,0.5,0.25,0.0,0.25
438,Biden,information congress intention ever helping us survive covid economic collapse created ,2020-10-31,0.273,0.519,0.208,-0.0,0.0,0.0,0.0,0.25,0.75
439,Biden,women black brown people diversity biden supporter picture cringe worthy ,2020-10-31,0.385,0.615,0.0,0.6124,0.0,0.0,0.0,1.0,0.0
440,Biden,biden better voice ever get vote least bad choice ,2020-10-31,0.451,0.549,0.0,0.6956,0.2,0.2,0.0,0.2,0.4
441,Biden,handful republican voters one moms friends know wont vote biden trump vot ,2020-10-31,0.22,0.78,0.0,0.4767,0.0,0.0,0.5,0.0,0.5
442,Biden,want winner election night joe biden win landslide period otherwise find ,2020-10-31,0.527,0.473,0.0,0.836,0.0,0.0,0.0,0.0,0.0
443,Biden,yet solid evidence anything biden f ,2020-10-31,0.286,0.714,0.0,0.1531,0.0,1.0,0.0,0.0,0.0
444,Biden,trump tweeted support late saturday maga caravan tried run biden campaign b ,2020-10-31,0.213,0.787,0.0,0.4019,0.0,0.0,0.0,0.5,0.5
445,Biden,okay joe biden campaign staff dying rage aneurysms every single day trump team amp ,2020-10-31,0.109,0.686,0.206,-0.4019,0.0,0.5,0.25,0.0,0.25
446,Biden,biden point view trump leadership ,2020-10-31,0.0,0.0,0.0,0.0,0.0,0.0,0.0,0.0,1.0
447,Biden,hey feel conned democrats biden beholden big corporations ,2020-10-31,0.0,0.0,0.0,0.0,0.0,0.0,0.0,0.0,1.0
448,Biden,mad trucks following biden bus yet outrage loses validity ,2020-10-31,0.0,0.405,0.595,-0.8316,0.5,0.0,0.0,0.5,0.0
449,Biden,saying since forever need unity need leader need vice president biden ,2020-10-31,0.0,0.0,0.0,0.0,0.0,0.5,0.0,0.0,0.5
450,Biden,new study stanford university found 18 president trumps campaign rallies led ,2020-10-31,0.0,0.0,0.0,0.0,0.0,0.5,0.0,0.0,0.5
451,Biden,make sure vote cant rely polls complace ,2020-10-31,0.277,0.723,0.0,0.3182,0.0,0.5,0.0,0.5,0.0
452,Biden,obama biden completely ignored opioid crisis terms caused deaths 45000 us citizens ,2020-10-31,0.0,0.59,0.41,-0.788,0.0,1.0,0.0,0.0,0.0
453,Biden,biden ahead enough non florida states also michigan ,2020-10-31,0.0,0.0,0.0,0.0,0.0,0.0,0.0,1.0,0.0
454,Biden,trump truckers central texas raped biden bus i35 broad daylight final days early voting au ,2020-10-31,0.0,0.753,0.247,-0.6808,0.0,0.4,0.2,0.0,0.4
455,Biden,destroy court trump rails biden desire uproot judicial system ,2020-10-31,0.205,0.53,0.265,-0.2023,0.17,0.5,0.0,0.17,0.17
456,Biden,replace president trump sub par failed former vp angry racist closet white su ,2020-10-31,0.0,0.485,0.515,-0.891,0.25,0.5,0.0,0.0,0.25
457,Biden,arent even hiding want harris president ,2020-10-31,0.266,0.563,0.172,0.1695,1.0,0.0,0.0,0.0,0.0
458,Biden,get debates commercials first miracle plan hell ,2020-10-31,0.284,0.373,0.343,-0.2023,0.0,0.0,0.0,0.0,1.0
459,Biden,plus know biden always looking excuse stay basement frankl ,2020-10-31,0.14,0.86,0.0,0.0772,0.25,0.25,0.0,0.5,0.0
460,Biden,president obama final state union announced joe biden would spearhead initiative ,2020-10-31,0.0,0.0,0.0,0.0,0.0,0.67,0.0,0.33,0.0
461,Biden,boxed biden bus one trump truck front bus one ,2020-10-31,0.0,0.0,0.0,0.0,0.0,0.0,0.0,0.0,1.0
462,Biden,anyone else feel like bidenharris signs look like something purge ,2020-10-31,0.385,0.615,0.0,0.6124,0.0,1.0,0.0,0.0,0.0
463,Biden,ask question joe bidens son hunter ever heard ,2020-10-31,0.0,0.0,0.0,0.0,0.0,0.67,0.0,0.0,0.33
464,Biden,biden sanders communist trojan horses ,2020-10-31,0.0,0.0,0.0,0.0,0.0,0.0,0.0,0.0,0.0
465,Biden,every tie biden 3 goes trump really clue early voting everyone voted tuesd ,2020-10-31,0.0,0.0,0.0,0.0,0.0,0.25,0.0,0.0,0.75
466,Biden,got bad news biden aint smashing shiet ,2020-10-31,0.0,0.632,0.368,-0.5423,0.0,0.0,0.0,1.0,0.0
467,Biden,vote death vote biden ,2020-10-31,0.0,0.435,0.565,-0.5994,0.0,1.0,0.0,0.0,0.0
468,Biden,twitter deleting links daily mail coverage hunter biden emails photos ,2020-10-31,0.0,0.0,0.0,0.0,0.0,0.5,0.0,0.5,0.0
469,Biden,everyone notice quickly fake news story trump supporter swerv ,2020-10-31,0.172,0.574,0.254,-0.25,0.0,0.25,0.0,0.5,0.25
470,Biden,bwahahahaha silent majority cant hear donnie think ,2020-10-31,0.0,0.0,0.0,0.0,0.0,0.0,0.0,0.0,1.0
471,Biden,joe biden rally draws many florida donald trump rally via tube ,2020-10-31,0.0,0.0,0.0,0.0,0.0,0.8,0.0,0.0,0.2
472,Biden,biden 4 years older wiser rump see loyal ,2020-10-31,0.515,0.485,0.0,0.6486,0.0,0.0,0.0,0.0,0.0
473,Biden,far eye see well maybe biden ca squinted ,2020-10-31,0.231,0.769,0.0,0.2732,0.0,1.0,0.0,0.0,0.0
474,Biden,yes lets clear biden isnt going win trump going lose ,2020-10-31,0.31,0.351,0.338,-0.121,0.0,0.29,0.0,0.57,0.14
475,Biden,dont know understand cartoon attacks trump make biden sound good bi ,2020-10-31,0.196,0.608,0.196,0.0,0.0,0.0,0.33,0.33,0.33
476,Biden,fact video get joe biden elect ,2020-10-31,0.0,0.0,0.0,0.0,0.0,0.0,0.0,0.0,0.0
477,Biden,talk trump hunter biden start reporting real news tired cnnf ,2020-10-31,0.0,0.756,0.244,-0.4404,0.0,0.0,0.0,0.5,0.5
478,Biden,fracking started obama biden oil independence came obama biden supporters clue mr president ,2020-10-31,0.195,0.805,0.0,0.4404,0.0,0.0,0.0,0.0,1.0
479,Biden,jinx biden picking cabinet drapes yet ,2020-10-31,0.0,0.0,0.0,0.0,0.0,0.0,0.0,0.0,0.0
480,Biden,quite bidens great position ,2020-10-31,0.593,0.407,0.0,0.6573,0.0,0.0,1.0,0.0,0.0
481,Biden,obama florida bidens radar ,2020-10-31,0.0,0.0,0.0,0.0,0.0,0.0,0.0,0.0,0.0
482,Biden,really unbelievable election could close corrupt joe biden senile ,2020-10-31,0.207,0.793,0.0,0.2716,0.0,0.33,0.33,0.0,0.33
483,Biden,yesterday 2 eagles flew overhead joe biden spoke tonight full blue moon lets elect ,2020-10-31,0.0,0.0,0.0,0.0,0.0,0.33,0.0,0.67,0.0
484,Biden,vote american elections simply pole keep fingers cr ,2020-10-31,0.0,0.0,0.0,0.0,0.0,0.0,0.0,0.0,0.0
485,Biden,joe biden really deserve president usa ,2020-10-31,0.0,0.0,0.0,0.0,0.0,0.0,0.0,0.0,1.0
486,Biden,joe biden better american orange ever need bidenator office ,2020-10-31,0.266,0.734,0.0,0.4404,0.0,0.0,0.0,0.0,1.0
487,Biden,speculation puru biden win give country confidence better us china relatio ,2020-10-31,0.556,0.444,0.0,0.875,0.0,0.75,0.0,0.0,0.25
488,Biden,bestthis americanot biden comma la ,2020-10-31,0.0,0.0,0.0,0.0,0.0,0.0,0.0,0.0,0.0
489,Biden,still ha ,2020-10-31,0.706,0.294,0.0,0.34,0.0,0.0,0.0,0.0,0.0
490,Biden,sunday november 1 2020 husband voted friday october 16 2020 took ,2020-10-31,0.0,0.0,0.0,0.0,0.0,0.0,0.0,0.0,1.0
491,Biden,actually dumb especially che put images clinton biden along trump show clinton ,2020-10-31,0.0,0.769,0.231,-0.5106,0.0,0.0,0.0,0.33,0.67
492,Biden,biden didnt get clearly favored today abc pa poll canceled tha selzer poll ia maybe ,2020-10-31,0.0,0.739,0.261,-0.5559,0.0,0.0,1.0,0.0,0.0
493,Biden,hey snl made joke donald trump jr lines prepare interview think got ,2020-10-31,0.167,0.833,0.0,0.296,0.0,0.17,0.17,0.17,0.5
494,Biden,im houston voted biden colonizer shot ,2020-10-31,0.0,0.0,0.0,0.0,0.0,0.0,0.0,0.0,0.0
495,Biden,far vary 280s 300s biden year ,2020-10-31,0.0,0.0,0.0,0.0,0.0,1.0,0.0,0.0,0.0
496,Biden,biden sleeping ,2020-10-31,0.0,0.0,0.0,0.0,0.0,0.0,0.0,0.0,0.0
497,Biden,shock poll washington post abc news poll gives president trump lead 52 48 florida trying hard save f ,2020-10-31,0.151,0.66,0.189,0.0516,0.25,0.25,0.0,0.0,0.5
498,Biden,umm trucks came intimidate bus like truc ,2020-10-31,0.269,0.538,0.194,0.1779,0.0,0.0,0.0,0.0,1.0
499,Biden,case biden still wins ,2020-10-31,0.552,0.448,0.0,0.5719,0.0,0.0,0.0,0.0,0.0
