,Search,Tweet,Entered on,pos_score,neu_score,neg_score,compound_score,angry_score,fear_score,happy_score,sad_score,surprise_score
746,Kamala Harris,normalize poc women happy kamala harris biggest fans kamala harris ,2020-11-09,0.291,0.709,0.0,0.5719,0.0,0.0,1.0,0.0,0.0
747,Kamala Harris,straordinary thank kamala harris good desitions excellents days g ,2020-11-09,0.474,0.526,0.0,0.6597,0.0,0.0,1.0,0.0,0.0
748,Kamala Harris,kamala harris election victory celebrated around world itv news ,2020-11-09,0.316,0.684,0.0,0.5719,0.0,0.0,0.0,0.0,0.0
749,Kamala Harris,kamala harris white suit dressing history ,2020-11-09,0.0,0.0,0.0,0.0,0.0,1.0,0.0,0.0,0.0
750,Kamala Harris,guessing rematch could kamala harris wo stand chance ,2020-11-09,0.222,0.778,0.0,0.25,0.0,0.67,0.0,0.0,0.33
751,Kamala Harris,commented thejournal_ie following criticism former uup deputy leader deletes appalling tweet ka ,2020-11-09,0.0,0.649,0.351,-0.6597,0.0,0.0,0.0,0.0,1.0
752,Kamala Harris,crazy ppl trying bring old videos expose biden amp kamala harris got moments please ,2020-11-09,0.133,0.636,0.231,-0.1779,0.0,0.5,0.0,0.5,0.0
753,Kamala Harris,12 claim trying draw attention indian heritage kamala harris th ,2020-11-09,0.0,0.0,0.0,0.0,0.0,0.5,0.0,0.0,0.5
754,Kamala Harris,billyownnear podcast episode 27 crazy sexy cool kamala harris first woman vp america 1220 new music ,2020-11-09,0.27,0.616,0.114,0.5106,0.0,0.25,0.25,0.25,0.25
755,Kamala Harris,gavin picks libby going barf ,2020-11-09,0.0,0.0,0.0,0.0,0.0,1.0,0.0,0.0,0.0
756,Kamala Harris,stop glorifying kamala harris bc shes woman still saying fucked shit doesnt g ,2020-11-09,0.157,0.37,0.472,-0.7783,0.0,0.0,0.33,0.0,0.67
757,Kamala Harris,see shit kamala harris idk like part feels like politicians shit bc ,2020-11-09,0.243,0.34,0.417,-0.5574,0.0,0.0,0.0,0.0,1.0
758,Kamala Harris,kumasi fuo name bi kamala harris kamara hallis ah dey room like ah come beat ,2020-11-09,0.152,0.848,0.0,0.3612,0.0,0.5,0.0,0.0,0.5
759,Kamala Harris,aww sweet inspired kamala kamala harris never ,2020-11-09,0.554,0.446,0.0,0.7351,0.0,0.0,1.0,0.0,0.0
760,Kamala Harris,manolo blahnik calls vp elect kamala harris divine woman amp barrier breaker outfit fashion trends ,2020-11-09,0.199,0.718,0.083,0.4767,0.0,0.0,0.0,0.0,0.0
761,Kamala Harris,feel need virtue signal woke police seriously genuinely believe ,2020-11-09,0.243,0.609,0.148,0.2732,0.0,0.0,0.0,1.0,0.0
762,Kamala Harris,much dislike kamala harris least remember name would taken less ,2020-11-09,0.0,0.776,0.224,-0.3818,0.0,0.5,0.0,0.0,0.5
763,Kamala Harris,example disrespectful excuse racists racially profiled ethnic minorities refused acknowledg ,2020-11-09,0.093,0.5,0.407,-0.6597,0.0,0.0,0.0,1.0,0.0
764,Kamala Harris,please respectful learn easy pronunciation madam vice president kamala harris name lest ye ap ,2020-11-09,0.427,0.573,0.0,0.802,0.0,0.5,0.0,0.5,0.0
765,Kamala Harris,joe biden kamala harris sworn january 20th mix packet powde ,2020-11-09,0.0,0.0,0.0,0.0,1.0,0.0,0.0,0.0,0.0
766,Kamala Harris,joe biden kamala harris neither socialist communist ,2020-11-09,0.0,0.0,0.0,0.0,0.0,0.0,0.0,1.0,0.0
767,Kamala Harris,corrected headline ni peer lord kilclooney criticised racist tweet us vice president elect kamala harris ,2020-11-09,0.0,0.657,0.343,-0.7783,0.0,0.0,0.0,0.0,0.0
768,Kamala Harris,mean stuff like asked bash whether thought public health experts scientis ,2020-11-09,0.2,0.8,0.0,0.3612,0.2,0.6,0.0,0.0,0.2
769,Kamala Harris,congratulations joe biden 2020 yess soo happy new president united states hal ,2020-11-09,0.536,0.464,0.0,0.886,0.0,0.0,0.33,0.67,0.0
770,Kamala Harris,completely enamored harris emhoff marriage rare really truly see man quietly stand bac ,2020-11-09,0.21,0.79,0.0,0.4927,0.0,0.33,0.33,0.0,0.33
771,Kamala Harris,mmw likely first year office biden declared uncapable president leading kama ,2020-11-09,0.0,0.0,0.0,0.0,0.0,0.5,0.0,0.0,0.5
772,Kamala Harris,peer withdraws reference kamala harris indian accused racism ,2020-11-09,0.0,0.488,0.512,-0.743,0.0,1.0,0.0,0.0,0.0
773,Kamala Harris,president elect joe biden doll amp vp elect kamala harris doll discussing covid task force team right ,2020-11-09,0.0,0.0,0.0,0.0,0.0,1.0,0.0,0.0,0.0
774,Kamala Harris,wanna smoke w kamala harriss stepdaughter ,2020-11-09,0.0,0.0,0.0,0.0,0.5,0.0,0.0,0.5,0.0
775,Kamala Harris,kamala harris american period amp identifies self joe biden identifies ,2020-11-09,0.0,0.0,0.0,0.0,0.0,0.33,0.67,0.0,0.0
776,Kamala Harris,idk see many people celebrating biden kamala harris bad racist trump ,2020-11-09,0.189,0.357,0.454,-0.6369,0.0,0.0,0.0,0.5,0.5
777,Kamala Harris,thanks yes guy previous suppose de ,2020-11-09,0.583,0.417,0.0,0.6808,0.0,0.5,0.0,0.5,0.0
778,Kamala Harris,congratulations vice president elect kamala harris historic election win past ucdc great ,2020-11-09,0.567,0.433,0.0,0.9153,0.0,0.0,0.5,0.5,0.0
779,Kamala Harris,pushed legislators intro stumped took credit ,2020-11-09,0.342,0.658,0.0,0.3818,0.0,0.67,0.0,0.0,0.33
780,Kamala Harris,embarrassment yang went unknown candidate outlasting billionaires senato ,2020-11-09,0.0,0.707,0.293,-0.4404,0.0,0.67,0.0,0.33,0.0
781,Kamala Harris,46 shirt kamala harris shirt joe shirt biden harris 2020 first woman short sleeve unisex ,2020-11-09,0.0,0.0,0.0,0.0,0.5,0.0,0.0,0.0,0.5
782,Kamala Harris,terrence sworn make fool ran points jumped defaming hardw ,2020-11-09,0.0,0.734,0.266,-0.4404,0.25,0.0,0.0,0.25,0.5
783,Kamala Harris,see uk fantastic start building constructive post eu alliances called taking back co ,2020-11-09,0.231,0.769,0.0,0.5574,0.0,0.33,0.33,0.0,0.33
784,Kamala Harris,kamala harris books surge popularity election hollywood reporter comics ,2020-11-09,0.279,0.721,0.0,0.4767,0.0,0.0,0.0,1.0,0.0
785,Kamala Harris,think donald go back english class learn pronounce vice president name kamala harris ,2020-11-09,0.0,0.0,0.0,0.0,0.0,0.0,0.0,0.0,1.0
786,Kamala Harris,absolutely ready let get together support new presi ,2020-11-09,0.478,0.522,0.0,0.6697,0.0,0.33,0.33,0.33,0.0
787,Kamala Harris,pain pain prayers mr biden kamala harris ,2020-11-09,0.0,0.431,0.569,-0.765,0.0,0.0,0.0,0.0,0.0
788,Kamala Harris,would like extend sincere gratitude usa president elect mr joe biden hope opens corridor ,2020-11-09,0.593,0.407,0.0,0.9022,0.0,0.75,0.0,0.25,0.0
789,Kamala Harris,called christians bible laughed jesus god made joe bidens amp ,2020-11-09,0.389,0.611,0.0,0.6249,0.0,0.0,0.0,0.5,0.5
790,Kamala Harris,epic c4 news ,2020-11-09,0.0,0.0,0.0,0.0,0.0,0.0,0.0,0.0,0.0
791,Kamala Harris,soo going discuss ongoing deliberate misgendering black women happen close ,2020-11-09,0.0,0.0,0.0,0.0,0.0,0.5,0.5,0.0,0.0
792,Kamala Harris,iain dale launches new mask celebrate president elect joe biden kamala harris abc ,2020-11-09,0.236,0.764,0.0,0.5719,0.0,0.0,0.0,1.0,0.0
793,Kamala Harris,kamala harris progressive pioneer san francisco district attorney ,2020-11-09,0.0,0.0,0.0,0.0,0.0,0.0,0.0,0.0,0.0
794,Kamala Harris,yet another reason sad bernie candidate could made kamala harris us top cop ,2020-11-09,0.113,0.692,0.195,-0.3182,0.0,0.0,0.0,0.75,0.25
795,Kamala Harris,breaking joe biden considering replacing alex trebec host jeopardy letting kamala harris become president ,2020-11-09,0.0,0.807,0.193,-0.4767,0.0,0.4,0.0,0.4,0.2
796,Kamala Harris,georgia john lewis district delivers poetic justice ,2020-11-09,0.362,0.638,0.0,0.5267,0.0,1.0,0.0,0.0,0.0
797,Kamala Harris,anyone video tulsi gabbard destroying kamala harris ,2020-11-09,0.0,0.625,0.375,-0.5574,0.0,1.0,0.0,0.0,0.0
798,Kamala Harris,spider senses telling republicans going politicize pronunciation madam vice president ,2020-11-09,0.0,0.0,0.0,0.0,0.0,0.5,0.0,0.5,0.0
799,Kamala Harris,halo unroll asked chhr01 wow gotten way ahead skis ,2020-11-09,0.322,0.678,0.0,0.5859,0.0,0.5,0.0,0.0,0.5
800,Kamala Harris,kamala harris asian black questions constitutes blackness arent new opi ,2020-11-09,0.0,0.0,0.0,0.0,0.0,1.0,0.0,0.0,0.0
801,Kamala Harris,auburn world history feel like article reading fitting week considering kamala harris electe ,2020-11-09,0.172,0.828,0.0,0.3612,0.0,0.33,0.33,0.33,0.0
802,Kamala Harris,jamaicans welcoming kamala harris first american vice president listen wonderful song ,2020-11-09,0.423,0.577,0.0,0.765,0.0,0.0,0.33,0.0,0.67
803,Kamala Harris,dc wannabe elites low life trump haters globalists reject coronati ,2020-11-09,0.0,0.467,0.533,-0.7906,0.0,0.33,0.0,0.33,0.33
804,Kamala Harris,happy next president vice president joe biden kamala harris ,2020-11-09,0.316,0.684,0.0,0.5719,0.0,0.0,1.0,0.0,0.0
805,Kamala Harris,going happen joe biden n kamala harris value truth especially vp elect harri ,2020-11-09,0.32,0.68,0.0,0.5719,0.5,0.5,0.0,0.0,0.0
806,Kamala Harris,full support wait call vice president kamala harris recognize ,2020-11-09,0.252,0.748,0.0,0.4019,0.0,0.0,0.0,0.0,1.0
807,Kamala Harris,mfs making fan edits kamala harris like shes terrible human ,2020-11-09,0.322,0.47,0.208,0.1779,0.0,0.5,0.0,0.5,0.0
808,Kamala Harris,want able stan kamala harris bad ,2020-11-09,0.148,0.455,0.398,-0.4939,0.0,0.0,0.0,1.0,0.0
809,Kamala Harris,ultimate troll upn leaving white house intersectionality bitch used ,2020-11-09,0.0,0.678,0.322,-0.5859,0.5,0.5,0.0,0.0,0.0
810,Kamala Harris,227 tube chili kamala harris first madam vice presidents history breaking ba ,2020-11-09,0.0,0.0,0.0,0.0,0.0,0.5,0.0,0.0,0.5
811,Kamala Harris,kamala harris shouldnt choose identifying black south asian 출처 voxdotcom ,2020-11-09,0.0,0.0,0.0,0.0,0.0,0.0,1.0,0.0,0.0
812,Kamala Harris,kamala harris must worst else would choose biden pulls hes borrowe ,2020-11-09,0.0,0.709,0.291,-0.6249,0.0,0.5,0.0,0.5,0.0
813,Kamala Harris,tlry sen kamala harris says weed legal elected read acb cron cgc apha gwph smg abbv ,2020-11-09,0.091,0.909,0.0,0.128,0.0,0.0,0.0,0.5,0.5
814,Kamala Harris,one 74m americans voted joe biden vice president kamala harris ballot legal pass ,2020-11-09,0.111,0.889,0.0,0.128,0.0,0.0,0.0,0.0,0.0
815,Kamala Harris,daughter parents grew jim crow south gwen webber mc leod remembers mother father ,2020-11-09,0.0,0.0,0.0,0.0,0.0,1.0,0.0,0.0,0.0
816,Kamala Harris,consider lucky given 3 extra hours stress pain girlboss kamala harris ,2020-11-09,0.176,0.44,0.384,-0.5106,0.0,0.33,0.33,0.33,0.0
817,Kamala Harris,whats wrong got birthday card reminders obama america kamala harris ,2020-11-09,0.0,0.744,0.256,-0.4767,0.0,0.0,0.0,0.0,0.0
818,Kamala Harris,mallika sherawat reveals kamala harris put ease feeling like fish water holly ,2020-11-09,0.419,0.581,0.0,0.6705,0.0,0.25,0.0,0.5,0.25
819,Kamala Harris,watch senator kamala harris ca wants legalize prostitution tube ,2020-11-09,0.0,0.0,0.0,0.0,0.0,0.5,0.0,0.0,0.5
820,Kamala Harris,supposed focused equity identifying pointing forci ,2020-11-09,0.342,0.658,0.0,0.3818,0.0,0.5,0.25,0.0,0.25
821,Kamala Harris,kamala harris story opened world possibilities young indian women ,2020-11-09,0.0,0.0,0.0,0.0,0.0,1.0,0.0,0.0,0.0
822,Kamala Harris,kamala harris palestinian ally beware ,2020-11-09,0.0,0.0,0.0,0.0,0.0,0.0,0.0,0.0,0.0
823,Kamala Harris,president joe biden vp kamala harris cong ,2020-11-09,0.0,0.0,0.0,0.0,0.0,0.0,0.0,0.0,0.0
824,Kamala Harris,senat want till 2th jan good man mr president elccted joe biden ,2020-11-09,0.296,0.704,0.0,0.4939,0.0,0.0,1.0,0.0,0.0
825,Kamala Harris,kamala harris dream last night rest dream way interesting thought id let everyone know ,2020-11-09,0.379,0.621,0.0,0.6908,0.0,0.0,0.33,0.33,0.33
826,Kamala Harris,kamala harris equal except laughing hyena ,2020-11-09,0.39,0.61,0.0,0.4939,0.0,0.0,0.0,0.0,0.0
827,Kamala Harris,kamala harris first black woman ,2020-11-09,0.0,0.0,0.0,0.0,0.0,0.0,0.0,0.0,1.0
828,Kamala Harris,dc wannabe elites low life trump haters globalists reject coronation joe bide ,2020-11-09,0.0,0.529,0.471,-0.7906,0.0,0.33,0.0,0.33,0.33
829,Kamala Harris,congratulations president elect joe biden vice president elect kamala harris ,2020-11-09,0.302,0.698,0.0,0.5994,0.0,0.0,0.0,0.0,0.0
830,Kamala Harris,love vice president kamala harris ,2020-11-09,0.512,0.488,0.0,0.6369,0.0,0.0,1.0,0.0,0.0
831,Kamala Harris,kamala harris stands shoulders women fought make america better place marginalised communit ,2020-11-09,0.191,0.658,0.151,0.1531,0.0,0.4,0.0,0.4,0.2
832,Kamala Harris,trump white house come january time hold biden harris accountable commitmen ,2020-11-09,0.0,0.0,0.0,0.0,0.0,0.5,0.0,0.0,0.5
833,Kamala Harris,mothers impersonation vp kamala harris ,2020-11-09,0.0,0.0,0.0,0.0,0.0,0.0,0.0,0.0,0.0
834,Kamala Harris,lost election joe biden kamala harris beat electoral college popular vote ,2020-11-09,0.199,0.638,0.163,0.128,0.0,0.33,0.0,0.33,0.33
835,Kamala Harris,kamala harris course shes unlikable comes number 1 amp 2 list ,2020-11-09,0.14,0.86,0.0,0.0772,0.0,0.5,0.0,0.0,0.5
836,Kamala Harris,elected please say joe biden kamala harris fired love thank ,2020-11-09,0.484,0.323,0.194,0.6597,0.0,0.0,0.33,0.33,0.33
837,Kamala Harris,showed daughter seeing transitioning country wasnt something going r ,2020-11-09,0.0,0.0,0.0,0.0,0.5,0.5,0.0,0.0,0.0
838,Kamala Harris,kamala harris joe biden closet making ballots saw one ballots ballot looked ,2020-11-09,0.0,0.0,0.0,0.0,0.0,0.0,0.0,1.0,0.0
839,Kamala Harris,may first woman office lastbecause every little girl watching tonight sees ,2020-11-09,0.0,0.0,0.0,0.0,0.0,0.25,0.0,0.0,0.75
840,Kamala Harris,turned dream reality ,2020-11-09,0.5,0.5,0.0,0.25,0.0,0.0,0.0,0.0,1.0
841,Kamala Harris,mayor london breed rep karen bass senator harris black woman ,2020-11-09,0.0,0.0,0.0,0.0,0.0,0.0,0.0,0.0,0.0
842,Kamala Harris,kamala harris joe biden closet making ballots saw one ballots ballot looked ,2020-11-09,0.0,0.0,0.0,0.0,0.0,0.0,0.0,1.0,0.0
843,Kamala Harris,us presidential election odds 2024 kamala harris vs donald trump meghan markle megxit ,2020-11-09,0.0,0.0,0.0,0.0,0.0,0.0,0.0,0.0,1.0
844,Kamala Harris,kamala wont let joe biden govern smoothly super president poor joe kamala harris says jo ,2020-11-09,0.195,0.65,0.155,0.2023,0.0,0.0,0.0,0.5,0.5
845,Kamala Harris,im one 756 million americans voted president joe biden vice president kamala harris b ,2020-11-09,0.0,0.0,0.0,0.0,0.0,0.0,0.0,0.0,0.0
846,Kamala Harris,senator kamala harris ca wants legalize prostitution via tube ,2020-11-09,0.0,0.0,0.0,0.0,0.0,1.0,0.0,0.0,0.0
847,Kamala Harris,background check kamala harris ,2020-11-09,0.0,0.0,0.0,0.0,0.0,0.0,0.0,0.0,0.0
848,Kamala Harris,nikki haley priti patel kamala harris indian women western politics tendency go full nazi ,2020-11-09,0.0,0.0,0.0,0.0,0.0,1.0,0.0,0.0,0.0
849,Kamala Harris,best thing ive heard second announcement president elect joe biden vic ,2020-11-09,0.296,0.704,0.0,0.6369,0.0,0.0,0.0,0.0,1.0
850,Kamala Harris,get memo saturday president joe biden amp vice p ,2020-11-09,0.0,0.0,0.0,0.0,0.0,0.0,0.0,0.0,0.0
851,Kamala Harris,coldplay sky full stars 5353 us sales since joe biden amp kamala harris firework show cel ,2020-11-09,0.0,0.0,0.0,0.0,1.0,0.0,0.0,0.0,0.0
852,Kamala Harris,actually false nothing negative hap ,2020-11-09,0.428,0.572,0.0,0.4585,0.0,0.0,0.0,0.5,0.5
853,Kamala Harris,joe biden sent black men prison crime bill signed kamal ,2020-11-09,0.0,0.541,0.459,-0.7783,0.0,0.67,0.0,0.33,0.0
854,Kamala Harris,kamala harris 52 matter ,2020-11-09,0.268,0.732,0.0,0.0258,0.0,1.0,0.0,0.0,0.0
855,Kamala Harris,problem kudos vice president kamala harris awesome job ,2020-11-09,0.49,0.331,0.179,0.6908,0.0,0.67,0.0,0.0,0.33
856,Kamala Harris,guess whatmost americans dont snort cocaine illegal tons syst ,2020-11-09,0.268,0.732,0.0,0.4449,0.0,0.0,0.0,0.0,1.0
857,Kamala Harris,im one 756 million americans voted president joe biden vice president kama ,2020-11-09,0.0,0.0,0.0,0.0,0.0,0.0,0.0,0.0,0.0
858,Kamala Harris,recent achievement vice president elect kamala harris shining light historically black colleges ,2020-11-09,0.0,0.0,0.0,0.0,0.0,1.0,0.0,0.0,0.0
859,Kamala Harris,someone already achieved milestone like kamala harris isnt first po l vp elect ,2020-11-09,0.352,0.648,0.0,0.6623,0.0,0.0,0.0,0.0,1.0
860,Kamala Harris,scared never going leave class decency eating precious ,2020-11-09,0.38,0.392,0.227,0.2378,0.2,0.4,0.0,0.2,0.2
861,Kamala Harris,white man asked ready kamala harris told anything possible shoved fist air smil ,2020-11-09,0.172,0.828,0.0,0.3612,0.2,0.4,0.2,0.2,0.0
862,Kamala Harris,thats pretty weird glitch suddenly answer changed ,2020-11-09,0.323,0.505,0.172,0.3612,0.0,0.0,1.0,0.0,0.0
863,Kamala Harris,well deserved win must say need kamala harris tweet ,2020-11-09,0.457,0.543,0.0,0.7096,0.0,0.0,0.0,0.0,1.0
864,Kamala Harris,reminder get elect house lords institution evidently many people ,2020-11-09,0.0,0.0,0.0,0.0,0.0,0.5,0.0,0.5,0.0
865,Kamala Harris,congratulations president elect joe biden vp kamala harris lets proud together ,2020-11-09,0.438,0.562,0.0,0.7906,0.0,0.0,0.5,0.5,0.0
866,Kamala Harris,fuk looks people didnt see fraud think ones see fraud ,2020-11-09,0.434,0.566,0.0,0.7306,0.0,0.5,0.0,0.0,0.5
867,Kamala Harris,kamala harris vp acceptance speech one syllable away god damned haiku america ,2020-11-09,0.305,0.539,0.156,0.3612,0.5,0.0,0.0,0.0,0.5
868,Kamala Harris,today joe biden kamala harris started planning assume control governments battle ,2020-11-09,0.0,0.794,0.206,-0.3818,0.0,0.0,0.0,0.0,0.0
869,Kamala Harris,decency decency kamala harris withheld evidence black ,2020-11-09,0.0,0.0,0.0,0.0,0.0,1.0,0.0,0.0,0.0
870,Kamala Harris,congratulations president elect joe biden vp kamala harris lets proud together ,2020-11-09,0.438,0.562,0.0,0.7906,0.0,0.0,0.5,0.5,0.0
871,Kamala Harris,president elect joe biden vice president elect kamala harris rolled transition covid 19 advisory boar ,2020-11-09,0.0,0.0,0.0,0.0,1.0,0.0,0.0,0.0,0.0
872,Kamala Harris,facts nah time tulsi put kamala harris front street keeping 100 people locked marijuan ,2020-11-09,0.0,0.903,0.097,-0.1027,0.0,0.0,0.0,1.0,0.0
873,Kamala Harris,talking son driving truck great long daily convos kamal ,2020-11-09,0.339,0.661,0.0,0.6249,0.0,0.67,0.33,0.0,0.0
874,Kamala Harris,kamala harris waiting presidency like ,2020-11-09,0.385,0.615,0.0,0.3612,0.0,0.0,0.0,0.0,1.0
875,Kamala Harris,fascinated kamala harris met husband 48 married 49 great fr ,2020-11-09,0.474,0.526,0.0,0.802,0.0,0.0,1.0,0.0,0.0
876,Kamala Harris,local young girls reflect kamala harris election vp means ,2020-11-09,0.0,0.0,0.0,0.0,0.0,0.0,0.0,0.0,1.0
877,Kamala Harris,supported candidate named kamala harris joe biden 2020 democratic primary g ,2020-11-09,0.204,0.796,0.0,0.3182,0.0,1.0,0.0,0.0,0.0
878,Kamala Harris,glad 6 3 conservative scotus gets consistently tell democrats get fucked especially satisfying th ,2020-11-09,0.32,0.457,0.223,0.2247,0.0,0.0,0.5,0.5,0.0
879,Kamala Harris,member uk house lords defends referring kamala harris indian ,2020-11-09,0.0,0.0,0.0,0.0,0.0,0.0,0.0,0.0,0.0
880,Kamala Harris,ted talks snl kamala harris three horsemen apocalypse ,2020-11-09,0.0,0.0,0.0,0.0,0.0,1.0,0.0,0.0,0.0
881,Kamala Harris,thought kamala harris ,2020-11-09,0.0,0.0,0.0,0.0,0.0,0.0,0.0,0.0,1.0
882,Kamala Harris,believe black women belong places decisions made said bailey black ,2020-11-09,0.0,0.0,0.0,0.0,0.0,0.4,0.2,0.2,0.2
883,Kamala Harris,douglas emhoff meet nation first isecond gentleman ,2020-11-09,0.0,0.0,0.0,0.0,0.0,0.0,0.0,0.0,1.0
884,Kamala Harris,friend high school posted photo kamala harris facebook said excited see ne ,2020-11-09,0.359,0.641,0.0,0.6808,0.0,0.25,0.25,0.25,0.25
885,Kamala Harris,one 74m americans voted president joe biden vice president kamala harris ballot lega ,2020-11-09,0.0,0.0,0.0,0.0,0.0,0.0,0.0,0.0,0.0
886,Kamala Harris,video lets americans stripes know welcome joe biden america ,2020-11-09,0.273,0.727,0.0,0.4588,0.0,0.0,0.5,0.5,0.0
887,Kamala Harris,president elect joe biden vice president elect kamala harris outlining plan addressing corona ,2020-11-09,0.0,0.0,0.0,0.0,0.0,0.0,0.0,0.0,0.0
888,Kamala Harris,kamala harris laughed jailing parents truancy funny ,2020-11-09,0.541,0.459,0.0,0.7096,0.0,0.5,0.0,0.0,0.5
889,Kamala Harris,picture kamala harris walking wap lecturing broke barriers females ,2020-11-09,0.0,0.741,0.259,-0.4215,0.0,0.0,0.0,0.0,1.0
890,Kamala Harris,congratulate kamala harris whose favorite title momala first black south asian daughter ,2020-11-09,0.383,0.617,0.0,0.7351,0.0,0.25,0.5,0.0,0.25
891,Kamala Harris,senator tried deny kamala harris entrance white public school girl elected president ,2020-11-09,0.0,0.821,0.179,-0.34,0.0,0.33,0.33,0.0,0.33
892,Kamala Harris,im surprised heard word indian interjected amongst com ,2020-11-09,0.213,0.787,0.0,0.2263,0.5,0.0,0.0,0.0,0.5
893,Kamala Harris,kamala harris useful tits boar hog sayin ,2020-11-09,0.296,0.51,0.194,0.25,0.0,0.0,0.0,0.0,0.0
894,Kamala Harris,kamala harris became vp hard work choirs sonia gandhi may ,2020-11-09,0.0,0.865,0.135,-0.1027,0.33,0.67,0.0,0.0,0.0
895,Kamala Harris,daily reminder kamala harris supports israel ,2020-11-09,0.333,0.667,0.0,0.3612,0.0,0.0,0.0,0.0,0.0
896,Kamala Harris,governor newsom please appoint congresswoman katie porter us senate vp elect kamala harris seat ,2020-11-09,0.15,0.85,0.0,0.3182,0.0,0.0,0.0,1.0,0.0
897,Kamala Harris,kamala harris actually read views goals ,2020-11-09,0.0,0.0,0.0,0.0,0.0,0.0,0.0,0.0,1.0
898,Kamala Harris,trump white house come january time hold biden harris accountable commitmen ,2020-11-09,0.0,0.0,0.0,0.0,0.0,0.5,0.0,0.0,0.5
899,Kamala Harris,think parents split shouldnt get involve family business ,2020-11-09,0.0,0.0,0.0,0.0,0.0,0.6,0.0,0.0,0.4
900,Kamala Harris,british tools never disappoint lord kilclooney accused racism calling kamala harris indian ,2020-11-09,0.129,0.513,0.359,-0.6177,0.0,0.0,0.0,1.0,0.0
901,Kamala Harris,criticized kamala harris ,2020-11-09,0.0,0.444,0.556,-0.3612,0.0,0.0,0.0,0.0,0.0
902,Kamala Harris,dc wannabe elites low life trump haters globalists reject coronat ,2020-11-09,0.0,0.467,0.533,-0.7906,0.0,0.33,0.0,0.33,0.33
903,Kamala Harris,hey donald trump stop complaining amp concede let joe biden amp kamala harris job 2021 ,2020-11-09,0.0,0.765,0.235,-0.4588,0.0,0.2,0.0,0.4,0.4
904,Kamala Harris,announced vaccine 90 efficacy nothing ,2020-11-09,0.0,0.0,0.0,0.0,0.0,0.0,0.0,0.0,0.0
905,Kamala Harris,1 adam schiff 2 bill de blasio 3 kamala harris 4 spartacus 5 mazie hirono 6 nancy pelosi 7 gav ,2020-11-09,0.0,0.0,0.0,0.0,0.0,0.0,0.0,0.0,0.0
906,Kamala Harris,mean enrique tarrio afro cuban leader proud boys vot ,2020-11-09,0.279,0.721,0.0,0.4767,0.0,0.0,1.0,0.0,0.0
907,Kamala Harris,kamala harris gonna forced take trumpcine owned ,2020-11-09,0.0,0.667,0.333,-0.4588,0.0,1.0,0.0,0.0,0.0
908,Kamala Harris,georgia voters vote jerk david perdue mocks kamala harris name trump rally warm ,2020-11-09,0.11,0.578,0.312,-0.5423,0.0,0.67,0.0,0.0,0.33
909,Kamala Harris,kamala harris blm terrorist group libs im crying going woman white house ,2020-11-09,0.0,0.562,0.438,-0.8316,0.0,0.75,0.0,0.0,0.25
910,Kamala Harris,like kamala harris half indiansame half bihariwe understand emotion bihar ,2020-11-09,0.217,0.783,0.0,0.3612,0.0,0.0,0.0,1.0,0.0
911,Kamala Harris,achieve dreams staff students westmount school montreal kam ,2020-11-09,0.278,0.722,0.0,0.4019,0.0,0.0,0.0,0.0,0.0
912,Kamala Harris,canadian born oakland california ,2020-11-09,0.0,0.0,0.0,0.0,0.0,0.0,0.0,1.0,0.0
913,Kamala Harris,kamala harris makes history america first vice president ,2020-11-09,0.0,0.0,0.0,0.0,0.0,0.33,0.0,0.33,0.33
914,Kamala Harris,im canadian count teri cut path chaos seems ,2020-11-09,0.0,0.508,0.492,-0.7003,0.0,0.67,0.0,0.33,0.0
915,Kamala Harris,sex workers interviewed voted biden regardless adamant harris views cant use us ,2020-11-09,0.0,0.0,0.0,0.0,0.0,0.0,0.0,1.0,0.0
916,Kamala Harris,kashmir integral part indiaif wish make kashmir usa help kamal ,2020-11-09,0.403,0.597,0.0,0.6597,0.0,0.0,0.0,0.5,0.5
917,Kamala Harris,awesome true team work best kamala harris nbcsnl ,2020-11-09,0.689,0.311,0.0,0.9022,0.0,0.33,0.0,0.0,0.67
918,Kamala Harris,imagine michelle obama president kamala harris vp even though michelle doesnt like politics wou ,2020-11-09,0.0,0.86,0.14,-0.2755,0.0,0.33,0.0,0.33,0.33
919,Kamala Harris,kamala harris gains momentum among democrats proposal legalize prostitution via washtimes ,2020-11-09,0.194,0.806,0.0,0.34,0.0,0.0,0.0,0.0,0.0
920,Kamala Harris,think biden harris strategic chess move biden wins gets immunity amp ushers ,2020-11-09,0.252,0.748,0.0,0.5719,0.0,0.0,0.0,0.0,1.0
921,Kamala Harris,thank voting joe biden kamala harris ,2020-11-09,0.333,0.667,0.0,0.3612,0.0,0.0,0.0,0.0,0.0
922,Kamala Harris,please sake great country help bring president joe biden vp kam ,2020-11-09,0.532,0.468,0.0,0.8442,0.0,0.0,0.25,0.5,0.25
923,Kamala Harris,inspirational statement dream ambition lead conviction see way others might ,2020-11-09,0.398,0.602,0.0,0.6486,0.5,0.0,0.5,0.0,0.0
924,Kamala Harris,one 74m americans voted president joe biden vice president kamala harris ballot ,2020-11-09,0.0,0.0,0.0,0.0,0.0,0.0,0.0,0.0,0.0
925,Kamala Harris,im shook kamala harris certain communities like idgaf yall say dont trust ,2020-11-09,0.275,0.479,0.246,0.1275,0.0,0.5,0.0,0.25,0.25
926,Kamala Harris,immensely enjoyed reading ,2020-11-09,0.623,0.377,0.0,0.5106,0.0,0.0,1.0,0.0,0.0
927,Kamala Harris,cool call indian bc know name cover ,2020-11-09,0.277,0.723,0.0,0.3182,0.0,0.5,0.5,0.0,0.0
928,Kamala Harris,dc wannabe elites low life trump haters globalists rejec ,2020-11-09,0.0,0.569,0.431,-0.6486,0.0,0.33,0.0,0.33,0.33
929,Kamala Harris,know rx makes racist reveal inner thoughts menlo park school board president r ,2020-11-09,0.0,0.733,0.267,-0.6124,0.0,0.5,0.0,0.25,0.25
930,Kamala Harris,want talk human rights lets talk bad trump cant leave ,2020-11-09,0.189,0.541,0.27,-0.4682,0.0,0.25,0.0,0.5,0.25
931,Kamala Harris,ask siri joe biden kamala harris listen answers ,2020-11-09,0.0,0.0,0.0,0.0,0.0,1.0,0.0,0.0,0.0
932,Kamala Harris,great heaving sobs joy relief every time hear vice president elect kamala harris weep joy ,2020-11-09,0.477,0.29,0.232,0.8225,0.0,0.33,0.33,0.33,0.0
