,Search,Tweet,Entered on,pos_score,neu_score,neg_score,compound_score,angry_score,fear_score,happy_score,sad_score,surprise_score
372,Kamala Harris,congratulations president elect joe biden amp vice president kamala harris vice president kamala harris breaks gl ,2020-11-09,0.307,0.693,0.0,0.7351,0.0,0.0,0.0,0.0,1.0
373,Kamala Harris,sweden matter familiarity familiar someone really appreciate ,2020-11-09,0.45,0.55,0.0,0.4754,0.0,0.33,0.33,0.0,0.33
374,Kamala Harris,kamala harris makes history first woman woman color vice president ,2020-11-09,0.0,0.0,0.0,0.0,0.0,0.25,0.0,0.5,0.25
375,Kamala Harris,kamala harris many identities first woman vice president ,2020-11-09,0.0,0.0,0.0,0.0,0.0,0.0,0.0,0.0,1.0
376,Kamala Harris,mention vp elect kamala harris better getting senators ,2020-11-09,0.293,0.707,0.0,0.4404,0.0,0.0,0.0,0.0,1.0
377,Kamala Harris,kamala harriss immigrant parents found home black study group ,2020-11-09,0.0,0.0,0.0,0.0,0.0,0.33,0.0,0.33,0.33
378,Kamala Harris,process failed country 200 years going fail country year ,2020-11-09,0.0,0.507,0.493,-0.7783,0.0,1.0,0.0,0.0,0.0
379,Kamala Harris,new york times british peer criticized calling indian ,2020-11-09,0.0,0.737,0.263,-0.3612,0.0,0.0,0.0,0.0,0.0
380,Kamala Harris,didnt violence lot people predicting add yet could get ugly han ,2020-11-09,0.211,0.577,0.212,-0.0015,0.0,0.0,0.0,1.0,0.0
381,Kamala Harris,god please let joe biden kamala harris good leaders tired leaders 100 headache ,2020-11-09,0.38,0.469,0.151,0.5267,0.0,0.2,0.2,0.4,0.2
382,Kamala Harris,fact racist tweeted ,2020-11-09,0.0,0.333,0.667,-0.6124,0.0,0.0,0.0,0.0,0.0
383,Kamala Harris,yes dancing n trump loosing hail kamala harris ,2020-11-09,0.444,0.556,0.0,0.4588,0.0,0.33,0.0,0.33,0.33
384,Kamala Harris,knew biden elected president somehow know name vp even donald trump know ,2020-11-09,0.0,0.0,0.0,0.0,0.0,0.0,0.0,0.0,1.0
385,Kamala Harris,remember endless taco bell chihuahua lawsuit kamala harris husband ,2020-11-09,0.0,0.808,0.192,-0.2263,0.0,0.0,0.0,0.0,0.0
386,Kamala Harris,kamala harris potus woohoo ,2020-11-09,0.524,0.476,0.0,0.5106,0.0,0.0,0.0,0.0,0.0
387,Kamala Harris,british peer criticized calling kamala harris indian john taylor tried claim racist af ,2020-11-09,0.0,0.629,0.371,-0.7579,0.0,0.0,0.0,0.0,1.0
388,Kamala Harris,malaysians assume indians pendatang asing even theyre american indian jamaican kamala ,2020-11-09,0.0,0.0,0.0,0.0,0.0,0.0,0.0,0.0,0.0
389,Kamala Harris,ambitious blind word honesty people behind equal worse ,2020-11-09,0.391,0.248,0.36,0.128,0.33,0.0,0.0,0.67,0.0
390,Kamala Harris,didnt violence lot people predicting add yet could get ugly han ,2020-11-09,0.211,0.577,0.212,-0.0015,0.0,0.0,0.0,1.0,0.0
391,Kamala Harris,november 8 2020 mon 1192020 heather cox richardson trump republican party leaders ,2020-11-09,0.213,0.787,0.0,0.4019,0.0,0.0,0.0,0.0,1.0
392,Kamala Harris,indian fuck obvious kamala harris would deal fuckry two days ,2020-11-09,0.0,0.72,0.28,-0.5423,0.0,0.33,0.67,0.0,0.0
393,Kamala Harris,femi fani kayode make think better christian made gods say ,2020-11-09,0.244,0.756,0.0,0.4404,0.0,0.0,0.0,0.33,0.67
394,Kamala Harris,joe biden kamala harris announce covid 19 advisory board ,2020-11-09,0.0,0.0,0.0,0.0,0.0,0.0,0.0,0.0,0.0
395,Kamala Harris,finding would next vice president kamala harris shared heartwarming conversation g ,2020-11-09,0.407,0.593,0.0,0.6705,0.0,1.0,0.0,0.0,0.0
396,Kamala Harris,2020 election barely books already priced 2024 odds available ,2020-11-09,0.0,0.0,0.0,0.0,0.0,0.0,0.0,0.0,0.0
397,Kamala Harris,sometimes compliments stick leave happy days later yes talking ,2020-11-09,0.595,0.327,0.078,0.836,0.0,0.25,0.5,0.25,0.0
398,Kamala Harris,oh hope never get losing president joe ,2020-11-09,0.504,0.496,0.0,0.6229,0.0,0.5,0.0,0.5,0.0
399,Kamala Harris,loving calling biden harris covid 19 plan keeping joint thing going beyond campaign sett ,2020-11-09,0.231,0.769,0.0,0.5994,0.0,0.5,0.25,0.0,0.25
400,Kamala Harris,definitely racist shadow doubt read tweets ref ,2020-11-09,0.205,0.303,0.492,-0.5859,0.0,0.67,0.0,0.33,0.0
401,Kamala Harris,chef reveals menu kamala harris victory dinner delaware restaurant last minute ,2020-11-09,0.0,0.0,0.0,0.0,0.0,0.0,0.0,0.0,1.0
402,Kamala Harris,van jones said kamala harris walked beyoncé instead mary j bl ,2020-11-09,0.268,0.732,0.0,0.5106,0.0,0.5,0.0,0.0,0.5
403,Kamala Harris,jess learn say kamala harris name correctly ,2020-11-09,0.0,0.0,0.0,0.0,0.0,0.0,0.0,0.0,1.0
404,Kamala Harris,epic ,2020-11-09,0.0,0.0,0.0,0.0,0.0,0.0,0.0,0.0,0.0
405,Kamala Harris,know pro tempore president senate becomes vice president kamala harris becomes president ,2020-11-09,0.0,0.0,0.0,0.0,0.0,0.0,0.0,0.0,0.0
406,Kamala Harris,indian americans celebrate vice president elect kamala harris ,2020-11-09,0.346,0.654,0.0,0.5719,0.0,0.0,0.0,0.0,0.0
407,Kamala Harris,nobody talking kamala harris pant suits 50 stars ,2020-11-09,0.0,0.0,0.0,0.0,0.0,0.0,0.0,0.0,1.0
408,Kamala Harris,fact check kamala harris wants legalize prostitution fact check kamala harris ,2020-11-09,0.0,0.0,0.0,0.0,0.0,0.0,0.0,0.0,0.0
409,Kamala Harris,tells touch members house lords extent institutional rac ,2020-11-09,0.0,0.0,0.0,0.0,0.0,0.0,0.0,1.0,0.0
410,Kamala Harris,courtesy say vice president elect kamala harris name one surprised ,2020-11-09,0.355,0.645,0.0,0.5267,0.0,0.0,0.0,0.0,1.0
411,Kamala Harris,300gh number e bi kamala harris ein number tswwc ,2020-11-09,0.302,0.698,0.0,0.1531,0.0,1.0,0.0,0.0,0.0
412,Kamala Harris,pleased announce donald trump big baby voted office january 20th 20 ,2020-11-09,0.225,0.775,0.0,0.4404,0.0,0.0,0.0,0.5,0.5
413,Kamala Harris,congressman ro khanna excellent replacement senator fill ,2020-11-09,0.381,0.619,0.0,0.5719,0.0,0.5,0.5,0.0,0.0
414,Kamala Harris,fact check kamala harris wants legalize prostitution fact check ,2020-11-09,0.0,0.0,0.0,0.0,0.0,0.0,0.0,0.0,0.0
415,Kamala Harris,provided slanted propaganda joe biden suppressed th ,2020-11-09,0.0,0.75,0.25,-0.25,0.0,0.0,0.0,0.0,0.0
416,Kamala Harris,thank joe biden kamala harris ,2020-11-09,0.385,0.615,0.0,0.3612,0.0,0.0,0.0,0.0,0.0
417,Kamala Harris,donald trump fires defense secretary mark esper us politics live ,2020-11-09,0.143,0.857,0.0,0.128,0.0,0.67,0.0,0.0,0.33
418,Kamala Harris,fact check pfizer part operation warp speed pfizer took gov ,2020-11-09,0.0,0.0,0.0,0.0,0.0,0.0,0.0,0.0,1.0
419,Kamala Harris,hell kamala harris ,2020-11-09,0.0,0.303,0.697,-0.6808,0.0,0.0,0.0,0.0,0.0
420,Kamala Harris,one way convince many trump voters take covid seriously take page history book ,2020-11-09,0.136,0.748,0.116,0.0772,0.0,0.5,0.0,0.0,0.5
421,Kamala Harris,fact check kamala harris wants legalize prostitution fact check kamala harris ,2020-11-09,0.0,0.0,0.0,0.0,0.0,0.0,0.0,0.0,0.0
422,Kamala Harris,fact check kamala harris wants legalize prostitution fact check kamala harris father said ,2020-11-09,0.0,0.0,0.0,0.0,0.0,0.0,0.0,0.0,1.0
423,Kamala Harris,kamala harris pronouns bio yall okay like know bar super low overlooked ,2020-11-09,0.449,0.378,0.173,0.7269,0.0,0.0,0.0,1.0,0.0
424,Kamala Harris,congressman ro khanna excellent replacement senator fill senate seat vice pres ,2020-11-09,0.27,0.73,0.0,0.5719,0.0,0.5,0.5,0.0,0.0
425,Kamala Harris,like explanation better also imagine edith wilson ii mean doctor jill b ,2020-11-09,0.375,0.625,0.0,0.6597,0.0,0.0,0.0,0.0,1.0
426,Kamala Harris,kamala stand issues like abortion climate change gun control ,2020-11-09,0.21,0.588,0.202,0.0258,0.0,1.0,0.0,0.0,0.0
427,Kamala Harris,kamala harris need go sit goofy ahh ,2020-11-09,0.0,0.0,0.0,0.0,0.0,0.0,0.0,0.0,0.0
428,Kamala Harris,meanwhile kamala harris vp ,2020-11-09,0.0,0.0,0.0,0.0,0.0,0.0,0.0,0.0,0.0
429,Kamala Harris,apology referring kamala harris indian going cancel decades exactly kin ,2020-11-09,0.107,0.714,0.179,-0.2023,0.0,0.5,0.0,0.5,0.0
430,Kamala Harris,utterly abhorrent house lords peer accused racism calling kamala harris indian ,2020-11-09,0.0,0.428,0.572,-0.8932,1.0,0.0,0.0,0.0,0.0
431,Kamala Harris,maybe could vote next election oh wait house lords ,2020-11-09,0.0,0.0,0.0,0.0,0.0,0.0,0.0,0.0,1.0
432,Kamala Harris,joe biden president gonna kamala harris 8 years ,2020-11-09,0.0,0.0,0.0,0.0,0.0,0.0,0.0,0.0,0.0
433,Kamala Harris,breakfast club power 1051 fm kamala harris makes history first woman woman color vice pr ,2020-11-09,0.0,0.0,0.0,0.0,0.2,0.2,0.0,0.4,0.2
434,Kamala Harris,fact check kamala harris wants legalize prostitution fact check kamala harris father said ,2020-11-09,0.0,0.0,0.0,0.0,0.0,0.0,0.0,0.0,1.0
435,Kamala Harris,congressman ro khanna excellent replacement senator fill senate seat vice pre ,2020-11-09,0.27,0.73,0.0,0.5719,0.0,0.5,0.5,0.0,0.0
436,Kamala Harris,biden isnt president hes mearly puppet kamala harris pulling strings ,2020-11-09,0.0,0.0,0.0,0.0,0.0,0.0,0.0,0.0,0.0
437,Kamala Harris,happens biden moves indian becomes president lord john kilclooney branded racist tw ,2020-11-09,0.0,0.733,0.267,-0.6124,0.0,0.0,0.0,1.0,0.0
438,Kamala Harris,fact check kamala harris wants legalize prostitution fact check kamala harri ,2020-11-09,0.0,0.0,0.0,0.0,1.0,0.0,0.0,0.0,0.0
439,Kamala Harris,kamala harris american whose multi racial ancestry contributes suitably role ,2020-11-09,0.0,0.0,0.0,0.0,0.0,0.0,0.0,0.0,0.0
440,Kamala Harris,let clear vile creature anti democratic house lords established track reco ,2020-11-09,0.153,0.471,0.376,-0.5859,0.0,0.33,0.0,0.67,0.0
441,Kamala Harris,kamala harris bro come ,2020-11-09,0.0,0.0,0.0,0.0,0.0,0.0,0.0,0.0,0.0
442,Kamala Harris,fact check kamala harris wants legalize prostitution fact check kamala harris father sai ,2020-11-09,0.0,0.0,0.0,0.0,0.0,0.0,0.0,0.0,0.0
443,Kamala Harris,kamala harris like hot step mom dad marries midlife crisis settle hap ,2020-11-09,0.151,0.602,0.247,-0.3818,0.0,0.5,0.0,0.5,0.0
444,Kamala Harris,winning friends influencing people usa ,2020-11-09,0.684,0.316,0.0,0.7579,0.0,0.0,1.0,0.0,0.0
445,Kamala Harris,fact check kamala harris wants legalize prostitution fact check kamala harris fa ,2020-11-09,0.0,0.0,0.0,0.0,0.0,0.0,0.0,0.0,0.0
446,Kamala Harris,kamala ms harris vice president vice pr ,2020-11-09,0.0,0.0,0.0,0.0,0.0,0.0,0.0,0.0,0.0
447,Kamala Harris,dear bbc news ni would like issue following correction behalf ni peer lord kilclooney ,2020-11-09,0.298,0.702,0.0,0.6249,0.0,0.5,0.0,0.0,0.5
448,Kamala Harris,tag welcomes historic election urges new administration prioritize restor ,2020-11-09,0.252,0.748,0.0,0.4019,0.0,0.0,1.0,0.0,0.0
449,Kamala Harris,winning georgia runoff elections split senate 50 50 giving democrats majority kamala harris br ,2020-11-09,0.326,0.674,0.0,0.7003,0.0,1.0,0.0,0.0,0.0
450,Kamala Harris,fact check kamala harris wants legalize prostitution fact check kamala harris father said ,2020-11-09,0.0,0.0,0.0,0.0,0.0,0.0,0.0,0.0,1.0
451,Kamala Harris,id let kamala harris wrongfully arrest ,2020-11-09,0.0,0.676,0.324,-0.34,0.0,0.0,0.0,1.0,0.0
452,Kamala Harris,maybe vice president harris kamala harris senator harris madame vp ,2020-11-09,0.0,0.0,0.0,0.0,0.0,0.0,0.0,0.0,0.0
453,Kamala Harris,free fair elections douchecanoe vo ,2020-11-09,0.651,0.349,0.0,0.6808,0.0,0.0,1.0,0.0,0.0
454,Kamala Harris,fact check kamala harris wants legalize prostitution fact ,2020-11-09,0.0,0.0,0.0,0.0,0.0,0.0,0.0,0.0,0.0
455,Kamala Harris,election joe biden kamala harris golden state poised exert influence white h ,2020-11-09,0.167,0.833,0.0,0.25,0.0,0.67,0.0,0.33,0.0
456,Kamala Harris,biden harris pelosi schumer democrat party take pfizer vaccine 9999 worlds population take ,2020-11-09,0.184,0.816,0.0,0.4019,0.0,0.0,0.0,0.0,0.0
457,Kamala Harris,cool woman vp still fuck kamala harris ,2020-11-09,0.213,0.463,0.324,-0.296,0.0,0.0,1.0,0.0,0.0
458,Kamala Harris,fact check kamala harris wants legalize prostitution fact check kamala harris father ,2020-11-09,0.0,0.0,0.0,0.0,0.0,0.0,0.0,0.0,0.0
459,Kamala Harris,think kamala harris one day regret abuse justice kavanaugh think kavanaugh forget ,2020-11-09,0.167,0.394,0.438,-0.6705,0.17,0.17,0.17,0.0,0.5
460,Kamala Harris,big tech wall street heres americas business leaders reacting joe biden kamala har read ,2020-11-09,0.0,0.0,0.0,0.0,0.33,0.33,0.0,0.33,0.0
461,Kamala Harris,election joe biden kamala harris golden state poised exert influence white h ,2020-11-09,0.167,0.833,0.0,0.25,0.0,0.67,0.0,0.33,0.0
462,Kamala Harris,former ulster unionist mp lord kilclooney accused racism describing vice president elect kamala har ,2020-11-09,0.0,0.656,0.344,-0.743,0.0,0.0,0.0,0.0,0.0
463,Kamala Harris,colonial mindset disease runs generations vp elect kamala harris indian origin ,2020-11-09,0.0,0.0,0.0,0.0,0.0,0.0,0.0,0.0,0.0
464,Kamala Harris,californias junior senator kamala harris poised become americas first female vice president remarkable ,2020-11-09,0.337,0.663,0.0,0.6808,0.0,0.33,0.33,0.0,0.33
465,Kamala Harris,thank truth people india never acknowledge blackness yet ,2020-11-09,0.444,0.556,0.0,0.5859,0.0,0.0,0.0,0.0,0.0
466,Kamala Harris,fact check kamala harris wants legalize prostitution fact check kamala harris f ,2020-11-09,0.0,0.0,0.0,0.0,0.0,0.0,0.0,0.0,0.0
467,Kamala Harris,governor gavin newsom choose fill rest kamala harris us senate term ,2020-11-09,0.0,0.0,0.0,0.0,0.0,1.0,0.0,0.0,0.0
468,Kamala Harris,honor president elect joe biden vice president kamala harris heres freedom amp peace unisex tee sa ,2020-11-09,0.456,0.544,0.0,0.8979,0.0,0.0,0.0,0.0,0.0
469,Kamala Harris,fact check kamala harris wants legalize prostitution fact check kamala harris ,2020-11-09,0.0,0.0,0.0,0.0,0.0,0.0,0.0,0.0,0.0
470,Kamala Harris,healing requires disinfecting wound ignoring holding accountable inflicti ,2020-11-09,0.0,0.722,0.278,-0.4019,0.0,0.0,0.0,0.0,0.0
471,Kamala Harris,official ,2020-11-09,0.0,0.0,0.0,0.0,0.0,0.0,0.0,0.0,0.0
472,Kamala Harris,fact check kamala harris wants legalize prostitution fact check kamala harris ,2020-11-09,0.0,0.0,0.0,0.0,0.0,0.0,0.0,0.0,0.0
473,Kamala Harris,wonder many lives could saved vaccine effectiveness criticized questioned ,2020-11-09,0.22,0.472,0.307,-0.0258,0.0,0.5,0.0,0.0,0.5
474,Kamala Harris,fun fact kamala harris projected winner vp position first person color ever hold ,2020-11-09,0.392,0.608,0.0,0.7964,0.0,0.0,0.25,0.25,0.5
475,Kamala Harris,brittney cooper articulates frustration black women america eloquent rage bluntly outlines som ,2020-11-09,0.0,0.599,0.401,-0.7717,0.0,0.33,0.0,0.33,0.33
476,Kamala Harris,asked kamala harris make healthy food free everyones ebt ,2020-11-09,0.462,0.538,0.0,0.7184,0.0,0.33,0.33,0.33,0.0
477,Kamala Harris,well looking good far ,2020-11-09,0.714,0.286,0.0,0.6124,0.0,0.5,0.5,0.0,0.0
478,Kamala Harris,fact check kamala harris wants legalize prostitution fact check kamala harris ,2020-11-09,0.0,0.0,0.0,0.0,0.0,0.0,0.0,0.0,0.0
479,Kamala Harris,kamala harris historic victory speech full chose truth ,2020-11-09,0.247,0.753,0.0,0.3182,0.0,0.0,0.0,0.0,0.0
480,Kamala Harris,hence forth john may refer vp vp harris vp kamala harris racist ,2020-11-09,0.0,0.733,0.267,-0.6124,0.0,1.0,0.0,0.0,0.0
481,Kamala Harris,know vp elect kamala harris name git ,2020-11-09,0.0,0.0,0.0,0.0,0.0,0.0,0.0,0.0,0.0
482,Kamala Harris,disgusting bigot cant even see name kamala harris hard remember google ,2020-11-09,0.0,0.652,0.348,-0.5859,0.5,0.0,0.0,0.5,0.0
483,Kamala Harris,think apology would order tweeted indefensible able twee ,2020-11-09,0.146,0.854,0.0,0.0516,0.0,0.33,0.0,0.33,0.33
484,Kamala Harris,president biden great job vice president kamala harris elected would love ,2020-11-09,0.48,0.52,0.0,0.8519,0.0,0.5,0.5,0.0,0.0
485,Kamala Harris,happy people shop online biden harris biden kamala create divisio ,2020-11-09,0.42,0.58,0.0,0.7003,0.0,0.0,1.0,0.0,0.0
486,Kamala Harris,fact check kamala harris wants legalize prostitution fact check kamala harris father ,2020-11-09,0.0,0.0,0.0,0.0,0.0,0.0,0.0,0.0,0.0
487,Kamala Harris,hideous know uk member house lords needs ,2020-11-09,0.0,0.0,0.0,0.0,0.0,1.0,0.0,0.0,0.0
488,Kamala Harris,fact check kamala harris wants legalize prostitution fact check kamala harris ,2020-11-09,0.0,0.0,0.0,0.0,0.0,0.0,0.0,0.0,0.0
489,Kamala Harris,vice president kamala harris exudes intelligence charm humility confidence lauren jauregui n ,2020-11-09,0.532,0.468,0.0,0.8442,0.0,0.33,0.33,0.33,0.0
490,Kamala Harris,siri love kamala harris born october 20 1964 president ,2020-11-09,0.344,0.656,0.0,0.6369,0.0,0.0,0.5,0.5,0.0
491,Kamala Harris,president joe biden vice president kamala harris congratulate successful work wish succ ,2020-11-09,0.519,0.481,0.0,0.8658,0.0,0.5,0.5,0.0,0.0
492,Kamala Harris,fact check kamala harris wants legalize prostitution fact check kamala harris ,2020-11-09,0.0,0.0,0.0,0.0,0.0,0.0,0.0,0.0,0.0
493,Kamala Harris,considering kamala harris name twitter today conclude offence racis ,2020-11-09,0.0,0.784,0.216,-0.296,0.0,0.0,0.0,1.0,0.0
494,Kamala Harris,uneducated must one know kamala harriss name ,2020-11-09,0.0,0.0,0.0,0.0,0.0,0.0,0.0,0.0,0.0
495,Kamala Harris,oh look another biden bot ,2020-11-09,0.0,0.0,0.0,0.0,0.0,0.0,0.0,0.0,0.0
496,Kamala Harris,insult disgrace ruby brideges lineage ados racially ruby undeniably unambiguously black kamala harris neither ,2020-11-09,0.0,0.649,0.351,-0.7579,0.0,0.33,0.0,0.67,0.0
497,Kamala Harris,guess kamala harris alexander soros son george soros soros runs foundation called open ,2020-11-09,0.0,0.0,0.0,0.0,0.0,0.5,0.0,0.0,0.5
498,Kamala Harris,fact check kamala harris wants legalize prostitution fact check kamala harris ,2020-11-09,0.0,0.0,0.0,0.0,0.0,0.0,0.0,0.0,0.0
499,Kamala Harris,putin xi strongmen congratulated biden yet silence speaks volumes ,2020-11-09,0.158,0.842,0.0,0.128,0.0,0.33,0.33,0.0,0.33
500,Kamala Harris,lord kilclooneys tweet kamala harris sadly another example casual racism practiced championed boris johnson ,2020-11-09,0.191,0.478,0.33,-0.5994,0.0,0.0,1.0,0.0,0.0
501,Kamala Harris,mean counties wont kamala harris bomb ,2020-11-09,0.345,0.655,0.0,0.3875,0.0,0.0,0.0,0.0,0.0
502,Kamala Harris,joe biden kamala harris racist trump ,2020-11-09,0.0,0.556,0.444,-0.6124,0.0,0.0,0.0,0.0,1.0
503,Kamala Harris,mwf congratulates president elect joe biden vice president elect kamala harris governor elect greg gianforte ,2020-11-09,0.0,0.0,0.0,0.0,0.0,0.0,1.0,0.0,0.0
504,Kamala Harris,look forward working together pm modi congratulates us president elect biden vp kamala ,2020-11-09,0.0,0.0,0.0,0.0,0.0,0.5,0.5,0.0,0.0
505,Kamala Harris,ok indian race ethnicity ,2020-11-09,0.423,0.577,0.0,0.296,0.0,1.0,0.0,0.0,0.0
506,Kamala Harris,californias junior senator kamala harris poised become americas first female vice president remarkable ,2020-11-09,0.337,0.663,0.0,0.6808,0.0,0.33,0.33,0.0,0.33
507,Kamala Harris,running kamala harris top dem ticket 2024 hilariously disastrous ,2020-11-09,0.142,0.551,0.307,-0.4767,0.0,0.0,0.33,0.33,0.33
508,Kamala Harris,ridiculous vp elect kamala harris significant wealth ba ,2020-11-09,0.4,0.4,0.2,0.3612,0.0,0.0,1.0,0.0,0.0
509,Kamala Harris,mr biden mrs kamala harris congratulations appointment president united ,2020-11-09,0.489,0.511,0.0,0.7717,0.0,0.0,1.0,0.0,0.0
510,Kamala Harris,like kamala harris shitty person reason shame tv3 ,2020-11-09,0.176,0.352,0.472,-0.6369,0.0,0.0,0.0,1.0,0.0
511,Kamala Harris,election joe biden kamala harris golden state poised exert influence white h ,2020-11-09,0.167,0.833,0.0,0.25,0.0,0.67,0.0,0.33,0.0
512,Kamala Harris,know name vp elect kamala harris sent offensive tweet ignorance ,2020-11-09,0.0,0.593,0.407,-0.6705,0.0,0.5,0.0,0.5,0.0
513,Kamala Harris,glad kamala harris please talk supporting isrel people must stand isrel ,2020-11-09,0.506,0.494,0.0,0.802,0.0,0.33,0.33,0.33,0.0
514,Kamala Harris,seen stories village india celebrating descendant kamala harris ancestral homes barack ,2020-11-09,0.27,0.73,0.0,0.5719,0.0,0.0,0.0,1.0,0.0
515,Kamala Harris,find highly suspect someone know kamala harris part indian know name ,2020-11-09,0.0,0.8,0.2,-0.3597,0.0,1.0,0.0,0.0,0.0
516,Kamala Harris,real lets forget orange peel office doesnt mean miss kamala harris joe biden hook ,2020-11-09,0.094,0.782,0.124,-0.1169,0.25,0.0,0.0,0.75,0.0
517,Kamala Harris,dementia stricken joe pedophile bidenamp ho kamala harris chameleon c girl escort prostitute ,2020-11-09,0.0,0.769,0.231,-0.5106,0.0,0.67,0.0,0.0,0.33
518,Kamala Harris,kamala harris first indian american congress first black woman vp shes defini ,2020-11-09,0.0,0.0,0.0,0.0,0.0,0.0,0.0,0.0,1.0
519,Kamala Harris,kamala harris win inspires women girls nationwide via welland tribune ,2020-11-09,0.456,0.544,0.0,0.7717,0.0,0.33,0.33,0.0,0.33
520,Kamala Harris,left kamala harris chart right obama angelic placements gemini ac gemini moon ,2020-11-09,0.0,0.0,0.0,0.0,0.0,1.0,0.0,0.0,0.0
521,Kamala Harris,californias junior senator kamala harris poised become americas first female vice president remarkable ,2020-11-09,0.337,0.663,0.0,0.6808,0.0,0.33,0.33,0.0,0.33
522,Kamala Harris,vice president elect kamala harris first woman win honorable position ,2020-11-09,0.477,0.523,0.0,0.8074,0.0,0.0,0.0,0.0,1.0
523,Kamala Harris,im glad patriot act taken away us hasan minhaj could ruin jokes kamala harris desi food ,2020-11-09,0.229,0.596,0.174,0.0516,0.17,0.0,0.33,0.33,0.17
524,Kamala Harris,ffs shesamerican trending learn anyway clear future confusion r ,2020-11-09,0.191,0.368,0.441,-0.5267,0.0,0.5,0.0,0.5,0.0
525,Kamala Harris,yet evidence prove tory party racist beyond redemption somehow passes silence ,2020-11-09,0.172,0.573,0.255,-0.3182,0.0,0.75,0.0,0.0,0.25
526,Kamala Harris,well kamala harris lost others showing something different corny ,2020-11-09,0.184,0.614,0.202,-0.0516,0.0,0.0,0.0,1.0,0.0
527,Kamala Harris,strong congratulation speech chancellor merkel joe biden kamala harris underlining importance th ,2020-11-09,0.519,0.481,0.0,0.8658,0.0,0.0,1.0,0.0,0.0
528,Kamala Harris,whatever views women hypocrisy left heaping praise kamala h ,2020-11-09,0.34,0.66,0.0,0.5574,0.0,1.0,0.0,0.0,0.0
529,Kamala Harris,see kilclooney deleted racist tweet kamala harris seems coward well gobshite ,2020-11-09,0.123,0.468,0.409,-0.7096,0.0,0.0,0.0,1.0,0.0
530,Kamala Harris,sure true quite articles days ago ,2020-11-09,0.56,0.44,0.0,0.6249,0.0,0.5,0.5,0.0,0.0
531,Kamala Harris,lord kilclooney would like assure racist know kamala harris name twee ,2020-11-09,0.29,0.473,0.237,-0.0258,0.0,1.0,0.0,0.0,0.0
532,Kamala Harris,mr biden mrs kamala harris congratulations appointment president united ,2020-11-09,0.489,0.511,0.0,0.7717,0.0,0.0,1.0,0.0,0.0
533,Kamala Harris,televised speech monday projected winner us presidential election joe biden laid plans ,2020-11-09,0.257,0.743,0.0,0.5859,0.0,0.0,0.0,0.0,0.0
534,Kamala Harris,bad month far covid 19 vaccine biden president elect kamala harris vp one came join th ,2020-11-09,0.112,0.711,0.178,-0.3182,0.0,0.33,0.0,0.33,0.33
535,Kamala Harris,kamala harris vp feel empowerment women computer science class college amp ,2020-11-09,0.0,0.0,0.0,0.0,0.0,0.5,0.0,0.0,0.5
536,Kamala Harris,claims know vp elect kamala harris name tool quickly search information ,2020-11-09,0.0,0.0,0.0,0.0,0.0,0.0,0.0,0.5,0.5
537,Kamala Harris,powerful womans speach first woman office last kamala harris histori ,2020-11-09,0.237,0.763,0.0,0.4215,0.0,0.0,0.0,0.0,1.0
538,Kamala Harris,kamala harris miss commie ,2020-11-09,0.0,0.652,0.348,-0.1531,0.0,0.0,0.0,1.0,0.0
539,Kamala Harris,today motivation monday quote comes history making vice president elect kamala harris ,2020-11-09,0.179,0.821,0.0,0.34,0.0,0.33,0.0,0.33,0.33
540,Kamala Harris,friends side drink alerting us og racist fuckwittery name kamala harris ,2020-11-09,0.193,0.559,0.248,-0.2263,0.0,0.0,1.0,0.0,0.0
541,Kamala Harris,turkish immigrants helped make breakthrough kamala harris daughter immigrants ,2020-11-09,0.0,0.0,0.0,0.0,0.0,0.0,0.0,0.5,0.5
542,Kamala Harris,lord kilclooney withdraws reference kamala harris indian accused racism peer says ,2020-11-09,0.0,0.588,0.412,-0.743,0.0,0.5,0.0,0.0,0.5
543,Kamala Harris,thank ms mos shogbamimu putting h j kil clooney h ,2020-11-09,0.294,0.706,0.0,0.3612,0.0,0.0,0.0,1.0,0.0
544,Kamala Harris,black women alpha kappa alpha celebrates soror kamala harris win atlanta ,2020-11-09,0.455,0.545,0.0,0.8176,0.0,1.0,0.0,0.0,0.0
545,Kamala Harris,anyone gonna call sky news people set firecrackers offered prayers kamala harris ,2020-11-09,0.0,0.0,0.0,0.0,0.0,1.0,0.0,0.0,0.0
546,Kamala Harris,bro didnt know kamala harris married chihuahua ,2020-11-09,0.0,0.0,0.0,0.0,0.0,0.0,0.0,0.0,0.0
547,Kamala Harris,retro style polls olivia palermo modern veep style kamala harris new flotus festi ,2020-11-09,0.0,0.0,0.0,0.0,0.0,0.0,0.0,0.0,0.0
548,Kamala Harris,post election snl check alec baldwin jim carrey maya rudolph ,2020-11-09,0.0,0.0,0.0,0.0,0.0,0.0,0.0,0.0,0.0
549,Kamala Harris,isitok lord kilclooney called kamala harris indian institutional racism ,2020-11-09,0.0,0.661,0.339,-0.6249,0.0,0.0,0.0,0.0,0.0
550,Kamala Harris,election biden kamala harris win facts research empathy must deployed ,2020-11-09,0.297,0.703,0.0,0.5859,0.0,0.0,1.0,0.0,0.0
551,Kamala Harris,siri hot water answer question old president triggers conspiracy theories wan ,2020-11-09,0.0,0.746,0.254,-0.5267,0.0,0.25,0.0,0.75,0.0
552,Kamala Harris,scrolled back tweets lot ,2020-11-09,0.0,0.0,0.0,0.0,0.0,0.0,0.0,1.0,0.0
553,Kamala Harris,kamala harris sorority sisters said vp election success ,2020-11-09,0.346,0.654,0.0,0.5719,0.0,0.0,0.0,0.5,0.5
554,Kamala Harris,tony west ubers chief legal officer brother law kamala harris hailing prop22 great drivers abso ,2020-11-09,0.301,0.699,0.0,0.6808,0.0,0.0,0.33,0.0,0.67
555,Kamala Harris,know kamala harris name referred indian upset people ,2020-11-09,0.0,0.729,0.271,-0.3818,0.0,1.0,0.0,0.0,0.0
556,Kamala Harris,want clear stan kamala harris still pretty cool finally first woman poc vp ,2020-11-09,0.511,0.489,0.0,0.8126,0.0,0.2,0.4,0.2,0.2
557,Kamala Harris,mr biden mrs kamala harris congratulations appointment president united sta ,2020-11-09,0.456,0.544,0.0,0.7717,0.0,0.0,1.0,0.0,0.0
