,Search,Tweet,Entered on,pos_score,neu_score,neg_score,compound_score,angry_score,fear_score,happy_score,sad_score,surprise_score
1308,Kamala Harris,okay gonna objectify vice president elect kamala harris hot ,2020-11-09,0.192,0.808,0.0,0.2263,0.0,0.0,0.0,1.0,0.0
1309,Kamala Harris,dont particularly agree kamala harris vp policies definitely think coul ,2020-11-09,0.207,0.614,0.179,0.0959,0.0,0.67,0.0,0.0,0.33
1310,Kamala Harris,pack bags loser fired people congratulations pre ,2020-11-09,0.262,0.268,0.47,-0.4767,0.0,0.0,0.0,1.0,0.0
1311,Kamala Harris,daily show trevor noah praises return speeches sound like speeches upon biden harris election ,2020-11-09,0.33,0.67,0.0,0.7096,0.0,0.0,0.0,0.0,0.0
1312,Kamala Harris,kamala harriss ancestral tamil nadu village celebrates biden harris win us election via ,2020-11-09,0.405,0.595,0.0,0.8176,0.0,0.0,0.0,0.0,0.0
1313,Kamala Harris,pack bags loser fired people congratulations pres ,2020-11-09,0.262,0.268,0.47,-0.4767,0.0,0.0,0.0,1.0,0.0
1314,Kamala Harris,pack bags loser fired people congratulations president elect vice ,2020-11-09,0.231,0.355,0.414,-0.4767,0.0,0.0,0.0,1.0,0.0
1315,Kamala Harris,kamala harriss ancestral tamil nadu village celebrates biden harris win us election via ,2020-11-09,0.405,0.595,0.0,0.8176,0.0,0.0,0.0,0.0,0.0
1316,Kamala Harris,consider kamala harris indian part indian indian ,2020-11-09,0.0,0.0,0.0,0.0,0.0,0.0,0.0,1.0,0.0
1317,Kamala Harris,understand belief irresponsible politically driven rhetori ,2020-11-09,0.0,0.633,0.367,-0.4404,0.0,0.5,0.0,0.5,0.0
1318,Kamala Harris,pack bags loser fired people congratulations president elect vice ,2020-11-09,0.231,0.355,0.414,-0.4767,0.0,0.0,0.0,1.0,0.0
1319,Kamala Harris,wore makeup today vice president elect soror kamala harris aka ,2020-11-09,0.0,0.0,0.0,0.0,0.0,0.0,0.0,0.0,0.0
1320,Kamala Harris,yea think think thats possible havent seen voters joe biden kamala harris say ,2020-11-09,0.0,0.0,0.0,0.0,0.0,0.25,0.0,0.0,0.75
1321,Kamala Harris,biden knows way around fine f gop im one ,2020-11-09,0.205,0.795,0.0,0.2023,0.0,0.0,1.0,0.0,0.0
1322,Kamala Harris,pack bags loser fired people congratulations president elec ,2020-11-09,0.245,0.314,0.44,-0.4767,0.0,0.0,0.0,1.0,0.0
1323,Kamala Harris,eric garcetti kamala harris amp katie porter diane feinstein df needs ,2020-11-09,0.0,0.0,0.0,0.0,0.0,0.0,0.0,0.0,0.0
1324,Kamala Harris,pack bags loser fired people congratulations preside ,2020-11-09,0.262,0.268,0.47,-0.4767,0.0,0.0,0.0,1.0,0.0
1325,Kamala Harris,top head kam ,2020-11-09,0.474,0.526,0.0,0.2023,0.0,0.5,0.0,0.0,0.5
1326,Kamala Harris,pack bags loser fired people congratulations president elect vice ,2020-11-09,0.231,0.355,0.414,-0.4767,0.0,0.0,0.0,1.0,0.0
1327,Kamala Harris,unacceptable withdraw life peerage uk peer sparks outrage calling kamala harris indian ,2020-11-09,0.0,0.613,0.387,-0.743,0.0,1.0,0.0,0.0,0.0
1328,Kamala Harris,great pleasure congratulate 46th president us president elected joe biden ,2020-11-09,0.611,0.389,0.0,0.9001,0.0,0.0,1.0,0.0,0.0
1329,Kamala Harris,yall gotta hold biden kamala harris pedigree character held trump pence ca ,2020-11-09,0.0,0.0,0.0,0.0,0.0,0.5,0.0,0.0,0.5
1330,Kamala Harris,pack bags loser fired people congratulations president elect vice ,2020-11-09,0.231,0.355,0.414,-0.4767,0.0,0.0,0.0,1.0,0.0
1331,Kamala Harris,kamala harris made history first black woman first person south asian descent elected v ,2020-11-09,0.0,0.0,0.0,0.0,0.0,0.25,0.0,0.25,0.5
1332,Kamala Harris,pack bags loser fired people congratulations president elect vice ,2020-11-09,0.231,0.355,0.414,-0.4767,0.0,0.0,0.0,1.0,0.0
1333,Kamala Harris,pack bags loser fired people congratul ,2020-11-09,0.0,0.364,0.636,-0.7906,0.0,0.0,0.0,1.0,0.0
1334,Kamala Harris,libs wowee kamala harris first female vice pre dont got healthcare police reform cann ,2020-11-09,0.0,0.0,0.0,0.0,0.0,0.0,0.0,0.0,1.0
1335,Kamala Harris,pack bags loser fired people congratulations president elect vice ,2020-11-09,0.231,0.355,0.414,-0.4767,0.0,0.0,0.0,1.0,0.0
1336,Kamala Harris,glass ceiling shattered black sorority members react vp elect kamala harris history making win ,2020-11-09,0.201,0.635,0.164,0.1779,0.0,0.33,0.0,0.67,0.0
1337,Kamala Harris,pack bags loser fired people congratulations president elect vice ,2020-11-09,0.231,0.355,0.414,-0.4767,0.0,0.0,0.0,1.0,0.0
1338,Kamala Harris,one 756 million americans voted president joe biden vice president kamala harri ,2020-11-09,0.0,0.0,0.0,0.0,1.0,0.0,0.0,0.0,0.0
1339,Kamala Harris,pack bags loser fired people congratulations president elect vice ,2020-11-09,0.231,0.355,0.414,-0.4767,0.0,0.0,0.0,1.0,0.0
1340,Kamala Harris,congratulations kamala harris first woman vice president usa 2020 history defining year reflection ,2020-11-09,0.245,0.755,0.0,0.5994,0.0,0.5,0.0,0.0,0.5
1341,Kamala Harris,kamala harris finna arrest pirated music downloaded pod 2013 ,2020-11-09,0.0,0.769,0.231,-0.34,0.0,0.0,0.0,0.0,0.0
1342,Kamala Harris,everyone saying come smt pratibha patil 1st female president india could inspire feminist ,2020-11-09,0.236,0.764,0.0,0.5719,0.0,0.0,0.5,0.0,0.5
1343,Kamala Harris,pack bags loser fired people congratulations ,2020-11-09,0.281,0.216,0.504,-0.4767,0.0,0.0,0.0,1.0,0.0
1344,Kamala Harris,pack bags loser fired people congratulations president ,2020-11-09,0.262,0.268,0.47,-0.4767,0.0,0.0,0.0,1.0,0.0
1345,Kamala Harris,predict kamala harris wear traditional indian saree inauguration ball biden harris2020 2021 ,2020-11-09,0.0,0.0,0.0,0.0,0.0,0.0,0.0,0.0,0.0
1346,Kamala Harris,fact trump lost going away joe biden amp kamala harris legally people voiced ,2020-11-09,0.095,0.748,0.156,-0.2263,0.2,0.4,0.0,0.2,0.2
1347,Kamala Harris,pack bags loser fired people congratulations president elect ,2020-11-09,0.245,0.314,0.44,-0.4767,0.0,0.0,0.0,1.0,0.0
1348,Kamala Harris,president elect joe biden vice president elect kamala harris participate meeting bidens transition ,2020-11-09,0.0,0.0,0.0,0.0,1.0,0.0,0.0,0.0,0.0
1349,Kamala Harris,meet kamala harris first woman first black person first south asian american elected vice president ,2020-11-09,0.0,0.0,0.0,0.0,0.0,0.0,0.0,0.0,1.0
1350,Kamala Harris,pack bags loser fired people congratulations president elect vice ,2020-11-09,0.231,0.355,0.414,-0.4767,0.0,0.0,0.0,1.0,0.0
1351,Kamala Harris,please appoint katie porter take place kamala harris mitch mc connell republican senators need ,2020-11-09,0.15,0.85,0.0,0.3182,0.0,0.5,0.0,0.5,0.0
1352,Kamala Harris,pack bags loser fired people congratulations president elect vice ,2020-11-09,0.231,0.355,0.414,-0.4767,0.0,0.0,0.0,1.0,0.0
1353,Kamala Harris,another joke matter diplomatic relationship china amp russia biden stop somethin ,2020-11-09,0.244,0.593,0.163,0.0258,0.0,0.5,0.5,0.0,0.0
1354,Kamala Harris,pack bags loser fired people congratulations president elect vice ,2020-11-09,0.231,0.355,0.414,-0.4767,0.0,0.0,0.0,1.0,0.0
1355,Kamala Harris,hate kamala harris mixed race would racist hate woman ,2020-11-09,0.0,0.345,0.655,-0.9081,0.0,0.5,0.0,0.5,0.0
1356,Kamala Harris,people know barack obama picked joe biden vp 2008 biden would viable ,2020-11-09,0.0,0.0,0.0,0.0,0.0,1.0,0.0,0.0,0.0
1357,Kamala Harris,concentrate future past joe biden kamala harris leaders even ,2020-11-09,0.0,0.0,0.0,0.0,0.0,0.0,0.0,1.0,0.0
1358,Kamala Harris,gentleman husband kamala harris ,2020-11-09,0.0,0.0,0.0,0.0,0.0,0.0,0.0,0.0,0.0
1359,Kamala Harris,kamala harris american isme india kahan se aaya abt pratibha patil indira gandhi dont se ,2020-11-09,0.0,0.0,0.0,0.0,0.0,0.0,0.0,0.0,0.0
1360,Kamala Harris,pack bags loser fired people congratulations president elect vice ,2020-11-09,0.231,0.355,0.414,-0.4767,0.0,0.0,0.0,1.0,0.0
1361,Kamala Harris,absolutely flip senate get least 5050 representation vp kamala harris tie breake ,2020-11-09,0.0,0.0,0.0,0.0,0.33,0.67,0.0,0.0,0.0
1362,Kamala Harris,kamala harris restore aid palestinians renew ties jerusalem post ,2020-11-09,0.216,0.784,0.0,0.296,0.0,0.0,0.0,0.0,0.0
1363,Kamala Harris,honesthumble opinion funny skit regarding kamala harris jimmy ijs ,2020-11-09,0.397,0.603,0.0,0.5574,0.0,0.0,0.5,0.0,0.5
1364,Kamala Harris,implying kamala harris already secretly president ,2020-11-09,0.0,0.0,0.0,0.0,0.0,0.0,0.0,0.0,0.0
1365,Kamala Harris,im one 74m americans voted president joe ,2020-11-09,0.0,0.0,0.0,0.0,0.0,0.0,0.0,0.0,0.0
1366,Kamala Harris,kamala harris says radfem answer quick ,2020-11-09,0.0,0.0,0.0,0.0,0.5,0.0,0.0,0.0,0.5
1367,Kamala Harris,one 756 million americans voted president joe biden ,2020-11-09,0.0,0.0,0.0,0.0,0.0,0.0,0.0,0.0,0.0
1368,Kamala Harris,kamala harris vice president elect set many firsts washington one like kamala harri ,2020-11-09,0.172,0.828,0.0,0.3612,0.33,0.33,0.0,0.0,0.33
1369,Kamala Harris,true jackson vp walked kamala harris could run ,2020-11-09,0.286,0.714,0.0,0.4215,0.0,0.0,0.0,0.0,0.0
1370,Kamala Harris,democrats win two senate races georgia 5050 senate means vice president w ,2020-11-09,0.275,0.725,0.0,0.5859,0.0,1.0,0.0,0.0,0.0
1371,Kamala Harris,vp elect cook go roast chicken turn three meals learned dis ,2020-11-09,0.0,0.0,0.0,0.0,0.0,0.5,0.0,0.0,0.5
1372,Kamala Harris,americas vice president elect introduced countrys first second gentleman sweet post ,2020-11-09,0.231,0.769,0.0,0.4588,0.0,0.0,0.0,0.0,1.0
1373,Kamala Harris,kamala harris vice president elect set many firsts washington one like kamala harri ,2020-11-09,0.172,0.828,0.0,0.3612,0.33,0.33,0.0,0.0,0.33
1374,Kamala Harris,isnt thing ag kamala harris ,2020-11-09,0.0,0.0,0.0,0.0,0.0,0.0,0.0,0.0,1.0
1375,Kamala Harris,dc wannabe elites low life trump haters globalists ,2020-11-09,0.0,0.531,0.469,-0.6486,0.0,0.33,0.0,0.33,0.33
1376,Kamala Harris,uk politician slammed referring kamala harris indian ,2020-11-09,0.0,0.0,0.0,0.0,0.0,0.0,0.0,0.0,0.0
1377,Kamala Harris,kamala harris would sure guess heartbeats away boom youve got nancy pelosi ,2020-11-09,0.173,0.827,0.0,0.3182,0.17,0.33,0.0,0.17,0.33
1378,Kamala Harris,lord kilclooneys comments us vice president elect excellency kamala harris confirms uk ,2020-11-09,0.241,0.759,0.0,0.5423,0.0,1.0,0.0,0.0,0.0
1379,Kamala Harris,congratulate kamala harris whose favorite title momala first black south asian daughter ,2020-11-09,0.383,0.617,0.0,0.7351,0.0,0.25,0.5,0.0,0.25
1380,Kamala Harris,fuck lady look girl name give kamala harris look video ,2020-11-09,0.0,0.72,0.28,-0.5423,0.0,0.33,0.33,0.0,0.33
1381,Kamala Harris,kamala harris expanded police state didnt charge derek chevin killing alaskan nati ,2020-11-09,0.0,0.714,0.286,-0.6597,0.0,0.0,0.33,0.33,0.33
1382,Kamala Harris,kamala harris expanded police state didnt charge derek chevin killing ,2020-11-09,0.0,0.672,0.328,-0.6597,0.0,0.0,0.33,0.33,0.33
1383,Kamala Harris,anybody black policy company find new agent called vice preside ,2020-11-09,0.0,0.0,0.0,0.0,0.0,1.0,0.0,0.0,0.0
1384,Kamala Harris,theres way hold kamala harris accountable without using recycled joke mock black people ,2020-11-09,0.0,0.701,0.299,-0.5702,0.0,0.0,1.0,0.0,0.0
1385,Kamala Harris,brexiter peer branded racist calling kamala harris indian racist new tory quintessenti ,2020-11-09,0.0,0.556,0.444,-0.8402,0.0,0.0,0.0,1.0,0.0
1386,Kamala Harris,kamala harris historic victory speech full chose truth tubeより ,2020-11-09,0.223,0.777,0.0,0.3182,0.0,0.0,0.0,0.0,0.0
1387,Kamala Harris,kamala harris actually said plan provide israel 38 billion dollars military assistance ,2020-11-09,0.0,0.0,0.0,0.0,0.0,0.0,0.0,0.0,1.0
1388,Kamala Harris,brown town celebrates history making kamala harris ,2020-11-09,0.381,0.619,0.0,0.5719,0.0,0.25,0.0,0.75,0.0
1389,Kamala Harris,friend racial mix kamala harris arent proud ,2020-11-09,0.298,0.465,0.237,0.1645,0.0,0.0,1.0,0.0,0.0
1390,Kamala Harris,kamala harris never identified brahmin ,2020-11-09,0.0,0.0,0.0,0.0,0.0,0.0,1.0,0.0,0.0
1391,Kamala Harris,browns town celebrates history making kamala harris news jamaica gleaner ,2020-11-09,0.291,0.709,0.0,0.5719,0.0,0.25,0.0,0.75,0.0
1392,Kamala Harris,every night throw dogs jail get little rush power like legend cop kamala harris feels ,2020-11-09,0.138,0.862,0.0,0.3041,0.5,0.0,0.5,0.0,0.0
1393,Kamala Harris,could im ,2020-11-09,0.0,0.0,0.0,0.0,0.0,0.0,0.0,0.0,0.0
1394,Kamala Harris,care politics take time acknowledge mad skills incredible teamwork behind scenes ,2020-11-09,0.208,0.584,0.208,0.0,0.25,0.25,0.0,0.25,0.25
1395,Kamala Harris,senator kamala harris ca wants legalize prostitution via tube ,2020-11-09,0.0,0.0,0.0,0.0,0.0,1.0,0.0,0.0,0.0
1396,Kamala Harris,joe biden zero family 20 yrs single 73 years kamala harris saysfighting work ,2020-11-09,0.0,0.0,0.0,0.0,0.0,0.5,0.0,0.0,0.5
1397,Kamala Harris,size shirt wear im guessing large kamala harris medium ,2020-11-09,0.0,0.0,0.0,0.0,0.0,0.0,0.0,0.0,1.0
1398,Kamala Harris,kamala harris said biden administration take immediate steps restore economic humanitarian assi ,2020-11-09,0.167,0.833,0.0,0.296,0.0,0.0,0.0,0.0,1.0
1399,Kamala Harris,drive crazy talk joe biden kamala harris need contr ,2020-11-09,0.0,0.769,0.231,-0.34,0.0,1.0,0.0,0.0,0.0
1400,Kamala Harris,funny black folks problem kamala harris white husband problem ,2020-11-09,0.203,0.42,0.378,-0.3612,0.0,0.75,0.0,0.0,0.25
1401,Kamala Harris,amp truly relationshipgoals doug hive k hive ,2020-11-09,0.367,0.633,0.0,0.4404,0.0,0.0,0.0,0.0,0.0
1402,Kamala Harris,remember big 47 year nothing burger bidens career family ,2020-11-09,0.0,0.0,0.0,0.0,0.0,0.0,0.0,0.0,1.0
1403,Kamala Harris,president elect joe biden amp vice president elect kamala harris america via tube ,2020-11-09,0.0,0.0,0.0,0.0,0.0,1.0,0.0,0.0,0.0
1404,Kamala Harris,supported kamala harris planned parenthood ,2020-11-09,0.365,0.635,0.0,0.3182,0.0,0.0,0.0,0.0,0.0
1405,Kamala Harris,discussion around holding kamala harris accountable funny ppl like pick choose injust ,2020-11-09,0.351,0.649,0.0,0.6597,0.0,0.0,0.0,0.0,1.0
1406,Kamala Harris,joe biden kamala harris winning election ,2020-11-09,0.405,0.595,0.0,0.5267,0.0,0.0,0.0,0.0,0.0
1407,Kamala Harris,someone sanitize everything place covid cases province ,2020-11-09,0.0,0.0,0.0,0.0,0.0,0.5,0.0,0.5,0.0
1408,Kamala Harris,fact check pfizer part operation warp speed pfizer took governm ,2020-11-09,0.0,0.0,0.0,0.0,0.0,0.0,0.0,0.0,1.0
1409,Kamala Harris,omg beyond pale lord dingbat needs learn google keep cake hole shut shame ,2020-11-09,0.0,0.795,0.205,-0.4767,0.25,0.25,0.0,0.25,0.25
1410,Kamala Harris,fact check pfizer part operation warp speed pfizer took government mone ,2020-11-09,0.0,0.0,0.0,0.0,0.0,0.0,0.0,0.0,1.0
1411,Kamala Harris,asia firecrackers prayers indians celebrate harris win ap ,2020-11-09,0.556,0.444,0.0,0.8176,0.0,0.0,0.0,0.0,0.0
1412,Kamala Harris,cant believe kamala harris made shawn mendes ugly ,2020-11-09,0.0,0.68,0.32,-0.5106,0.0,0.0,0.0,1.0,0.0
1413,Kamala Harris,transition transition joe biden kamala harris sworn january 20 ,2020-11-09,0.0,0.0,0.0,0.0,1.0,0.0,0.0,0.0,0.0
1414,Kamala Harris,history making moment kamala harris wears suffragette white via voguemagazine ,2020-11-09,0.0,0.0,0.0,0.0,0.0,0.75,0.0,0.25,0.0
1415,Kamala Harris,fact check pfizer part operation warp speed pfizer took government mone ,2020-11-09,0.0,0.0,0.0,0.0,0.0,0.0,0.0,0.0,1.0
1416,Kamala Harris,kamala harriss record trans rights isnt mixed ,2020-11-09,0.0,0.0,0.0,0.0,0.0,1.0,0.0,0.0,0.0
1417,Kamala Harris,real deal despise trump passion staunch supporter joe biden kamala harris ,2020-11-09,0.329,0.516,0.155,0.4019,0.5,0.0,0.0,0.25,0.25
1418,Kamala Harris,seems president company thinks vice president elect kamala harris hoe cancel policy ,2020-11-09,0.0,0.846,0.154,-0.25,0.0,0.33,0.0,0.33,0.33
1419,Kamala Harris,kamala harris typing ,2020-11-09,0.0,0.0,0.0,0.0,0.0,1.0,0.0,0.0,0.0
1420,Kamala Harris,one hate biden think kamala harris contrived pu ,2020-11-09,0.0,0.508,0.492,-0.7003,0.0,0.0,0.0,0.5,0.5
1421,Kamala Harris,majority elected us senators us house representatives endorsed accepted us presidentia ,2020-11-09,0.313,0.687,0.0,0.4767,0.0,0.0,0.0,0.0,0.0
1422,Kamala Harris,read complained apologised clarified convinced alluding pride ,2020-11-09,0.533,0.246,0.221,0.4215,0.0,0.0,0.33,0.67,0.0
1423,Kamala Harris,democrats senate seats watch happen conveniently 50 50 ,2020-11-09,0.0,0.0,0.0,0.0,0.0,0.0,0.5,0.0,0.5
1424,Kamala Harris,malaysian tv station call kamala harris mother illegal immigrant intentional think ,2020-11-09,0.0,0.735,0.265,-0.5574,0.0,0.0,0.0,0.0,1.0
1425,Kamala Harris,kamala harris said eats breakfast felt brown girls learn word anything else ,2020-11-09,0.0,0.0,0.0,0.0,0.17,0.17,0.0,0.33,0.33
1426,Kamala Harris,kamala harris american indian come someone politics know na ,2020-11-09,0.0,0.0,0.0,0.0,0.0,1.0,0.0,0.0,0.0
1427,Kamala Harris,see sci story biden may know real fighter cancer surv ,2020-11-09,0.114,0.571,0.314,-0.5859,0.0,0.5,0.0,0.5,0.0
1428,Kamala Harris,trump nothing tackle covid look biden election created ,2020-11-09,0.222,0.778,0.0,0.25,0.0,0.0,0.0,0.0,1.0
1429,Kamala Harris,thank mary marg olohan must read article pro life ,2020-11-09,0.238,0.762,0.0,0.3612,0.0,1.0,0.0,0.0,0.0
1430,Kamala Harris,congratulations president elect biden vp elect kamala harris surprise us ,2020-11-09,0.429,0.571,0.0,0.7184,0.0,0.0,0.0,0.0,1.0
1431,Kamala Harris,black women backbone democracy kamala harris ,2020-11-09,0.0,0.0,0.0,0.0,0.0,0.0,0.0,0.0,0.0
1432,Kamala Harris,found telling watching lot cable news past weekend election called many wh ,2020-11-09,0.0,0.0,0.0,0.0,0.0,0.0,0.0,0.75,0.25
1433,Kamala Harris,luo neighbor named newborn daughter kamala harris atieno ,2020-11-09,0.0,0.0,0.0,0.0,0.0,0.0,0.0,0.0,0.0
1434,Kamala Harris,saylike kamala harrishe cannot decide black brown ,2020-11-09,0.0,0.0,0.0,0.0,0.0,0.0,0.0,1.0,0.0
1435,Kamala Harris,lie raised embrace blackness indians criticized e ,2020-11-09,0.261,0.455,0.284,-0.0516,0.0,0.0,0.0,1.0,0.0
1436,Kamala Harris,get kamala harris fucked pastex put mtf mens prison appreciate shes learned ,2020-11-09,0.139,0.464,0.397,-0.7184,0.0,0.0,0.5,0.25,0.25
1437,Kamala Harris,yesyes yes madame vp kamala harris mvp harris fallon tonight ,2020-11-09,0.231,0.769,0.0,0.4019,0.0,0.0,0.0,1.0,0.0
1438,Kamala Harris,interesting many ppl think theyre complimenting kamala harris saying like better f ,2020-11-09,0.62,0.38,0.0,0.886,0.0,0.0,0.25,0.0,0.75
1439,Kamala Harris,im one 74m americans voted president joe biden vice pres ,2020-11-09,0.0,0.0,0.0,0.0,0.0,0.0,0.0,0.0,0.0
1440,Kamala Harris,sure agree president falsely cites cdc study explicit intent encoura ,2020-11-09,0.375,0.625,0.0,0.5859,0.0,0.67,0.0,0.0,0.33
1441,Kamala Harris,insurer becaused called vp elect kamala harris hoe ,2020-11-09,0.0,0.0,0.0,0.0,0.0,1.0,0.0,0.0,0.0
1442,Kamala Harris,congratulations kamala harris god bless ,2020-11-09,0.815,0.185,0.0,0.8316,0.0,0.0,0.5,0.0,0.5
1443,Kamala Harris,article crock st trump endured 4 years non stop abuse duty ,2020-11-09,0.0,0.556,0.444,-0.7506,0.0,0.5,0.0,0.0,0.5
1444,Kamala Harris,attention anyone moral compass greg tramontin finds acceptable disrespect ,2020-11-09,0.19,0.579,0.231,-0.128,0.0,0.0,1.0,0.0,0.0
1445,Kamala Harris,joe biden president elect kamala harris vice president elect ,2020-11-09,0.0,0.0,0.0,0.0,0.0,0.0,0.0,0.0,0.0
1446,Kamala Harris,bs career nothing hacks joe biden kamala harris ,2020-11-09,0.0,0.0,0.0,0.0,0.0,0.0,0.0,0.0,0.0
1447,Kamala Harris,victory joe biden kamala harris may set forth progressive politics hope nations kamala harri ,2020-11-09,0.182,0.818,0.0,0.4404,0.2,0.8,0.0,0.0,0.0
1448,Kamala Harris,nothing amusing indian people trying wrap heads around kamala harris hear h ,2020-11-09,0.0,0.821,0.179,-0.2924,0.0,1.0,0.0,0.0,0.0
1449,Kamala Harris,okay gonna objectify vice president elect kamala harris hot ,2020-11-09,0.192,0.808,0.0,0.2263,0.0,0.0,0.0,1.0,0.0
1450,Kamala Harris,dont particularly agree kamala harris vp policies definitely think coul ,2020-11-09,0.207,0.614,0.179,0.0959,0.0,0.67,0.0,0.0,0.33
1451,Kamala Harris,pack bags loser fired people congratulations pre ,2020-11-09,0.262,0.268,0.47,-0.4767,0.0,0.0,0.0,1.0,0.0
1452,Kamala Harris,daily show trevor noah praises return speeches sound like speeches upon biden harris election ,2020-11-09,0.33,0.67,0.0,0.7096,0.0,0.0,0.0,0.0,0.0
1453,Kamala Harris,kamala harriss ancestral tamil nadu village celebrates biden harris win us election via ,2020-11-09,0.405,0.595,0.0,0.8176,0.0,0.0,0.0,0.0,0.0
1454,Kamala Harris,pack bags loser fired people congratulations pres ,2020-11-09,0.262,0.268,0.47,-0.4767,0.0,0.0,0.0,1.0,0.0
1455,Kamala Harris,pack bags loser fired people congratulations president elect vice ,2020-11-09,0.231,0.355,0.414,-0.4767,0.0,0.0,0.0,1.0,0.0
1456,Kamala Harris,kamala harriss ancestral tamil nadu village celebrates biden harris win us election via ,2020-11-09,0.405,0.595,0.0,0.8176,0.0,0.0,0.0,0.0,0.0
1457,Kamala Harris,consider kamala harris indian part indian indian ,2020-11-09,0.0,0.0,0.0,0.0,0.0,0.0,0.0,1.0,0.0
1458,Kamala Harris,understand belief irresponsible politically driven rhetori ,2020-11-09,0.0,0.633,0.367,-0.4404,0.0,0.5,0.0,0.5,0.0
1459,Kamala Harris,pack bags loser fired people congratulations president elect vice ,2020-11-09,0.231,0.355,0.414,-0.4767,0.0,0.0,0.0,1.0,0.0
1460,Kamala Harris,wore makeup today vice president elect soror kamala harris aka ,2020-11-09,0.0,0.0,0.0,0.0,0.0,0.0,0.0,0.0,0.0
1461,Kamala Harris,yea think think thats possible havent seen voters joe biden kamala harris say ,2020-11-09,0.0,0.0,0.0,0.0,0.0,0.25,0.0,0.0,0.75
1462,Kamala Harris,biden knows way around fine f gop im one ,2020-11-09,0.205,0.795,0.0,0.2023,0.0,0.0,1.0,0.0,0.0
1463,Kamala Harris,pack bags loser fired people congratulations president elec ,2020-11-09,0.245,0.314,0.44,-0.4767,0.0,0.0,0.0,1.0,0.0
1464,Kamala Harris,eric garcetti kamala harris amp katie porter diane feinstein df needs ,2020-11-09,0.0,0.0,0.0,0.0,0.0,0.0,0.0,0.0,0.0
1465,Kamala Harris,pack bags loser fired people congratulations preside ,2020-11-09,0.262,0.268,0.47,-0.4767,0.0,0.0,0.0,1.0,0.0
1466,Kamala Harris,top head kam ,2020-11-09,0.474,0.526,0.0,0.2023,0.0,0.5,0.0,0.0,0.5
1467,Kamala Harris,pack bags loser fired people congratulations president elect vice ,2020-11-09,0.231,0.355,0.414,-0.4767,0.0,0.0,0.0,1.0,0.0
1468,Kamala Harris,unacceptable withdraw life peerage uk peer sparks outrage calling kamala harris indian ,2020-11-09,0.0,0.613,0.387,-0.743,0.0,1.0,0.0,0.0,0.0
1469,Kamala Harris,great pleasure congratulate 46th president us president elected joe biden ,2020-11-09,0.611,0.389,0.0,0.9001,0.0,0.0,1.0,0.0,0.0
1470,Kamala Harris,yall gotta hold biden kamala harris pedigree character held trump pence ca ,2020-11-09,0.0,0.0,0.0,0.0,0.0,0.5,0.0,0.0,0.5
1471,Kamala Harris,pack bags loser fired people congratulations president elect vice ,2020-11-09,0.231,0.355,0.414,-0.4767,0.0,0.0,0.0,1.0,0.0
1472,Kamala Harris,kamala harris made history first black woman first person south asian descent elected v ,2020-11-09,0.0,0.0,0.0,0.0,0.0,0.25,0.0,0.25,0.5
1473,Kamala Harris,pack bags loser fired people congratulations president elect vice ,2020-11-09,0.231,0.355,0.414,-0.4767,0.0,0.0,0.0,1.0,0.0
1474,Kamala Harris,pack bags loser fired people congratul ,2020-11-09,0.0,0.364,0.636,-0.7906,0.0,0.0,0.0,1.0,0.0
1475,Kamala Harris,libs wowee kamala harris first female vice pre dont got healthcare police reform cann ,2020-11-09,0.0,0.0,0.0,0.0,0.0,0.0,0.0,0.0,1.0
1476,Kamala Harris,pack bags loser fired people congratulations president elect vice ,2020-11-09,0.231,0.355,0.414,-0.4767,0.0,0.0,0.0,1.0,0.0
1477,Kamala Harris,glass ceiling shattered black sorority members react vp elect kamala harris history making win ,2020-11-09,0.201,0.635,0.164,0.1779,0.0,0.33,0.0,0.67,0.0
1478,Kamala Harris,pack bags loser fired people congratulations president elect vice ,2020-11-09,0.231,0.355,0.414,-0.4767,0.0,0.0,0.0,1.0,0.0
1479,Kamala Harris,one 756 million americans voted president joe biden vice president kamala harri ,2020-11-09,0.0,0.0,0.0,0.0,1.0,0.0,0.0,0.0,0.0
1480,Kamala Harris,pack bags loser fired people congratulations president elect vice ,2020-11-09,0.231,0.355,0.414,-0.4767,0.0,0.0,0.0,1.0,0.0
1481,Kamala Harris,congratulations kamala harris first woman vice president usa 2020 history defining year reflection ,2020-11-09,0.245,0.755,0.0,0.5994,0.0,0.5,0.0,0.0,0.5
1482,Kamala Harris,kamala harris finna arrest pirated music downloaded pod 2013 ,2020-11-09,0.0,0.769,0.231,-0.34,0.0,0.0,0.0,0.0,0.0
1483,Kamala Harris,everyone saying come smt pratibha patil 1st female president india could inspire feminist ,2020-11-09,0.236,0.764,0.0,0.5719,0.0,0.0,0.5,0.0,0.5
1484,Kamala Harris,pack bags loser fired people congratulations ,2020-11-09,0.281,0.216,0.504,-0.4767,0.0,0.0,0.0,1.0,0.0
1485,Kamala Harris,pack bags loser fired people congratulations president ,2020-11-09,0.262,0.268,0.47,-0.4767,0.0,0.0,0.0,1.0,0.0
1486,Kamala Harris,predict kamala harris wear traditional indian saree inauguration ball biden harris2020 2021 ,2020-11-09,0.0,0.0,0.0,0.0,0.0,0.0,0.0,0.0,0.0
1487,Kamala Harris,fact trump lost going away joe biden amp kamala harris legally people voiced ,2020-11-09,0.095,0.748,0.156,-0.2263,0.2,0.4,0.0,0.2,0.2
1488,Kamala Harris,pack bags loser fired people congratulations president elect ,2020-11-09,0.245,0.314,0.44,-0.4767,0.0,0.0,0.0,1.0,0.0
1489,Kamala Harris,president elect joe biden vice president elect kamala harris participate meeting bidens transition ,2020-11-09,0.0,0.0,0.0,0.0,1.0,0.0,0.0,0.0,0.0
1490,Kamala Harris,meet kamala harris first woman first black person first south asian american elected vice president ,2020-11-09,0.0,0.0,0.0,0.0,0.0,0.0,0.0,0.0,1.0
1491,Kamala Harris,pack bags loser fired people congratulations president elect vice ,2020-11-09,0.231,0.355,0.414,-0.4767,0.0,0.0,0.0,1.0,0.0
1492,Kamala Harris,please appoint katie porter take place kamala harris mitch mc connell republican senators need ,2020-11-09,0.15,0.85,0.0,0.3182,0.0,0.5,0.0,0.5,0.0
