,Search,Tweet,Entered on,pos_score,neu_score,neg_score,compound_score,angry_score,fear_score,happy_score,sad_score,surprise_score
830,liberal,voting liberal democrats bit like heath ledger protesting ali g ,2020-11-02,0.203,0.569,0.228,-0.0772,0.0,0.0,0.0,0.0,0.0
831,liberal,wonder daughters always seemed liberal laura ,2020-11-02,0.0,0.0,0.0,0.0,0.0,0.0,0.0,0.67,0.33
832,liberal,key skill liberal mp speak long periods time without ever addressing content question ,2020-11-02,0.0,0.0,0.0,0.0,0.0,0.67,0.0,0.17,0.17
833,liberal,liberal movie star say theyre going move united states trump wins ironic part ,2020-11-02,0.361,0.556,0.083,0.7184,0.0,0.25,0.0,0.25,0.5
834,liberal,awesome ,2020-11-02,1.0,0.0,0.0,0.6249,0.0,0.0,0.0,0.0,1.0
835,liberal,remembering spent nov 4 2016 reassuring sobbing liberal boss trumps election wasnt dark anti im ,2020-11-02,0.255,0.602,0.142,0.2644,0.0,0.0,0.0,0.67,0.33
836,liberal,boomhauer bill could definitely see boomhauer could crypto liberal thou ,2020-11-02,0.231,0.769,0.0,0.4019,0.0,1.0,0.0,0.0,0.0
837,liberal,cw election riot stuff anyway go back college town tonight one liberal col ,2020-11-02,0.0,0.769,0.231,-0.5574,0.25,0.5,0.0,0.25,0.0
838,liberal,laughing loud yes im sick trademark wo nd erb ad tube getting way breadtube want real ,2020-11-02,0.32,0.533,0.147,0.4404,0.0,0.25,0.0,0.75,0.0
839,liberal,liberal teachers professors brainwashing pray go families values morals ,2020-11-02,0.37,0.444,0.185,0.3612,0.0,0.5,0.0,0.0,0.5
840,liberal,kisses darling favorite liberal vegan scream halloween queen ,2020-11-02,0.601,0.238,0.161,0.8126,0.0,0.5,0.5,0.0,0.0
841,liberal,enough talk talk cheap time europe kick migrants leftist liberal bootlickers let th ,2020-11-02,0.0,0.0,0.0,0.0,0.0,0.0,0.0,0.5,0.5
842,liberal,oh mistake actually wasted time chat another skin color gender myopic liberal set ,2020-11-02,0.0,0.663,0.337,-0.6808,0.0,0.33,0.0,0.33,0.33
843,liberal,career politician fighter pilot amp patriot knows like raise family ca25 ,2020-11-02,0.313,0.687,0.0,0.4767,0.0,0.0,0.0,0.5,0.5
844,liberal,100 sure donald loves black people biggest prob ,2020-11-02,0.5,0.5,0.0,0.7184,0.0,0.5,0.5,0.0,0.0
845,liberal,im literally grateful im liberal college campus hide trump supporters sta ,2020-11-02,0.378,0.513,0.109,0.6369,0.25,0.25,0.25,0.0,0.25
846,liberal,read fukuyama imply could advance beyond liberal democracy decl ,2020-11-02,0.0,0.0,0.0,0.0,0.0,1.0,0.0,0.0,0.0
847,liberal,yes need places fact checkers facts well known liberal bias ,2020-11-02,0.364,0.53,0.106,0.5267,0.0,0.5,0.0,0.5,0.0
848,liberal,reality well known liberal bias ,2020-11-02,0.323,0.462,0.215,0.1779,0.0,0.0,0.0,0.0,0.0
849,liberal,remember nazis white supremacists looted burned obama ye ,2020-11-02,0.0,0.778,0.222,-0.25,0.0,0.5,0.0,0.5,0.0
850,liberal,every liberal friend wanted bernie one wanted hillary biden supported hate tru ,2020-11-02,0.302,0.495,0.203,0.2023,0.0,0.0,0.5,0.5,0.0
851,liberal,true full empty promises democratic liberal states look like 3rd wor ,2020-11-02,0.473,0.419,0.108,0.7269,0.0,0.0,0.0,1.0,0.0
852,liberal,correct see reporting anything negative regarding biden scandals ,2020-11-02,0.0,0.465,0.535,-0.7845,0.0,0.0,0.33,0.33,0.33
853,liberal,agreed unfortunately level cognitive dissonance average p ,2020-11-02,0.247,0.471,0.282,-0.0772,0.0,0.5,0.0,0.5,0.0
854,liberal,yeah liberal ,2020-11-02,0.688,0.312,0.0,0.296,0.0,0.0,0.0,0.0,0.0
855,liberal,,2020-11-02,0.0,0.0,0.0,0.0,0.0,0.0,0.0,0.0,0.0
856,liberal,proven lie question many liberal took time look see ,2020-11-02,0.0,0.0,0.0,0.0,0.0,0.67,0.0,0.0,0.33
857,liberal,liberal gamer voted donald trump 2020 election via tube ,2020-11-02,0.0,0.0,0.0,0.0,0.0,0.5,0.0,0.0,0.5
858,liberal,point liberal conservative family watches fox news nightly bueno ,2020-11-02,0.0,0.0,0.0,0.0,0.0,0.0,0.0,0.25,0.75
859,liberal,liberal leftist cities hmm ,2020-11-02,0.0,0.0,0.0,0.0,0.0,0.0,0.0,0.0,0.0
860,liberal,slow trickle common sense treatment planet ensure massive profits stay way massi ,2020-11-02,0.355,0.645,0.0,0.6705,0.33,0.67,0.0,0.0,0.0
861,liberal,ive following sides social media years twitter bw liberal playgro ,2020-11-02,0.0,0.0,0.0,0.0,0.0,0.5,0.0,0.5,0.0
862,liberal,glad involved star wars anymore privileged liberal hack know anything los ,2020-11-02,0.337,0.457,0.206,0.3182,0.0,0.5,0.5,0.0,0.0
863,liberal,unlike great powers history united states liberal democracy retains capacity rebuild ,2020-11-02,0.434,0.566,0.0,0.7845,0.25,0.25,0.25,0.25,0.0
864,liberal,let liberal tears flow like river ,2020-11-02,0.298,0.476,0.226,0.1531,0.0,0.0,0.0,1.0,0.0
865,liberal,cut cloth ,2020-11-02,0.0,0.323,0.677,-0.2732,0.0,0.0,0.0,0.0,0.0
866,liberal,get private school ai cheap liberal elite ,2020-11-02,0.0,0.0,0.0,0.0,0.0,0.0,0.0,0.0,0.0
867,liberal,governor whitmer leader without cause atypical leftist liberal democrats leaders ,2020-11-02,0.0,0.0,0.0,0.0,0.0,0.0,0.0,0.0,0.0
868,liberal,90 gerrymandered districts federally mandated ensure ,2020-11-02,0.342,0.658,0.0,0.3818,0.0,0.0,0.0,0.0,0.0
869,liberal,,2020-11-02,0.0,0.0,0.0,0.0,0.0,0.0,0.0,0.0,0.0
870,liberal,liberal democrat georgia voted straight blue biden harris2020l ,2020-11-02,0.213,0.787,0.0,0.2263,0.0,0.0,0.0,1.0,0.0
871,liberal,businesses board liberal cities due rioting looting lefties lefties omg could trum ,2020-11-02,0.0,0.0,0.0,0.0,0.0,0.67,0.0,0.0,0.33
872,liberal,tj leftist always part lol defini ,2020-11-02,0.359,0.641,0.0,0.4215,0.0,0.0,0.0,1.0,0.0
873,liberal,liberal market theory appropriated idea self trope individual acting ou ,2020-11-02,0.0,0.0,0.0,0.0,0.0,0.67,0.33,0.0,0.0
874,liberal,bernie sanders holds zoom liberal squad ,2020-11-02,0.0,0.0,0.0,0.0,0.0,0.0,0.0,0.0,0.0
875,liberal,dear tim grant exemption wear mask dont complain contract covid fact ,2020-11-02,0.474,0.526,0.0,0.7359,0.0,0.25,0.0,0.5,0.25
876,liberal,live pa voting biden family lives ok voting trump thinks virus li ,2020-11-02,0.167,0.833,0.0,0.296,0.0,0.0,0.0,0.0,1.0
877,liberal,opinion valuable anybodys else yet promote ,2020-11-02,0.588,0.412,0.0,0.6908,0.0,0.0,0.0,0.0,0.0
878,liberal,say im liberal say im conservative amy mc grath ,2020-11-02,0.0,0.0,0.0,0.0,0.0,0.0,0.0,0.0,1.0
879,liberal,justin trudeau lib ,2020-11-02,0.0,0.0,0.0,0.0,0.0,0.0,0.0,0.0,0.0
880,liberal,barking amp growling dog sounds whoa seems like demonic spirits people believe lies ,2020-11-02,0.153,0.675,0.172,-0.0772,0.25,0.0,0.0,0.5,0.25
881,liberal,good luck sir grew south liberal democrat little faith ar ,2020-11-02,0.546,0.454,0.0,0.813,0.0,0.0,0.67,0.0,0.33
882,liberal,liberal left countdown socialism let show whats really going happen tomorrow polls vote ,2020-11-02,0.0,0.0,0.0,0.0,0.0,0.33,0.0,0.33,0.33
883,liberal,democrats dnc opinion rev even commit multiple actions voter fraud wil ,2020-11-02,0.147,0.6,0.253,-0.3818,0.0,1.0,0.0,0.0,0.0
884,liberal,,2020-11-02,0.0,0.0,0.0,0.0,0.0,0.0,0.0,0.0,0.0
885,liberal,laughing loud youre liberal ,2020-11-02,0.516,0.484,0.0,0.4939,0.0,0.0,0.0,0.0,0.0
886,liberal,dictatory ,2020-11-02,0.0,0.0,0.0,0.0,0.0,0.0,0.0,0.0,0.0
887,liberal,exactly least sciences liber ,2020-11-02,0.0,0.0,0.0,0.0,0.0,0.0,0.0,0.0,0.0
888,liberal,mean got university without told wha ,2020-11-02,0.0,0.0,0.0,0.0,0.0,0.0,0.0,1.0,0.0
889,liberal,vote president tomorrow america make liberal tears flow ,2020-11-02,0.0,0.787,0.213,-0.2263,0.0,0.0,0.0,1.0,0.0
890,liberal,even telling labor people seem comfortable idea winning elections liberal help w ,2020-11-02,0.54,0.46,0.0,0.8555,0.0,0.0,0.25,0.5,0.25
891,liberal,worst insult ever called bird app liberal ,2020-11-02,0.0,0.403,0.597,-0.8126,0.33,0.0,0.0,0.33,0.33
892,liberal,could walk street holding hands ex gf austin would get whistled honked ,2020-11-02,0.0,0.0,0.0,0.0,0.0,0.5,0.0,0.5,0.0
893,liberal,used liberal found actually meant ,2020-11-02,0.0,0.0,0.0,0.0,0.0,0.0,0.0,0.0,1.0
894,liberal,theyre mostly center right network 3 4 liberal opinion hosts primetime really ,2020-11-02,0.0,0.0,0.0,0.0,0.0,0.67,0.0,0.0,0.33
895,liberal,laugh keep resorting ,2020-11-02,0.643,0.357,0.0,0.5574,0.0,0.0,0.0,0.0,0.0
896,liberal,liberal rioting ,2020-11-02,0.0,0.0,0.0,0.0,0.0,1.0,0.0,0.0,0.0
897,liberal,liberal extremists 10 days rioting raping looting justified deaths career crimin ,2020-11-02,0.164,0.545,0.291,-0.4767,0.0,0.75,0.25,0.0,0.0
898,liberal,another reminder blame black men trump wins 7 enough sway election white liberal media ,2020-11-02,0.216,0.643,0.14,0.3182,0.0,0.5,0.0,0.0,0.5
899,liberal,tax churches ,2020-11-02,0.0,0.0,0.0,0.0,0.0,0.0,0.0,0.0,1.0
900,liberal,hence said backbone possible unpackage classic liberal would stand ,2020-11-02,0.0,0.0,0.0,0.0,0.0,0.67,0.0,0.0,0.33
901,liberal,3 pa counties list lean liberal hmm rump doj enforcers ca ,2020-11-02,0.0,0.0,0.0,0.0,0.0,0.0,0.0,0.0,0.0
902,liberal,hate like theres really cool pride thing capital live liberal ,2020-11-02,0.445,0.343,0.212,0.4716,0.0,0.17,0.33,0.17,0.33
903,liberal,would share medicare give free place stay guess im socialist lo ,2020-11-02,0.379,0.621,0.0,0.6705,0.17,0.5,0.17,0.0,0.17
904,liberal,inverse true women higher body count liberal lesson ,2020-11-02,0.286,0.714,0.0,0.4215,0.0,1.0,0.0,0.0,0.0
905,liberal,100 slur oh x yea hes probably liberal ,2020-11-02,0.0,0.0,0.0,0.0,0.0,1.0,0.0,0.0,0.0
906,liberal,yet ignores cause behind much divide 8 years unapologetic li ,2020-11-02,0.0,0.792,0.208,-0.2732,0.0,0.0,0.0,1.0,0.0
907,liberal,treated contempt pretensions dedicated gaslighter liberal tende ,2020-11-02,0.254,0.424,0.322,-0.2023,0.0,0.0,0.0,0.0,1.0
908,liberal,yeah town wicked liberal didnt think parts got bad ,2020-11-02,0.146,0.397,0.457,-0.6908,0.0,0.0,0.0,0.67,0.33
909,liberal,streets boulder flooded liberal tears tomorrow night ,2020-11-02,0.0,0.759,0.241,-0.2263,0.0,0.33,0.0,0.67,0.0
910,liberal,longer mother voting trump sickening liberal left cons ,2020-11-02,0.0,0.673,0.327,-0.5267,0.0,0.0,0.0,0.0,1.0
911,liberal,woman bit lame wet liberal mis gender ,2020-11-02,0.0,0.682,0.318,-0.4215,0.0,0.0,0.0,0.0,0.0
912,liberal,6call liberal america want someone presidential happy someone finally jus ,2020-11-02,0.385,0.615,0.0,0.6124,0.0,0.5,0.5,0.0,0.0
913,liberal,tell liberal national party see trump model viable path follow w ,2020-11-02,0.231,0.769,0.0,0.4019,0.0,0.25,0.25,0.25,0.25
914,liberal,course said staunch liberal cuck ,2020-11-02,0.0,0.0,0.0,0.0,0.0,0.0,0.0,0.0,1.0
915,liberal,macmillan self defined social democrat per alistair horne excellent biography indeed ,2020-11-02,0.27,0.73,0.0,0.5719,0.0,0.67,0.33,0.0,0.0
916,liberal,f liberal seriously ,2020-11-02,0.0,0.37,0.63,-0.1779,0.0,0.0,0.0,0.0,0.0
917,liberal,exploding liberal heads free world ,2020-11-02,0.452,0.548,0.0,0.5106,0.0,0.5,0.5,0.0,0.0
918,liberal,crowd white liberal furious disgusted treatm ,2020-11-02,0.0,0.36,0.64,-0.7964,0.33,0.33,0.0,0.33,0.0
919,liberal,biden policies hit miss hits important believe ,2020-11-02,0.214,0.595,0.19,0.0516,0.4,0.2,0.2,0.2,0.0
920,liberal,one died purely covid19 usa average 25 un ,2020-11-02,0.0,0.66,0.34,-0.5574,0.0,1.0,0.0,0.0,0.0
921,liberal,ex liberal stafferspollieslobbyists would take blame anything woman throw bus ,2020-11-02,0.0,0.789,0.211,-0.34,0.0,1.0,0.0,0.0,0.0
922,liberal,laughing loud poc liberal republican catholic school ,2020-11-02,0.348,0.652,0.0,0.4939,0.0,0.0,0.0,0.0,0.0
923,liberal,main issue today libera ,2020-11-02,0.0,0.0,0.0,0.0,0.0,1.0,0.0,0.0,0.0
924,liberal,im confident trump going win im even going vote tomorrow join brothers show pathet ,2020-11-02,0.455,0.545,0.0,0.8481,0.0,0.5,0.0,0.17,0.33
925,liberal,really bad habit lot popular leftist commentators describing trump behavior totall ,2020-11-02,0.18,0.577,0.243,-0.2484,0.0,0.0,0.0,0.5,0.5
926,liberal,folks tend see immigration issues incorrectly thousandsmillions ppl come america amp n ,2020-11-02,0.0,0.0,0.0,0.0,0.0,1.0,0.0,0.0,0.0
927,liberal,acceleration want brown people become liberal europe ,2020-11-02,0.178,0.822,0.0,0.0772,0.0,0.0,0.0,1.0,0.0
928,liberal,jonathan turley election day riots get dems liberal media share blame ,2020-11-02,0.138,0.503,0.358,-0.5423,0.0,0.5,0.5,0.0,0.0
929,liberal,really mrs patel blame happens damn appeasing liberal go ,2020-11-02,0.15,0.449,0.401,-0.5209,0.5,0.0,0.0,0.0,0.5
930,liberal,liberal women worse lib men stand ,2020-11-02,0.0,0.617,0.383,-0.4767,0.0,0.5,0.0,0.5,0.0
931,liberal,im liberal im voting trump soo youre conservative ,2020-11-02,0.0,0.0,0.0,0.0,0.0,0.0,0.0,0.0,1.0
932,liberal,yes foetid nest liberal cronies board escaped attention holgate takes fall ,2020-11-02,0.18,0.6,0.22,-0.1531,0.0,0.33,0.0,0.33,0.33
933,liberal,fox news tucker carlson tonight breaks cable news ratings records love capitalism ,2020-11-02,0.276,0.724,0.0,0.6369,0.0,0.0,0.33,0.33,0.33
934,liberal,check back wednesday send crate tissues friends fa ,2020-11-02,0.307,0.693,0.0,0.4767,0.0,0.5,0.5,0.0,0.0
935,liberal,joe_warmington dare oppose liberal point view accuse ,2020-11-02,0.0,0.769,0.231,-0.2023,0.0,0.5,0.0,0.0,0.5
936,liberal,lnow bible teacher liberal love much talks blm politics lot say ,2020-11-02,0.296,0.704,0.0,0.6369,0.0,0.25,0.25,0.25,0.25
937,liberal,welfare get job ,2020-11-02,0.0,0.0,0.0,0.0,0.0,1.0,0.0,0.0,0.0
938,liberal,vote joe dont need liberal trump yeah real women vote joe ,2020-11-02,0.18,0.82,0.0,0.296,0.0,0.0,0.0,0.5,0.5
939,liberal,dawkins liberal tell effort logically end pandemic ,2020-11-02,0.0,0.0,0.0,0.0,0.0,0.0,0.0,1.0,0.0
940,liberal,next week philip morris asks willing change help reduce lung cancer ,2020-11-02,0.168,0.559,0.273,-0.4019,0.0,0.5,0.0,0.0,0.5
941,liberal,please tell anti abortion sign says everyone ,2020-11-02,0.24,0.521,0.24,0.0,0.0,0.25,0.0,0.5,0.25
942,liberal,shouldnt entire liberal left right ,2020-11-02,0.0,0.0,0.0,0.0,0.0,1.0,0.0,0.0,0.0
943,liberal,loud proud liberal ,2020-11-02,0.608,0.392,0.0,0.4767,0.0,0.0,1.0,0.0,0.0
944,liberal,love australia chances also love liberal party ausvotes19 ,2020-11-02,0.763,0.237,0.0,0.9169,0.0,0.33,0.67,0.0,0.0
945,liberal,reminds scene russian docudrama trotsky wife natalia sedova chi ,2020-11-02,0.0,0.0,0.0,0.0,0.0,0.0,0.0,0.0,0.0
946,liberal,highlight part said antifa rioting believe said posting liberal views ,2020-11-02,0.211,0.789,0.0,0.34,0.0,0.5,0.0,0.0,0.5
947,liberal,thats standard map without changes site 270 win trump trying fix liberal bias 1776 act ,2020-11-02,0.209,0.714,0.077,0.5267,0.0,0.0,0.0,0.0,1.0
948,liberal,believe liberal cities preparing mess violent losers ,2020-11-02,0.0,0.29,0.71,-0.8689,0.5,0.0,0.0,0.5,0.0
949,liberal,1 talk exactly like liberal 2 youre right wont successful ,2020-11-02,0.216,0.518,0.265,-0.1461,0.0,1.0,0.0,0.0,0.0
950,liberal,one racist people government filled hate venom anyone ,2020-11-02,0.0,0.438,0.562,-0.8271,0.0,0.5,0.0,0.5,0.0
951,liberal,said rioting even liberal lol literally ,2020-11-02,0.359,0.641,0.0,0.4215,0.0,0.5,0.0,0.0,0.5
952,liberal,soon liberal gets elected lying begins ,2020-11-02,0.0,0.595,0.405,-0.5267,0.0,0.0,0.0,0.0,0.0
953,liberal,right winger republican numb nuts consider liberal true li ,2020-11-02,0.207,0.444,0.348,-0.2263,0.0,0.33,0.0,0.67,0.0
954,liberal,canadian house commons least 1 million signatures remove pm justin trudeau liberal government ,2020-11-02,0.0,0.0,0.0,0.0,0.0,0.5,0.0,0.0,0.5
955,liberal,awkward middle ground liberals call conservative conservatives call liberal ,2020-11-02,0.0,0.833,0.167,-0.1531,0.0,0.0,0.0,1.0,0.0
956,liberal,oh yes liberal tears tastes lot like 20 coffee craft beer heavy dose netflix debt ,2020-11-02,0.252,0.534,0.214,0.2023,0.0,0.0,0.2,0.8,0.0
957,liberal,idk location know personally liberal either way ,2020-11-02,0.0,0.811,0.189,-0.1027,0.0,0.0,0.0,0.0,0.0
958,liberal,never said accuse racism saying thats general ,2020-11-02,0.494,0.506,0.0,0.5975,0.0,0.0,0.0,0.0,1.0
959,liberal,sounds liberal ,2020-11-02,0.0,0.0,0.0,0.0,0.0,0.0,0.0,0.0,0.0
960,liberal,guess missed liberal cities burning ,2020-11-02,0.0,0.645,0.355,-0.296,0.0,0.0,0.0,0.67,0.33
961,liberal,us violated prominent liberal principles principles free trade democracy equalit ,2020-11-02,0.35,0.438,0.212,0.296,0.0,0.67,0.33,0.0,0.0
962,liberal,im pretty sure reason liberal cities hellholes liberal ,2020-11-02,0.478,0.522,0.0,0.6705,0.0,0.33,0.33,0.33,0.0
963,liberal,back west wing terri theres room liberal media metropolitan elite optimism ,2020-11-02,0.259,0.741,0.0,0.5423,0.0,1.0,0.0,0.0,0.0
964,liberal,yup w ,2020-11-02,0.0,0.0,0.0,0.0,0.0,0.0,0.0,0.0,0.0
965,liberal,oh yeah im sorry ive dented sensitivities liberal democrats ,2020-11-02,0.21,0.667,0.124,0.2263,0.0,0.0,0.0,1.0,0.0
966,liberal,nice liberal talking points covid 19 little democrat governor ,2020-11-02,0.259,0.741,0.0,0.4215,0.0,0.0,0.5,0.0,0.5
967,liberal,get fucking clue ,2020-11-02,0.0,0.0,0.0,0.0,0.0,0.0,0.5,0.0,0.5
968,liberal,far mine think demographics weird year ,2020-11-02,0.0,0.746,0.254,-0.1779,0.0,0.5,0.0,0.0,0.5
969,liberal,st augustine fl flagler college one best small private liberal arts schools cheaper ,2020-11-02,0.259,0.741,0.0,0.6369,0.0,0.5,0.0,0.0,0.5
970,liberal,liberal cnn believe ca censor free speech maga ,2020-11-02,0.268,0.488,0.244,0.0772,0.0,0.5,0.5,0.0,0.0
971,liberal,racists assholes coming liberal city spreading corona fuck lying prick ,2020-11-02,0.0,0.231,0.769,-0.9485,0.0,0.33,0.33,0.0,0.33
972,liberal,auspol wrong politicians amp public servants better ordinary people normal criminal matt ,2020-11-02,0.158,0.489,0.353,-0.5574,0.0,0.33,0.0,0.33,0.33
973,liberal,standby spineless terrorist appeasing liberal pussies blaming islamophobia mental health etc vienna attack ,2020-11-02,0.091,0.409,0.5,-0.875,0.5,0.5,0.0,0.0,0.0
974,liberal,non mask protesters ones really responsible spi ,2020-11-02,0.273,0.527,0.2,0.1761,0.0,0.5,0.0,0.25,0.25
975,liberal,push back liberal lies vote trump make america great ,2020-11-02,0.295,0.504,0.201,0.3182,0.0,0.25,0.25,0.25,0.25
976,liberal,oh recognize help grew communism ,2020-11-02,0.403,0.597,0.0,0.4019,0.0,0.0,0.0,0.0,1.0
977,liberal,must joking done nothing except lie apart abysmal failure ,2020-11-02,0.156,0.574,0.27,-0.34,0.0,0.0,0.5,0.5,0.0
978,liberal,typical liberal bullshit using death man push political agenda fucking absolutely disgusting ,2020-11-02,0.0,0.435,0.565,-0.9131,0.0,0.67,0.17,0.17,0.0
979,liberal,allow biden get pardon family step let liberal leftist kamala decimate ou ,2020-11-02,0.296,0.704,0.0,0.4939,0.0,0.0,0.0,0.67,0.33
980,liberal,like speaking country ousted corrupt conservative president voted liberal one ,2020-11-02,0.217,0.783,0.0,0.3612,0.0,1.0,0.0,0.0,0.0
981,liberal,opposition fox news owned disney appears play friendly liberal let ,2020-11-02,0.412,0.588,0.0,0.6808,0.0,0.2,0.2,0.6,0.0
982,liberal,recall ottawa chief police defended 1 b gun registry boondoggle ,2020-11-02,0.0,0.745,0.255,-0.34,0.0,0.0,0.0,0.0,0.0
983,liberal,voted feet fleeing liberal utopia ny nd im im going vote ,2020-11-02,0.0,0.0,0.0,0.0,0.0,1.0,0.0,0.0,0.0
984,liberal,liberal beech profess liberalism anyone screw terrorism ,2020-11-02,0.0,0.455,0.545,-0.7184,0.0,1.0,0.0,0.0,0.0
985,liberal,canadian house commons least 1 million signatures remove pm justin trudeau liberal government ,2020-11-02,0.0,0.0,0.0,0.0,0.0,0.5,0.0,0.0,0.5
986,liberal,months still looking liberal explain run ,2020-11-02,0.0,0.0,0.0,0.0,0.0,0.0,0.0,0.0,0.0
987,liberal,ah hence concern hater liberal party big time thank update ,2020-11-02,0.347,0.467,0.187,0.34,0.0,0.0,0.0,1.0,0.0
988,liberal,always laugh someone like tweet go raging liberal card etc ,2020-11-02,0.37,0.424,0.206,0.4019,0.5,0.0,0.0,0.5,0.0
989,liberal,im cali liberal family owns gun dad military kind given ,2020-11-02,0.246,0.58,0.174,0.25,0.0,0.33,0.33,0.0,0.33
990,liberal,natural liberal young heart conservat ,2020-11-02,0.385,0.615,0.0,0.3612,0.0,0.0,0.0,1.0,0.0
991,liberal,liberal elites think platitudes nice words solve problem ,2020-11-02,0.374,0.407,0.22,0.2263,0.2,0.4,0.2,0.0,0.2
992,liberal,voting social justice ideology platform anti enlightenment amp conflicts liberal democracy ,2020-11-02,0.209,0.491,0.301,-0.128,0.0,0.67,0.0,0.33,0.0
993,liberal,see making liberal understand two different things ,2020-11-02,0.0,0.0,0.0,0.0,0.0,0.0,0.0,0.5,0.5
994,liberal,getting standards marriage modern liberal civilisation al ,2020-11-02,0.0,0.0,0.0,0.0,0.0,0.0,0.0,0.0,0.0
995,liberal,sounds like liberal plan propaganda fool taxpayers canada ,2020-11-02,0.202,0.403,0.395,-0.34,0.0,0.0,0.0,0.0,0.0
996,liberal,basicincome ,2020-11-02,0.0,0.0,0.0,0.0,0.0,0.0,0.0,0.0,0.0
997,liberal,right next door austria switzerland liberal gun laws world ,2020-11-02,0.0,0.769,0.231,-0.34,0.0,0.5,0.0,0.0,0.5
998,liberal,even imagine socialist america canada midst worst socialist lib ,2020-11-02,0.0,0.661,0.339,-0.6249,0.0,0.0,0.0,0.5,0.5
999,liberal,popularity inflated hundreds millions dollars free advertising hyperbolically f ,2020-11-02,0.516,0.484,0.0,0.7506,0.0,0.0,1.0,0.0,0.0
1000,liberal,r hottest females liberal like really lie political beliefs chance hey guys vote biden ,2020-11-02,0.29,0.71,0.0,0.5423,0.0,0.33,0.0,0.0,0.67
1001,liberal,dumbest liberal tweet ever congratulations little less intelligent ,2020-11-02,0.433,0.342,0.226,0.464,0.0,0.0,0.0,0.0,1.0
1002,liberal,important count every vote ,2020-11-02,0.375,0.625,0.0,0.2023,0.0,0.5,0.5,0.0,0.0
1003,liberal,omg late liberal government ,2020-11-02,0.0,0.0,0.0,0.0,0.0,0.0,0.0,0.5,0.5
1004,liberal,yes im liberal drink blood children pizza shop basements ,2020-11-02,0.252,0.748,0.0,0.4019,0.0,0.5,0.0,0.5,0.0
1005,liberal,thank donald trump finishing job potus john f kennedy started wh ,2020-11-02,0.217,0.783,0.0,0.3612,0.0,0.5,0.0,0.0,0.5
1006,liberal,education teaches people think teach people lib ,2020-11-02,0.0,0.0,0.0,0.0,0.0,0.0,0.0,0.67,0.33
1007,liberal,btwin seriousness liberal af grew army brat army veteran father fn love fir ,2020-11-02,0.256,0.671,0.073,0.6124,0.0,0.5,0.5,0.0,0.0
1008,liberal,hey look liberal ladies getting ready tomorrow ,2020-11-02,0.294,0.706,0.0,0.3612,0.0,0.0,0.5,0.0,0.5
1009,liberal,liberal losers wo accept election results ,2020-11-02,0.26,0.4,0.34,-0.2023,0.0,0.0,0.0,1.0,0.0
1010,liberal,like age realize people said financially conservative socially liberal full shit ,2020-11-02,0.166,0.596,0.238,-0.2732,0.25,0.0,0.25,0.0,0.5
1011,liberal,mc conaughey referred dudes austin tx liberal hillbillies sounds oddly worth trip ,2020-11-02,0.306,0.694,0.0,0.5267,0.0,1.0,0.0,0.0,0.0
1012,liberal,oh im triggered lol idc people vote biden thats ,2020-11-02,0.259,0.741,0.0,0.4215,0.0,0.0,0.0,0.0,0.0
1013,liberal,worked got lifelong liberal supporter bu ,2020-11-02,0.296,0.704,0.0,0.2732,0.0,1.0,0.0,0.0,0.0
1014,liberal,thank standing liberal peers brave thing perilous time go girl go trump ,2020-11-02,0.371,0.629,0.0,0.7096,0.0,0.5,0.0,0.0,0.5
1015,liberal,exhausting ignorant people know used liberal ,2020-11-02,0.0,0.465,0.535,-0.5574,0.0,0.0,0.0,0.0,0.0
1016,liberal,love liberal larry parodies hilarious ,2020-11-02,0.697,0.303,0.0,0.7845,0.0,0.0,1.0,0.0,0.0
1017,liberal,youre racist angry liberal loser ,2020-11-02,0.0,0.157,0.843,-0.8934,0.5,0.0,0.0,0.5,0.0
1018,liberal,son tht dont make since hes obviously talking mouth leftists ,2020-11-02,0.0,0.0,0.0,0.0,0.0,0.0,0.0,1.0,0.0
1019,liberal,activist account live liberal state id crucified ,2020-11-02,0.0,0.0,0.0,0.0,0.0,0.5,0.0,0.5,0.0
1020,liberal,god fbi documented bidens corruption real biden ex business partner ,2020-11-02,0.189,0.811,0.0,0.2732,0.0,0.4,0.0,0.2,0.4
1021,liberal,partisanship destroying states voted ndp husband sides w ,2020-11-02,0.0,0.625,0.375,-0.5574,0.0,0.5,0.0,0.5,0.0
1022,liberal,sad liberal nutjobs protesting rioting burning actually think behavior wo ,2020-11-02,0.0,0.576,0.424,-0.7096,0.0,0.2,0.0,0.4,0.4
1023,liberal,sorry give reason stay liberal canada love country ,2020-11-02,0.365,0.522,0.113,0.5994,0.2,0.2,0.2,0.4,0.0
1024,liberal,jon see tomorrow peaceful patriots respond liberal anarchists liberal left ,2020-11-02,0.262,0.738,0.0,0.4939,0.0,0.0,0.5,0.5,0.0
1025,liberal,jonathan turley election day riots get plenty blame go around ,2020-11-02,0.0,0.584,0.416,-0.6908,0.0,0.5,0.5,0.0,0.0
1026,liberal,despite state persecution lack support hindus brahmi ,2020-11-02,0.483,0.517,0.0,0.5664,0.5,0.0,0.0,0.5,0.0
1027,liberal,arent taught history liberal agenda ,2020-11-02,0.0,0.0,0.0,0.0,0.0,0.5,0.0,0.5,0.0
1028,liberal,see radicalized popular culture liberal arts education radicalized reality hu ,2020-11-02,0.237,0.763,0.0,0.4215,0.0,0.0,0.0,0.0,0.0
1029,liberal,dont computer even though look like googled 27 year old liberal kinda went ,2020-11-02,0.172,0.828,0.0,0.3612,0.0,0.5,0.0,0.5,0.0
1030,liberal,focus right wrong liberal labor soften politics nar ,2020-11-02,0.0,0.693,0.307,-0.4767,0.0,1.0,0.0,0.0,0.0
1031,liberal,indeed bob trash toss ,2020-11-02,0.0,0.0,0.0,0.0,0.5,0.0,0.0,0.5,0.0
1032,liberal,like twilight zone ,2020-11-02,0.556,0.444,0.0,0.3612,0.0,0.0,0.0,0.0,0.0
1033,liberal,know fact republicans get like riots looting l ,2020-11-02,0.231,0.463,0.306,-0.2023,0.0,1.0,0.0,0.0,0.0
1034,liberal,personally know seven households identify republican kenosha county n ,2020-11-02,0.0,0.0,0.0,0.0,0.0,0.0,1.0,0.0,0.0
1035,liberal,im trashing liberal clowns right good reason ,2020-11-02,0.326,0.674,0.0,0.4404,0.25,0.25,0.25,0.25,0.0
1036,liberal,absolutely level violence regardless result liberallots ,2020-11-02,0.0,0.533,0.467,-0.6573,0.0,1.0,0.0,0.0,0.0
1037,liberal,holy shit trump really get blamed everything handwriting one far ,2020-11-02,0.0,0.534,0.466,-0.7893,0.0,0.2,0.0,0.2,0.6
1038,liberal,exactly tell liberal friends afflicted w tds im ,2020-11-02,0.292,0.472,0.236,0.1531,0.0,0.0,0.5,0.5,0.0
1039,liberal,looked polls know early voting tends ,2020-11-02,0.0,0.0,0.0,0.0,0.0,0.0,0.0,0.0,0.0
1040,liberal,dr emrani classy rebuttal tyson nothing liberal talking head thanks putting place ,2020-11-02,0.367,0.633,0.0,0.7003,0.0,0.67,0.0,0.33,0.0
