,Search,Tweet,Entered on,pos_score,neu_score,neg_score,compound_score,angry_score,fear_score,happy_score,sad_score,surprise_score
1457,liberal,le liberal theory arrived ,2020-11-02,0.0,0.0,0.0,0.0,0.0,0.0,0.0,0.0,0.0
1458,liberal,someone selling trump flags tractor supply parking lot flag said trump 2020 ,2020-11-02,0.0,0.0,0.0,0.0,0.0,0.2,0.0,0.2,0.6
1459,liberal,quintessential flip flopping liberal right hypocrites another arrog ,2020-11-02,0.0,0.0,0.0,0.0,0.5,0.5,0.0,0.0,0.0
1460,liberal,upcoming election trump bitches going want celebratory dick liberal bitches going wa ,2020-11-02,0.064,0.392,0.544,-0.8957,0.0,0.67,0.0,0.0,0.33
1461,liberal,without evidence pls name liberal left wing accounts suppressed demonetize ,2020-11-02,0.0,0.88,0.12,-0.0572,0.0,1.0,0.0,0.0,0.0
1462,liberal,bad lot voters todays remember bleak dark draining days liberal democrat ,2020-11-02,0.0,0.741,0.259,-0.5423,0.0,0.0,0.2,0.8,0.0
1463,liberal,w may dumb sure hell stupid mad one endorse fool ,2020-11-02,0.192,0.083,0.725,-0.93,0.33,0.67,0.0,0.0,0.0
1464,liberal,completely agree im staunch liberal disgusting g ,2020-11-02,0.274,0.392,0.334,-0.1548,0.0,0.0,0.0,1.0,0.0
1465,liberal,sorry rasied believe liberal good thing ,2020-11-02,0.354,0.488,0.159,0.3818,0.0,0.0,0.33,0.33,0.33
1466,liberal,keep posting stories white niggas dorm room stupid liberal infographics swear changer ,2020-11-02,0.0,0.562,0.438,-0.7184,0.33,0.67,0.0,0.0,0.0
1467,liberal,internet liberal sites saying election biden refuse believe majority ,2020-11-02,0.0,0.784,0.216,-0.296,0.0,0.0,0.0,0.5,0.5
1468,liberal,get small boat liberal tears underwater time ,2020-11-02,0.0,0.759,0.241,-0.2263,0.0,0.0,0.0,1.0,0.0
1469,liberal,every liberal learn day ,2020-11-02,0.0,0.0,0.0,0.0,0.0,0.0,1.0,0.0,0.0
1470,liberal,voting red kind comment plays hands validates many liberal wary concerns ,2020-11-02,0.494,0.506,0.0,0.7783,0.25,0.25,0.25,0.25,0.0
1471,liberal,ira ,2020-11-02,0.0,0.0,0.0,0.0,0.0,0.0,0.0,0.0,0.0
1472,liberal,trump 26 biden 1 assault allegation ,2020-11-02,0.0,0.513,0.487,-0.5859,0.0,0.0,0.0,0.0,1.0
1473,liberal,stupid ass liberal policies dumocrats ,2020-11-02,0.0,0.303,0.697,-0.7845,0.0,1.0,0.0,0.0,0.0
1474,liberal,burn liberal mothership cnn put brucey boy place ,2020-11-02,0.0,0.0,0.0,0.0,0.0,0.33,0.0,0.67,0.0
1475,liberal,thank much many people hate religion conservatives use im libe ,2020-11-02,0.176,0.563,0.261,-0.296,0.0,0.0,0.0,1.0,0.0
1476,liberal,smart dressing like smashing beer looked foolish especially know liberal dunce cap ,2020-11-02,0.319,0.552,0.129,0.4767,0.0,0.0,0.0,0.0,0.0
1477,liberal,going vote tomorrow point biden 10 pts liberal friends go ,2020-11-02,0.256,0.744,0.0,0.4767,0.0,0.33,0.33,0.0,0.33
1478,liberal,love liberal phil ochs still relevant ,2020-11-02,0.457,0.543,0.0,0.6369,0.0,0.0,1.0,0.0,0.0
1479,liberal,youre master gaslighting teach one many liberal universities around country trump2020 ,2020-11-02,0.0,0.0,0.0,0.0,0.0,0.0,0.0,1.0,0.0
1480,liberal,sure problem typical liberal view dont support democrats must racist cou ,2020-11-02,0.126,0.383,0.491,-0.7689,0.0,1.0,0.0,0.0,0.0
1481,liberal,white liberal approval going head laugh ,2020-11-02,0.626,0.374,0.0,0.7717,0.0,0.75,0.25,0.0,0.0
1482,liberal,overheard pool today would vote liberal immigrants ooh people everywhere ,2020-11-02,0.0,0.0,0.0,0.0,0.0,0.5,0.0,0.0,0.5
1483,liberal,gen z memes long fuck like say ur socialist ur memes r liberal ,2020-11-02,0.167,0.6,0.233,-0.25,0.0,0.33,0.33,0.0,0.33
1484,liberal,said possible genuinely isnt wants w ,2020-11-02,0.0,0.0,0.0,0.0,0.0,0.0,0.0,0.5,0.5
1485,liberal,liberal governors certify election2020 results state ie pennsylvania michigan trump wins ,2020-11-02,0.27,0.73,0.0,0.5719,0.0,0.0,0.0,0.5,0.5
1486,liberal,jealous size rallies stopping liberal protests violence wh ,2020-11-02,0.0,0.274,0.726,-0.8625,0.0,1.0,0.0,0.0,0.0
1487,liberal,well trump current president children school sin ,2020-11-02,0.196,0.467,0.336,-0.3612,0.0,0.0,0.0,0.0,1.0
1488,liberal,dont even get started scotus 50 50 end ,2020-11-02,0.0,0.0,0.0,0.0,0.0,0.0,0.0,0.0,0.0
1489,liberal,always denial guess shame called leader graspi ,2020-11-02,0.0,0.659,0.341,-0.4767,0.0,0.0,0.0,0.67,0.33
1490,liberal,specific group racist racism start inside heart conser ,2020-11-02,0.0,0.426,0.574,-0.8442,0.0,0.0,0.0,0.5,0.5
1491,liberal,fuck shapiro trump going roll pa enjoy next four years liberal douche bag ,2020-11-02,0.167,0.521,0.312,-0.4215,0.0,0.2,0.4,0.0,0.4
1492,liberal,liberal overrated race baiting reporter espn says texas change ou ,2020-11-02,0.0,0.0,0.0,0.0,0.0,0.5,0.0,0.0,0.5
1493,liberal,liberal boomer lady tell ukrainian lived ukraine family ukrai ,2020-11-02,0.0,0.0,0.0,0.0,0.0,0.0,0.0,0.5,0.5
1494,liberal,europe reaping sowed amp paying price secular amp liberal islamists requested ref ,2020-11-02,0.0,0.0,0.0,0.0,0.0,1.0,0.0,0.0,0.0
1495,liberal,liberal media polls wrong last time ,2020-11-02,0.0,0.617,0.383,-0.4767,0.0,0.0,0.0,0.0,0.0
1496,liberal,saved liberal tears turned champagne final election results ,2020-11-02,0.42,0.42,0.16,0.4767,0.0,0.33,0.0,0.33,0.33
1497,liberal,hopefully getting big chartered plane liberal celebrities leave nation ,2020-11-02,0.248,0.642,0.11,0.3612,0.0,0.0,0.0,0.0,0.0
1498,liberal,canadian house commons least 1 million signatures remove pm justin trudeau liberal government ,2020-11-02,0.0,0.0,0.0,0.0,0.0,0.5,0.0,0.0,0.5
1499,liberal,liberal sanders never used advocate medicare 4 ,2020-11-02,0.0,0.0,0.0,0.0,0.0,0.0,0.0,0.0,0.0
1500,liberal,back canada need ask liberal ps release documents ,2020-11-02,0.0,0.0,0.0,0.0,0.0,1.0,0.0,0.0,0.0
1501,liberal,uk police chiefs said accused breaking strict coronavirus rules liberal society ,2020-11-02,0.0,0.82,0.18,-0.296,0.0,0.33,0.0,0.0,0.67
1502,liberal,4 years ca wait see liberal tears tomororow ,2020-11-02,0.0,0.759,0.241,-0.2263,0.0,0.0,0.0,0.5,0.5
1503,liberal,disinformation liberal left everywhere amp sickening try cancel eve ,2020-11-02,0.0,0.565,0.435,-0.6597,0.0,0.0,0.0,0.0,0.0
1504,liberal,many liberal sheep never question anything amp believe everything read see msm ,2020-11-02,0.0,0.0,0.0,0.0,0.0,0.5,0.0,0.5,0.0
1505,liberal,sit entire class liberal mba students crying trump better rewarded c ,2020-11-02,0.377,0.432,0.191,0.4588,0.0,0.25,0.0,0.0,0.75
1506,liberal,like idea however emphasis 2020 us presidential elect ,2020-11-02,0.263,0.737,0.0,0.3612,0.0,0.0,0.0,0.0,1.0
1507,liberal,cant many thoughts many scenarios much let tomorrow come chips fall whe ,2020-11-02,0.0,0.0,0.0,0.0,0.0,0.33,0.0,0.67,0.0
1508,liberal,forces running liberal party canada want establish new organization intimidate brainwash c ,2020-11-02,0.29,0.58,0.13,0.296,0.0,0.67,0.0,0.0,0.33
1509,liberal,week newsletter try explain version chinese fine dining try serve chines ,2020-11-02,0.153,0.847,0.0,0.2023,0.0,0.0,1.0,0.0,0.0
1510,liberal,liberal tears flow tomorrow ,2020-11-02,0.0,0.612,0.388,-0.2263,0.0,0.0,0.0,1.0,0.0
1511,liberal,globalists communists socialists wealthy liberal hypocrites honestly boy trump 50 correct ai ,2020-11-02,0.355,0.645,0.0,0.6705,0.0,0.0,0.5,0.0,0.5
1512,liberal,dont want us driven change apc weve operated mindset b ,2020-11-02,0.0,0.867,0.133,-0.0572,0.0,1.0,0.0,0.0,0.0
1513,liberal,streets big words fucking larper gun fetish kno ,2020-11-02,0.0,0.723,0.277,-0.3976,0.33,0.0,0.33,0.33,0.0
1514,liberal,1 connection israel foreign countries 2 keeping taxes reasonable 3 morality n ,2020-11-02,0.0,0.0,0.0,0.0,0.0,0.0,0.0,0.0,0.0
1515,liberal,wealthy liberal hypocrites incorporated organization cabaret act brokerage firm ,2020-11-02,0.238,0.762,0.0,0.3612,0.0,0.5,0.5,0.0,0.0
1516,liberal,wonder achieved opposition next 10 years least springst ,2020-11-02,0.0,0.0,0.0,0.0,0.0,0.0,0.0,0.0,1.0
1517,liberal,better liberal ,2020-11-02,0.744,0.256,0.0,0.4404,0.0,0.0,0.0,0.0,1.0
1518,liberal,called liberal muslims dangerous actual jihadis give cover fire thes ,2020-11-02,0.0,0.593,0.407,-0.6705,0.0,1.0,0.0,0.0,0.0
1519,liberal,left wants sides cake fo ,2020-11-02,0.0,0.0,0.0,0.0,0.0,0.0,0.0,0.0,0.0
1520,liberal,someone w extended family inc brother sib avid trump supporters ,2020-11-02,0.421,0.579,0.0,0.6249,0.0,0.0,0.25,0.0,0.75
1521,liberal,election 1 side liberal crybabies cannot accept defeat ,2020-11-02,0.257,0.517,0.226,0.0762,0.0,0.0,0.0,0.0,0.0
1522,liberal,whatever liberal media ch 4 ,2020-11-02,0.0,0.0,0.0,0.0,0.0,0.0,0.0,0.0,0.0
1523,liberal,fund another liberal doesnt work ,2020-11-02,0.0,0.0,0.0,0.0,0.0,1.0,0.0,0.0,0.0
1524,liberal,empires trust damn good thing founders got liberal educations impo ,2020-11-02,0.39,0.44,0.17,0.5423,0.0,0.33,0.33,0.0,0.33
1525,liberal,extremiat beheads blasphemy direct action liberal defends incident protestsrallies liberal pro def ,2020-11-02,0.0,0.0,0.0,0.0,0.0,1.0,0.0,0.0,0.0
1526,liberal,science liberal conspiracy theory ,2020-11-02,0.0,0.469,0.531,-0.5267,0.0,0.0,0.0,0.0,0.0
1527,liberal,liberal bull crap electronic mis management takes cheat ,2020-11-02,0.0,0.517,0.483,-0.6808,0.0,0.0,0.0,0.0,1.0
1528,liberal,ideas broad depth religion become many merely means li ,2020-11-02,0.0,0.0,0.0,0.0,0.0,1.0,0.0,0.0,0.0
1529,liberal,think intelligent form life believes washington post know zero american ,2020-11-02,0.25,0.75,0.0,0.4588,0.0,0.5,0.0,0.0,0.5
1530,liberal,look liberal made phones biden harris ,2020-11-02,0.0,0.0,0.0,0.0,0.0,0.0,0.0,1.0,0.0
1531,liberal,liberal nothing knowing condoms work ,2020-11-02,0.0,0.0,0.0,0.0,0.0,1.0,0.0,0.0,0.0
1532,liberal,win win win liberaldemocratic party ,2020-11-02,0.934,0.066,0.0,0.9337,0.0,0.0,0.0,0.0,0.0
1533,liberal,white liberal gen z kids ,2020-11-02,0.0,0.0,0.0,0.0,0.0,0.5,0.5,0.0,0.0
1534,liberal,nobody commercials tv every 5 seconds vote democrat youre voting libera ,2020-11-02,0.0,0.0,0.0,0.0,0.0,0.0,0.0,0.0,0.0
1535,liberal,original post stands george bush 1amp2 reagan nixon prior president conservative ,2020-11-02,0.187,0.813,0.0,0.3182,0.0,1.0,0.0,0.0,0.0
1536,liberal,trump media retweet ,2020-11-02,0.0,0.0,0.0,0.0,0.0,0.0,0.0,0.0,1.0
1537,liberal,nah officers met nav ,2020-11-02,0.0,0.682,0.318,-0.1027,0.0,0.0,0.0,0.0,0.0
1538,liberal,fight black bitch started fight p trump fired amp 100 right call h ,2020-11-02,0.0,0.357,0.643,-0.9118,0.0,0.25,0.0,0.5,0.25
1539,liberal,context andrew schlafly invented conservapedia thought wikipedia liberal also pro ,2020-11-02,0.0,0.0,0.0,0.0,0.0,0.5,0.0,0.0,0.5
1540,liberal,speaking vlad give reading try yet another liberal ,2020-11-02,0.0,0.0,0.0,0.0,0.0,1.0,0.0,0.0,0.0
1541,liberal,im clear dont like trumps better example hypocrisy com ,2020-11-02,0.198,0.457,0.344,-0.2302,0.0,0.0,0.0,0.33,0.67
1542,liberal,die hard trumper unfortunately live se nm state pretty red unfortu ,2020-11-02,0.179,0.391,0.43,-0.5423,0.4,0.0,0.2,0.4,0.0
1543,liberal,everytime see one ads liberal mob cringe politics ,2020-11-02,0.0,0.0,0.0,0.0,0.5,0.5,0.0,0.0,0.0
1544,liberal,mr president would like list liberal jews round know several ,2020-11-02,0.217,0.783,0.0,0.3612,0.0,1.0,0.0,0.0,0.0
1545,liberal,seriously dedicated casting vote top comment youtube account th ,2020-11-02,0.384,0.48,0.136,0.4767,0.0,0.5,0.0,0.0,0.5
1546,liberal,nyt whinier columnists like stephens insipid ones like bruni wont find better synthesi ,2020-11-02,0.258,0.464,0.279,-0.1043,0.0,0.5,0.0,0.0,0.5
1547,liberal,small point would say disturbing lived liberal cities fucked ,2020-11-02,0.0,0.476,0.524,-0.8271,0.0,0.25,0.25,0.0,0.5
1548,liberal,final liberal plea ,2020-11-02,0.0,0.0,0.0,0.0,0.0,1.0,0.0,0.0,0.0
1549,liberal,protecting liberal city progressive democrats worried ana ,2020-11-02,0.0,0.732,0.268,-0.296,0.0,0.0,0.5,0.5,0.0
1550,liberal,someone lived nyc lets real majority city liberal im sure pl ,2020-11-02,0.187,0.813,0.0,0.3182,0.0,0.33,0.0,0.67,0.0
1551,liberal,keep doubling lies typical liberal ,2020-11-02,0.0,0.588,0.412,-0.4215,0.0,0.0,0.0,0.0,0.0
1552,liberal,going trouble biden winsdemocrats letting far left liberal ag ,2020-11-02,0.0,0.748,0.252,-0.4019,0.0,0.5,0.0,0.5,0.0
1553,liberal,election day tomorrow look back year regret regret voted based someones perso ,2020-11-02,0.0,0.641,0.359,-0.6808,0.0,0.0,0.25,0.25,0.5
1554,liberal,force less 2 k oh thats right labor libera ,2020-11-02,0.0,0.0,0.0,0.0,0.0,1.0,0.0,0.0,0.0
1555,liberal,cant wait 4 year long liberal tantrum ,2020-11-02,0.0,0.641,0.359,-0.4215,0.0,0.5,0.0,0.0,0.5
1556,liberal,thought way worse australia media us liberal giant st show ,2020-11-02,0.0,0.744,0.256,-0.4767,0.0,0.0,0.0,0.5,0.5
1557,liberal,throughout country businesses boarding windows painting black li ,2020-11-02,0.0,0.0,0.0,0.0,0.0,1.0,0.0,0.0,0.0
1558,liberal,fat chance allowed nuts move ,2020-11-02,0.274,0.411,0.315,-0.0772,0.0,1.0,0.0,0.0,0.0
1559,liberal,fighting biden crime family wealth overwhelming hypocrisy liberal e ,2020-11-02,0.225,0.352,0.423,-0.4215,0.0,0.0,0.0,0.67,0.33
1560,liberal,woman long liberal ,2020-11-02,0.0,0.0,0.0,0.0,0.0,1.0,0.0,0.0,0.0
1561,liberal,apparently scared facts maam ,2020-11-02,0.0,0.508,0.492,-0.4404,0.0,0.0,0.0,1.0,0.0
1562,liberal,yeah uh thats lot ppl died big liberal cities smh ,2020-11-02,0.146,0.464,0.391,-0.5719,0.0,0.5,0.0,0.5,0.0
1563,liberal,canadian house commons least 1 million signatures remove pm justin trudeau liberal government ,2020-11-02,0.0,0.0,0.0,0.0,0.0,0.5,0.0,0.0,0.5
1564,liberal,media never able convince public objective president trump everyon ,2020-11-02,0.0,0.821,0.179,-0.1877,0.0,0.0,0.0,0.0,1.0
1565,liberal,rick santorum mentioned tonight said pg one liberal papers ,2020-11-02,0.0,0.0,0.0,0.0,0.0,0.0,0.0,0.0,1.0
1566,liberal,trump also reigious word liberal hypocrites joe biden used ,2020-11-02,0.0,0.0,0.0,0.0,0.5,0.0,0.0,0.0,0.5
1567,liberal,isnt liberal ,2020-11-02,0.0,0.0,0.0,0.0,0.0,0.0,0.0,0.0,0.0
1568,liberal,yeah dont second think badham selfless enough vote mate ,2020-11-02,0.216,0.784,0.0,0.296,0.0,0.0,0.0,0.0,1.0
1569,liberal,trump ginning anger try truth change anger liberal progressive ,2020-11-02,0.146,0.382,0.471,-0.7269,0.0,0.0,0.0,0.67,0.33
1570,liberal,typical liberal mindset ,2020-11-02,0.0,0.0,0.0,0.0,0.0,0.0,0.0,0.0,0.0
1571,liberal,lord coming republican democrat liberal conservative socialist capitalist ,2020-11-02,0.0,0.0,0.0,0.0,0.0,0.0,0.0,0.0,1.0
1572,liberal,sure entertaining woke white liberal woman telling hispanic americans think vote ,2020-11-02,0.366,0.634,0.0,0.6369,0.0,0.5,0.0,0.25,0.25
1573,liberal,mean youngerindoctrinated nc population shift change liberal wishful thinking ,2020-11-02,0.0,0.0,0.0,0.0,0.0,0.0,0.0,0.0,1.0
1574,liberal,nothing made happier liberal tears since ,2020-11-02,0.0,0.461,0.539,-0.5684,0.0,0.0,0.0,1.0,0.0
1575,liberal,entertainment news ,2020-11-02,0.737,0.263,0.0,0.4215,0.0,0.0,0.0,0.0,0.0
1576,liberal,amazing encouraging people vote considered liberal 2020 election ,2020-11-02,0.545,0.455,0.0,0.802,0.0,0.0,0.0,0.5,0.5
1577,liberal,liberal media best toolbag ,2020-11-02,0.583,0.417,0.0,0.6369,0.0,0.0,0.0,0.0,1.0
1578,liberal,gone qld election actually voted liberal neoliberal conservatives fact horrified ,2020-11-02,0.0,0.72,0.28,-0.5423,0.0,0.5,0.0,0.0,0.5
1579,liberal,got 50 liberal trump wins texas ,2020-11-02,0.425,0.575,0.0,0.5719,0.0,0.0,0.0,0.0,1.0
1580,liberal,course youre liberal cause msm hasnt mentioned yet ,2020-11-02,0.0,0.0,0.0,0.0,0.0,0.0,0.0,0.0,0.0
1581,liberal,prove lady nobody else adele ,2020-11-02,0.0,0.0,0.0,0.0,0.0,1.0,0.0,0.0,0.0
1582,liberal,liberal cities says preparing peaceful protesting ,2020-11-02,0.32,0.4,0.28,0.1027,0.0,0.0,0.5,0.0,0.5
1583,liberal,typing caps doesnt make one ,2020-11-02,0.0,0.0,0.0,0.0,0.0,0.5,0.0,0.5,0.0
1584,liberal,im leftist liberal republicans want fight least use right terminology laugh ,2020-11-02,0.316,0.516,0.168,0.3182,0.0,0.5,0.0,0.5,0.0
1585,liberal,lord coming republican democrat liberal conservative socialist capitalist ,2020-11-02,0.0,0.0,0.0,0.0,0.0,0.0,0.0,0.0,1.0
1586,liberal,great post people need wake harris going president biden wo ,2020-11-02,0.313,0.687,0.0,0.6249,0.0,0.5,0.5,0.0,0.0
1587,liberal,seen liberal communist associate beheading brahman terrorism boycott type li ,2020-11-02,0.0,0.537,0.463,-0.7845,0.0,1.0,0.0,0.0,0.0
1588,liberal,kamala harris liberal bernie sanders senate record analysis shows ,2020-11-02,0.0,0.0,0.0,0.0,0.0,1.0,0.0,0.0,0.0
1589,liberal,whats worse liberal cult members never get even devolves marxist slave stat ,2020-11-02,0.0,0.78,0.22,-0.4767,0.0,0.0,0.0,1.0,0.0
1590,liberal,vote sleepy joe biden vote give control government globalists communists socia ,2020-11-02,0.0,0.0,0.0,0.0,0.0,1.0,0.0,0.0,0.0
1591,liberal,liberal politicians media incited violence hatred country youre fooling one ,2020-11-02,0.0,0.389,0.611,-0.9001,0.0,0.0,0.0,0.0,0.0
1592,liberal,principled best conservatism holds liberal ends right individual enjoy maximum de ,2020-11-02,0.451,0.549,0.0,0.8126,0.0,0.6,0.2,0.0,0.2
1593,liberal,texas georgia becoming liberal fast enough either go blue tomorrow opinion ,2020-11-02,0.0,0.0,0.0,0.0,0.0,0.0,0.0,1.0,0.0
1594,liberal,ets greens voted labor party fighting pr ,2020-11-02,0.265,0.49,0.245,0.0516,0.0,0.0,0.0,1.0,0.0
1595,liberal,lol also even state called liberal media vote never give hope biden conceives concedes ,2020-11-02,0.163,0.697,0.14,0.1012,0.0,0.67,0.0,0.33,0.0
1596,liberal,advocate medicare green new deal wait already said fuck ty ,2020-11-02,0.184,0.567,0.248,-0.2263,0.0,0.0,0.33,0.0,0.67
1597,liberal,jody wilson raybould former attor gen reported months har ,2020-11-02,0.0,0.0,0.0,0.0,0.0,0.0,0.0,0.0,0.0
1598,liberal,well liberal e thot laughing loud daughter would disown ,2020-11-02,0.469,0.531,0.0,0.6486,0.0,1.0,0.0,0.0,0.0
1599,liberal,except opinion doesnt matter even cant care white liberal voices show jesus right ,2020-11-02,0.0,0.748,0.252,-0.4023,0.0,1.0,0.0,0.0,0.0
1600,liberal,larger cities highly educated people missoula helena billings great falls ,2020-11-02,0.313,0.687,0.0,0.6249,0.0,0.0,1.0,0.0,0.0
1601,liberal,well going take conservative cheap shot back need focus liberal conserv ,2020-11-02,0.174,0.826,0.0,0.2732,0.0,1.0,0.0,0.0,0.0
1602,liberal,justice roberts sided liberal justices count votes election roberts hopes voter fraud deny trump win ,2020-11-02,0.382,0.382,0.237,0.5859,0.0,0.75,0.0,0.0,0.25
1603,liberal,degrees mainly brainwashed liberal colleges today hence taught myse ,2020-11-02,0.0,0.0,0.0,0.0,0.0,0.5,0.0,0.5,0.0
1604,liberal,feel good vibes white liberal spending thousands dollars community se ,2020-11-02,0.244,0.756,0.0,0.4404,0.0,0.5,0.5,0.0,0.0
1605,liberal,thing liberal left lovers liberty humanity ,2020-11-02,0.63,0.37,0.0,0.7783,0.0,0.5,0.0,0.0,0.5
1606,liberal,started comment liberal posts see replies haha ,2020-11-02,0.333,0.667,0.0,0.4588,0.0,0.0,0.0,0.0,0.0
1607,liberal,europe paying show liberal behavior extremist muslims come iraq syria libiya ,2020-11-02,0.0,0.0,0.0,0.0,0.0,0.0,0.0,0.0,0.0
1608,liberal,yeah tensions might high rioting ai really right wing thing let real w ,2020-11-02,0.148,0.671,0.181,-0.128,0.11,0.44,0.0,0.22,0.22
1609,liberal,liberal tears ,2020-11-02,0.0,0.345,0.655,-0.2263,0.0,0.0,0.0,1.0,0.0
1610,liberal,bet trumpets would say person probably liberal ,2020-11-02,0.0,0.0,0.0,0.0,0.0,0.75,0.0,0.0,0.25
1611,liberal,day election us make america liberal urge americans elect president tremendous ,2020-11-02,0.0,0.0,0.0,0.0,0.0,0.0,0.5,0.25,0.25
1612,liberal,deep even creepy liberal larry guy knows ,2020-11-02,0.0,0.0,0.0,0.0,0.0,1.0,0.0,0.0,0.0
1613,liberal,happens youre liberal ,2020-11-02,0.0,0.0,0.0,0.0,0.0,0.0,0.0,0.0,0.0
1614,liberal,competence well known liberal bias ,2020-11-02,0.323,0.462,0.215,0.1779,0.0,1.0,0.0,0.0,0.0
1615,liberal,yall sum stance well wouldve liked one address new common trope se ,2020-11-02,0.329,0.671,0.0,0.5994,0.0,1.0,0.0,0.0,0.0
1616,liberal,disinformation liberal left everywhere amp sickening try cancel everyone else wi ,2020-11-02,0.0,0.625,0.375,-0.6597,0.0,0.0,0.0,0.0,0.0
1617,liberal,thats gladys amp liberal loonies ,2020-11-02,0.0,0.0,0.0,0.0,0.0,0.0,0.0,0.0,0.0
1618,liberal,us like every country population fails evenly distributed cit ,2020-11-02,0.203,0.569,0.228,-0.0772,0.0,0.0,0.0,0.0,0.0
1619,liberal,anyway small amount seats highly unlikely get majority ,2020-11-02,0.0,0.0,0.0,0.0,0.0,1.0,0.0,0.0,0.0
1620,liberal,brilliant strategy encourage liberal lunatics rioting looting burning busine ,2020-11-02,0.452,0.382,0.166,0.6705,0.0,0.4,0.4,0.2,0.0
1621,liberal,next president trump 2020 4 years everytime liberal complains comment ,2020-11-02,0.0,0.755,0.245,-0.3818,0.0,0.0,0.0,0.5,0.5
1622,liberal,omg im really love laughing loud tell liberal hippies fuck ,2020-11-02,0.432,0.379,0.189,0.6674,0.0,0.0,0.4,0.2,0.4
1623,liberal,liberal small business owners boarding windows liberal run districts protect deranged liberals ,2020-11-02,0.191,0.809,0.0,0.3818,0.0,0.33,0.33,0.33,0.0
1624,liberal,helping afghan government fend ,2020-11-02,0.423,0.577,0.0,0.296,0.0,0.0,0.0,0.0,1.0
1625,liberal,dance emotion ,2020-11-02,0.0,0.0,0.0,0.0,0.0,0.5,0.0,0.5,0.0
1626,liberal,typical freaking liberal government freebies ,2020-11-02,0.326,0.349,0.326,0.0,0.0,0.0,0.0,0.0,0.0
1627,liberal,know getting votes intimidation couple guys big trucks ,2020-11-02,0.0,0.714,0.286,-0.4215,0.0,0.0,0.0,0.0,0.0
1628,liberal,shame clyburn true legacy earned respect last decade destroy ,2020-11-02,0.337,0.286,0.377,-0.1779,0.0,0.5,0.5,0.0,0.0
1629,liberal,wealthy liberal hypocrites brand jaredkushner sis law voted biden ,2020-11-02,0.238,0.762,0.0,0.3612,0.0,0.0,0.33,0.33,0.33
1630,liberal,scared toss ups red states liberal black woman almost beat trumper white governor demographics destiny ,2020-11-02,0.0,0.828,0.172,-0.4404,0.14,0.14,0.0,0.57,0.14
1631,liberal,formalities kill talent throw away formalities make working environments liberal dev community big data ,2020-11-02,0.144,0.615,0.241,-0.4404,0.2,0.4,0.0,0.2,0.2
1632,liberal,aw man finale hbo made feel good future liberal wants ,2020-11-02,0.244,0.756,0.0,0.4404,0.0,0.0,0.5,0.5,0.0
1633,liberal,end liberal left ,2020-11-02,0.0,0.0,0.0,0.0,0.0,0.0,0.0,0.0,0.0
1634,liberal,watched every rally another liberal lying ass without giving actual direct quotes ,2020-11-02,0.0,0.502,0.498,-0.8375,0.0,0.75,0.0,0.0,0.25
1635,liberal,yup like fact might happen many major cities texas liberal mean aus ,2020-11-02,0.185,0.815,0.0,0.3612,1.0,0.0,0.0,0.0,0.0
1636,liberal,says cnn liberal news outlets disappointed soon ,2020-11-02,0.0,0.659,0.341,-0.4767,0.0,0.0,0.0,0.5,0.5
1637,liberal,certainly trudeau typical liberal male submissive week kneed limp w ,2020-11-02,0.205,0.598,0.197,0.0258,0.0,0.0,0.0,0.0,0.0
1638,liberal,parties liberal party conservative party ,2020-11-02,0.802,0.198,0.0,0.7964,0.0,0.0,0.0,0.0,0.0
1639,liberal,happened foxconn jobs promised bilked tax payers ,2020-11-02,0.294,0.706,0.0,0.3612,0.0,0.5,0.0,0.5,0.0
1640,liberal,excited trump win landslide going see greatest liberal meltdown world ev ,2020-11-02,0.565,0.435,0.0,0.886,0.0,0.25,0.0,0.5,0.25
1641,liberal,better win read hes president liberal tears snowflake comments anymore ,2020-11-02,0.429,0.449,0.122,0.7003,0.0,0.0,0.0,0.5,0.5
1642,liberal,proud canadian liberal much better sell fo ,2020-11-02,0.545,0.455,0.0,0.7184,0.0,0.0,0.5,0.0,0.5
1643,liberal,corporatist model one really differe ,2020-11-02,0.0,0.0,0.0,0.0,0.0,0.5,0.0,0.0,0.5
1644,liberal,always happens law enforcement amp rule law get set aside left mob liberal politics personal v ,2020-11-02,0.0,0.0,0.0,0.0,0.12,0.5,0.0,0.12,0.25
1645,liberal,yeah troops worried typical liberal temper tantrum ,2020-11-02,0.169,0.231,0.6,-0.6808,0.5,0.0,0.0,0.5,0.0
1646,liberal,definitely alone liberal conservative part texas ,2020-11-02,0.31,0.46,0.23,0.1779,0.0,0.5,0.0,0.5,0.0
1647,liberal,due overwhelming lead biden already early voting going nearly impossible trump ,2020-11-02,0.0,0.0,0.0,0.0,0.0,0.5,0.0,0.0,0.5
1648,liberal,educated people suffer conceit certification qualifies every word every ,2020-11-02,0.0,0.696,0.304,-0.5423,1.0,0.0,0.0,0.0,0.0
1649,liberal,late night pre election ramble ive noticed conservatives arent worried voting see voting ,2020-11-02,0.136,0.864,0.0,0.2235,0.0,0.33,0.0,0.67,0.0
1650,liberal,election blocking channels like block fox put trump screen every 5 secs ,2020-11-02,0.156,0.5,0.344,-0.4588,0.0,0.0,0.0,0.67,0.33
1651,liberal,pro choice pro lgbt anti censorship really ,2020-11-02,0.0,0.723,0.277,-0.3182,0.5,0.0,0.0,0.0,0.5
1652,liberal,never said find liberal source said liber ,2020-11-02,0.0,0.0,0.0,0.0,0.0,0.0,0.0,0.0,1.0
1653,liberal,unfollowed spreading liberal propaganda ,2020-11-02,0.0,0.6,0.4,-0.25,0.0,1.0,0.0,0.0,0.0
1654,liberal,funny liberal even funny like friggin love everyone means live lov ,2020-11-02,0.646,0.354,0.0,0.9152,0.0,0.0,0.33,0.0,0.67
1655,liberal,black liberal vote georgia makes plausible florida strange place ,2020-11-02,0.0,0.816,0.184,-0.2023,0.0,0.5,0.0,0.5,0.0
1656,liberal,spanglish surprisingly liberal interesting adam fool ,2020-11-02,0.454,0.278,0.269,0.25,0.0,0.0,1.0,0.0,0.0
1657,liberal,grown think typical montana sensitive bullshit detect ,2020-11-02,0.0,0.612,0.388,-0.5859,0.0,0.5,0.0,0.0,0.5
1658,liberal,pressley supported liz snake warren supported hillary 16 liber ,2020-11-02,0.397,0.603,0.0,0.5574,0.0,0.0,0.0,0.0,0.0
1659,liberal,pretty sure trump loss would disaster certain survive without ,2020-11-02,0.422,0.222,0.356,0.0516,0.0,0.5,0.17,0.17,0.17
1660,liberal,firecrackers one attacked various liberal wokes ,2020-11-02,0.0,0.625,0.375,-0.4588,0.0,0.0,0.0,0.0,0.0
1661,liberal,yes shock atack wiena pariz incompetent eu politik talk talk chep governments incompetent ,2020-11-02,0.132,0.439,0.429,-0.7269,0.0,0.0,0.0,0.5,0.5
1662,liberal,trying dick watching liberal cry compilations tube pretty hilarious come ,2020-11-02,0.322,0.328,0.35,-0.128,0.0,0.25,0.5,0.0,0.25
