,Search,Tweet,Entered on,pos_score,neu_score,neg_score,compound_score,angry_score,fear_score,happy_score,sad_score,surprise_score
0,liberal,people voted london mayor socialist left wingers liberals every shade mu ,2020-11-02,0.0,0.0,0.0,0.0,0.0,0.0,0.0,0.0,0.0
1,liberal,may reason voting way ,2020-11-02,0.0,0.0,0.0,0.0,0.0,0.5,0.0,0.5,0.0
2,liberal,enough votes get tossed arbitrary technicalities like construction method ,2020-11-02,0.238,0.762,0.0,0.3612,0.0,0.5,0.0,0.5,0.0
3,liberal,liberal conservative yall suck ,2020-11-02,0.0,0.508,0.492,-0.4404,0.0,0.0,0.0,0.0,0.0
4,liberal,democrat republican conservative liberalwhoever done via ,2020-11-02,0.0,0.0,0.0,0.0,0.0,0.0,0.0,0.0,0.0
5,liberal,president trump entered plane rally handed umbrella holding staff member wa ,2020-11-02,0.0,0.0,0.0,0.0,0.0,0.67,0.0,0.0,0.33
6,liberal,says main political divide us longer liberal conservative democracy autocracy ,2020-11-02,0.0,0.0,0.0,0.0,0.0,0.5,0.0,0.0,0.5
7,liberal,honestly conservative trump supporter id happy biden gets elected hes essentially c ,2020-11-02,0.524,0.476,0.0,0.8316,0.0,0.0,0.5,0.0,0.5
8,liberal,looks like duck dynasty yet liberal fool ,2020-11-02,0.24,0.481,0.279,-0.1027,0.0,0.0,0.0,1.0,0.0
9,liberal,love mom much carried 9 months womb would ,2020-11-02,0.412,0.588,0.0,0.6369,0.0,0.5,0.5,0.0,0.0
10,liberal,us violated prominent liberal principles principles free trade democracy equalit ,2020-11-02,0.35,0.438,0.212,0.296,0.0,0.67,0.33,0.0,0.0
11,liberal,voter suppression exists liberal hmm por haps vote ,2020-11-02,0.0,0.0,0.0,0.0,0.0,0.0,0.0,0.0,0.0
12,liberal,different democratic liberal ,2020-11-02,0.0,0.0,0.0,0.0,0.0,0.0,0.0,0.0,0.0
13,liberal,patriots need show big time tomorrow let liberal dems know longer silent majority vote trump2020 ,2020-11-02,0.0,0.0,0.0,0.0,0.0,0.0,0.0,1.0,0.0
14,liberal,,2020-11-02,0.0,0.0,0.0,0.0,0.0,0.0,0.0,0.0,0.0
15,liberal,really type screaming liberal find fucking twitterdotcom man ,2020-11-02,0.0,0.709,0.291,-0.4364,0.0,0.33,0.33,0.0,0.33
16,liberal,anti vaxxer texas called rabid liberal said would rabies vaccine ,2020-11-02,0.0,0.796,0.204,-0.3182,0.0,0.67,0.0,0.0,0.33
17,liberal,liberal media brought us point ,2020-11-02,0.0,0.0,0.0,0.0,0.0,0.0,0.0,0.5,0.5
18,liberal,state opinion one push irrelevant take advantage groups wh ,2020-11-02,0.2,0.8,0.0,0.25,0.0,0.25,0.25,0.25,0.25
19,liberal,really embarrassing many childhood friends trump supporters growing liberal conserv ,2020-11-02,0.464,0.362,0.174,0.5868,0.0,0.25,0.25,0.0,0.5
20,liberal,whens last time read bible jesus neither liberal socialist ,2020-11-02,0.0,0.0,0.0,0.0,0.0,0.0,0.0,1.0,0.0
21,liberal,might get twitter week two tomorrow cause everything gonna election th ,2020-11-02,0.0,0.0,0.0,0.0,0.33,0.0,0.0,0.67,0.0
22,liberal,allowed educators kindergarten college teach anti american curriculums youth ,2020-11-02,0.0,0.777,0.223,-0.3182,0.0,0.5,0.0,0.5,0.0
23,liberal,bernie better primaries liberal president fascist president ,2020-11-02,0.252,0.435,0.313,-0.1779,0.0,0.5,0.0,0.0,0.5
24,liberal,sure hope goes well much risk hope vast majority seen enough liberal ,2020-11-02,0.528,0.363,0.109,0.7964,0.0,1.0,0.0,0.0,0.0
25,liberal,needed tokenized put spot yt liberal attacked ignorant yt students didnt li ,2020-11-02,0.0,0.662,0.338,-0.6249,0.0,0.5,0.0,0.5,0.0
26,liberal,course wouldnt want youus hear disagree liberal want either suppress ,2020-11-02,0.0,0.581,0.419,-0.4667,0.0,0.0,0.0,0.0,0.0
27,liberal,please stop least stop speaking behalf christians nothing reinforce stereotypes tha ,2020-11-02,0.156,0.544,0.299,-0.2732,0.0,0.5,0.0,0.5,0.0
28,liberal,like liberal conservative parties centrist c ,2020-11-02,0.634,0.366,0.0,0.6369,0.0,0.0,0.0,0.0,0.0
29,liberal,one content liberal striving educate become leftist ,2020-11-02,0.0,0.0,0.0,0.0,0.0,1.0,0.0,0.0,0.0
30,liberal,liked tube video liberal gamer voted donald trump 2020 election via tube ,2020-11-02,0.203,0.797,0.0,0.4215,0.0,0.67,0.0,0.0,0.33
31,liberal,husband works heart hospital liberal co worker turns tvs cnn hides remotes ,2020-11-02,0.0,0.866,0.134,-0.1779,0.25,0.25,0.0,0.25,0.25
32,liberal,anyone else think joe paid pushing liberal propaganda hard l ,2020-11-02,0.0,0.673,0.327,-0.34,0.33,0.33,0.0,0.0,0.33
33,liberal,excuse way shape form liberal fact unbiased political scale ,2020-11-02,0.138,0.745,0.117,0.0516,0.0,0.0,0.0,0.5,0.5
34,liberal,werent blinded liberal thought th ,2020-11-02,0.0,0.0,0.0,0.0,0.0,0.0,0.0,0.0,1.0
35,liberal,think idea culture tractable amenable change genetics also someth ,2020-11-02,0.0,0.0,0.0,0.0,0.0,0.0,0.0,0.0,1.0
36,liberal,democrat tribalism believe liberal democracy western civic val ,2020-11-02,0.0,0.0,0.0,0.0,0.0,0.0,0.0,0.0,0.0
37,liberal,fiscal conservative socially liberal worked perot break ,2020-11-02,0.0,0.0,0.0,0.0,0.0,0.33,0.33,0.0,0.33
38,liberal,store owners liberal nyc boarding last checked nyc ,2020-11-02,0.0,0.0,0.0,0.0,0.0,0.0,0.0,0.0,0.0
39,liberal,oh look another liberal white woman telling black man think sho ,2020-11-02,0.0,0.0,0.0,0.0,0.0,0.33,0.0,0.33,0.33
40,liberal,thank lady ga ga needlessly insulting millions americans smug st ,2020-11-02,0.297,0.483,0.221,0.0258,0.0,0.0,0.0,0.0,0.0
41,liberal,probably also sinking feeling power liberal tenants real world limits ,2020-11-02,0.143,0.857,0.0,0.128,0.2,0.2,0.0,0.4,0.2
42,liberal,yepgot cussed liberal ass niece trump supporterin house le ,2020-11-02,0.0,0.696,0.304,-0.5423,0.0,0.0,0.0,0.0,1.0
43,liberal,allowed educators kindergarten college teach anti american curriculums youth ,2020-11-02,0.0,0.777,0.223,-0.3182,0.0,0.5,0.0,0.5,0.0
44,liberal,austin always liberal blue city matter texas red state ,2020-11-02,0.121,0.879,0.0,0.0258,0.2,0.2,0.0,0.6,0.0
45,liberal,liberal lunacy ,2020-11-02,0.0,0.0,0.0,0.0,0.0,0.0,0.0,0.0,0.0
46,liberal,3 race house district 102 ana maria ramos says shes listened voices linda koop r ignored ko ,2020-11-02,0.0,0.859,0.141,-0.3182,0.0,0.67,0.0,0.0,0.33
47,liberal,nothing evil white liberal malcomx ,2020-11-02,0.468,0.532,0.0,0.5448,0.0,1.0,0.0,0.0,0.0
48,liberal,youre allowed blame people voted trump nonsense liberal demo ,2020-11-02,0.0,0.579,0.421,-0.6249,0.0,0.0,0.0,0.0,1.0
49,liberal,elite genuinely afraid trump simple pure nationalastic moral without media priest fake liberalelite ,2020-11-02,0.175,0.825,0.0,0.3724,0.0,0.4,0.0,0.4,0.2
50,liberal,liberal media right joe biden 120 percentage points always yelling every ,2020-11-02,0.0,0.0,0.0,0.0,0.0,0.25,0.0,0.25,0.5
51,liberal,many enlistments ol cranky joe undertake resist ,2020-11-02,0.0,0.0,0.0,0.0,0.0,0.0,0.0,0.0,0.0
52,liberal,guy hitting asking see today saw posted quote youre ,2020-11-02,0.0,0.0,0.0,0.0,0.5,0.5,0.0,0.0,0.0
53,liberal,omg liberal crazy trolling mute keeps coming back ,2020-11-02,0.0,0.745,0.255,-0.34,0.2,0.2,0.0,0.0,0.6
54,liberal,could well iowa missouri state defends riley cooper hates donovan mc nabb ,2020-11-02,0.14,0.667,0.193,-0.2023,0.0,0.0,0.0,1.0,0.0
55,liberal,buy labour members pretending prefer biden trump trump win empower reactionaries worldw ,2020-11-02,0.342,0.658,0.0,0.6369,0.0,0.0,0.33,0.0,0.67
56,liberal,time supported happening border small ,2020-11-02,0.365,0.635,0.0,0.3182,0.0,0.0,0.0,0.0,0.0
57,liberal,tbf canadians descended former also reli ,2020-11-02,0.0,0.0,0.0,0.0,0.0,0.0,0.0,1.0,0.0
58,liberal,q wont happy using libera ,2020-11-02,0.0,0.5,0.5,-0.4585,0.0,0.0,1.0,0.0,0.0
59,liberal,tjey anti abortion ads hey expect liberal media ,2020-11-02,0.0,0.753,0.247,-0.3182,0.0,0.0,0.5,0.0,0.5
60,liberal,reality liberal bias eh ,2020-11-02,0.0,0.682,0.318,-0.1027,0.0,0.0,0.0,0.0,0.0
61,liberal,texas liberal clan spinning story ,2020-11-02,0.0,0.0,0.0,0.0,0.0,0.0,0.0,0.0,0.0
62,liberal,blindly liberal ability see sides bad righ ,2020-11-02,0.213,0.463,0.324,-0.296,0.0,0.0,0.0,1.0,0.0
63,liberal,try proving say ugh mention leftist ,2020-11-02,0.0,0.641,0.359,-0.4215,0.0,0.33,0.0,0.33,0.33
64,liberal,liberal media 911 mode stoking ,2020-11-02,0.0,0.0,0.0,0.0,0.0,1.0,0.0,0.0,0.0
65,liberal,1 point alt left liberal kids 0 points republican conservative parents ,2020-11-02,0.0,0.0,0.0,0.0,0.0,0.25,0.25,0.0,0.5
66,liberal,could argue mental illness thinking ,2020-11-02,0.0,0.37,0.63,-0.6249,0.0,0.0,0.0,0.0,1.0
67,liberal,classical liberallibertarian party died ron paul retired ,2020-11-02,0.239,0.442,0.319,-0.2263,0.0,1.0,0.0,0.0,0.0
68,liberal,call political analysis obviously far left wing liberal democrat fanboy ,2020-11-02,0.0,0.0,0.0,0.0,0.0,1.0,0.0,0.0,0.0
69,liberal,austin always liberal blue city matter texas red state remain red without austin ,2020-11-02,0.084,0.916,0.0,0.0258,0.33,0.17,0.0,0.5,0.0
70,liberal,2 justices unanimously decide equal number ,2020-11-02,0.245,0.755,0.0,0.0772,0.0,1.0,0.0,0.0,0.0
71,liberal,fck liberal hitler stans today ,2020-11-02,0.0,0.0,0.0,0.0,0.0,0.0,0.0,0.0,0.0
72,liberal,fan liberal female shiny face trump left either granted ,2020-11-02,0.381,0.619,0.0,0.5106,0.0,0.0,0.0,0.0,1.0
73,liberal,thats people voted trump dont want tell liberal phone voted trump ,2020-11-02,0.0,0.891,0.109,-0.0572,0.0,0.0,0.0,0.33,0.67
74,liberal,im liberal nice assumption im guy understands reality reality done ,2020-11-02,0.237,0.763,0.0,0.4215,0.0,0.0,1.0,0.0,0.0
75,liberal,liberal bro nah bro im leftist youre gay ,2020-11-02,0.0,0.833,0.167,-0.1027,0.0,0.0,1.0,0.0,0.0
76,liberal,atheist liberal traitor sheep ,2020-11-02,0.0,0.0,0.0,0.0,0.0,0.0,0.0,0.0,0.0
77,liberal,yeah looks pretty conservative seasonings im super liberal sea ,2020-11-02,0.608,0.392,0.0,0.8519,0.0,0.0,1.0,0.0,0.0
78,liberal,brain dead liberal medias ruined brain mrzack know covid19 ,2020-11-02,0.0,0.486,0.514,-0.8126,0.0,0.0,0.0,1.0,0.0
79,liberal,peak tds sam disappointed still love though ,2020-11-02,0.341,0.407,0.252,0.2732,0.0,0.0,0.33,0.67,0.0
80,liberal,funny one single person blm liberal hit one people yet number blm people w ,2020-11-02,0.276,0.724,0.0,0.4939,0.33,0.33,0.0,0.0,0.33
81,liberal,dude dont take advice liberal white woman ,2020-11-02,0.0,0.0,0.0,0.0,0.0,1.0,0.0,0.0,0.0
82,liberal,fired editorial cartoonist cartoons critical trump ended daily print pu ,2020-11-02,0.0,0.467,0.533,-0.7906,0.0,0.67,0.0,0.0,0.33
83,liberal,maybe cause started watching liberalsjw find ba pretty entertaining idk laughing loud ,2020-11-02,0.497,0.428,0.075,0.836,0.0,0.0,0.5,0.0,0.5
84,liberal,liberal progressive muslims really need visit psychiatrist soon getting crazy se ,2020-11-02,0.0,0.806,0.194,-0.34,0.0,0.5,0.0,0.0,0.5
85,liberal,richard right wrong man liberal right pti ,2020-11-02,0.0,0.659,0.341,-0.4767,0.0,1.0,0.0,0.0,0.0
86,liberal,allowed educators kindergarten college teach anti american curriculums impr ,2020-11-02,0.0,0.777,0.223,-0.3182,0.0,0.5,0.0,0.5,0.0
87,liberal,dorsey liberal weasel ,2020-11-02,0.0,0.0,0.0,0.0,0.0,0.0,0.0,0.0,0.0
88,liberal,remember looting rioting republican senators surrounded angry liberal mobs long ago ,2020-11-02,0.0,0.752,0.248,-0.5106,0.5,0.5,0.0,0.0,0.0
89,liberal,perfectly acceptable free liberal society criticize debate mock reject ,2020-11-02,0.469,0.144,0.388,0.4019,0.0,0.0,1.0,0.0,0.0
90,liberal,liberal news lies dont report bidens crimes knowingly dont care truth ,2020-11-02,0.0,0.52,0.48,-0.7499,0.0,0.0,0.0,1.0,0.0
91,liberal,republican alaskans think someone liberal horrific offense someone rapist valley trash ,2020-11-02,0.0,0.415,0.585,-0.9062,0.2,0.2,0.0,0.2,0.4
92,liberal,ive seen enough bullshit liberal cities time new leader ship democrats think des ,2020-11-02,0.0,0.759,0.241,-0.5859,0.0,0.5,0.0,0.0,0.5
93,liberal,love long colby seems every week ,2020-11-02,0.457,0.543,0.0,0.6369,0.0,0.33,0.33,0.33,0.0
94,liberal,straight one many liberal trash rags many lies fake n ,2020-11-02,0.138,0.435,0.428,-0.6124,0.67,0.0,0.0,0.33,0.0
95,liberal,oppose fracking colorado liberal governor drank fracking fluid hes runni ,2020-11-02,0.0,0.0,0.0,0.0,0.0,0.0,0.0,0.0,1.0
96,liberal,mr rather thought intelligent individual well thought wrong say ,2020-11-02,0.359,0.423,0.218,0.25,0.0,0.25,0.0,0.0,0.75
97,liberal,vote 77 year old man doesnt eve ,2020-11-02,0.0,0.0,0.0,0.0,0.0,0.0,0.0,0.0,0.0
98,liberal,without need academic career right choose want opinion ,2020-11-02,0.157,0.843,0.0,0.0772,0.0,1.0,0.0,0.0,0.0
99,liberal,socially conservative fiscally liberal vice versa ,2020-11-02,0.0,0.0,0.0,0.0,0.0,0.0,1.0,0.0,0.0
100,liberal,would surprised many karen actually well mannered suburban liberal women ,2020-11-02,0.333,0.667,0.0,0.4588,0.0,0.33,0.0,0.0,0.67
101,liberal,got called liberal nazi today crazy care welfare employees customers ,2020-11-02,0.235,0.588,0.176,0.2023,0.0,1.0,0.0,0.0,0.0
102,liberal,im liberal state want seen one though ,2020-11-02,0.178,0.822,0.0,0.0772,0.0,0.0,0.0,1.0,0.0
103,liberal,,2020-11-02,0.0,0.0,0.0,0.0,0.0,0.0,0.0,0.0,0.0
104,liberal,happens real world liberal ,2020-11-02,0.0,0.0,0.0,0.0,0.0,0.0,0.0,1.0,0.0
105,liberal,liberal drugs color shocked ,2020-11-02,0.0,0.566,0.434,-0.3182,0.0,0.0,0.0,0.5,0.5
106,liberal,feel like many people confuse able memorize regurgitate liberal taking ,2020-11-02,0.202,0.645,0.153,0.1531,0.0,0.67,0.0,0.0,0.33
107,liberal,sincere message white liberal saviors think ground stand comes black ,2020-11-02,0.231,0.769,0.0,0.4019,0.0,0.6,0.0,0.0,0.4
108,liberal,enjoyed 4 years think radical islamists murdering jews christians hyper centris ,2020-11-02,0.212,0.513,0.276,-0.25,0.0,0.0,0.5,0.0,0.5
109,liberal,let guess someone moved texas welcome return liberal state ,2020-11-02,0.273,0.727,0.0,0.4588,0.0,0.0,0.25,0.5,0.25
110,liberal,see censorship liberal media outlets pushe ,2020-11-02,0.0,0.0,0.0,0.0,0.0,0.0,0.0,0.0,0.0
111,liberal,even said crazily ungrateful want hurt eve election rig ,2020-11-02,0.083,0.255,0.662,-0.8442,0.0,0.0,0.0,0.67,0.33
112,liberal,seems standard liberal response either totally passionate really stupid ,2020-11-02,0.252,0.478,0.27,-0.0679,0.0,0.25,0.0,0.5,0.25
113,liberal,see anecdotally much college educated suburba ,2020-11-02,0.0,0.0,0.0,0.0,0.0,1.0,0.0,0.0,0.0
114,liberal,02 ifr liberal hearts go courage ,2020-11-02,0.39,0.61,0.0,0.4939,0.0,0.5,0.0,0.5,0.0
115,liberal,liberal queen ,2020-11-02,0.0,0.0,0.0,0.0,0.0,0.0,0.0,0.0,0.0
116,liberal,unfortunately isnt gerrymandered district de ,2020-11-02,0.0,0.625,0.375,-0.34,0.0,0.0,0.0,1.0,0.0
117,liberal,apparently grants scheme administered illegally ,2020-11-02,0.322,0.678,0.0,0.2263,0.0,0.0,0.0,0.0,0.0
118,liberal,really liberal democrat orders defy logic reason sanity ,2020-11-02,0.0,0.0,0.0,0.0,0.0,0.0,0.0,0.5,0.5
119,liberal,explains followers ,2020-11-02,0.0,0.0,0.0,0.0,0.0,0.0,0.0,0.0,0.0
120,liberal,favour allowing kashmir freedom pakistan allows ,2020-11-02,0.64,0.36,0.0,0.7964,0.0,0.0,1.0,0.0,0.0
121,liberal,hey michael still calling black people sell outs nothing like liberal white racist ,2020-11-02,0.0,0.643,0.357,-0.7278,0.33,0.33,0.0,0.0,0.33
122,liberal,kirstie liberal sorry ,2020-11-02,0.0,0.606,0.394,-0.0772,0.0,0.0,0.0,1.0,0.0
123,liberal,joe whiney liberal ,2020-11-02,0.0,0.465,0.535,-0.3182,0.0,0.0,0.0,0.0,0.0
124,liberal,genius many thought account simply crazy liberal 1 7 supporters ,2020-11-02,0.257,0.531,0.212,0.128,0.0,0.5,0.0,0.0,0.5
125,liberal,us vulnerable extent level ,2020-11-02,0.0,0.612,0.388,-0.2263,0.0,0.0,0.0,1.0,0.0
126,liberal,joe biden sold us china youre slave liberal conglomerate youre pigeon regurgit ,2020-11-02,0.0,0.0,0.0,0.0,0.0,0.0,0.0,0.0,0.0
127,liberal,really cheer people ramming biden supporters road hey dip sht americans ,2020-11-02,0.419,0.581,0.0,0.7574,0.0,0.0,0.33,0.0,0.67
128,liberal,america loses either way biden brings wars return horrible trad ,2020-11-02,0.0,0.427,0.573,-0.8555,0.0,0.33,0.0,0.67,0.0
129,liberal,ca wait see president got calling hanen sort liberal hanen amazingly right wing ,2020-11-02,0.0,0.0,0.0,0.0,0.0,0.67,0.0,0.0,0.33
130,liberal,tired ca stand news much death ,2020-11-02,0.0,0.37,0.63,-0.7783,0.0,1.0,0.0,0.0,0.0
131,liberal,calm storm washington dc braces possible post election disorder via ,2020-11-02,0.177,0.615,0.208,-0.1027,0.0,0.0,0.25,0.5,0.25
132,liberal,lying americans russia 4 years help liberal insanity ,2020-11-02,0.196,0.29,0.514,-0.6597,0.0,0.0,0.0,0.0,1.0
133,liberal,bc losers going throw fits reside liberal hellholes ,2020-11-02,0.0,0.673,0.327,-0.5267,0.0,0.33,0.33,0.33,0.0
134,liberal,ca wait see liberal snowflake meltdowns announce donald j ,2020-11-02,0.0,0.0,0.0,0.0,0.0,0.0,0.0,0.5,0.5
135,liberal,f talking abt im liberal im sagitarius ,2020-11-02,0.0,0.0,0.0,0.0,0.0,0.0,0.0,0.0,0.0
136,liberal,whos tearing rural kentucky ill give hint liberal cities people ,2020-11-02,0.0,0.763,0.237,-0.4215,0.0,0.5,0.0,0.5,0.0
137,liberal,tw gun mention hear mom laugh laugh one asking shes voting bc like ,2020-11-02,0.46,0.427,0.114,0.8074,0.0,1.0,0.0,0.0,0.0
138,liberal,american universities liberal cesspools president impact bes ,2020-11-02,0.0,0.0,0.0,0.0,1.0,0.0,0.0,0.0,0.0
139,liberal,man would love communism right liberal communism like rain nic ,2020-11-02,0.456,0.544,0.0,0.7717,0.0,0.67,0.33,0.0,0.0
140,liberal,want politically correct say liberal depraved ,2020-11-02,0.206,0.794,0.0,0.0772,0.0,0.0,0.0,0.0,1.0
141,liberal,seeing conservative kids went high school liberal gtgtgtgtgtgt ,2020-11-02,0.0,0.0,0.0,0.0,0.0,0.67,0.33,0.0,0.0
142,liberal,yeah quincy exactly liberal stronghold clinton win 2016 repsmayor de ,2020-11-02,0.517,0.483,0.0,0.7579,0.0,0.0,0.0,0.0,0.0
143,liberal,lot big leftist twitter accounts regularly spew transphobia liberal trans people every big leftist ,2020-11-02,0.0,0.0,0.0,0.0,0.2,0.4,0.0,0.4,0.0
144,liberal,professor college said job attempt influence politically job ,2020-11-02,0.0,0.0,0.0,0.0,0.0,0.75,0.0,0.0,0.25
145,liberal,liberal dude like actually even know words mean one voting ,2020-11-02,0.217,0.783,0.0,0.3612,0.5,0.0,0.0,0.0,0.5
146,liberal,well sounds ominousremember one thingwhatever liberal democrats accuse conservatives ,2020-11-02,0.193,0.642,0.165,0.0772,0.0,0.0,0.0,0.0,0.0
147,liberal,yes liberal family members also see peopleassociates known flaming lib ,2020-11-02,0.231,0.769,0.0,0.4019,0.33,0.0,0.0,0.33,0.33
148,liberal,blaming president united states unrest ,2020-11-02,0.311,0.333,0.356,-0.1027,0.0,0.0,0.0,1.0,0.0
149,liberal,us violated prominent liberal principles principles free trade democracy equalit ,2020-11-02,0.35,0.438,0.212,0.296,0.0,0.67,0.33,0.0,0.0
150,liberal,always liberal ya prat ,2020-11-02,0.0,0.0,0.0,0.0,0.0,0.0,0.0,1.0,0.0
151,liberal,liberal start obama years become leftist since especially th ,2020-11-02,0.0,0.0,0.0,0.0,0.0,0.0,0.0,0.0,0.0
152,liberal,liberal stances mother conservative think fucking stupid disown someo ,2020-11-02,0.0,0.684,0.316,-0.5709,0.0,0.0,0.5,0.0,0.5
153,liberal,ive moved moderateliberal basically socialist ,2020-11-02,0.0,0.0,0.0,0.0,0.0,1.0,0.0,0.0,0.0
154,liberal,aww missed little unhinged liberal let begin anti needless se ,2020-11-02,0.0,0.64,0.36,-0.5423,0.25,0.0,0.0,0.75,0.0
155,liberal,damn called dirty liberal really makes wish voted trump lol kidding ,2020-11-02,0.382,0.32,0.298,0.1477,0.2,0.0,0.2,0.2,0.4
156,liberal,well liberal correlate higher intelligence thanks playing ,2020-11-02,0.767,0.233,0.0,0.836,0.0,1.0,0.0,0.0,0.0
157,liberal,voted year believe integrity matters every american right know going ,2020-11-02,0.316,0.684,0.0,0.4019,0.0,1.0,0.0,0.0,0.0
158,liberal,im liberal havent come within mile fact anything little sack ,2020-11-02,0.0,0.0,0.0,0.0,0.0,1.0,0.0,0.0,0.0
159,liberal,extremely unethical dont even know two days youre lib ,2020-11-02,0.0,0.69,0.31,-0.5563,0.0,0.0,1.0,0.0,0.0
160,liberal,good anti jacketers rally outside burlington coat factory protest liberal cold weather conspiracy ,2020-11-02,0.148,0.459,0.393,-0.5859,0.0,0.25,0.5,0.0,0.25
161,liberal,harper two completely different cases respe ,2020-11-02,0.0,0.0,0.0,0.0,0.0,0.0,0.0,0.0,0.0
162,liberal,liberal meltdown radical left media ,2020-11-02,0.0,0.0,0.0,0.0,0.0,0.0,0.0,1.0,0.0
163,liberal,ignorant voters stand proof trump aga ,2020-11-02,0.0,0.704,0.296,-0.2732,0.0,0.67,0.0,0.0,0.33
164,liberal,point going talk rampant xenophobia liberalleftist spaces ,2020-11-02,0.0,0.0,0.0,0.0,0.0,0.75,0.0,0.0,0.25
165,liberal,jihadist attack aimed jewish synagogue austria note terrorist shouts allahu fubar ,2020-11-02,0.0,0.404,0.596,-0.9153,0.0,0.5,0.0,0.0,0.5
166,liberal,liberal minded traditional sense word would discussion ,2020-11-02,0.0,0.0,0.0,0.0,0.33,0.33,0.0,0.0,0.33
167,liberal,definitely liberal ,2020-11-02,0.73,0.27,0.0,0.4019,0.0,1.0,0.0,0.0,0.0
168,liberal,replying many liberal californians moved arizona ,2020-11-02,0.0,0.0,0.0,0.0,0.0,0.0,0.0,0.0,0.0
169,liberal,fauci well liked anymore normal people media say people like bullshit lib ,2020-11-02,0.385,0.417,0.198,0.3818,0.0,0.5,0.0,0.0,0.5
170,liberal,attacked bus mean driving next andor around attacki ,2020-11-02,0.0,0.7,0.3,-0.4588,0.0,1.0,0.0,0.0,0.0
171,liberal,second councillor quits liberal democrat group joins conservatives ,2020-11-02,0.0,0.0,0.0,0.0,0.0,0.0,0.0,0.0,1.0
172,liberal,good place liberal democracy replaced millet style social order p ,2020-11-02,0.266,0.734,0.0,0.4404,0.0,0.75,0.25,0.0,0.0
173,liberal,riight white liberal elite establishment vote trumpism ,2020-11-02,0.0,0.0,0.0,0.0,0.0,1.0,0.0,0.0,0.0
174,liberal,unfortunately liberal block covid every country europe struggling balance ,2020-11-02,0.0,0.426,0.574,-0.7964,0.0,0.5,0.0,0.5,0.0
175,liberal,come know going happen california new york nee jersey etc tur ,2020-11-02,0.0,0.0,0.0,0.0,0.0,1.0,0.0,0.0,0.0
176,liberal,relevant celebs hilarious oh smart liberal turning bunch ,2020-11-02,0.474,0.526,0.0,0.6597,0.0,0.0,0.5,0.0,0.5
177,liberal,last four years trump attacked constantly liberal sore losers ,2020-11-02,0.0,0.403,0.597,-0.836,0.33,0.0,0.0,0.33,0.33
178,liberal,thats exactly right liberal media say anything help another liberal ,2020-11-02,0.231,0.769,0.0,0.4019,0.0,0.33,0.0,0.0,0.67
179,liberal,way think right spot observation especially context socialist left r ,2020-11-02,0.0,0.0,0.0,0.0,0.0,0.75,0.0,0.0,0.25
180,liberal,comon denominator liberal run cities simply ,2020-11-02,0.0,0.0,0.0,0.0,0.0,0.0,0.0,0.0,0.0
181,liberal,think politics page one made angriest short back forth ,2020-11-02,0.0,0.661,0.339,-0.6249,0.25,0.25,0.0,0.25,0.25
182,liberal,bob barker reminding help control pest population liberal spayed neutered ,2020-11-02,0.231,0.769,0.0,0.4019,0.0,0.0,0.0,0.0,1.0
183,liberal,brutal secularism rank communalists ask two years ago agon ,2020-11-02,0.0,0.661,0.339,-0.6249,0.5,0.5,0.0,0.0,0.0
184,liberal,yeah theres lot reasons hope anxiety high think thing even couple years ,2020-11-02,0.323,0.57,0.108,0.5267,0.0,0.29,0.0,0.43,0.29
185,liberal,want know millennials experienced point many family members ar ,2020-11-02,0.14,0.86,0.0,0.0772,0.0,0.0,0.0,0.0,1.0
186,liberal,3 states away jersey makes hoffman better booker mo ,2020-11-02,0.293,0.707,0.0,0.4404,0.25,0.0,0.0,0.5,0.25
187,liberal,announcement announcement could complete normal way eventually ann ,2020-11-02,0.0,0.0,0.0,0.0,0.0,0.0,0.0,0.0,0.0
188,liberal,dont forget put add controlled lil puppet voting really ,2020-11-02,0.172,0.828,0.0,0.1695,0.25,0.0,0.0,0.5,0.25
189,liberal,laughing loud texas great state move cali see liberal policies ,2020-11-02,0.477,0.523,0.0,0.8074,0.0,0.33,0.33,0.33,0.0
190,liberal,illustration outdated may apply liberal conservative friends republicans 20 ,2020-11-02,0.279,0.721,0.0,0.4767,0.0,0.5,0.5,0.0,0.0
191,liberal,hear north korea quite liberal compared uk ,2020-11-02,0.0,0.0,0.0,0.0,0.0,0.0,0.0,0.0,0.0
192,liberal,karen definitely liberal know ,2020-11-02,0.474,0.526,0.0,0.4019,0.0,1.0,0.0,0.0,0.0
193,liberal,liberal putch ex officer try revanchist lack promotion różański ,2020-11-02,0.0,0.777,0.223,-0.3182,0.0,0.0,0.0,0.0,0.0
194,liberal,1962 northern rhodesia coalition govt formed united federal party 16 seats unip 14 seats anc 7 seats bnp ,2020-11-02,0.268,0.732,0.0,0.6705,0.0,1.0,0.0,0.0,0.0
195,liberal,according pew research roughly 20 25 black voters identify liberal 68 conservativemoderate black pe ,2020-11-02,0.0,0.0,0.0,0.0,0.0,0.0,1.0,0.0,0.0
196,liberal,liberal left media caused report news report ,2020-11-02,0.0,0.0,0.0,0.0,0.0,0.0,0.0,0.0,0.0
197,liberal,complete censorship isnt one liberal whose social media page ,2020-11-02,0.0,0.0,0.0,0.0,0.0,1.0,0.0,0.0,0.0
198,liberal,thirst blessed day ,2020-11-02,0.661,0.339,0.0,0.5994,0.0,0.0,1.0,0.0,0.0
199,liberal,youve house people hotels many years prosperous ,2020-11-02,0.341,0.659,0.0,0.4767,0.0,0.0,1.0,0.0,0.0
200,liberal,liberal gamer wow ,2020-11-02,0.655,0.345,0.0,0.5859,0.0,0.0,0.0,0.0,1.0
201,liberal,jack sint frostnixon liberal lie living rent free head lately good video ,2020-11-02,0.383,0.617,0.0,0.7351,0.0,0.25,0.5,0.25,0.0
202,liberal,nah live liberal area blue state laugh ,2020-11-02,0.36,0.5,0.14,0.4939,0.0,0.0,0.0,1.0,0.0
203,liberal,took study university test said liberal arts fuck yess ,2020-11-02,0.0,0.696,0.304,-0.5423,0.0,0.0,0.25,0.25,0.5
204,liberal,wales take reasonably liberal policy welsh however embr ,2020-11-02,0.0,0.0,0.0,0.0,0.0,0.5,0.0,0.0,0.5
205,liberal,adhere constitution whether conservative liberal ,2020-11-02,0.0,0.0,0.0,0.0,0.0,1.0,0.0,0.0,0.0
206,liberal,worked cpl yrs took break nursing liberal place ev ,2020-11-02,0.0,0.0,0.0,0.0,0.0,0.5,0.0,0.0,0.5
207,liberal,one view silver linings country decides run completely ,2020-11-02,0.0,0.0,0.0,0.0,0.0,1.0,0.0,0.0,0.0
208,liberal,treasurer libdemlife simon lr lib dem member long time currently sits th ,2020-11-02,0.12,0.88,0.0,0.128,0.0,1.0,0.0,0.0,0.0
209,liberal,makes second half co chair team board member last term ,2020-11-02,0.0,0.0,0.0,0.0,0.0,0.0,0.0,1.0,0.0
210,liberal,first 2 co chairs alansm alan founder member liberal reform tech consultant ,2020-11-02,0.0,0.0,0.0,0.0,0.0,0.0,0.0,0.0,1.0
